id,titlu,pret,moneda,nr_camere,suprafata,link,imagini_paths,numar_imagini,observatii,descriere,data_cont,nr_postari,pret_estim,data_cont_parsed,vechime_zile,scam,delta_pret
1,Anunț,279000,EUR,3,134,https://www.publi24.ro/anunturi/imobiliare/de-vanzare/case/case-vile/anunt/vila-3-camere-hanul-cu-peste-lac/3hghhh7582h87he3139056g70fgg7ggg.html,images_case/anunt_1_img_0.webp|images_case/anunt_1_img_1.webp|images_case/anunt_1_img_2.webp|images_case/anunt_1_img_3.webp,4,,"VG Real Estate vă propune spre vânzare o vilă elegantă situată în Zona Mamaia Sat,Hanul cu Peste,lac Siutghiol ideală pentru familie/birou/sediu firmă. Proprietatea oferă un spațiu generos, finisaje de calitate și o curte perfectă pentru relaxare. Detalii proprietate: •	Suprafață utilă: 134mp •	Suprafață teren: 60 mp •	Număr camere: 3 •	Compartimentare: Decomandată •	Regim înălțime: Parter +1 •	An construcție: 2021 •	Material construcție: Cărămidă / Beton •	Finisaje: Moderne •	Utilități: Apă, gaz, curent, canalizare, internet, TV Dotări și facilități: •	Bucătărie: Mobilată și utilată complet •	Baie: 2 băi •	Încălzire: Centrală proprie •	Aer condiționat: Da •	Sistem de securitate: Supraveghere video •	Piscină: Nu •	Ponton la lac Parcare: •     Parcare disponibilă în fata casei Puncte de interes în apropiere •	Magazine: Mega Image •	Lac / ponton la lac • Preț: 279000 € usor negociabil Modalități de plată: Cash / Credit ipotecar Pentru mai multe detalii și vizionări, nu ezitați să ne contactați! ID anunț : 1755072752",13.09.2022,188,136908.171875,2022-09-13,1181.0,0,142091.828125
2,Anunț,229990,EUR,6,214,https://www.publi24.ro/anunturi/imobiliare/de-vanzare/case/casa/anunt/casa-cu-multe-oportunitati-pretabila-regim-hotelier-sau-casa-de-locuit/97e1219e15d47831dedf3ed22e00h7f1.html,images_case/anunt_2_img_0.webp|images_case/anunt_2_img_1.webp|images_case/anunt_2_img_2.webp|images_case/anunt_2_img_3.webp,4,,"In Cisnadie, in zona istorica este o casa individuala de vanzare , comparabila cu o fortareata din punct de vedere al intimitatii, compusa din 3 corpuri de cladire cu u suprafata utila 214 mp utili care se pot amenaja pentru regim hotelier sau zona de locuit pentru o familie numeroasa. Dar aceasta casa se poate combina astfel incat sa poti locui in curte si sa poti avea si spatiu de inchiriat. Casa beneficieaza de o intimitate sporita , deoarece in interiorul curtii nu exista vreun geam de la vecini. Curtea este ca o fortareata inchisa. O parte a casei a fost construita in 1930, iar restul sunt constructii mai noi. In anii1980 si 1995. Corpul 1 de casa este compus din camera, bucatarie si baie, si are in total o suprafata de 50 mp utili. Corpul 2 si 3 comunica intre ele si sunt compuse in total din 6 camere, 4 bai, 1 bucatarie si 2 holuri, avand o suprafata totala de 164 mp utili. Curtea beneficiaza de 2 pivnite generoase, de o frumoasa terasa intre vegetatia curtii care este inchisa cu sticla, iar in curtea si-a pastrat nota autentica prin pastrarea corlatei desfasurata pe 2 parti ale curtii. Incalzirea este prin centrale proprii si sunt 2. Una pentru un corp de casa, iar a doua centrala deserveste celelalte 2 corpuri de cladire din curte. Geamurile sunt tip termopan, iar pardoseala este tip parchet si gresie. Suprafata totala a curtii este de 800 mp, din care terenul liber este de 518 mp si se regaseste atat in curte, cat si in spatele curtii intr-o gradina care poate fi una exotica, sau una de legume . In curte se pot parca mai multe masini, astfel incat nu vor fi probleme cu locurile de parcare din strada. Zona unde este aceasta casa este una istorica si foarte bine cotata din punct de vedere imobiliar, mai ales daca se doreste dezvoltarea unei afaceri. Tot zona buna este si daca doresti sa locuiesti permanent, deoarece, desi casa este in zona centrala si zona turistica, in curte este liniste si multa intimitate. Pret: 229.990€ Cod ofertă / ID: P22337 Sună-ne acum la 0369.823.823 și află detalii despre această proprietate de vanzare din Cisnadie, dar și despre alte proprietăți potrivite pentru tine. Apartamente de vanzare Sibiu Case de vanzare Sibiu Informatii speciale: 1. Descarcă aplicația de mobilul tau "" TABOO Imobiliare "" din Apple Store, Google Play sau Huawei AppGallery pentru a afla instantaneu noile proprietăți care intră pe piață. 2. Dacă ai o proprietate pe care vrei să o vinzi sau să o închiriezi , suntem aici pentru tine! Contactează-ne pentru o evaluare gratuită fără obligații și vei descoperi avantajele de a lucra cu o echipă dedicată și experimentată. 3. Dacă vrei sa incepi o cariera de agent imobiliar , suna la 0369.823.823 si programeaza o intalnire pentru a afla toate beneficiile si avantajele. Intra pe www.TABOO.ro și descoperă cele mai recente oferte, actualizate zilnic. ID anunț : 1733994309",03.05.2018,1329,210692.125,2018-03-05,2834.0,0,19297.875
3,Anunț,274000,EUR,4,266,https://www.publi24.ro/anunturi/imobiliare/de-vanzare/case/case-vile/anunt/casa-cu-4-camere-2-bai-si-teren-de-266-mp-zona-arhitectilor/2dgfgg2198797580ef42di6866eh5i5d.html,images_case/anunt_3_img_0.webp|images_case/anunt_3_img_1.webp|images_case/anunt_3_img_2.webp|images_case/anunt_3_img_3.webp,4,,"De vanzare casa mobilata si utilata cu 4 camere decomandate, 2 bai, balcon si terasa, dispusa pe Parter + Etaj+ Pod, amplasata pe un teren de 266 mp, localizata in zona Arhitectilor. Curtea libera a casei insumeaza 201 mp cu deschidere de 10 m si dispune de acces auto cu poarta automatizata, curtea dispune de imprejmuire cu gard metalic, cale de acces auto si pietonala pavata cu dale din beton, gazon insamantat si arbusti decorativi. Casa dispune de o suprafata utila de 112 mp, acestia fiind distribuiti pe parter si etaj. Parterul este alcatuit din camera de zi, bucataria partial separata care poate fi delimitata foarte usor cu un perete din sticla sau rigips si pozitionata usa, hol de acces la care adaugam si locul special amenajat pentru cuier si pantofar, baie dotata cu geam pentru aerisire si cada, hol cu casa scarii. Etajul este compus din 3 dormitoare dintre care unul matrimonial si cele 2 dormitoare destinate copiilor sau oaspetilor, baia dotata cu geam cabina de dus. Separat de suprafata utila casa dispune si de un balcon de aproximativ 9 mp in care accesul se face din dormitorul matrimonial si podul in suprafata egala cu etajul iar accesul facanduse prin intermediul unei scari retractabile pozitionate pe hol. Parcarea se realizeaza in curtea imobilului unde se pot parca aproximativ 3 autoturisme plus alte 3 in fata casei. Din punct de vedere al finisajelor si al dotarilor aceasta dispune de: centrala termica marca Bosch si incalzire in pardoseala cu termostatare individuala pentru fiecare incapere, distribuitor separat pentru Parter si Etaj,  usi de lemn la interior marca Naturen pereti tencuiti ( tencuiala var-ciment ), gletuiti si zugraviti in lavabila alba si zugraveli stucco venetian, pardoseala placata integral cu gresie speciala pentru incalzirea in pardoseala, obiecte sanitare suspendate montate pe pozitie, instalatii electrice cu tablou general individual si sigurante pentru consumatorii de putere, prize si intrerupatoare montate marca Schneider, instalatii pentru curenti slabi TV, Internet, instalatie termica, interfon functional, acorduri apa-canal in baie si bucatarie, racord gaz metan in bucatarie si terasa, contorizari individuale si contoare montate pentru Gaz, Curent si Apa; Din punct de vedere structural aceasta dispune de: elevatie izolata, placata cu polistiren extrudat si acoperita cu tencuiala, zidarie din caramida Porotherm Wienerberger cu grosimea de 30 cm exterior si 25 cm interior, zidarie dubla intre case 60 cm + izolatie fonica din polistiren extrudat, pereti exteriori izolati cu vata bazaltica si tencuiala decorativa, tamplarie PVC marca Salamander 7 camere, 3 foi de sticla si protectie solara, glafuri interioare si exterioare, usa de acces din PVC izolatoare termic si fonic, acoperis tip sarpanta cu invelitoare tip tigla din beton marca Bramac ce include tot sistemul ( tigla, hidroizolatie, jgheaburi, burlane si parazapezi ); Locuinta se preda complet mobilata si utila, ceea ce include: mobilier de bucatarie realizat pe comanda din MDF infoliat si electrocasnice incastrate ( plita electrica, cuptor electric, masina de spalat vase, frigider, toate fiind marca Whirepool si Samsung ), mobilier de living, dormitorul matrimonial amenajat ca atare, un dormitor amenajat ca si dressing, altul amenajat ca si birou, baile complet amenajate cu obiecte sanitare incastrate si mobilierul specific. Valoarea de achizitie este de 274.000 euro, aceasta poatefi achizitionata si prin accesarea unui credit bancar. ID intern: 2931. ID anunț : 1756381945",10.07.2020,460,160733.5625,2020-10-07,1887.0,0,113266.4375
4,Anunț,47000,EUR,4,1000,https://www.publi24.ro/anunturi/imobiliare/de-vanzare/case/case-vile/anunt/casa-demolabila-1000mp-in-sf-ilie-vechi/312ie1h7hfi67156egihff7332641gi1.html,,0,,"Blitz va propune spre vanzare o casa in zona Sf. Ilie vechi, casa avand o suprafata de 50-70 mp utili si teren in suprafata de 1000 mp. imobilul necesita o renovare completa sau demolare Casa se afla intr-o zona linistita departe de agitatia orasului dar la o distanta mica de acesta. Va asteptam la vizionare! Cod ofertă / ID BLITZ: P130280 ID anunț : 1724859413",07.05.2021,9948,21533.3515625,2021-07-05,1616.0,0,25466.6484375
5,Anunț,99000,EUR,3,88,https://www.publi24.ro/anunturi/imobiliare/de-vanzare/case/case-vile/anunt/casa-cu-teren/009g41570e907fg21d8fg322i7858e9h.html,images_case/anunt_5_img_0.jpg|images_case/anunt_5_img_1.jpg|images_case/anunt_5_img_2.jpg|images_case/anunt_5_img_3.jpg,4,,"vand casa cu peste  1 hectar de teren intravilan in Topa de cris cu front stradal la E60 de 65 metri. casa si terenul reprezinta oportunitatea de a incepe o afacere in diferite domenii. Situata la 50 metri de biserica ortodoxa in centrul satului si la E60  casa  ofera locul ideal pentru mai multe proiecte (spatiu comercial,spalatorie auto, service auto,  proiect pe agricultura, proiecte turistice, se pot amenaja casute, locuri de joaca, precum si alte idei de proiecte rurale. Topa de cris se afla la 2 km de zona turistica Vadu crisului. Casa este constuita din caramida cu peretii de 50cm, ceea ce ofera o izolatie termica mare iar fundatia din piatra cioplita este foarte rezistenta . ID anunț : 1724007072",15.09.2017,1,152237.703125,2017-09-15,3005.0,0,-53237.703125
6,Anunț,120000,EUR,4,120,https://www.publi24.ro/anunturi/imobiliare/de-vanzare/case/case-vile/anunt/casa-noua-de-vanzare-in-judetul-dambovita/6e82e4h71ge17d4215id61968336h652.html,images_case/anunt_6_img_0.jpg|images_case/anunt_6_img_1.jpg|images_case/anunt_6_img_2.jpg|images_case/anunt_6_img_3.jpg,4,,"Casa proiectata pentru cheltuieli minime la incalzire ! Casa are 4 camere cu suprafata utila de 120m2( la care se adauga 100m2 reprezentind suprafata podului mansardabil ). Este racordata la reteaua electrica, de apa , canalizare. Interioarele si instalatia electrica sunt finalizate . De asemeni usile sunt montate la toate camerele fiind executate din lemn masiv .Casa este situata in comuna Ludesti , judetul Dimbovita (la 1,30 ore de mers cu masina din Bucuresti pe un drum complet asfaltat) .In apropiere se afla orasele Targoviste si Gaesti .Localitatea beneficiaza de magazine alimentare ,brutarie,pizzerie,clinica medicala. Zona este deosebita fiind inconjurata de paduri de foioase si dealuri incarcate de pomi fructiferi. Terenul pe care este asezata casa are suprafata de 2100 m2 si este inconjurat cu gard . Este o casa pasiva (clasa energetica A) avind pereţii exteriori izolati cu Neopor (care este un polistiren cu densitate mare rezistent la incendiu) de 18cm la exterior si de 6cm la interior si deci pierderile de caldura sunt minime. Podul este imbracat in interior cu lambriu si poate fi facut locuibil daca se doreste. Acoperisul este realizat cu tabla Lindab sub care se afla un strat izolator de Neopor de 10 cm grosime care asigura o izolatie termica a podului .Tavanul este izolat cu un strat de polistiren de 10cm grosime .Fiind o casa pasiva(fara pierderi de caldura prin pereti) se poate obtine in interior o temperatura de 19 grade Celsius cind in exterior sunt -15grade Celsius si asta fara a incalzi in interior . Casa e compusa din 4 camere ,2 bai şi 2 bucatarii şi se preda la cheie la preţul menţionat. Imobilul are proiect al structurii de rezistenta,proiect pentru instalatia electrica si sanitara , autorizatie de constructie,cadastru,certificat energetic.Fundatia are 1,8m sub nivelul solului iar soclul casei are 1m peste nivelul solului .Îmobilul este proiectat sa reziste la seisme de peste 8 grade pe scara Richter fara a exista nici un impact asupra structurii de rezistenta. ID anunț : 1765059378",15.08.2011,1,233976.46875,2011-08-15,5228.0,0,-113976.46875
7,Anunț,98500,EUR,6,1800,https://www.publi24.ro/anunturi/imobiliare/de-vanzare/case/case-vile/anunt/vand-casa-la-alb/3h6i751i7ed977d3d6feif2582813i71.html,images_case/anunt_7_img_0.webp|images_case/anunt_7_img_1.webp|images_case/anunt_7_img_2.jpg|images_case/anunt_7_img_3.jpg,4,,"Vând casă la alb aflată pe un teren de 1800mp împrejmuit cu gard din tablă în partea din fața iar în partea din spate este din plasă.Pe teren se află vita de vie în rod, livadă cu pomi fructiferi in rod, iar pe mijlocul terenului se poate cultiva legume,cu ieșire la un pârâu. Casa este pe doua nivele +pod,partea de jos are un living,bucătărie,baie,două dormitoare mari,casa centralei,terasa care poate fi folosita și ca garaj și beci.Partea de sus două dormitoare,o baie,dressing,cameră de oaspeți și balcon si podul. Tâmplarie tip lemn maro cu geam tip oglindă,șape sus și jos,instalație sanitară  termică sus-jos,apa trasă în toată casa,inclusiv în beci,fosa, tablă metalică din oțel zincat.Are trase in casa in toate camerele,toate cablurile,Tv,internet si sistem de alarma, iar la poarta sistem automat cu deschidere electrica.Este amplasată intr-un loc liniștit cu vecini buni la 20 de minute de oraș. Mai multe detalii la telefon: ID anunț : 1724776842",13.12.2023,3,154430.703125,2023-12-13,725.0,0,-55930.703125
8,Anunț,130000,EUR,3,100,https://www.publi24.ro/anunturi/imobiliare/de-vanzare/case/vila/anunt/vand-casa-in-comuna-berceni-ilfov-130000-euro-merita-vazuta/3i93e4f1e9d374e41e21f2f97h8275g1.html,images_case/anunt_8_img_0.jpg|images_case/anunt_8_img_1.jpg|images_case/anunt_8_img_2.jpg|images_case/anunt_8_img_3.jpg,4,,"Vând casa în comuna Berceni Ilfov strada Zanelor Suprafața utila 100 mp  Suprafața teren 200 mp 3 dormitoare 2 bai sufragerie  bucatarie 2 balcoane - panouri fotovoltaice  6 kw  cu dosar de prosumator -caramida rustica aparenta, -usa intrare metalica cu frier forjat și sticla mata , -ferestre salamander 82 mm 3 rânduri de garnitura  sticla tripan 4s -rulouri electrice acționate electric smart cu telecomanda buton și wifi -gardul laterale și spate placi beton iar frontal soclu și stalpi beton  și fier aspect placut Utilități : put ( cămin hidrofor f mare tip beci1.7X1.7 înălțime2.2 m) gaze, curent,  cablu net tv ,fosa septica, asfalt la 60 m ,zona linistita  casa face parte dintr-un ansamblu de 6 case stadiul construcției finisaje duplex 1 duplex 2 în curs de ridicare etapa 1 Izolata  exterior polistiren eps 80 pod vata bazaltica și folie aluminiu -tabla acoperiș 0.5mm vopsea grande mat - ID anunț : 1672966730",23.01.2015,1,136731.234375,2015-01-23,3971.0,0,-6731.234375
9,Anunț,159000,EUR,5,141,https://www.publi24.ro/anunturi/imobiliare/de-vanzare/case/case-vile/anunt/vand-casa-1-h-de-teren/e8e42e4gd71679he2ei0e61000i5idhf.html,images_case/anunt_9_img_0.webp|images_case/anunt_9_img_1.webp|images_case/anunt_9_img_2.webp|images_case/anunt_9_img_3.webp,4,,Vand casa.in judetul Botoșani..com Hudești.Sat Baseu..toate detaliile la tell... ID anunț : 1763540209,12.07.2024,1,172224.515625,2024-12-07,365.0,0,-13224.515625
10,Anunț,200000,EUR,3,178,https://www.publi24.ro/anunturi/imobiliare/de-vanzare/case/case-vile/anunt/casa-moderna-direct-de-la-proprietar/0h0f738fdf907075d38e84333d0eie03.html,images_case/anunt_10_img_0.webp|images_case/anunt_10_img_1.webp|images_case/anunt_10_img_2.webp|images_case/anunt_10_img_3.webp,4,,"Casă modernă, construită integral din cărămidă Porotherm în 2020, situata într-o zonă liniștită ( str. Stan Dragu, Aradul Nou), aproape de supermarket, cu acces rapid la autostradă. Imobilul oferă confort, spațiu si eficienta energetica, compartimentare practică, fiind ideal pentru o familie. Caracteristici principale: 2 dormitoare, dressing, baie, living luminos open-space cu bucataria, mobilă la comandă+electrocasnice moderne incluse, hol acces generos, terasă, garaj pentru 2 masini, camera tehnica, curte ideala pentru amenajări. Dotări: Încălzire in pardoseala, aer condiționat, panou solar pentru încălzirea apei, centrală termică pe peleti+ termostat ambiental- soluție eficientă si economică,  utilități complete, izolatie termica 10 cm, acoperiș Bramac, toate utilitățile racordate, locație excelenta. Se vinde direct de la proprietar, fara comision. Casa moderna, gata de mutat. Rog firmele imobiliare sa nu ma contacteze. ID anunț : 1763767648",21.10.2022,1,136291.203125,2022-10-21,1143.0,0,63708.796875
11,Anunț,7500,EUR,3,80,https://www.publi24.ro/anunturi/imobiliare/de-vanzare/case/casa-de-vacanta/anunt/vand-cabane-tip-a/13he13f5did07ig6285304d567i787hg.html,images_case/anunt_11_img_0.webp|images_case/anunt_11_img_1.webp|images_case/anunt_11_img_2.webp|images_case/anunt_11_img_3.webp,4,,"Case si Cabane din lemn, de tip A, dimensiuni in functie de preferintele clientilor cu proiectul clientului sau dupa proiectele noastre. Construim case si cabane din lemn, tip A, folosind materiale de buna calitate, arhitectura deosebita, cu o echipa de exceptie cu experienta in acest domeniu. AVANS 0%       , plata se va face esalonat pe parcursul lucrarii. Acest tip de locuinta reprezinta un mediu de locuit sanatos si va ofera o ambianta originala, placuta si relaxanta. Oferim garantie si calitate la cele mai accesibile preturi, avand o vasta experienta in prelucrarea lemnului de peste 10 ani. Oferta noastra pentru case, cabane din lemn, se adreseaza atat celor care vor sa aiba o casa de vacanta sau o locuinta permanenta cat si celor care au in plan amenjarea exterioara a acestora. Ne deplasăm în toată tara fără costuri suplimentare. Experiență de peste 10 ani. Garanție și Calitate la cele mai Accesibile Prețuri! Modul de constructie ne permite sa amplasam constructiile din lemn atat in mediu urban, cat si in cel rural, transportul facandu-se pana la locatia clientului, oriunde in țară. Pentru orice nelămurire nu ezitați să ne contactați la numarul de telefon: ID anunț : 1759572607",04.10.2025,6,149569.8125,2025-04-10,241.0,0,-142069.8125
12,Anunț,5500,EUR,3,60,https://www.publi24.ro/anunturi/imobiliare/de-vanzare/case/casa-de-vacanta/anunt/vand-cabane-tip-a/911151gd3dii72eg1027i0gfdgd39d19.html,images_case/anunt_12_img_0.webp|images_case/anunt_12_img_1.webp|images_case/anunt_12_img_2.webp|images_case/anunt_12_img_3.webp,4,,"Cabanele A-Frame   refugiul perfect în mijlocul naturii! Design spectaculos, construcție durabilă și acel aer cozy care te face să te îndrăgostești de fiecare colț! Cu un stil minimalist și eficient, cabanele A-frame sunt alegerea ideală pentru: Căsuțe de vacanță Glamping sau afaceri în turism Locuințe de weekend sau chiar permanente Construcție rapidă și sustenabilă Rezistență excelentă la intemperii Posibilități multiple de compartimentare Fiecare proiect este realizat cu atenție la detalii, din lemn de calitate, și poate fi personalizat în funcție de nevoile tale! Contactează-ne și hai să construim împreună cabana visurilor tale! Vezi în imagini câteva dintre proiectele noastre recente. ACEPTAM VARIANTE AUTO ID anunț : 1759572579",04.10.2025,6,156794.328125,2025-04-10,241.0,0,-151294.328125
13,Anunț,6500,EUR,3,80,https://www.publi24.ro/anunturi/imobiliare/de-vanzare/case/casa-de-vacanta/anunt/vand-cabane-tip-a/009788ddd2i073i61gegeghhf4431e18.html,images_case/anunt_13_img_0.webp|images_case/anunt_13_img_1.webp|images_case/anunt_13_img_2.webp|images_case/anunt_13_img_3.webp,4,,"Cabanele A-Frame   refugiul perfect în mijlocul naturii! Design spectaculos, construcție durabilă și acel aer cozy care te face să te îndrăgostești de fiecare colț! Cu un stil minimalist și eficient, cabanele A-frame sunt alegerea ideală pentru: Căsuțe de vacanță Glamping sau afaceri în turism Locuințe de weekend sau chiar permanente Construcție rapidă și sustenabilă Rezistență excelentă la intemperii Posibilități multiple de compartimentare Fiecare proiect este realizat cu atenție la detalii, din lemn de calitate, și poate fi personalizat în funcție de nevoile tale! Contactează-ne și hai să construim împreună cabana visurilor tale! Vezi în imagini câteva dintre proiectele noastre recente. ACEPTAM VARIANTE AUTO ID anunț : 1759572217",04.10.2025,6,136339.953125,2025-04-10,241.0,0,-129839.953125
14,Anunț,308000,EUR,3,276,https://www.publi24.ro/anunturi/imobiliare/de-vanzare/case/case-vile/anunt/casa-de-vanzare-bucuresti-noi/g7f26d1g3e8f78f9d0636h74gee917hf.html,images_case/anunt_14_img_0.webp|images_case/anunt_14_img_1.webp|images_case/anunt_14_img_2.webp|images_case/anunt_14_img_3.webp,4,,"De vânzare casa 3 camere,2 bai,teren 276mp , utili 90mp,  Utilități. apa , canal, gaze, electricitate,cadastru intabulare, Proprietar , comision 0%. mai mult detalii la telefon , preț 308000 euro negociabil  tel    + 4patru.7.cinci .0 zero.234 doi doi 1 ID anunț : 1753452084",21.08.2020,1,193634.21875,2020-08-21,1934.0,0,114365.78125
15,Anunț,89950,EUR,3,60,https://www.publi24.ro/anunturi/imobiliare/de-vanzare/case/casa-de-vacanta/anunt/vand-casa-la-munte-in-campulung-moldovenesc/ig70eg1d944272hf271047gh22700405.html,images_case/anunt_15_img_0.jpg|images_case/anunt_15_img_1.jpg|images_case/anunt_15_img_2.webp|images_case/anunt_15_img_3.webp,4,,"Vând casă cu suprafață de 65m2 cu utilități: energie electrică, gaze naturale, apă, canalizare, internet și TV. Finalizarea construcției - 2023. Zona liniștită la 10 minute de mers pe jos până în centrul orașului Câmpulung Moldovenesc. Casa are 3 camere: salon intrare, living și dormitor matrimonial, baie cu duș și bucătărie utilată complet și un dressing spațios la mansardă. Design-ul interior este unul modern cu influențe rustice, cu șemineu pe lemne, centrală pe gaz, beci, și 2 terase aferente intrării și bucătăriei. Locuința este mobilată total, cu mobilier din lemn masiv. Pentru vizionare și alte detalii, vă punem la dispoziție pe WhatsApp foto și video. ID anunț : 1731154098",09.11.2024,4,159505.84375,2024-09-11,452.0,0,-69555.84375
16,Anunț,59500,EUR,7,2267,https://www.publi24.ro/anunturi/imobiliare/de-vanzare/case/case-vile/anunt/proprietar-vand-casa-cu-7-camere-in-diculesti-jud-valcea-teren-2267-mp/9fdh538d855h789id9g2h391e9d31327.html,images_case/anunt_16_img_0.webp|images_case/anunt_16_img_1.webp|images_case/anunt_16_img_2.webp|images_case/anunt_16_img_3.webp,4,,"Se propune spre vânzare o proprietate spațioasă, decomandată, ideală pentru familii sau pensiune, bine construită și mobilată, situată în Diculești, la aproximativ 51 km de Craiova, 31 km de Balș, cu un regim de înălțime P, având un număr de 7 camere, cu o suprafață utilă de 218 mp la sol și teren 2267 mp, front stradal mare de 25 m. Anul constructiei este 1975, fundație de piatră, material zidărie cărămidă, acoperiș de tablă zincată. Proprietatea dispune de garaj (32 mp) cu groapă, accesat de la stradă pe o placă de beton armat, un  pătul (15 mp ) din lemn, acoperit cu tablă, fixat pe piloni de beton armat, 2 beciuri generoase, 2 poduri spațioase, cu posibilitate de mansardare. Imobilul este dotat cu: sistem de alarmă, podele lemn natur, uși de lemn la camere și intrare 2 poduri spațioase mansardabile, 2 beciuri generoase, ferestre tâmplărie lemn, protejate de ornamente metalice antiefracție, spații de depozitare, acoperiș tablă zincată, ogeac și cuptor zidit pentru pâine și afumătoare, cotețe zidite pentru porc și găini împrejmuirea terenului din spatele casei este cu fundație, elevație și gard din sârmă metalică. poartă acces auto, curent trifazic CATV stradă asfaltată, iluminat stradal. Confortul termic se realizează cu ajutorul sobelor de teracotă Necesită renovări: geamuri termopan, renovare plafon, aducerea apei în casă și amenajarea băii bucatariei. Se vinde mobilată după cum este prezentată în imagini. Proprietatea dispune de  teren pentru grădină, poziționat în spatele casei, partial în pantă, ideal pentru plantarea viței-de-vie și a pomilor fructiferi, dar și pentru o grădină generoasă de legume și zarzavaturi. Dacă îți dorești o casă bine compartimentată, această locuință îti poate oferi tot confortul și calitatea unui cămin bine structurat. Ideală pentru: - locuință permanentă pentru familie, - casă de vacanță, - conversie în pensiune rurală, - investiție pe termen lung. ID anunț : 1756894603",03.09.2025,1,161532.546875,2025-03-09,273.0,0,-102032.546875
17,Anunț,36999,EUR,4,3662,https://www.publi24.ro/anunturi/imobiliare/de-vanzare/case/case-vile/anunt/vand-casa-la-tara/d8545eh95h037f8fe1260d963d635i92.html,images_case/anunt_17_img_0.jpg|images_case/anunt_17_img_1.jpg|images_case/anunt_17_img_2.jpg|images_case/anunt_17_img_3.jpg,4,,"Vând casa la Țara, Mai exact în Bălaia la 22 de Km De Oradea! Suprafața terenului este de 3662mp Pentru mai multe detali sunați la zero zero trei patru șase patru doi, doi, doi, patru opt unu șapte ID anunț : 1697981574",22.10.2023,1,172057.53125,2023-10-22,777.0,0,-135058.53125
18,Anunț,199500,EUR,6,500,https://www.publi24.ro/anunturi/imobiliare/de-vanzare/case/case-vile/anunt/casa-de-vanzare-direct-proprietar/35889eig622g7913e44200di5fdifd98.html,images_case/anunt_18_img_0.webp|images_case/anunt_18_img_1.webp|images_case/anunt_18_img_2.webp|images_case/anunt_18_img_3.webp,4,,"Casa P+E+ pod, direct de la proprietar. Suprafata teren 500 mp. Suprafata utila 220 mp. Anul construcției 2008 din caramida. La parter: living generos, o camera birou, baie cu dus , bucatarie, camera tehnica cu centrala proprie termica pe gaz, care are si usa exterioara , debara. La etaj: 4 dormitoare, baie cu cada si bideu, biblioteca. Fiecare dormitor are balcon, iar unul are si teracota pe lângă calorifer. Exista un garaj construit din caramida, cu pod, dar si alte 4 locuri de parcare in curte, pe aleea de langa casa. Terasa de aproximativ 15 mp in spatele casei langa bucataria complet mobilata si utilata, inclusiv masina spalat vase. Ferestre cu geam termopan, usa intrare PVC, usi intetioare din lemn, podele: gresie si parchet. Strada este asfaltata, iluminat stradal, paza, mijloc de transport in comun, apa curenta, gaz-calorifere , curent, canalizare, internet. ID anunț : 1762536444",07.04.2009,1,143648.25,2009-07-04,6000.0,0,55851.75
19,Anunț,165000,EUR,4,373,https://www.publi24.ro/anunturi/imobiliare/de-vanzare/case/case-vile/anunt/casa-la-cheie-oras-pantelimon/648h994336217330d5h83h3he0g8gfhg.html,images_case/anunt_19_img_0.webp|images_case/anunt_19_img_1.webp|images_case/anunt_19_img_2.webp|images_case/anunt_19_img_3.webp,4,,"Casa de vanzare Oras Pantelimon Intr.prutului nr 31 Teren 373 mp Construcție 97 mp Casa este alcătuită din: 2 dormitoare 1 living 2 bai 1 hol 1 bucătărie 1 terasa Placa de beton între Parter si pod Casa se afla in construcție dar se preda la cheie Aveți posibilitatea de a va alege finisajele Se accepta credit bancar Toată documentația pregătită pentru banca,  notar ID anunț : 1762261213",21.03.2018,2,170031.625,2018-03-21,2818.0,0,-5031.625
20,Anunț,34000,EUR,4,30,https://www.publi24.ro/anunturi/imobiliare/de-vanzare/case/case-vile/anunt/casa-de-vanzare/31df197f869i7h06e46eid7328fde4e4.html,images_case/anunt_20_img_0.webp|images_case/anunt_20_img_1.webp|images_case/anunt_20_img_2.webp|images_case/anunt_20_img_3.webp,4,,Vând casă si teren in satul Valioara comuna Răchitova la 17km de orașul Hațeg in stare buna cu toate utilitățile plus anexe M-ai multe detalii la telefon ID anunț : 1755827805,01.10.2012,2,130941.890625,2012-01-10,5080.0,0,-96941.890625
21,Anunț,176000,EUR,4,116,https://www.publi24.ro/anunturi/imobiliare/de-vanzare/case/case-vile/anunt/utvin-casa-individuala-direct-de-la-proprietar/67g66e4hhfe776h7d9248i18iehgg5ii.html,images_case/anunt_21_img_0.webp|images_case/anunt_21_img_1.webp|images_case/anunt_21_img_2.webp|images_case/anunt_21_img_3.webp,4,,"Oferim spre vânzare o casă individuală complet finalizată situată în Utvin,pe o strada liniștită ferită de aglomerație. Casa beneficiază de toate utilitățile de la rețea (apă,gaz,curent,canalizare),sistem de încălzire prin pardoseală,centrală termică,geamuri tripan bicolore alb antracit,curte amenajată cu gazon și aleei betonate. Compartimentare: -hol de acces -2 băi -3 dormitoare -bucătărie închisă -living -terasă acoperită -pod de depozitare Suprafața utilă -116mp Suprafața teren-400mp Se acceptă achiziționarea prin intermediul unui credit bancar. Casa este disponibilă pentru o mutare imediată. Prețul este de 176.000 euro TVA inclus. Nu se percepe comision ,COMISION 0%. Mai multe detalii telefonic. ID anunț : 1761925949",03.08.2022,1,139392.53125,2022-03-08,1370.0,0,36607.46875
22,Anunț,25000,EUR,4,22,https://www.publi24.ro/anunturi/imobiliare/de-vanzare/case/case-vile/anunt/vand-casa-la-23-km-de-craiova/f8gi5d750g797g18e9f5eid7d1801356.html,,0,,casa4 camere  gard de beton ID anunț : 1657178004,29.11.2021,1,21531.197265625,2021-11-29,1469.0,0,3468.802734375
23,Anunț,150000,EUR,3,75,https://www.publi24.ro/anunturi/imobiliare/de-vanzare/case/case-vile/anunt/triplex-giroc-mobilat-si-utilat-150-000-euro/43h0h888e05d741he4heih10ee1hi2e5.html,images_case/anunt_23_img_0.jpg|images_case/anunt_23_img_1.jpg|images_case/anunt_23_img_2.jpg|images_case/anunt_23_img_3.jpg,4,,"Anunț de Vânzare Triplex -Giroc Avem plăcerea de a vă oferi spre vânzare un triplex modern, situat într-o zonă liniștită de case, ideal pentru familii sau pentru cei care caută confort și intimitate. Detalii imobil: Suprafață utilă: 75 mp Structură: Parter + Etaj Construcție: 2021 (din cărămidă) Împărțirea spațiului: Parter: bucătărie, hol, baie, terasă Etaj: 2 dormitoare, baie, balcon Dotări: Mobilier de calitate, se vinde complet mobilat și utilat Încălzire prin pardoseală Aer condiționat Carport pentru parcare Eficiență energetică: Clasă A Locație: Situat aproape de benzinăria ESO, la limita dintre Timișoara și Giroc, într-o zonă ce oferă liniște și acces la facilități necesare. Această proprietate reprezintă o oportunitate excelentă pentru cei care caută un cămin modern, confortabil și bine echipat. Preț: 150.000 Euro Nu ratați ocazia de a deveni proprietar al acestui triplex! Pentru mai multe informații sau pentru programarea unei vizionări, vă rugăm să ne contactați. Telefon   0723 100 819 ID anunț : 1731084973",21.02.2010,381,147487.0625,2010-02-21,5768.0,0,2512.9375
24,Anunț,57000,EUR,4,5725,https://www.publi24.ro/anunturi/imobiliare/de-vanzare/case/case-vile/anunt/vand-casa-cu-teren-5725-mp-livada-100-pomi-fructiferi-hala-220-mp-in-dragoiesti-jud-timis/9g77i5eh088f71hhe6g37451d19d298i.html,images_case/anunt_24_img_0.webp|images_case/anunt_24_img_1.webp|images_case/anunt_24_img_2.webp|images_case/anunt_24_img_3.webp,4,,"Proprietar, vând casă cu curte, gradina, livada și hala în satul Dragoiesti, comuna Racovița, judetul Timiș. Casa este integral din cărămidă, cu pod înalt, parțial izolata termic. Necesita renovare moderată. Baia și bucătăria nu sunt amenajate. -suprafață teren: 5725 mp.                                         -suprafață hala: 222 mp. -livada mixta tânără, intrata pe rod, 100 pomi fructiferi. -anexe: grajd, cocina, coteț, țarc exterior pentru păsări, cuști iepuri, afumătoare zidită.                                       -utilități: curent electric trifazic, rețeaua de apă în fața casei, foraj pentru udarea grădinii, gaz in perspectiva. ID anunț : 1758763229",03.03.2008,1,150286.4375,2008-03-03,6488.0,0,-93286.4375
25,Anunț,150000,EUR,4,132,https://www.publi24.ro/anunturi/imobiliare/de-vanzare/case/case-vile/anunt/casa-cu-4-camere-curte-proprie-renovata-zona-centrala-str-mihai-viteazu/i93i1969i3i77dhhehehh94di541851e.html,images_case/anunt_25_img_0.webp|images_case/anunt_25_img_1.webp|images_case/anunt_25_img_2.webp|images_case/anunt_25_img_3.webp,4,,,14.10.2020,53,263004.46875,2020-10-14,1880.0,0,-113004.46875
26,Anunț,469000,EUR,10,384,https://www.publi24.ro/anunturi/imobiliare/de-vanzare/case/casa-de-vacanta/anunt/pensiune-cu-10-camere-de-vanzare-in-breb/38f43d484f0d79fd12g84517gh7g60g9.html,images_case/anunt_26_img_0.webp|images_case/anunt_26_img_1.webp|images_case/anunt_26_img_2.webp|images_case/anunt_26_img_3.webp,4,,"Satul Breb ,situat in inima Maramuresului ,este un loc renumit pentru pastrarea autentica a vietii cotidiene maramuresene .Atmosfera sa traditionala ,cu case de lemn vechi de secole ,porti sculptate manual si obiceiuri stravechi ,ofera vizitatorilor o experienta autentica si de neuitat. Breb este cunoscut si pentru numeroasele pensiuni care gazduiesc turistii dornici sa descopere farmecul rural si ospitalitatea maramureseana ,care l au cucerit si pana pe monarhul Angliei. Peisajele de poveste ale satului ,cu dealuri inverzite si vai pitoresti ,sunt completate de privelisti spectaculoase catre Creasta Cocosului ,o formatiune stancoasa impresionanta ,ideala pentru drumetii si explorari. In apropiere se gasesc si alte atractii importante ,cum ar fi partia de schi din Cavnic ,telescaunul Suior si statiunile cu ape sarate si dulci din Ocna Sugatag. Astfel ,Breb reuseste sa atraga turisti datorita frumusetii sale naturale ,traditiilor autentice si oportunitatilor diverse de recreere ,consolidandu si reputatia de destinatie turistica de top in Maramures. Situata in pitoreasca localitate Breb, aceasta pensiune ofera un refugiu autentic in inima Maramuresului, pe un teren generos de 2371mp. Cladirea principalaare o suprafata de 384mp si include sase camere spatioase ,fiecare cu baie proprie ,idelala pentru a gazdui oaspeti in confort total ,de asemenea se mai afla si o casa traditionala de 110 mp care dispune de o centrala proprie si patru camere ,la fel cu bai proprii. Facilitati si Dotari 6 camere cu bai proprii ,decorate in stil traditional maramuresean. doua terase, una interioara si una exterioara , perfecta pentru relaxare. o sala de mese cu o capacitate totala de 20 de persoane ,si o terasa exterioara cu o capacitate de 36 de persoane. anexa cu cuptor pentru paine si cazan pentru palinca. trei porti maramuresene autentice care aduc un farmec deosebit locatiei. Echipamente si Infrastructura centrala pe lemne si boiler de apa de 400 litri. panouri fotovoltaice de 6KW care asigura independenta energetica. apa curenta si fosa septica. colejna pentru depozitarea lemnelor necesare pentru incalzire. Facilitati Externe o gradina bine intretinuta si o livada cu pomi fructiferi. garaj de 40mp ,echipat cu masini de spalat ,frigifer si masina de spalat vase. Constructuie si Desing Pensiunea ,construita in anul 2012 , este acoperita cu un acoperis din tabla, asigurand durabilitate si protectie impotriva intemperiilor. Interiorul si exteriorul sunt decorate cu elemente traditional maramuresene ,oferind o experienta autentica si unica. Aceasta pensiune este locul ideal pentru cei care doresc sa se bucure de frumusetea si traditiile Maramuresului, intr un cadru confortabil si bine echipat. ID anunț : 1751330067",11.08.2022,99,151392.96875,2022-11-08,1125.0,0,317607.03125
27,Anunț,399800,EUR,4,193,https://www.publi24.ro/anunturi/imobiliare/de-vanzare/case/case-vile/anunt/film-tur-3d-locuinta-rafinata-arhitectura-cu-personalitate-asezare-cautata-livezeni-mures/d067ig4higd17860dgg4g0e80gd0785d.html,images_case/anunt_27_img_0.jpg|images_case/anunt_27_img_1.jpg|images_case/anunt_27_img_2.jpg|images_case/anunt_27_img_3.jpg,4,,"Comision cumparator:0% ASCENDENT IMOBILIARE TARGU MURES va propune: Vila de Lux cu Arhitectura Moderna, Confort si Securitate de Top Descoperiti aceasta superba vila cu arhitectura moderna, finalizata in 2019, ce ofera o locuinta ideala pentru cei care apreciaza eleganta, confortul si siguranta. Situata pe un teren generos de 16,2 arii, aceasta proprietate se remarca prin finisajele premium si dotarile de top. Va invitam sa experimentati o vizionare initiala, din locatia unde va aflati, chiar acum, prin accesarea turului virtual  si a filmului de prezentare: Tur virtual tridimensional: https:  my.matterport.com show ?m=RopYL4g4Jrt Film prezentare: https:  www.youtube.com watch?v=M9xOiMw995Q Detalii Tehnice si Structurale: Suprafata utila: 193 mp | Desfasurata: 360 mp; Constructie solida, cu fundatie din beton, zidarie Porotherm si izolatie termica superioara; Acoperis durabil din tigla Bramac; Instalatie electrica premium, cu cablaj separat pe fiecare nivel; Geamuri termopan de calitate germana. Interior de Lux si Functionalitate: Parter: Hol primitor cu dulap incorporat; Bucatarie open space, complet echipata cu aparatura AEG: cuptor incorporat, plita cu inductie, cuptor cu microunde, hota tip insula, frigider LG Side by Side; Living spatios tip loft, cu semineu modern si incalzire in pardoseala de ultima generatie; Dormitor generos si un dressing complet utilat; Baie moderna, complet echipata, cu dus walk-in. Mansarda: 3 dormitoare mobilate cu gust; Baie moderna cu cada si oglinda smart; Acces la terasa de 50 mp cu gazon artificial din doua dormitoare si balcon de 7 mp din al treilea dormitor. Spatii Exterioare Amenajate: Terasa de 100 mp la nivelul solului; Curte pavata cu piatra naturala, iluminata ambiental; Garaj dublu automatizat, cu rigole de scurgere si spatiu de depozitare suplimentar; Pivnita cu usa culisanta; Doua terase suplimentare de 70 mp, amplasate deasupra garajului si depozitului; Fantana cu hidrofor; Foisor acoperit cu tigla Bramac, inconjurat de plante ornamentale, tuia si pomi fructiferi; Aleile din jurul casei pavate cu granit; Teren complet imprejmuit cu gard si terasat pe 4 nivele. Confort si Securitate de Varf: Confort termic asigurat de centrala Vaillant, incalzire in pardoseala si semineu modern; la mansarda sunt disponibile calorifere; Sistem de securitate avansat: alarma BSG, camere de supraveghere, senzori de miscare in fiecare incapere; Cablu TV si internet de mare viteza; Iluminare LED interior-exterior, cu lumini ambientale; Mobilier MDF personalizat, de inalta calitate. Aceasta vila reprezinta combinatia perfecta intre design modern, functionalitate si siguranta, fiind alegerea ideala pentru o familie care isi doreste un camin deosebit, in care luxul si confortul sunt la ele acasa. Nu ratati oportunitatea de a deveni proprietarul acestei bijuterii imobiliare! Se accepta ca si metoda de plata credit , cash si BTC. Invitam colegii la colaborare, onoram agentul  agentia partenera cu comisionul aferent! Detalii, fotografii suplimentare, precum si alte variante similare exclusive: www.ascendentimobiliare.ro ID anunț : 1763502226",23.05.2018,500,208931.359375,2018-05-23,2755.0,0,190868.640625
28,Anunț,330000,EUR,4,164,https://www.publi24.ro/anunturi/imobiliare/de-vanzare/case/case-vile/anunt/casa-individuala-164-mp-utili-433-mp-teren-zona-dezmir-partea-de-jos/e01e22h9g4d178hidh6g820d459403gd.html,images_case/anunt_28_img_0.jpg|images_case/anunt_28_img_1.jpg|images_case/anunt_28_img_2.jpg|images_case/anunt_28_img_3.jpg,4,,"Va oferim spre vanzare casa individuala situata in prima parte din Dezmir, partea de jos, cu acces foarte rapid si cu mijloace de transport in apropiere si la 2 km de intrarea in Cluj. Casa are suprafata utila de 164 mp, 433 mp teren si este organizata astfel: Parter - living cu dining, bucatarie, baie, casa scarii, camera tehnica si terasa. La etaj: 3 dormitoare, 2 bai, dresing, hol si 1 terasa. Incalzirea se face prin centrala proprie cu sistem de incalzire in pardoseala la parter si calorifere la etaj. Casa are curent electric, gaz, apa si canalizare si se vinde partial mobilata si utilata. Va asteptam cu drag sa ne contactati pentru a stabili o vizionare! ID anunț : 1720695999",07.04.2020,470,144637.0625,2020-07-04,1982.0,0,185362.9375
29,Anunț,195000,EUR,4,108,https://www.publi24.ro/anunturi/imobiliare/de-vanzare/case/case-vile/anunt/casa-noua-eficienta-energetic-giroc-108-mp-utili-276-mp-teren-195-000-euro/91h5g1d22f28730f228004e1gh166e25.html,images_case/anunt_29_img_0.webp|images_case/anunt_29_img_1.webp|images_case/anunt_29_img_2.webp|images_case/anunt_29_img_3.webp,4,,"Oportunitate de a achiziționa o casă modernă și eficientă energetic în Giroc. Situată într-o zonă liniștită, proprietatea oferă 108 mp utili și 276 mp teren. Caracteristici: Compartimentare practică: - Parter: living cu acces la terasă acoperită, bucătărie închisă, debara, baie, camera tehnica. - Etaj: 3 dormitoare (unul cu dressing), 2 balcoane și baie. Unitate separata prin camera tehnica, fara pereti comuni. Eficiență energetică ridicată, datorită pompei de căldură și panourilor fotovoltaice Finisaje de înaltă calitate. Curte cu gazon rulou. Toate utilitățile: gaz, curent, apă și canalizare. 2 locuri de parcare. Pret 195.000 Euro Tel.0723100819 ID anunț : 1759425642",21.02.2010,381,158118.25,2010-02-21,5768.0,0,36881.75
30,Anunț,25500,EUR,3,23,https://www.publi24.ro/anunturi/imobiliare/de-vanzare/case/case-vile/anunt/vand-casa-in-com-zam-hunedoara-central-pret-25-500-negociabil/5e9ffeeg301879f5e4h3h5g0gg7fdeeh.html,images_case/anunt_30_img_0.jpg|images_case/anunt_30_img_1.jpg|images_case/anunt_30_img_2.jpg|images_case/anunt_30_img_3.webp,4,,"Vând casa in comuna Zam,jud.Hunedoara.Casa este situată central,fiind în apropiere magazine alimentare,primăria, scoala,gradinita, camin cultural, spital,gara,etc.Casa necesită renovare! Dispune de 3 camere,bucatarie, baie,pivniță,2 holuri,posibilitate terasă deasupra pivnitei + anexe,fantana, curte frontala cu vita de vie,curte pentru pasari, grădină. Preț 25. 500 euro negociabil. Mai multe detalii la telefon:  Gabi. ID anunț : 1724526701",24.08.2024,1,135408.046875,2024-08-24,470.0,0,-109908.046875
31,Anunț,150000,EUR,6,4720,https://www.publi24.ro/anunturi/imobiliare/de-vanzare/case/case-vile/anunt/casa-de-vanzare-in-orasul-covasna/31f892995fe17gh42e6116ie3ef6h12d.html,images_case/anunt_31_img_0.webp|images_case/anunt_31_img_1.webp|images_case/anunt_31_img_2.webp|images_case/anunt_31_img_3.webp,4,,"Proprietatea se afla in Covasna si are o suprafata de 4720mp. Suprafata construita este de 366 mp si are 2 corpuri de casa, unul mai nou si unul mai vechi. Aceasta dispune de 9 dormitoare, 2 bucatari, 2 bai, 3 balcoane, o camara, un beci, un cuptor de facut paine si o sura veche. Propietatea prezinta curtea din fata, curtea din spate si o gradina mare cu vita de vie. In anul 2023 s-au terminat finisarile atat in interior cat si in exterior. Pentru cei interesati va rog sa contactati nr de tel Exclus agenti ID anunț : 1765055864",07.11.2024,1,194686.625,2024-07-11,514.0,0,-44686.625
32,Anunț,150766,EUR,4,134,https://www.publi24.ro/anunturi/imobiliare/de-vanzare/case/case-vile/anunt/casa-giroc-4-camere-complex-privat-150-766-euro/ehi0eefe20i77137ee1dhe90gh7de01i.html,images_case/anunt_32_img_0.jpg|images_case/anunt_32_img_1.jpg|images_case/anunt_32_img_2.jpg|images_case/anunt_32_img_3.jpg,4,,"Casa este situata in Giroc, are 2 locuri de parcare proprii. Este construita pe un teren de 134 mp, 86 mp utili + curte libera + pod. Este compartimentata astfel: Parter: hol, living, zona de luat masa, bucatarie, baie, camera tehnica, terasa; Etaj: hol, 3 dormitoare, 1 baie, balcon. Casa este racordata la toate utilitatile (canalizare, gaz, apa, curent), dispunand de centrala proprie pe gaz, geamuri pvc 3 sticle profile Rehau, izolatie exterior Baumit 100 mm eps 80, caramida porotherm Cemacon 30 com, betoane Holcim, pod pentru depozitare, placa de beton. Pretul este de 150.766 euro. Telefon: 0741145639. ID anunț : 1665740877",21.02.2010,381,147477.59375,2010-02-21,5768.0,0,3288.40625
33,Anunț,72500,EUR,2,1200,https://www.publi24.ro/anunturi/imobiliare/de-vanzare/case/case-vile/anunt/1200mp-teren-casa-cu-2-corpuri-asfalt-utilitati-locatie-buna/d920i2fe68g77hed2d27i3522480h59d.html,images_case/anunt_33_img_0.webp|images_case/anunt_33_img_1.webp|images_case/anunt_33_img_2.webp|images_case/anunt_33_img_3.webp,4,,"De vanzare casa cu teren  in jud. Timis, comuna Peciu Nou ( 23 km de Timisoara) cu acces pe diferite rute. Imobilul este situat pe o strada asfaltata, iluminata, adiacenta drumului principal( nu este trafic), foarte aproape de Magazinul La 2 Pasi , aproape de Gradinita si Scoala. Casa este compusa din 2 corpuri : Corpul 1 :  bucatarie , camera renovata si mobilata, camera neamenajata. Corptul 2 :  bucatarie , baie , 2 camere amenajate si mobilate. Proprietatea are acces la toate utilitatile, fiind racordata la : apa, canalizare, curent electric. Gazul este la poarta. Incalzirea se realizeaza cu soba-lemne. In spatele casei exista o anexa si o gradina care poate fi folosita pentru activitati agricole. Se vinde exact cum este prezentata in galeria foto. Contactati-ma telefonic sau mesaj pe WhatsApp si trimit video-uri, poze, anterior vizitei. NU se plateste comision . 0757192289 Sasu Razvan ID anunț : 1765055747",19.03.2019,32,154265.71875,2019-03-19,2455.0,0,-81765.71875
34,Anunț,195000,EUR,4,108,https://www.publi24.ro/anunturi/imobiliare/de-vanzare/case/case-vile/anunt/casa-noua-eficienta-energetic-giroc-108-mp-utili-276-mp-teren-195-000-euro/8f217ddf05i7712d274650f9gf2d4fd8.html,images_case/anunt_34_img_0.webp|images_case/anunt_34_img_1.webp|images_case/anunt_34_img_2.webp|images_case/anunt_34_img_3.webp,4,,"Oportunitate de a achiziționa o casă modernă și eficientă energetic în Giroc. Situată într-o zonă liniștită, proprietatea oferă 108 mp utili și 276 mp teren. Caracteristici: Compartimentare practică: - Parter: living cu acces la terasă acoperită, bucătărie închisă, debara, baie, camera tehnica. - Etaj: 3 dormitoare (unul cu dressing), 2 balcoane și baie. Unitate separata prin camera tehnica, fara pereti comuni. Eficiență energetică ridicată, datorită pompei de căldură și panourilor fotovoltaice Finisaje de înaltă calitate. Curte cu gazon rulou. Toate utilitățile: gaz, curent, apă și canalizare. 2 locuri de parcare. Pret 195.000 Euro Tel.0723100819 ID anunț : 1747402039",21.02.2010,381,152926.421875,2010-02-21,5768.0,0,42073.578125
35,Anunț,72500,EUR,2,1200,https://www.publi24.ro/anunturi/imobiliare/de-vanzare/case/case-vile/anunt/1200mp-teren-casa-cu-2-corpuri-asfalt-utilitati-locatie-buna/950fieg7f3f578441h4160i6672dh677.html,images_case/anunt_35_img_0.webp|images_case/anunt_35_img_1.webp|images_case/anunt_35_img_2.webp|images_case/anunt_35_img_3.webp,4,,"De vanzare casa cu teren  in jud. Timis, comuna Peciu Nou ( 23 km de Timisoara) cu acces pe diferite rute. Imobilul este situat pe o strada asfaltata, iluminata, adiacenta drumului principal( nu este trafic), foarte aproape de Magazinul La 2 Pasi , aproape de Gradinita si Scoala. Casa este compusa din 2 corpuri : Corpul 1 :  bucatarie , camera renovata si mobilata, camera neamenajata. Corptul 2 :  bucatarie , baie , 2 camere amenajate si mobilate. Proprietatea are acces la toate utilitatile, fiind racordata la : apa, canalizare, curent electric. Gazul este la poarta. Incalzirea se realizeaza cu soba-lemne. In spatele casei exista o anexa si o gradina care poate fi folosita pentru activitati agricole. Se vinde exact cum este prezentata in galeria foto. Contactati-ma telefonic sau mesaj pe WhatsApp si trimit video-uri, poze, anterior vizitei. NU se plateste comision . 0757192289 Sasu Razvan ID anunț : 1764238571",19.03.2019,32,154265.71875,2019-03-19,2455.0,0,-81765.71875
36,Anunț,150766,EUR,4,134,https://www.publi24.ro/anunturi/imobiliare/de-vanzare/case/case-vile/anunt/casa-giroc-drum-asfaltat-150-766-euro/8i77f3h8e25378g5e5dededg3e21id55.html,images_case/anunt_36_img_0.jpg|images_case/anunt_36_img_1.jpg|images_case/anunt_36_img_2.jpg|images_case/anunt_36_img_3.jpg,4,,"Casa este situata in Giroc, are 2 locuri de parcare proprii. Este construita pe un teren de 134 mp, 86 mp utili + curte libera + pod. Este compartimentata astfel: Parter: hol, living, zona de luat masa, bucatarie, baie, camera tehnica, terasa; Etaj: hol, 3 dormitoare, 1 baie, balcon. Casa este racordata la toate utilitatile (canalizare, gaz, apa, curent), dispunand de centrala proprie pe gaz, geamuri pvc 3 sticle profile Rehau, izolatie exterior Baumit 100 mm eps 80, caramida porotherm Cemacon 30 com, betoane Holcim, pod pentru depozitare, placa de beton. Pretul este de 150.766 euro. Telefon: 0741145639. ID anunț : 1665741272",21.02.2010,381,161992.390625,2010-02-21,5768.0,0,-11226.390625
37,Anunț,152000,EUR,4,300,https://www.publi24.ro/anunturi/imobiliare/de-vanzare/case/case-vile/anunt/casa-individuala-sagului-teren-300mp-4-camere-152-000-euro/025edfee7d7d7g0824542d317i02i712.html,images_case/anunt_37_img_0.webp|images_case/anunt_37_img_1.webp|images_case/anunt_37_img_2.webp|images_case/anunt_37_img_3.webp,4,,"Vă propunem spre vânzare o casă individuală situată în zona Sagului. Caracteristici: Suprafață utilă: 110 mp Teren: 300 mp An construcție: 1973 (îmbunătățită în 2012) Structură: Solidă, izolație cu polieter Compartimentare: 3 dormitoare, hol, living, bucătărie, baie, beci, garaj Facilități: Casa este racordată la toate utilitățile și beneficiază de un garaj propriu. De asemenea, poziția casei este excelentă, având toate necesitățile la câteva minute de mers pe jos, inclusiv mijloace de transport în comun, hipermarketuri, grădiniță și școală. Pret 152.000 Euro Tel 0723100819 ID anunț : 1760893419",21.02.2010,381,158439.875,2010-02-21,5768.0,0,-6439.875
38,Anunț,195000,EUR,4,108,https://www.publi24.ro/anunturi/imobiliare/de-vanzare/case/case-vile/anunt/casa-giroc-4-camere-constructie-noua-195-000-euro/g7did7ge0d577453223fd7g86d44f907.html,images_case/anunt_38_img_0.webp|images_case/anunt_38_img_1.webp|images_case/anunt_38_img_2.webp|images_case/anunt_38_img_3.webp,4,,"Oportunitate de a achiziționa o casă modernă în localitatea Giroc. Situată într-o zonă liniștită, proprietatea oferă 108 mp utili și 276 mp teren. Unitate separata prin camera tehnica, fara pereti comuni. Caracteristici: Compartimentare practică: - Parter: living cu acces la terasă acoperită, bucătărie închisă, debara, baie, camera tehnica. - Etaj: 3 dormitoare (unul cu dressing), 2 balcoane și baie. Finisaje de înaltă calitate. Toate utilitățile: gaz, curent, apă și canalizare. 2 locuri de parcare in fata casei Pret 179.000 Euro Tel.0723100819 ID anunț : 1759426784",21.02.2010,381,149320.984375,2010-02-21,5768.0,0,45679.015625
39,Anunț,145000,EUR,4,90,https://www.publi24.ro/anunturi/imobiliare/de-vanzare/case/case-vile/anunt/casa-insiruita-chisoda-drum-asfaltat-4-camere-90mp-145-000-euro/363573de578h77e6157877h3f8877334.html,images_case/anunt_39_img_0.webp|images_case/anunt_39_img_1.webp|images_case/anunt_39_img_2.webp|images_case/anunt_39_img_3.webp,4,,"Se vinde o casa insiruita situata intr-un ansamblu rezidential cu acces privat, in localitatea Chisoda, aproape de restaurantul Cuina, la asfalt. Imobilul are o suprafata utila de 90 mp si dispune de teren in spate de 40 mp, precum si de doua locuri de parcare in fata casei. Este racordata la toate utilitatile: curent, gaz, apa si canalizare. Casa este compartimentata astfel: la parter se afla livingul cu bucataria open space (cu posibilitate de inchidere), o baie si terasa, iar la etaj sunt trei dormitoare, o baie si un pod cu scara retractabila (spatiu de depozitare). Imobilul beneficiaza de finisaje de calitate, precum gresie, faianta, parchet laminat, instalatii electrice si sanitare moderne, obiecte sanitare montate in bai, centrala proprie pe gaz si incalzire prin pardoseala. Pretul de vanzare este de 145.000 euro. Pentru mai multe informatii sunati la 0723 100 819. ID anunț : 1762283209",21.02.2010,381,163669.359375,2010-02-21,5768.0,0,-18669.359375
40,Anunț,150000,EUR,3,75,https://www.publi24.ro/anunturi/imobiliare/de-vanzare/case/case-vile/anunt/triplex-giroc-mobilat-si-utilat-complet-2-locuri-de-parcare-150-000-euro/i78d7h7g026f7261eh0e07h4d9hi4767.html,images_case/anunt_40_img_0.webp|images_case/anunt_40_img_1.webp|images_case/anunt_40_img_2.webp|images_case/anunt_40_img_3.webp,4,,"Descoperă acest triplex modern de vânzare în Giroc, ideal pentru familie! Cu o suprafață de 75 mp, construcție din 2021, și finisaje de calitate, locuința este compusă din parter și etaj, incluzând living, bucătărie, 2 dormitoare, 2 băi, terasă și balcon. Este complet mobilată și utilată, cu încălzire prin pardoseală, aer condiționat și carport. Situată aproape de Timișoara, aproape de Eso, într-o zonă liniștită, această proprietate eficientă energetic oferă confort și intimitate. Preț: 150.000 Euro. Contactează-ne pentru vizionare! Tel 0723100819 ID anunț : 1759430516",21.02.2010,381,159898.46875,2010-02-21,5768.0,0,-9898.46875
41,Anunț,170000,EUR,4,115,https://www.publi24.ro/anunturi/imobiliare/de-vanzare/case/case-vile/anunt/duplex-giroc-4-camere-3-bai-115mp-utili-170-000-euro/2hfheid61ghd715i18e5781e9hff3e84.html,images_case/anunt_41_img_0.webp|images_case/anunt_41_img_1.webp|images_case/anunt_41_img_2.webp|images_case/anunt_41_img_3.webp,4,,"Propunem spre vânzare jumătate de duplex situat în localitatea Giroc, într-o zonă nouă de case, liniștită și bine dezvoltată, cu acces rapid la toate utilitățile. Proprietatea are tipologia P+1E și o suprafață utilă de 115 mp, fiind compartimentată astfel: Parter: - Hol de acces - Baie - Spațiu de depozitare - Bucătărie + living open space (cu posibilitatea de închidere a bucătăriei) - Acces către terasa generoasă de 20 mp Etaj: - Hol - Baie - spatiu pentru dressing - 3 dormitoare, dintre care unul matrimonial, prevăzut cu baie proprie și dressing - Balcon Toate băile dispun de geam pentru aerisire naturală. Finisajele sunt la alegere, dintr-o gamă variată, pentru a vă personaliza locuința după propriul gust. Confortul termic este asigurat de centrala proprie pe gaz și încălzire prin pardoseală. Curtea permite amenajarea unui carport pentru protejarea mașinii. Fotografiile din anunț reprezintă randări folosite cu scop informativ. Casa se află în stadiul de selectare a finisajelor, acestea putând fi personalizate de viitorul proprietar. Termenul de predare este de aproximativ două săptămâni. Preț: 170.000 (TVA 21% inclus) Telefon: 0723 100 819 ID anunț : 1763754176",21.02.2010,381,168784.734375,2010-02-21,5768.0,0,1215.265625
42,Anunț,159900,EUR,4,102,https://www.publi24.ro/anunturi/imobiliare/de-vanzare/case/case-vile/anunt/casa-individuala-4-camere-remetea-mare/2g63d249258e70191hh6891g8e917di1.html,images_case/anunt_42_img_0.webp|images_case/anunt_42_img_1.webp|images_case/anunt_42_img_2.webp|images_case/anunt_42_img_3.jpg,4,,"Proprietar ofer spre vanzare casa individuala( la cheie) în Remetea Mare cu o suprafață utilă de 102 mp, având 3 dormitoare, 2 bai, hol, living, bucătărie, cameră tehnică și terasă de 12 mp. Terenul are o suprafață de 532 mp. Casa este intabulata,gaz, curent, apa și fosa septica. Construcția este realizată din cărămidă Porotherm, tâmplărie pvc cu geam tripan, țiglă metalica, încălzire în pardoseala, placa peste parter, acoperis din țiglă, izolata cu polistiren de 10 cm. Aceasta se afla în Remetea Mare pe str. Macilor, având asfalt și iluminat stradal la 20 m. ID anunț : 1739629248",15.06.2021,1,124712.109375,2021-06-15,1636.0,0,35187.890625
43,Anunț,195000,EUR,4,108,https://www.publi24.ro/anunturi/imobiliare/de-vanzare/case/case-vile/anunt/casa-giroc-4-camere-108mp-utili-195-000-euro/id4h40h11h567h352hee840321i9714f.html,images_case/anunt_43_img_0.webp|images_case/anunt_43_img_1.webp|images_case/anunt_43_img_2.webp|images_case/anunt_43_img_3.webp,4,,"OOportunitate de a achiziționa o casă modernă și eficientă energetic în Giroc. Situată într-o zonă liniștită, proprietatea oferă 108 mp utili și 276 mp teren. Caracteristici: Compartimentare practică: - Parter: living cu acces la terasă acoperită, bucătărie închisă, debara, baie, camera tehnica. - Etaj: 3 dormitoare (unul cu dressing), 2 balcoane și baie. Unitate separata prin camera tehnica, fara pereti comuni. Eficiență energetică ridicată, datorită pompei de căldură și panourilor fotovoltaice Finisaje de înaltă calitate. Curte cu gazon rulou. Toate utilitățile: gaz, curent, apă și canalizare. 2 locuri de parcare. Pret 195.000 Euro Tel.0723100819 ID anunț : 1759427253",21.02.2010,381,148006.40625,2010-02-21,5768.0,0,46993.59375
44,Anunț,145000,EUR,4,90,https://www.publi24.ro/anunturi/imobiliare/de-vanzare/case/case-vile/anunt/casa-insiruita-chisoda-drum-asfaltat-4-camere-90mp-145-000-euro/d1gf86f1531970dg1ef654hg21g59ee9.html,images_case/anunt_44_img_0.webp|images_case/anunt_44_img_1.webp|images_case/anunt_44_img_2.webp|images_case/anunt_44_img_3.webp,4,,"Se vinde o casa insiruita situata intr-un ansamblu rezidential cu acces privat, in localitatea Chisoda, aproape de restaurantul Cuina, la asfalt. Imobilul are o suprafata utila de 90 mp si dispune de teren in spate de 40 mp, precum si de doua locuri de parcare in fata casei. Este racordata la toate utilitatile: curent, gaz, apa si canalizare. Casa este compartimentata astfel: la parter se afla livingul cu bucataria open space (cu posibilitate de inchidere), o baie si terasa, iar la etaj sunt trei dormitoare, o baie si un pod cu scara retractabila (spatiu de depozitare). Imobilul beneficiaza de finisaje de calitate, precum gresie, faianta, parchet laminat, instalatii electrice si sanitare moderne, obiecte sanitare montate in bai, centrala proprie pe gaz si incalzire prin pardoseala. Pretul de vanzare este de 145.000 euro. Pentru mai multe informatii sunati la 0723 100 819. ID anunț : 1762280053",21.02.2010,381,169016.921875,2010-02-21,5768.0,0,-24016.921875
45,Anunț,195000,EUR,4,108,https://www.publi24.ro/anunturi/imobiliare/de-vanzare/case/case-vile/anunt/casa-nou-giroc-4-camere-108mp-195-000-euro/1776107g391d76511ig93g7506425f16.html,images_case/anunt_45_img_0.webp|images_case/anunt_45_img_1.webp|images_case/anunt_45_img_2.webp|images_case/anunt_45_img_3.webp,4,,"Oportunitate de a achiziționa o casă modernă și eficientă energetic în Giroc. Situată într-o zonă liniștită, proprietatea oferă 108 mp utili și 276 mp teren. Caracteristici: Compartimentare practică: - Parter: living cu acces la terasă acoperită, bucătărie închisă, debara, baie, camera tehnica. - Etaj: 3 dormitoare (unul cu dressing), 2 balcoane și baie. Unitate separata prin camera tehnica, fara pereti comuni. Eficiență energetică ridicată, datorită pompei de căldură și panourilor fotovoltaice Finisaje de înaltă calitate. Curte cu gazon rulou. Toate utilitățile: gaz, curent, apă și canalizare. 2 locuri de parcare. Pret 195.000 Euro Tel.0723100819 ID anunț : 1759426897",21.02.2010,381,144288.0625,2010-02-21,5768.0,0,50711.9375
46,Anunț,152000,EUR,4,300,https://www.publi24.ro/anunturi/imobiliare/de-vanzare/case/case-vile/anunt/casa-individuala-zona-sagului-300mp-teren-4-camere-152-000-euro/02i0f2f5g21977g9d7h55h2323h42i42.html,images_case/anunt_46_img_0.webp|images_case/anunt_46_img_1.webp|images_case/anunt_46_img_2.webp|images_case/anunt_46_img_3.webp,4,,"Vă propunem spre vânzare o casă individuală situată în zona Sagului. Caracteristici: Suprafață utilă: 110 mp Teren: 300 mp An construcție: 1973 (îmbunătățită în 2012) Structură: Solidă, izolație cu polieter Compartimentare: 3 dormitoare, hol, living, bucătărie, baie, beci, garaj Facilități: Casa este racordată la toate utilitățile și beneficiază de un garaj propriu. De asemenea, poziția casei este excelentă, având toate necesitățile la câteva minute de mers pe jos, inclusiv mijloace de transport în comun, hipermarketuri, grădiniță și școală. Pret 152.000 Euro Tel 0723100819 ID anunț : 1760893856",21.02.2010,381,158685.953125,2010-02-21,5768.0,0,-6685.953125
47,Anunț,150766,EUR,4,134,https://www.publi24.ro/anunturi/imobiliare/de-vanzare/case/case-vile/anunt/casa-giroc-4-camere-150-766-euro/g38ff2g0h1787ffge117d97ihi5h752i.html,images_case/anunt_47_img_0.jpg|images_case/anunt_47_img_1.jpg|images_case/anunt_47_img_2.jpg|images_case/anunt_47_img_3.jpg,4,,"Casa este situata in Giroc, are 2 locuri de parcare proprii. Este construita pe un teren de 134 mp, 86 mp utili + curte libera + pod. Este compartimentata astfel: Parter: hol, living, zona de luat masa, bucatarie, baie, camera tehnica, terasa; Etaj: hol, 3 dormitoare, 1 baie, balcon. Casa este racordata la toate utilitatile (canalizare, gaz, apa, curent), dispunand de centrala proprie pe gaz, geamuri pvc 3 sticle profile Rehau, izolatie exterior Baumit 100 mm eps 80, caramida porotherm Cemacon 30 com, betoane Holcim, pod pentru depozitare, placa de beton. Pretul este de 150.766 euro. Telefon: 0741145639. ID anunț : 1665740722",21.02.2010,381,151857.53125,2010-02-21,5768.0,0,-1091.53125
48,Anunț,170000,EUR,6,1000,https://www.publi24.ro/anunturi/imobiliare/de-vanzare/case/case-vile/anunt/vila-s-p-2-la-intrare-in-mihailesti-giurgiu-tufa/423e0i5ge3fe7h8ged7410hedh45568h.html,images_case/anunt_48_img_0.jpg|images_case/anunt_48_img_1.jpg|images_case/anunt_48_img_2.jpg|images_case/anunt_48_img_3.jpg,4,,"Vila de vanzare in Mihailesti, Giurgiu cu subsol + parter + 2 etaje; se afla aproape de intrarea in oras si este prevazuta cu drum privat. UNIC PROPRIETAR. CONSTRUITA IN 2009 DE CATRE PROPRIETAR PENTRU UZ PERSONAL. Suprafata teren: 1000mp Subsol - 2 camere + 1 hol Parter: - camera cu dressing si baie - living room mare cu iesire in fata, scara acces etaj 1, scara acces subsol si acces bucatarie - baie de serviciu - bucatarie mare cu iesire in spate si acces centrala Etaj 1: - 1 camera cu baie, dressing si acces balcon mare - 1 camera cu dressing si acces balcon mare - birou care se poate transforma in camera - living mic cu balcon si scara acces etaj 2 - baie pe hol Etaj 2: - camera cu dressing, baie si balcon - camera cu dressing si acces balcon foarte mic - spatiu deschis cu acces balcon mic * casa este prevazuta cu centrala electrica cu lemne + bolier apa calda * butelie (in prezent se fac lucrari pentru implementare retea gaz) * casa are 3 iesiri (fata, spate si iesire prin centrala) * in fata, spatiu pentru 4, 5 masini * in lateral ""1"": magazie mare * in lateral ""2"": gazon + copacei (brazi, pomi fructiferi) * in spate: gratar din caramida, spatiu pentru gradina sau pentru piscina mica * porti electrice cu telecomanda * casa este imprejmuita cu gard din beton (in fata) si gard din lemn (in spate si laterale) ID anunț : 1616539967",13.05.2016,6,160690.546875,2016-05-13,3495.0,0,9309.453125
49,Anunț,65000,EUR,4,225,https://www.publi24.ro/anunturi/imobiliare/de-vanzare/case/case-vile/anunt/spatiu-comercial-225-mp-in-techirghiol-ideal-pentru-business/03745h865fdd72fie88dhg7e8d9efgf8.html,images_case/anunt_49_img_0.webp|images_case/anunt_49_img_1.webp|images_case/anunt_49_img_2.webp|images_case/anunt_49_img_3.webp,4,,"Spatiu comercial de vanzare in Techirghiol ndash; locatie excelenta, pret avantajos! Adresa: Strada Nicolae Balcescu nr. 24, Techirghiol, chiar langa geamie Detalii proprietate: Suprafata teren: 183 mp Amprenta la sol: 183 mp Suprafata construita desfasurata: 225 mp (include un beci de 42 mp) Compartimentare: 4 incaperi + beci Spatiul necesita renovare integrala Avantaje si potential: Pret imbatabil: 68000 euro (aprox. 300 euro mp construit) Toate actele pregatite: cadastru, intabulare ndash; vanzarea se poate perfecta imediat Utilitati: gazele sunt la poarta Locatie centrala, vizibilitate excelenta Potrivit pentru diverse activitati comerciale: productie, alimentatie publica, restaurante, magazine, jocuri de noroc, depozitare si multe altele De ce sa investesti aici? Spatiul se afla intr-o zona cu potential ridicat, perfecta pentru dezvoltarea unui business profitabil. Este o oportunitate rara de a cumpara un imobil comercial in Techirghiol la un pret avantajos, cu posibilitati multiple de valorificare. Contacteaza-ne acum pentru detalii si pentru programarea unei vizionari! ID anunț : 1755627582",29.04.2022,181,205879.3125,2022-04-29,1318.0,0,-140879.3125
50,Anunț,155000,EUR,5,165,https://www.publi24.ro/anunturi/imobiliare/de-vanzare/case/casa/anunt/casa-individuala-5-camere-zona-centrala-radauti/d64046f201817fefe0f0de852e467fgf.html,images_case/anunt_50_img_0.jpg|images_case/anunt_50_img_1.jpg|images_case/anunt_50_img_2.jpg|images_case/anunt_50_img_3.jpg,4,,"Blitz imobiliare ofera spre vanzare/schimb casa individuala in Radauti. Proprietatea dispune de o suprafata utila de 165 mp (P+1) pe un teren de 300 mp, fiind compartimentata dupa cum urmeaza : - parter : living generos, doua dormitoare, bucatarie utilata, garaj, spatiu tehnic si beci, hol, o baie cu dus si una cu cada - etaj: doua dormitoare mari, living, un dresing Cladirea este construita din caramida, foarte bine izolata, atat termic cat si fonic, dispune de geamuri termopan, o centrala termica pe gaz (2022). Situat intr-o zona linistita, predominanta de case, imobilul este alegerea ideala pentru o familie care doreste intimitate si liniste. Este o zona cu acces facil spre toate punctele de interes major: scoala, supermarket, piata, zone comerciale. Imobilul de vinde semiutilat. Va asteptam la vizionare! Cod ofertă / ID BLITZ: P101021 ID anunț : 1724859556",07.05.2021,9948,174792.59375,2021-07-05,1616.0,0,-19792.59375
51,Anunț,205000,EUR,4,520,https://www.publi24.ro/anunturi/imobiliare/de-vanzare/case/case-vile/anunt/exclusivitate-vila-noua-de-vanzare-in-sancrai-cartier-rasaritului/i67hgi724d0573egd2754h120feh641d.html,images_case/anunt_51_img_0.jpg|images_case/anunt_51_img_1.jpg|images_case/anunt_51_img_2.jpg|images_case/anunt_51_img_3.jpg,4,,"Blitz Imobiliare va ofera in exclusivitate la vanzare  ultimele 4 case noi constructie 2022 , situate in exclusivistul cartier Răsăritului din Sancraiul de Mureş. Exista si posibilitatea de schomb+ diferenta sau rate fixe la dezvoltator! Terenul aferent fiecarei case este de 520mp Casa este racordata la toate utilităţile (energie electrică, tv, internet, gaze naturale, salubritate şi canalizare), drum asfaltat. Cu un design deosebit şi compartimentare foarte eficientă, sunt compuse din: Parter: living, dining, bucătărie, baie, terasă şi garaj. Etaj: 3 dormitoare, baie şi hol, POD spaţios izolat. Case sunt eficiente energetic, cu încălzire în pardoseală, centrală termică proprie, tâmplărie PVC cu geamuri tripan, instalaţiile electrice şi sanitare poziţionate, sapă autonivelantă, acoperiş BRAMAC cu ţiglă de beton, izolaţie de 10 cm EPS 80, tencuială decorativă siliconată. Curtea amenajată şi proprietatea împrejmuită cu gard. Va asteptam la vizionare! Cod ofertă / ID BLITZ: P140611 ID anunț : 1739865417",07.05.2021,9948,159453.8125,2021-07-05,1616.0,0,45546.1875
52,Anunț,300000,EUR,4,210,https://www.publi24.ro/anunturi/imobiliare/de-vanzare/case/case-vile/anunt/vila-otopeni-centru-i-individuala-calcan-i-p-1e-m-i-comision-0/hg87e0g20dfi71df118f3634415441e5.html,images_case/anunt_52_img_0.webp|images_case/anunt_52_img_1.webp|images_case/anunt_52_img_2.webp|images_case/anunt_52_img_3.webp,4,,"Va ofer spre vanzare vile premium, moderne, individuale, alipite la calcan, in Otopeni, intr-o zona centrala, aproape de Hotelul Aviator,  pe o strada privata necirculata, intr-un cartier linistit, cu acces rapid la DN1, locatie ideala pentru un stil de viață liniștit, relaxat si confortabil. Acces facil catre toate centrele comerciale din Otopeni, Balotesti si Baneasa! Disponibilitate imediata pentru vanzare! Vila se vinde la cheie! Finalizare ianuarie 2026! Vile premium! Detalii financiare: pret vanzare 300.000 euro; discount 5% pentru antecontracte semnate in 31 decembrie 2025! Vilele sunt in constructie - cu finalizare ianuarie 2026, construite pe P+1E+M, construita pe un teren cu o suprafata totala de 210 mp, cu suprafata utila de 165 mp, cu o compartimentare eficienta si moderna a spatiilor. Dotari si finisaje premium: - vile realizate la cele mai inalte standarde; - 2 vile cu arhitectura moderna si 2 vile cu arhitectura clasica - structura din beton armat si caramida; fiecare casă are structură și zidărie individuală - termoizolație de 10cm -  geamuri mari panoramice cu deschideri osciloculisante, sticlă tripan, profil Salamander - incalzire in pardoseala - acoperis din tabla de 5mm grosime, cu o garantie de 30 ani - porti automate Facilitati locatie: - acces rapid supermarketuri: Lidl, Penny, Mega Image - acces rapid DN1 si mijloace de transport; in viitor metrou - acces rapid Aeroport Henri Coanda si Baneasa - acces rapid centre comerciale: Otopeni, Balotesti, Baneasa - unitati educationale si de invatamant: gradinite de stat si private, scoala generala de stat, liceu de stat, Academia de Politie - acces rapid centura Bucuresti, A0 si A3 Va invit sa programati o vizionare! Alina Dinoiu Pentru mai multe oferte, va astept aici: dinoiuimobiliare.ro ID anunț : 1760053169",12.08.2024,100,246085.296875,2024-12-08,364.0,0,53914.703125
53,Anunț,220000,EUR,5,120,https://www.publi24.ro/anunturi/imobiliare/de-vanzare/case/case-vile/anunt/duplex-modern-5-camere-120-mp-utili-langa-eso-construtie-2025/73eeh7f9f93f7e572ddg345eghh00f8i.html,images_case/anunt_53_img_0.webp|images_case/anunt_53_img_1.webp|images_case/anunt_53_img_2.webp|images_case/anunt_53_img_3.webp,4,,"Se vinde o casă tip duplex cu arhitectură modernă, situată la limita dintre Timișoara și Giroc, în apropierea benzinăriei ESO, cu acces rapid la mijloace de transport, școli, grădinițe, supermarketuri și alte puncte de interes. Imobilul are suprafață utilă de 120 mp și teren de 270 mp, fiind construit pe regim de înălțime P+E (parter + etaj). Casa este compartimentată eficient și oferă confort, lumină naturală și finisaje de calitate. Compartimentare: Parter: - hol de acces - baie de serviciu - bucătărie închisă - dormitor birou (ideal pentru lucru de acasă) - living spațios cu ieșire pe terasă - spațiu de depozitare Etaj: - 3 dormitoare luminoase - baie principală - dressing (cu posibilitate de transformare în a doua baie) Pod: - placă de beton și acces prin scară retractabilă, ideal pentru depozitare suplimentară Confortul termic este asigurat de centrala proprie pe gaz, cu încălzire prin pardoseală. Accesul auto se face printr-o poarta metalica, iar curtea permite amenajarea unui carport pentru protejarea masinii. Pentru detalii si vizionari, va rugam sa ne contactati. Pret 220.000 Euro Tel.0723100819 ID anunț : 1761636174",21.02.2010,381,177090.265625,2010-02-21,5768.0,0,42909.734375
54,Anunț,195000,EUR,4,26,https://www.publi24.ro/anunturi/imobiliare/de-vanzare/case/case-vile/anunt/casa-tip-duplex-giroc-mobilata-si-utilata-195-000-euro/8f744400572f7024d273612177ih58g0.html,images_case/anunt_54_img_0.webp|images_case/anunt_54_img_1.webp|images_case/anunt_54_img_2.webp|images_case/anunt_54_img_3.webp,4,,"Locuinta se afla intr-o zona linistita si sigura, ideala pentru familii, cu acces pietruit pana in fata casei. Este aproape de gradinita si scoala, avand acces facil catre Timisoara si centura rutiera. Compartimentarea include la parter o bucatarie inchisa cu insula si mobilier la comanda, electrocasnice premium, un living luminos de 26 mp cu iesire pe terasa si o baie cu dus. La etaj se afla un dormitor matrimonial cu dressing, doua dormitoare secundare, o baie cu cada si un hol spatios cu acces la podul izolat. Casa beneficiaza de finisaje de calitate, precum izolatie cu polistiren, tamplarie tripan Salamander, incalzire in pardoseala cu centrala Immergas, pardoseala SPC rezistenta la apa si obiecte sanitare premium. Toate camerele au TV si internet. Exteriorul include o curte amenajata cu flori, marmura si gazon, cu locuri de parcare in curte si in fata casei. Accesul auto se face printr-o poarta metalica, iar curtea permite amenajarea unui carport pentru protejarea masinii. Proprietatea are sistem de irigatii automat si este pregatita pentru videointerfon, automatizare poarta si sistem de alarma. Locuinta este conectata la utilitati. In total, casa este noua, in garantie, si a fost mobilata si utilata integral la inceputul lunii august. Se vinde gata de locuit. Pentru detalii si vizionari, va rugam sa ne contactati. Tel.0723100819 ID anunț : 1761075733",21.02.2010,381,144585.5,2010-02-21,5768.0,0,50414.5
55,Anunț,150766,EUR,4,134,https://www.publi24.ro/anunturi/imobiliare/de-vanzare/case/case-vile/anunt/casa-giroc-constructie-2022-drum-asfaltat-150-766-euro/0ee16gd1614g70g61egi60932fid2823.html,images_case/anunt_55_img_0.jpg|images_case/anunt_55_img_1.jpg|images_case/anunt_55_img_2.jpg|images_case/anunt_55_img_3.jpg,4,,"Casa este situata in Giroc, are 2 locuri de parcare proprii. Este construita pe un teren de 134 mp, 86 mp utili + curte libera + pod. Este compartimentata astfel: Parter: hol, living, zona de luat masa, bucatarie, baie, terasa; Etaj: hol, 3 dormitoare, 1 baie, balcon. Casa este racordata la toate utilitatile (canalizare, gaz, apa, curent), dispunand de centrala proprie pe gaz, geamuri pvc 3 sticle profile Rehau, izolatie exterior Baumit 100 mm eps 80, caramida porotherm Cemacon 30 com, betoane Holcim, pod pentru depozitare, placa de beton. Pretul este de 150.766 euro. Telefon: 0741145639. ID anunț : 1665741959",21.02.2010,381,171501.875,2010-02-21,5768.0,0,-20735.875
56,Anunț,150000,EUR,3,49,https://www.publi24.ro/anunturi/imobiliare/de-vanzare/case/case-vile/anunt/casa-drum-asfaltat-chisoda-constructie-2025/di553i6g091e7g07e6gf6edfe6id675i.html,images_case/anunt_56_img_0.webp|images_case/anunt_56_img_1.jpg|images_case/anunt_56_img_2.jpg|images_case/anunt_56_img_3.jpg,4,,"Casa este situata in Chisoda, are 2 locuri de parcare proprii. Are 96.49 mp suprafata utila + curte libera + pod. Este compartimentata astfel: Parter: hol, living + bucatarie, baie, terasa, debara; Etaj: hol, 2 dormitoare, 1 baie. Casa este racordata la toate utilitatile (canalizare, gaz, apa, curent), dispunand de centrala proprie pe gaz, geamuri pvc 3 sticle profile Rehau, izolatie exterior Baumit 100 mm eps 80, caramida porotherm Cemacon 30 com, betoane Holcim, pod pentru depozitare, placa de beton. Pretul este de 150.000 euro. Telefon: 0741145639. ID anunț : 1714037454",21.02.2010,381,181033.125,2010-02-21,5768.0,0,-31033.125
57,Anunț,195000,EUR,4,108,https://www.publi24.ro/anunturi/imobiliare/de-vanzare/case/case-vile/anunt/casa-noua-giroc-108mp-utili-4-camere-195-000-euro/4d942e8eigde70302f52500h547e6276.html,images_case/anunt_57_img_0.webp|images_case/anunt_57_img_1.webp|images_case/anunt_57_img_2.webp|images_case/anunt_57_img_3.webp,4,,"OOportunitate de a achiziționa o casă modernă și eficientă energetic în Giroc. Situată într-o zonă liniștită, proprietatea oferă 108 mp utili și 276 mp teren. Caracteristici: Compartimentare practică: - Parter: living cu acces la terasă acoperită, bucătărie închisă, debara, baie, camera tehnica. - Etaj: 3 dormitoare (unul cu dressing), 2 balcoane și baie. Unitate separata prin camera tehnica, fara pereti comuni. Eficiență energetică ridicată, datorită pompei de căldură și panourilor fotovoltaice Finisaje de înaltă calitate. Curte cu gazon rulou. Toate utilitățile: gaz, curent, apă și canalizare. 2 locuri de parcare. Pret 195.000 Euro Tel.0723100819 ID anunț : 1759427219",21.02.2010,381,143132.125,2010-02-21,5768.0,0,51867.875
58,Anunț,195000,EUR,4,26,https://www.publi24.ro/anunturi/imobiliare/de-vanzare/case/case-vile/anunt/casa-tip-duplex-giroc-mobilata-si-utilata-195-000-euro/19g187521h6h7deh2d72dig39041f83f.html,images_case/anunt_58_img_0.webp|images_case/anunt_58_img_1.webp|images_case/anunt_58_img_2.webp|images_case/anunt_58_img_3.webp,4,,"Locuinta se afla intr-o zona linistita si sigura, ideala pentru familii, cu acces pietruit pana in fata casei. Este aproape de gradinita si scoala, avand acces facil catre Timisoara si centura rutiera. Compartimentarea include la parter o bucatarie inchisa cu insula si mobilier la comanda, electrocasnice premium, un living luminos de 26 mp cu iesire pe terasa si o baie cu dus. La etaj se afla un dormitor matrimonial cu dressing, doua dormitoare secundare, o baie cu cada si un hol spatios cu acces la podul izolat. Casa beneficiaza de finisaje de calitate, precum izolatie cu polistiren, tamplarie tripan Salamander, incalzire in pardoseala cu centrala Immergas, pardoseala SPC rezistenta la apa si obiecte sanitare premium. Toate camerele au TV si internet. Exteriorul include o curte amenajata cu flori, marmura si gazon, cu locuri de parcare in curte si in fata casei. Accesul auto se face printr-o poarta metalica, iar curtea permite amenajarea unui carport pentru protejarea masinii. Proprietatea are sistem de irigatii automat si este pregatita pentru videointerfon, automatizare poarta si sistem de alarma. Locuinta este conectata la utilitati. In total, casa este noua, in garantie, si a fost mobilata si utilata integral la inceputul lunii august. Se vinde gata de locuit. Pentru detalii si vizionari, va rugam sa ne contactati. Tel.0723100819 ID anunț : 1761124715",21.02.2010,381,151009.0625,2010-02-21,5768.0,0,43990.9375
59,Anunț,150766,EUR,4,134,https://www.publi24.ro/anunturi/imobiliare/de-vanzare/case/case-vile/anunt/casa-giroc-4-camere-150-766-euro/2fg3e771g3937dfiee62d38fdi0737fe.html,images_case/anunt_59_img_0.jpg|images_case/anunt_59_img_1.jpg|images_case/anunt_59_img_2.jpg|images_case/anunt_59_img_3.jpg,4,,"Casa este situata in Giroc, are 2 locuri de parcare proprii. Este construita pe un teren de 134 mp, 86 mp utili + curte libera + pod. Este compartimentata astfel: Parter: hol, living, zona de luat masa, bucatarie, baie, camera tehnica, terasa; Etaj: hol, 3 dormitoare, 1 baie, balcon. Casa este racordata la toate utilitatile (canalizare, gaz, apa, curent), dispunand de centrala proprie pe gaz, geamuri pvc 3 sticle profile Rehau, izolatie exterior Baumit 100 mm eps 80, caramida porotherm Cemacon 30 com, betoane Holcim, pod pentru depozitare, placa de beton. Pretul este de 150.766 euro. Telefon: 0741145639 ID anunț : 1665741472",21.02.2010,381,144992.015625,2010-02-21,5768.0,0,5773.984375
60,Anunț,223000,EUR,5,360,https://www.publi24.ro/anunturi/imobiliare/de-vanzare/case/case-vile/anunt/vila-p-i-la-8-km-de-baia-mare/e909i16dd2fd7f4fd20f252ei21f23e6.html,images_case/anunt_60_img_0.webp|images_case/anunt_60_img_1.webp|images_case/anunt_60_img_2.webp|images_case/anunt_60_img_3.webp,4,,"Qportunitate deosebita in noul cartier rezidential din orasul Baia Sprie, in imediata apropiere a Baii Mari - 8 km, vila P+I din caramida, in suprafata utila de 360 mp. Imobilul este compartimentat astfel: parter: living (34,20 mp.), bucatarie (18,30 mp.), camera (18, 20 mp.), baie (6,5 mp.), uscatorie (10.50 mp.), camara si camera tehnica microcentrala (43 mp.) + garaj dublu (52 mp.); etaj: 3 dormitoare, salon (46 mp.), 2 bai, 2 holuri suprafata etaj = 140 mp + birou de 39.90 mp. Imobilul se vinde partial mobilat + utilat. Total teren = 1.314 mp. Casa este situata intr-o zona deosebita la 600 m de DN18 Baia-Mare-Sighetu Marmatiei, la capat de drum de centura Baia Mare-Baia Sprie, pretabila chiar pentru conlocuire mai multe generatii. Atentie investitori: imobilul se afla in aria de dezvoltare a viitorului AQUAPARK cu dotari multiple, inclusiv supermarket si centru de sanatate. NU ratati ocazia de a investi intr-o zona in plina dezvoltare, cu drumuri noi si conexiuni excelente, aer cu ozon si zona inconjurata de padure si munti de o frumusete rara! Pretul este cu mult sub pretul pietei! Putem lua in calcul si variante de schimb! ID anunț : 1748954090",31.01.2015,2,182543.453125,2015-01-31,3963.0,0,40456.546875
61,Anunț,150000,EUR,3,75,https://www.publi24.ro/anunturi/imobiliare/de-vanzare/case/case-vile/anunt/triplex-giroc-3-camere-constructie-2021-mobilat-si-utilat-150-000-euro/428f1h352ge17281254h373i0gf2hfif.html,images_case/anunt_61_img_0.webp|images_case/anunt_61_img_1.webp|images_case/anunt_61_img_2.webp|images_case/anunt_61_img_3.webp,4,,"Descoperă acest triplex modern de vânzare în Giroc, ideal pentru familie! Cu o suprafață de 75 mp, construcție din 2021, și finisaje de calitate, locuința este compusă din parter și etaj, incluzând living, bucătărie, 2 dormitoare, 2 băi, terasă și balcon. Este complet mobilată și utilată, cu încălzire prin pardoseală, aer condiționat și carport. Situată aproape de Timișoara, aproape de Eso, într-o zonă liniștită, această proprietate eficientă energetic oferă confort și intimitate. Preț: 150.000 Euro. Contactează-ne pentru vizionare! Tel 0723100819 ID anunț : 1759434913",21.02.2010,381,151733.0625,2010-02-21,5768.0,0,-1733.0625
62,Anunț,195000,EUR,4,108,https://www.publi24.ro/anunturi/imobiliare/de-vanzare/case/case-vile/anunt/casa-noua-giroc-4-camere-108mp-utili-195-000-euro/f94eh8527e127e102d0dh66e7gd742d1.html,images_case/anunt_62_img_0.webp|images_case/anunt_62_img_1.webp|images_case/anunt_62_img_2.webp|images_case/anunt_62_img_3.webp,4,,"OOportunitate de a achiziționa o casă modernă și eficientă energetic în Giroc. Situată într-o zonă liniștită, proprietatea oferă 108 mp utili și 276 mp teren. Caracteristici: Compartimentare practică: - Parter: living cu acces la terasă acoperită, bucătărie închisă, debara, baie, camera tehnica. - Etaj: 3 dormitoare (unul cu dressing), 2 balcoane și baie. Unitate separata prin camera tehnica, fara pereti comuni. Eficiență energetică ridicată, datorită pompei de căldură și panourilor fotovoltaice Finisaje de înaltă calitate. Curte cu gazon rulou. Toate utilitățile: gaz, curent, apă și canalizare. 2 locuri de parcare. Pret 195.000 Euro Tel.0723100819 ID anunț : 1759426999",21.02.2010,381,153199.5,2010-02-21,5768.0,0,41800.5
63,Anunț,195000,EUR,4,26,https://www.publi24.ro/anunturi/imobiliare/de-vanzare/case/case-vile/anunt/casa-tip-duplex-giroc-mobilata-si-utilata-195-000-euro/i2idei7gdiee7h39d090egf3h6gh6ifi.html,images_case/anunt_63_img_0.webp|images_case/anunt_63_img_1.webp|images_case/anunt_63_img_2.webp|images_case/anunt_63_img_3.webp,4,,"Locuinta se afla intr-o zona linistita si sigura, ideala pentru familii, cu acces pietruit pana in fata casei. Este aproape de gradinita si scoala, avand acces facil catre Timisoara si centura rutiera. Compartimentarea include la parter o bucatarie inchisa cu insula si mobilier la comanda, electrocasnice premium, un living luminos de 26 mp cu iesire pe terasa si o baie cu dus. La etaj se afla un dormitor matrimonial cu dressing, doua dormitoare secundare, o baie cu cada si un hol spatios cu acces la podul izolat. Casa beneficiaza de finisaje de calitate, precum izolatie cu polistiren, tamplarie tripan Salamander, incalzire in pardoseala cu centrala Immergas, pardoseala SPC rezistenta la apa si obiecte sanitare premium. Toate camerele au TV si internet. Exteriorul include o curte amenajata cu flori, marmura si gazon, cu locuri de parcare in curte si in fata casei. Accesul auto se face printr-o poarta metalica, iar curtea permite amenajarea unui carport pentru protejarea masinii. Proprietatea are sistem de irigatii automat si este pregatita pentru videointerfon, automatizare poarta si sistem de alarma. Locuinta este conectata la utilitati. In total, casa este noua, in garantie, si a fost mobilata si utilata integral la inceputul lunii august. Se vinde gata de locuit. Pentru detalii si vizionari, va rugam sa ne contactati. Tel:0723 100 819 ID anunț : 1761077076",21.02.2010,381,153128.0,2010-02-21,5768.0,0,41872.0
64,Anunț,195000,EUR,4,108,https://www.publi24.ro/anunturi/imobiliare/de-vanzare/case/case-vile/anunt/casa-noua-eficienta-energetic-giroc-108-mp-utili-276-mp-teren-195-000-euro/3237504d5ig272h4d8f9785d9hg51e9g.html,images_case/anunt_64_img_0.webp|images_case/anunt_64_img_1.webp|images_case/anunt_64_img_2.webp|images_case/anunt_64_img_3.webp,4,,"Oportunitate de a achiziționa o casă modernă și eficientă energetic în Giroc. Situată într-o zonă liniștită, proprietatea oferă 108 mp utili și 276 mp teren. Caracteristici: Compartimentare practică: - Parter: living cu acces la terasă acoperită, bucătărie închisă, debara, baie, camera tehnica. - Etaj: 3 dormitoare (unul cu dressing), 2 balcoane și baie. Unitate separata prin camera tehnica, fara pereti comuni. Eficiență energetică ridicată, datorită pompei de căldură și panourilor fotovoltaice Finisaje de înaltă calitate. Curte cu gazon rulou. Toate utilitățile: gaz, curent, apă și canalizare. 2 locuri de parcare. Pret 195.000 Euro Tel.0723100819 ID anunț : 1747401319",21.02.2010,381,156384.15625,2010-02-21,5768.0,0,38615.84375
65,Anunț,150000,EUR,3,49,https://www.publi24.ro/anunturi/imobiliare/de-vanzare/case/case-vile/anunt/casa-constructie-2025-chisoda-150-000-euro/954e0920266270g6e70de85h809678h8.html,images_case/anunt_65_img_0.webp|images_case/anunt_65_img_1.jpg|images_case/anunt_65_img_2.jpg|images_case/anunt_65_img_3.jpg,4,,"Casa este situata in Chisoda, are 2 locuri de parcare proprii. Are 96.49 mp suprafata utila + curte libera + pod. Este compartimentata astfel: Parter: hol, living + bucatarie, baie, terasa, debara; Etaj: hol, 2 dormitoare, 1 baie. Casa este racordata la toate utilitatile (canalizare, gaz, apa, curent), dispunand de centrala proprie pe gaz, geamuri pvc 3 sticle profile Rehau, izolatie exterior Baumit 100 mm eps 80, caramida porotherm Cemacon 30 com, betoane Holcim, pod pentru depozitare, placa de beton. Pretul este de 150.000 euro. Telefon: 0741145639. ID anunț : 1749117262",21.02.2010,381,184609.578125,2010-02-21,5768.0,0,-34609.578125
66,Anunț,50000,EUR,3,473,https://www.publi24.ro/anunturi/imobiliare/de-vanzare/case/case-vile/anunt/casa-de-vanzare-in-mehadia/93d6d05e96if72df147d67949ede6fh1.html,images_case/anunt_66_img_0.jpg|images_case/anunt_66_img_1.jpg|images_case/anunt_66_img_2.jpg|images_case/anunt_66_img_3.jpg,4,,"Casă de vânzare  în comuna Mehadia(la 6 km.de Băile Herculane)cu beci boltit din cărămidă,curte +grădină,suprafată totală 473mp. ID anunț : 1723992648",18.08.2024,1,228727.4375,2024-08-18,476.0,0,-178727.4375
67,Anunț,152000,EUR,4,110,https://www.publi24.ro/anunturi/imobiliare/de-vanzare/case/case-vile/anunt/casa-individuala-sagului-110mp-utili-4-camere-152-000-euro/f06011egd79f77h32hi54147559d7g11.html,images_case/anunt_67_img_0.webp|images_case/anunt_67_img_1.webp|images_case/anunt_67_img_2.webp|images_case/anunt_67_img_3.webp,4,,,,0,158721.125,,,0,-6721.125
68,Anunț,169000,EUR,3,142,https://www.publi24.ro/anunturi/imobiliare/de-vanzare/case/case-vile/anunt/duplex-3-camere-mobilata-giarmata-vii-169-000-euro/96eh77id3d217127263e092dfi877hi5.html,images_case/anunt_68_img_0.jpg|images_case/anunt_68_img_1.jpg|images_case/anunt_68_img_2.jpg|images_case/anunt_68_img_3.jpg,4,,"Se vinca duplex mobilat in Giarmata Vii , P+ pod mansardabil, cu o suprafata de 142mp si un teren de 375 mp in Dumbravita . Casa are 2 dormitioare, un living foarte generos, bucatarie inchisa, debara , si se vinde mobilata. Pret : 169.000 euro ID anunț : 1727851815",21.02.2010,381,139147.0,2010-02-21,5768.0,0,29853.0
69,Anunț,150766,EUR,4,134,https://www.publi24.ro/anunturi/imobiliare/de-vanzare/case/case-vile/anunt/casa-giroc-constructie-noua-complex-privat-150-766-euro/62ii0i8039f875621295i61726d1di2f.html,images_case/anunt_69_img_0.jpg|images_case/anunt_69_img_1.jpg|images_case/anunt_69_img_2.jpg|images_case/anunt_69_img_3.jpg,4,,"Casa este situata in Giroc, are 2 locuri de parcare proprii. Este construita pe un teren de 134 mp, 86 mp utili + curte libera + pod. Este compartimentata astfel: Parter: hol, living, zona de luat masa, bucatarie, baie, camera tehnica, terasa; Etaj: hol, 3 dormitoare, 1 baie, balcon. Casa este racordata la toate utilitatile (canalizare, gaz, apa, curent), dispunand de centrala proprie pe gaz, geamuri pvc 3 sticle profile Rehau, izolatie exterior Baumit 100 mm eps 80, caramida porotherm Cemacon 30 com, betoane Holcim, pod pentru depozitare, placa de beton. Pretul este de 150.766 euro. Telefon: 0741145639. ID anunț : 1665741562",21.02.2010,381,138126.609375,2010-02-21,5768.0,0,12639.390625
70,Anunț,10000,EUR,6,350,https://www.publi24.ro/anunturi/imobiliare/de-vanzare/case/case-vile/anunt/casa-de-vanzare-in-timisoara/gg04348e6id272gdde451f6384f98fff.html,images_case/anunt_70_img_0.webp|images_case/anunt_70_img_1.webp|images_case/anunt_70_img_2.webp|images_case/anunt_70_img_3.webp,4,,"Vând casa noua stare lux ,350  mp teren 1700 mp ,zona linistita,garaj,terasa ,pomi fructiferi.  pret neg la față locului!,accept si schimb cu diverse!:Tel ID anunț : 1757073885",10.03.2009,13,158262.90625,2009-10-03,5909.0,0,-148262.90625
71,Anunț,36000,EUR,4,128,https://www.publi24.ro/anunturi/imobiliare/de-vanzare/case/case-vile/anunt/casa-de-vanzare-comuna-peretu/0gf0f8d8f11d76e4dige76f11eeei5g3.html,images_case/anunt_71_img_0.webp|images_case/anunt_71_img_1.webp|images_case/anunt_71_img_2.webp|images_case/anunt_71_img_3.webp,4,,"Casa din caramida de Vanzare situata pe strada Garii in comuna Peretu. Suprafata casa 128 m2- compusa din    4 camere, bucatarie, baie si holuri. Suprafata teren 610 m2 Deschidere teren la strada asfaltata 30m Toate utilitatile( apa curenta, canalizare, curent). Garaj Beci ID anunț : 1747374553",15.03.2011,1,139142.96875,2011-03-15,5381.0,0,-103142.96875
72,Anunț,145000,EUR,4,90,https://www.publi24.ro/anunturi/imobiliare/de-vanzare/case/case-vile/anunt/casa-insiruita-chisoda-drum-asfaltat-4-camere-90mp-145-000-euro/591ii6e526i17hh5d4fh9eh29494509f.html,images_case/anunt_72_img_0.webp|images_case/anunt_72_img_1.webp|images_case/anunt_72_img_2.webp|images_case/anunt_72_img_3.webp,4,,"Se vinde o casa insiruita situata intr-un ansamblu rezidential cu acces privat, in localitatea Chisoda, aproape de restaurantul Cuina, la asfalt. Imobilul are o suprafata utila de 90 mp si dispune de teren in spate de 40 mp, precum si de doua locuri de parcare in fata casei. Este racordata la toate utilitatile: curent, gaz, apa si canalizare. Casa este compartimentata astfel: la parter se afla livingul cu bucataria open space (cu posibilitate de inchidere), o baie si terasa, iar la etaj sunt trei dormitoare, o baie si un pod cu scara retractabila (spatiu de depozitare). Imobilul beneficiaza de finisaje de calitate, precum gresie, faianta, parchet laminat, instalatii electrice si sanitare moderne, obiecte sanitare montate in bai, centrala proprie pe gaz si incalzire prin pardoseala. Pretul de vanzare este de 145.000 euro. Pentru mai multe informatii sunati la 0723 100 819. ID anunț : 1763662558",21.02.2010,381,175951.703125,2010-02-21,5768.0,0,-30951.703125
73,Anunț,290000,EUR,6,310,https://www.publi24.ro/anunturi/imobiliare/de-vanzare/case/case-vile/anunt/vand-vila-d-p-m-episcopia-sc-310-mp-teren-513-mp-garaj-gaz-lux-str-principala/1394hf40f9h8702114ih9d5dh682gfhd.html,images_case/anunt_73_img_0.webp|images_case/anunt_73_img_1.webp|images_case/anunt_73_img_2.webp|images_case/anunt_73_img_3.webp,4,,,,0,178588.9375,,,0,111411.0625
74,Anunț,289000,EUR,4,140,https://www.publi24.ro/anunturi/imobiliare/de-vanzare/case/case-vile/anunt/duplex-modern-cu-4-camere-chisoda-pasha-garden/6d050ig862hg7e3f1932593gg7f1332d.html,images_case/anunt_74_img_0.webp|images_case/anunt_74_img_1.webp|images_case/anunt_74_img_2.webp|images_case/anunt_74_img_3.webp,4,,"District Real Estate va prezinta spre vanzare un duplex modern si spațios cu 4 camere, dressing si 3 bai, situat in Chisoda,in proximitate avem Pasha Garden ,Lidl ,Penny ,Profi si mijloace de transport in comun. Duplexul se desfasoara pe o suprafata utila de 140mp și este amplasata pe un teren de 340mp. Compartimentarea proprietatii este urmatoarea: Parter: - Hol acces, - Living, - Bucătărie cu iesire pe terasa, - Baie dotată cu dus, - Debara, - Spatiu de depozitare sub scara, - Terasa 12mp, Etaj: - Dormitor matrimonial cu dressing si baie dotata cu cada, - 2 dormitoare cu iesire  balcon, - Baie dotata cu dus, - Baie dotata cu cada, - Pod, Detalii suplimentare: -Confortul termic este realizat cu ajutorul centralei proprii prin pardosea, - Peretele despărțitor este dublu, - Sistem de alarma - Poarta automatizata Duplexul dispune de toate utilitatile : apa retea, fosa septica, curent, gaz. Pretul de vanzare este de 289.000euro ! Oferim consultanta si solutii financiare in vederea obtinerii unui credit imobiliar avantajos, cu ajutorul colaboratorilor nostri. Pentru vizionari si alte detalii va stam la dispozitie. ID anunț : 1764414793",27.10.2021,717,173452.59375,2021-10-27,1502.0,0,115547.40625
75,Anunț,88000,EUR,4,100,https://www.publi24.ro/anunturi/imobiliare/de-vanzare/case/case-vile/anunt/casa-la-doar-5-km-de-ploiesti-in-loc-ghighiu-la-doar-88000/hdif384f11h87801d85891072h955fhh.html,images_case/anunt_75_img_0.webp|images_case/anunt_75_img_1.webp|images_case/anunt_75_img_2.webp|images_case/anunt_75_img_3.webp,4,,"Agentia Perfect Imobiliare va propune pentru vanzare o casa in localitatea Ghighiu,la doar 5 km de Ploiesti. !!! Casa este construita in anul 1955 si este renovata complet recent. Suprafata imobilului este de 100 mp utili,iar terenul are 836 mp . Terenul este imprejmuit cu gard din lemn, beton si porti de fier. Constructia este parter . Îmbunătățiri: -geamuri si usi termopan -gresie si faianta -usa de lemn la intrare -CENTRALA TERMICA - acoperiș nou -renovată în 2022!!! Compartimentare: nedecomandat, 4 camere Proprietarul detine toata documentatia necesara vanzarii,iar imobilul este pregatit pentru a fi utilizat,nemaifiind necesara nicio investitie. !!! Pretul imobilului este de 88.000 euro, negociabil. Pentru mai multe detalii si vizionari,ne puteti contacta la O72459O344 sau O726 928.227 ID 4012 ID anunț : 1759253629",23.11.2022,28,154276.046875,2022-11-23,1110.0,0,-66276.046875
76,Anunț,180000,EUR,5,150,https://www.publi24.ro/anunturi/imobiliare/de-vanzare/case/casa/anunt/vanzare-casa-constructie-noua-p-1-situata-in-targu-jiu-cartier-dragoieni/6efefd47g8707fg41fi0hh2i65hg9d95.html,images_case/anunt_76_img_0.webp|images_case/anunt_76_img_1.webp|images_case/anunt_76_img_2.webp|images_case/anunt_76_img_3.webp,4,,,,0,153327.6875,,,0,26672.3125
77,Anunț,145000,EUR,4,90,https://www.publi24.ro/anunturi/imobiliare/de-vanzare/case/case-vile/anunt/casa-insiruita-chisoda-drum-asfaltat-4-camere-90mp-145-000-euro/591ii6e526i17hh5d4fh9eh29494509f.html,images_case/anunt_77_img_0.webp|images_case/anunt_77_img_1.webp|images_case/anunt_77_img_2.webp|images_case/anunt_77_img_3.webp,4,,"Se vinde o casa insiruita situata intr-un ansamblu rezidential cu acces privat, in localitatea Chisoda, aproape de restaurantul Cuina, la asfalt. Imobilul are o suprafata utila de 90 mp si dispune de teren in spate de 40 mp, precum si de doua locuri de parcare in fata casei. Este racordata la toate utilitatile: curent, gaz, apa si canalizare. Casa este compartimentata astfel: la parter se afla livingul cu bucataria open space (cu posibilitate de inchidere), o baie si terasa, iar la etaj sunt trei dormitoare, o baie si un pod cu scara retractabila (spatiu de depozitare). Imobilul beneficiaza de finisaje de calitate, precum gresie, faianta, parchet laminat, instalatii electrice si sanitare moderne, obiecte sanitare montate in bai, centrala proprie pe gaz si incalzire prin pardoseala. Pretul de vanzare este de 145.000 euro. Pentru mai multe informatii sunati la 0723 100 819. ID anunț : 1763662558",21.02.2010,381,175951.703125,2010-02-21,5768.0,0,-30951.703125
78,Anunț,145000,EUR,4,90,https://www.publi24.ro/anunturi/imobiliare/de-vanzare/case/case-vile/anunt/casa-insiruita-chisoda-drum-asfaltat-4-camere-90mp-145-000-euro/98ie3dg74h3g7609e6g0172d38518i20.html,images_case/anunt_78_img_0.webp|images_case/anunt_78_img_1.webp|images_case/anunt_78_img_2.webp|images_case/anunt_78_img_3.webp,4,,"Se vinde o casa insiruita situata intr-un ansamblu rezidential cu acces privat, in localitatea Chisoda, aproape de restaurantul Cuina, la asfalt. Imobilul are o suprafata utila de 90 mp si dispune de teren in spate de 40 mp, precum si de doua locuri de parcare in fata casei. Este racordata la toate utilitatile: curent, gaz, apa si canalizare. Casa este compartimentata astfel: la parter se afla livingul cu bucataria open space (cu posibilitate de inchidere), o baie si terasa, iar la etaj sunt trei dormitoare, o baie si un pod cu scara retractabila (spatiu de depozitare). Imobilul beneficiaza de finisaje de calitate, precum gresie, faianta, parchet laminat, instalatii electrice si sanitare moderne, obiecte sanitare montate in bai, centrala proprie pe gaz si incalzire prin pardoseala. Pretul de vanzare este de 145.000 euro. Pentru mai multe informatii sunati la 0723 100 819. ID anunț : 1763714040",21.02.2010,381,187910.3125,2010-02-21,5768.0,0,-42910.3125
79,Anunț,220000,EUR,5,120,https://www.publi24.ro/anunturi/imobiliare/de-vanzare/case/case-vile/anunt/duplex-modern-5-camere-120-mp-utili-langa-eso-construtie-2025/99ee116i468i794821fig0745h4981h6.html,images_case/anunt_79_img_0.webp|images_case/anunt_79_img_1.webp|images_case/anunt_79_img_2.webp|images_case/anunt_79_img_3.webp,4,,"Se vinde o casă tip duplex cu arhitectură modernă, situată la limita dintre Timișoara și Giroc, în apropierea benzinăriei ESO, cu acces rapid la mijloace de transport, școli, grădinițe, supermarketuri și alte puncte de interes. Imobilul are suprafață utilă de 120 mp și teren de 270 mp, fiind construit pe regim de înălțime P+E (parter + etaj). Casa este compartimentată eficient și oferă confort, lumină naturală și finisaje de calitate. Confortul termic este asigurat de centrala proprie pe gaz, cu încălzire prin pardoseală. Compartimentare: Parter: hol de acces baie de serviciu bucătărie închisă dormitor   birou living spațios cu ieșire pe terasă spațiu de depozitare Etaj: 3 dormitoare luminoase baie principală dressing (cu posibilitate de transformare în a doua baie) Pod: placă de beton și acces prin scară retractabilă Accesul auto se face printr-o poarta metalica, iar curtea permite amenajarea unui carport pentru protejarea masinii. Pentru detalii si vizionari, va rugam sa ne contactati. Pret 220.000 Euro Tel.0723100819 ID anunț : 1761495746",21.02.2010,381,195679.1875,2010-02-21,5768.0,0,24320.8125
80,Anunț,220000,EUR,3,260,https://www.publi24.ro/anunturi/imobiliare/de-vanzare/case/case-vile/anunt/casa-individuala-giroc-260mp-teren-220-000-euro/h9i35337d8517eifehd9d723i585i123.html,images_case/anunt_80_img_0.webp|images_case/anunt_80_img_1.webp|images_case/anunt_80_img_2.webp|images_case/anunt_80_img_3.webp,4,,,,0,163482.671875,,,0,56517.328125
81,Anunț,185000,EUR,4,108,https://www.publi24.ro/anunturi/imobiliare/de-vanzare/case/case-vile/anunt/casa-noua-eficienta-energetic-giroc-108-mp-utili-276-mp-teren-185-000-euro/97ed8e3d5e7h722i1f48fedh2h700378.html,images_case/anunt_81_img_0.webp|images_case/anunt_81_img_1.webp|images_case/anunt_81_img_2.webp|images_case/anunt_81_img_3.webp,4,,"Oportunitate de a achiziționa o casă modernă și eficientă energetic în Giroc. Situată într-o zonă liniștită, proprietatea oferă 108 mp utili și 276 mp teren. Caracteristici: Compartimentare practică: - Parter: living cu acces la terasă acoperită, bucătărie închisă, debara, baie, camera tehnica. - Etaj: 3 dormitoare (unul cu dressing), 2 balcoane și baie. Unitate separata prin camera tehnica, fara pereti comuni. Eficiență energetică ridicată, datorită pompei de căldură și panourilor fotovoltaice Finisaje de înaltă calitate. Curte cu gazon rulou. Toate utilitățile: gaz, curent, apă și canalizare. 2 locuri de parcare. Pret 185.000 Euro Tel.0723100819 ID anunț : 1759427732",21.02.2010,381,137931.3125,2010-02-21,5768.0,0,47068.6875
82,Anunț,170000,EUR,4,115,https://www.publi24.ro/anunturi/imobiliare/de-vanzare/case/case-vile/anunt/duplex-giroc-4-camere-3-bai-115mp-utili-170-000-euro/ef75167i5d657788d79fh208d6h3807f.html,images_case/anunt_82_img_0.webp|images_case/anunt_82_img_1.webp|images_case/anunt_82_img_2.webp|images_case/anunt_82_img_3.webp,4,,"Propunem spre vânzare jumătate de duplex situat în localitatea Giroc, într-o zonă nouă de case, liniștită și bine dezvoltată, cu acces rapid la toate utilitățile. Proprietatea are tipologia P+1E și o suprafață utilă de 115 mp, fiind compartimentată astfel: Parter: - Hol de acces - Baie - Spațiu de depozitare - Bucătărie + living open space (cu posibilitatea de închidere a bucătăriei) - Acces către terasa generoasă de 20 mp Etaj: - Hol - Baie - spatiu pentru dressing - 3 dormitoare, dintre care unul matrimonial, prevăzut cu baie proprie și dressing - Balcon Toate băile dispun de geam pentru aerisire naturală. Finisajele sunt la alegere, dintr-o gamă variată, pentru a vă personaliza locuința după propriul gust. Confortul termic este asigurat de centrala proprie pe gaz și încălzire prin pardoseală. Curtea permite amenajarea unui carport pentru protejarea mașinii. Fotografiile din anunț reprezintă randări folosite cu scop informativ. Casa se află în stadiul de selectare a finisajelor, acestea putând fi personalizate de viitorul proprietar. Termenul de predare este de aproximativ două săptămâni. Preț: 170.000   (TVA 21% inclus) Telefon: 0723 100 819 ID anunț : 1763751193",21.02.2010,381,168438.53125,2010-02-21,5768.0,0,1561.46875
83,Anunț,150766,EUR,4,134,https://www.publi24.ro/anunturi/imobiliare/de-vanzare/case/case-vile/anunt/casa-giroc-constructie-2025-4-camere-150-766-euro/i447403d544979e82f682fe4eid11815.html,images_case/anunt_83_img_0.jpg|images_case/anunt_83_img_1.jpg|images_case/anunt_83_img_2.jpg|images_case/anunt_83_img_3.jpg,4,,"Casa este situata in Giroc, are 2 locuri de parcare proprii. Este construita pe un teren de 134 mp, 86 mp utili + curte libera + pod. Este compartimentata astfel: Parter: hol, living, zona de luat masa, bucatarie, baie, camera tehnica, terasa; Etaj: hol, 3 dormitoare, 1 baie, balcon. Casa este racordata la toate utilitatile (canalizare, gaz, apa, curent), dispunand de centrala proprie pe gaz, geamuri pvc 3 sticle profile Rehau, izolatie exterior Baumit 100 mm eps 80, caramida porotherm Cemacon 30 com, betoane Holcim, pod pentru depozitare, placa de beton. Pretul este de 150.766 euro. Telefon: 0741145639. ID anunț : 1665741014",21.02.2010,381,156601.5,2010-02-21,5768.0,0,-5835.5
84,Anunț,450000,EUR,4,70,https://www.publi24.ro/anunturi/imobiliare/de-vanzare/case/case-vile/anunt/casa-veche-renovata-parter-mansarda-curte-proprie-foisorul-de-foc/ef8540e3780i780513616ehe70991de0.html,images_case/anunt_84_img_0.jpg|images_case/anunt_84_img_1.jpg|images_case/anunt_84_img_2.jpg|images_case/anunt_84_img_3.jpg,4,,"*** Va oferim spre vanzare o casa amplasata ultracentral, cu vedere catre Foisorul de Foc, al carei aer antebelic a fost mentinut, desi s-a adaugat o mansarda la inceputul anilor 90. Sobele de teracota originale sunt pastrate doar ca elemente decorative, incalzirea fiind asigurata de o centrala proprie pe gaz. Usile interioare sunt cele originale, din lemn cu geamuri de cristal. Parchetul de lemn masiv, foarte bine intretinut, da un aspect deosebit incaperilor. Casa a fost consolidata si renovata interior si exterior si ofera un spatiu excelent de locuit pentru o familie numeroasa. Curtea libera de 70 mp poate fi folosita pentru petrecerea timpului liber, dar permite si amenajarea un garaj. Parterul casei este format dintr-un hol mare, amenajat ca birou, din care avem intrari separate pentru camera de zi si dormitorul cu baie proprie. Bucataria are acces din living, iar de aici iesim intr-o curte interioara mica cu acces la beci. Tot din living se face accesul la mansarda construita in 1992, pe o scara elicoidala. Mansarda, construita integral din lemn, este formata din 4 camere, hol, baie, debara. Aceasta structura va ofera posibilitatea de a recompartimenta cu usurinta mansarda, in scopul obtinerii spatiului dorit. Pentru informatii suplimentare si programarea unei vizionari, va rog, nu ezitati sa ne contactati. Avem cheile proprietatii si putem organiza cu usurinta vizionarea imobilului. *** ID anunț : 1765054709",28.03.2019,943,171410.265625,2019-03-28,2446.0,0,278589.734375
85,Anunț,150000,EUR,3,49,https://www.publi24.ro/anunturi/imobiliare/de-vanzare/case/case-vile/anunt/casa-constructie-2025-chisoda-150-000-euro/f0i7g1iig6h373d2d3gd6404451g7h7d.html,images_case/anunt_85_img_0.webp|images_case/anunt_85_img_1.jpg|images_case/anunt_85_img_2.jpg|images_case/anunt_85_img_3.jpg,4,,"Casa este situata in Chisoda, are 2 locuri de parcare proprii. Are 96.49 mp suprafata utila + curte libera + pod. Este compartimentata astfel: Parter: hol, living + bucatarie, baie, terasa, debara; Etaj: hol, 2 dormitoare, 1 baie. Casa este racordata la toate utilitatile (canalizare, gaz, apa, curent), dispunand de centrala proprie pe gaz, geamuri pvc 3 sticle profile Rehau, izolatie exterior Baumit 100 mm eps 80, caramida porotherm Cemacon 30 com, betoane Holcim, pod pentru depozitare, placa de beton. Pretul este de 150.000 euro. Telefon: 0741145639. ID anunț : 1691140944",21.02.2010,381,183464.375,2010-02-21,5768.0,0,-33464.375
86,Anunț,170000,EUR,4,115,https://www.publi24.ro/anunturi/imobiliare/de-vanzare/case/case-vile/anunt/duplex-giroc-4-camere-3-bai-115mp-utili-170-000-euro/7h9275hi976575782741e09de04d8i4e.html,images_case/anunt_86_img_0.webp|images_case/anunt_86_img_1.webp|images_case/anunt_86_img_2.webp|images_case/anunt_86_img_3.webp,4,,"Propunem spre vânzare jumătate de duplex situat în localitatea Giroc, într-o zonă nouă de case, liniștită și bine dezvoltată, cu acces rapid la toate utilitățile. Proprietatea are tipologia P+1E și o suprafață utilă de 115 mp, fiind compartimentată astfel: Parter: - Hol de acces - Baie - Spațiu de depozitare - Bucătărie + living open space (cu posibilitatea de închidere a bucătăriei) - Acces către terasa generoasă de 20 mp Etaj: - Hol - Baie - spatiu pentru dressing - 3 dormitoare, dintre care unul matrimonial, prevăzut cu baie proprie și dressing - Balcon Toate băile dispun de geam pentru aerisire naturală. Finisajele sunt la alegere, dintr-o gamă variată, pentru a vă personaliza locuința după propriul gust. Confortul termic este asigurat de centrala proprie pe gaz și încălzire prin pardoseală. Curtea permite amenajarea unui carport pentru protejarea mașinii. Fotografiile din anunț reprezintă randări folosite cu scop informativ. Casa se află în stadiul de selectare a finisajelor, acestea putând fi personalizate de viitorul proprietar. Termenul de predare este de aproximativ două săptămâni. Preț: 170.000  Euro (TVA 21% inclus) Telefon: 0723 100 819 ID anunț : 1764236914",21.02.2010,381,165913.59375,2010-02-21,5768.0,0,4086.40625
87,Anunț,220000,EUR,5,120,https://www.publi24.ro/anunturi/imobiliare/de-vanzare/case/case-vile/anunt/duplex-modern-5-camere-120-mp-utili-langa-eso-construtie-2025/g631fe09h6637g0h2h02fe08g8idh3g2.html,images_case/anunt_87_img_0.webp|images_case/anunt_87_img_1.webp|images_case/anunt_87_img_2.webp|images_case/anunt_87_img_3.webp,4,,,,0,197704.453125,,,0,22295.546875
88,Anunț,149000,EUR,4,30,https://www.publi24.ro/anunturi/imobiliare/de-vanzare/case/case-vile/anunt/nou-case-de-calitate/688889177e0g74h41650h6egfg2f7e43.html,images_case/anunt_88_img_0.webp|images_case/anunt_88_img_1.webp|images_case/anunt_88_img_2.webp|images_case/anunt_88_img_3.webp,4,,"PENTRU CINE NU CAUTA DOAR PRET, CI O CASA BINE FACUTA! Direct de la proprietar,de vanzare case insiruite mosnita noua, la 500m de noul lidl-drumul boilor. cartier nou, beneficiaza de toate utilitatile=gaz, curent, apa retea, canalizare, drum pavat, iluminat stradal, fibra optica casele sunt unele  la alb,se pot alege finisajele alta finisata la cheie. sunt camere inalte 2.8m, ferestre mari cu tamplarie salamander 75mm, 7camere, geam tripan, rulouri exterioare gri antracit, plase insecte, glafuri marmura gard tabla perforata, un loc de parcare in fata curtii, unul in curte izolatie foarte buna cu polistiren eps80 de 15cm, tencuiala decorativa oskar, clasa energetica A=dobanda mai mica la banca. izolatie pod cu spuma de 10cm si suplimentar izolatie  mansarda cu vata de 10cm cu aluminiu mansarda inalta , pod inalt cu scara acces incalzire prin pardoseala cu termostat cu comanda wifi de pe telefon  in fiecare camera acoperis tigla bramac finisajele sunt de foarte buna calitate cu garantie de buna executie casele au 3dormitoare, doua bai, living cu bucatarie de 30m2, terasa acoperita cu camera tehnica si wc ,lavoar teren cca 220m2, suprafata utila casa  95m2 pret de vanzare-149000 euro cu tva 21% inclus cea de pe colt cu teren 635m2-pret vanzatre 179.000-tva inclus se pot vinde si la alb , se mai scad 13000 euro din pret ID anunț : 1751640523",14.02.2019,1,159147.34375,2019-02-14,2488.0,0,-10147.34375
89,Anunț,79990,EUR,2,3475,https://www.publi24.ro/anunturi/imobiliare/de-vanzare/case/case-vile/anunt/oportunitate-de-vanzare-casa-teren-3475-mp-mihaiesti-sanpaul-28-km-de-cluj/87162051315f788fe5fddfdei63gf431.html,images_case/anunt_89_img_0.webp|images_case/anunt_89_img_1.webp|images_case/anunt_89_img_2.webp|images_case/anunt_89_img_3.webp,4,,"În tot ceea ce facem, credem în locuri care îți schimbă ritmul vieții. Credem în liniște, în natură, în spații care îți oferă libertatea de a construi așa cum simți. Punem sub semnul întrebării modul obișnuit de a privi o gospodărie rurală, pentru că aici nu vorbim doar despre o casă – vorbim despre un stil de viață. Aici găsești un loc unde timpul curge altfel. Unde poți transforma 3.475 mp într-o poveste: locuință, agroturism, grădină, livadă sau pur și simplu refugiul tău. Localizare Sat Mihăiești, Comuna Sânpaul, jud. Cluj Doar 28 km de Cluj-Napoca, cu acces rapid la E81 și Autostrada Transilvania. Un loc accesibil, dar totuși retras, unde simți că aparții naturii. Casa de locuit (~100 mp) O casă tradițională, consolidată și modernizată cu grijă, pregătită să fie locuită sau transformată după propriul vis. Structură •	cărămidă •	acoperiș din țiglă •	compartimentare funcțională: 2 camere + bucătărie, baie si coridor Dotări ✔ Izolație interioară și exterioară ✔ Geamuri termopan ✔ Parchet, gresie ✔ Baie amenajată ✔ Energie electrică ✔ Fântână proprie ✔ Fosă septică Tot ce ai nevoie pentru confortul de bază – restul poate deveni creația ta. Anexe (~100 mp) •	grajd •	șură •	depozit Construcții solide din cărămidă, cu acoperiș de țiglă. Perfecte pentru extindere, spații de depozitare, atelier sau proiecte agricole/turistice. Teren – 3.475 mp de posibilități Aici ai spațiu pentru tot ce ți-ai imaginat vreodată: • curte mare • grădină sau livadă • loc de joacă, foișor, seră • extinderea casei • mini-ferma ta • un concept de agroturism Un teren intravilan, împrejmuit, cu deschidere la drum. Avantaje •	Proprietate intabulată, fără sarcini •	Casă renovată parțial, cu utilități •	Teren mare: 3.475 mp •	Zonă liniștită, aer curat •	Acces facil către Cluj – ideală pentru cei care vor liniște fără a se rupe de oraș •	Potrivită pentru: locuință permanentă, casă de vacanță, investiție, gospodărie modernă Proprietatea se vinde ca pachet complet Casă + teren + anexe Pentru detalii și vizionare Grand Imob Expert 0749 905 267 ID anunț : 1765054029",26.01.2022,65,184134.0,2022-01-26,1411.0,0,-104144.0
90,Anunț,150766,EUR,4,134,https://www.publi24.ro/anunturi/imobiliare/de-vanzare/case/case-vile/anunt/casa-giroc-complex-privat-150-766-euro/e8ig436823dh77i72h4667153dh7856i.html,images_case/anunt_90_img_0.jpg|images_case/anunt_90_img_1.jpg|images_case/anunt_90_img_2.jpg|images_case/anunt_90_img_3.jpg,4,,"Casa este situata in Giroc, are 2 locuri de parcare proprii. Este construita pe un teren de 134 mp, 86 mp utili + curte libera + pod. Este compartimentata astfel: Parter: hol, living, zona de luat masa, bucatarie, baie, camera tehnica, terasa; Etaj: hol, 3 dormitoare, 1 baie, balcon. Casa este racordata la toate utilitatile (canalizare, gaz, apa, curent), dispunand de centrala proprie pe gaz, geamuri pvc 3 sticle profile Rehau, izolatie exterior Baumit 100 mm eps 80, caramida porotherm Cemacon 30 com, betoane Holcim, pod pentru depozitare, placa de beton. Pretul este de 150.766 euro. Telefon: 0741145639. ID anunț : 1665741272",21.02.2010,381,154230.796875,2010-02-21,5768.0,0,-3464.796875
91,Anunț,152000,EUR,4,110,https://www.publi24.ro/anunturi/imobiliare/de-vanzare/case/case-vile/anunt/casa-individuala-4-camere-110mp-utili-sagului-152-000-euro/6hdff2952e597h3g289g038103d9d9if.html,images_case/anunt_91_img_0.webp|images_case/anunt_91_img_1.webp|images_case/anunt_91_img_2.webp|images_case/anunt_91_img_3.webp,4,,"Vă propunem spre vânzare o casă individuală situată în zona Sagului. Caracteristici: Suprafață utilă: 110 mp Teren: 300 mp An construcție: 1973 (îmbunătățită în 2012) Structură: Solidă, izolație cu polieter Compartimentare: 3 dormitoare, hol, living, bucătărie, baie, beci, garaj Facilități: Casa este racordată la toate utilitățile și beneficiază de un garaj propriu. De asemenea, poziția casei este excelentă, având toate necesitățile la câteva minute de mers pe jos, inclusiv mijloace de transport în comun, hipermarketuri, grădiniță și școală. Pret 152.000 Euro Tel 0723100819 ID anunț : 1760894355",21.02.2010,381,157543.03125,2010-02-21,5768.0,0,-5543.03125
92,Anunț,145000,EUR,4,90,https://www.publi24.ro/anunturi/imobiliare/de-vanzare/case/case-vile/anunt/casa-insiruita-chisoda-drum-asfaltat-4-camere-90mp-145-000-euro/4d00f3h5h39372g4e6g1821h8i94769d.html,images_case/anunt_92_img_0.webp|images_case/anunt_92_img_1.webp|images_case/anunt_92_img_2.webp|images_case/anunt_92_img_3.webp,4,,"Se vinde o casa insiruita situata intr-un ansamblu rezidential cu acces privat, in localitatea Chisoda, aproape de restaurantul Cuina, la asfalt. Imobilul are o suprafata utila de 90 mp si dispune de teren in spate de 40 mp, precum si de doua locuri de parcare in fata casei. Este racordata la toate utilitatile: curent, gaz, apa si canalizare. Casa este compartimentata astfel: la parter se afla livingul cu bucataria open space (cu posibilitate de inchidere), o baie si terasa, iar la etaj sunt trei dormitoare, o baie si un pod cu scara retractabila (spatiu de depozitare). Imobilul beneficiaza de finisaje de calitate, precum gresie, faianta, parchet laminat, instalatii electrice si sanitare moderne, obiecte sanitare montate in bai, centrala proprie pe gaz si incalzire prin pardoseala. Pretul de vanzare este de 145.000 euro. Pentru mai multe informatii sunati la 0723 100 819. ID anunț : 1762347826",21.02.2010,381,185737.9375,2010-02-21,5768.0,0,-40737.9375
93,Anunț,150000,EUR,3,49,https://www.publi24.ro/anunturi/imobiliare/de-vanzare/case/case-vile/anunt/casa-drum-asfaltat-chisoda-150-000-euro/15df3i0647hf7diie45g4g96eg966197.html,images_case/anunt_93_img_0.jpg|images_case/anunt_93_img_1.webp|images_case/anunt_93_img_2.jpg|images_case/anunt_93_img_3.jpg,4,,,,0,181344.1875,,,0,-31344.1875
94,Anunț,195000,EUR,4,108,https://www.publi24.ro/anunturi/imobiliare/de-vanzare/case/case-vile/anunt/casa-noua-eficienta-energetic-giroc-108-mp-utili-276-mp-teren-195-000-euro/39fdh0hi562877f6160i7d4h9ghf89hi.html,images_case/anunt_94_img_0.webp|images_case/anunt_94_img_1.webp|images_case/anunt_94_img_2.webp|images_case/anunt_94_img_3.webp,4,,"Oportunitate de a achiziționa o casă modernă și eficientă energetic în Giroc. Situată într-o zonă liniștită, proprietatea oferă 108 mp utili și 276 mp teren. Caracteristici: Compartimentare practică: - Parter: living cu acces la terasă acoperită, bucătărie închisă, debara, baie, camera tehnica. - Etaj: 3 dormitoare (unul cu dressing), 2 balcoane și baie. Unitate separata prin camera tehnica, fara pereti comuni. Eficiență energetică ridicată, datorită pompei de căldură și panourilor fotovoltaice Finisaje de înaltă calitate. Curte cu gazon rulou. Toate utilitățile: gaz, curent, apă și canalizare. 2 locuri de parcare. Pret 195.000 Euro Tel.0723100819 ID anunț : 1759426115",21.02.2010,381,175638.6875,2010-02-21,5768.0,0,19361.3125
95,Anunț,700000,EUR,6,270,https://www.publi24.ro/anunturi/imobiliare/de-vanzare/case/vila/anunt/locuinta-individuala-de-vanzare-p-e-m-dristor/96hi9418f65g77541778d608164919g4.html,images_case/anunt_95_img_0.webp|images_case/anunt_95_img_1.webp|images_case/anunt_95_img_2.webp|images_case/anunt_95_img_3.webp,4,,,,0,145626.796875,,,0,554373.203125
96,Anunț,145000,EUR,4,450,https://www.publi24.ro/anunturi/imobiliare/de-vanzare/case/casa/anunt/casa-de-4-camere-plan-parter-450-mp-teren-holboca/97740995edi47250dfe9195d4g8e89dd.html,images_case/anunt_96_img_0.webp|images_case/anunt_96_img_1.webp|images_case/anunt_96_img_2.webp|images_case/anunt_96_img_3.jpg,4,,"Blitz va propune pentru cumparare o casa pe plan parter cu o suprafata utila de 90mp. Aceasta este construita pe un teren de 450mp si este formata dintr-un living deschis, 3 dormitoare, 1 baie si 1 bucatarie inchisa cu iesire spre terasa. Casa este construita din caramida, pe structura din beton si benficiaza de apa, gaz, curent si fosa septica. De asemenea, in ceea ce priveste tamplaria, s-a folosit tripan de la Gealan iar acoperisul este din tabla de calitate. Pozitionarea este la 500m de drumul principal, si se bucura de acces facil catre oras si punctele importante. Va asteptam cu drag la vizionare! Cod ofertă / ID BLITZ: P138809 ID anunț : 1738152895",07.05.2021,9948,162813.4375,2021-07-05,1616.0,0,-17813.4375
97,Anunț,199000,EUR,5,100,https://www.publi24.ro/anunturi/imobiliare/de-vanzare/case/case-vile/anunt/casa-de-vanzare-in-campina-cartier-campinita/04i89275227173dddfif51f9fd07003f.html,images_case/anunt_97_img_0.webp|images_case/anunt_97_img_1.webp|images_case/anunt_97_img_2.webp|images_case/anunt_97_img_3.webp,4,,"Casa de vanzare in Campina,cartier Campinita Constructie 2012,regim de inaltime-parter,etaj,pod mansardabil Structura de rezistenta-caramida cu plansee din beton armat Amprenta la sol este de 100 mp Suprafata totala construita parter si etaj 198 mp Parter:living,dormitor,bucatarie,baie,cs,camera tehnica Etaj:3 dormitoare,baie,hol,balcoane Dispune de geamuri termopan,izolatie cu polistiren la exterior Utilitati:apa ,curent electric,gaz,fosa septica Acoperisul cu tabla tip ""Lindab"" Casa necesita finisajele finale.. Teren in suprafata total de 335 mp Pretul de vanzare este de 199000 euro ID anunț : 1758346625",04.07.2012,14,132702.625,2012-04-07,4992.0,0,66297.375
98,Anunț,60000,EUR,3,60,https://www.publi24.ro/anunturi/imobiliare/de-vanzare/case/case-vile/anunt/se-vinde-casa-in-cart-mviteazau-3-camere-la-pretul-de-60-000-euro/38fh8124dih370f322fe2d9562228919.html,images_case/anunt_98_img_0.webp|images_case/anunt_98_img_1.webp|images_case/anunt_98_img_2.webp|images_case/anunt_98_img_3.webp,4,,"Se vinde casa in Cart. M. Viteazu , in suprafata de 60 mp , teren suprafata totala de 200 mp , compusa din 3 camere , bucatarie , .canalizare ,apa curenta , gaze la poarta , incalzire pe sobe teracota ( doua) , izolata exterior . pret  38 000 euro . telefon 0765431415 . ID anunț : 1764661829",13.01.2021,21,112868.109375,2021-01-13,1789.0,0,-52868.109375
99,Anunț,155000,EUR,4,100,https://www.publi24.ro/anunturi/imobiliare/de-vanzare/case/case-vile/anunt/duplex-la-cheie-100-mp-mosnita-noua/55hf0ie8d4i17e0e28i19hgg5g7fh74i.html,images_case/anunt_99_img_0.webp|images_case/anunt_99_img_1.webp|images_case/anunt_99_img_2.webp|images_case/anunt_99_img_3.webp,4,,,,0,175450.90625,,,0,-20450.90625
100,Anunț,69900,EUR,2,70,https://www.publi24.ro/anunturi/imobiliare/de-vanzare/case/case-vile/anunt/casa-de-vanzare-cu-amintiri/f3e9574449i572632244ee81if285020.html,images_case/anunt_100_img_0.webp|images_case/anunt_100_img_1.webp|images_case/anunt_100_img_2.webp|images_case/anunt_100_img_3.webp,4,,"AcasA Imobiliare caută un nou proprietar pentru o casuta modesta (singur in curte) dar locuibila ,situata in Galati ,strada Ana Ipatescu ,o zona linstita aflata intr-o continua dezvoltare. Poziționare strategică între confortul urban și relaxarea de pe malul Dunării, cu acces facil către centrul orașului și alte zone importante. Imobilul dispune de 2 camere , o bucătărie si având o suprafață utilă de 70 mp și un teren total de 100 mp. Casa necesită renovare, oferind astfel posibilitatea de personalizare completă conform preferințelor viitorului proprietar. Este ideală pentru cei care doresc să investească într-o zonă aflata in continua dezvoltare sau să-și finiseze locuinta dupa propriul gust. .Desi necesita un refresh , cateva investitii sunt deja facute,fiind dotată cu centrală termică proprie și geamuri termopan, investiții deja făcute care reduc semnificativ costurile unei reamenajări totale. Din categoria dependintelor, de amintit ar fi un garaj ce poate fi folosit atat pentru parcarea unei masini cat si pentru spatiu de depozitare. .Dacă vrei un loc pe care să-l transformi în acasă suna la 0755.939.128 Apelează acum Cristina AcasA Imobiliare si programeaza o vizionare. ID anunț : 1746600264",12.12.2014,75,182703.0625,2014-12-12,4013.0,0,-112803.0625
101,Anunț,390000,EUR,7,1626,https://www.publi24.ro/anunturi/imobiliare/de-vanzare/case/case-vile/anunt/casa-vila-locuinta-cu-7camere-2garaje-spatiu-verde-livada-partea-de-nord-dn1-com-ciolpani-ilfov/f392h795ddd2770e2e3438f3662d4f8e.html,images_case/anunt_101_img_0.webp|images_case/anunt_101_img_1.webp|images_case/anunt_101_img_2.webp|images_case/anunt_101_img_3.webp,4,,,19.04.2019,4,156257.78125,2019-04-19,2424.0,0,233742.21875
102,Anunț,139990,EUR,4,100,https://www.publi24.ro/anunturi/imobiliare/de-vanzare/case/case-vile/anunt/casa-pe-parter-cu-3-dormitoare-si-doua-bai-in-clinceni/i1id5ig9g3i87d85193f66366i0771h9.html,images_case/anunt_102_img_0.webp|images_case/anunt_102_img_1.webp|images_case/anunt_102_img_2.webp|images_case/anunt_102_img_3.webp,4,,"I!!! MPORTANT !!! - locuinta prezentata in poze este cu incalzire prin calorifere, dar proiectul este cu incalzire in pardoseala (aici a fost dorinta exclusiva a proprietarului). PREZENTARE: Casa individuala construita in Clinceni. Aceasta face parte dintr-un ansamblu rezidential alcatuit din 26 de unitati. Conplexul dispune de utilitati complete: retea de apa si canalizare, gaz si curent. Casa prezentata are o suprafata utila de 100 mp. si este alcatuita din 4 camere: hol acces living bucatarie separata baie cu dus baie cu cada 3 dormitoare Confortul termic este asigurat prin utilizarea sistemului de incalzire in pardoseala + tamplarie tripan Salamander. Dupa cum se poate vedea in ultima poza, compartimentarea peretilor interiori s-a realizat folosind caramida de 26 cm. Casa este construita pe un teren in suprafata de 400 mp. Finisajele sunt la alegerea viitorilor proprietari. Termen de predare: decembrie 2025. Casa se preda la cheie, complet finisata si echipata cu centrala termica si obiecte sanitare. Pretul afisat este cu TVA inclus! Comision: 0% Detalii suplimentare la telefon: 0725321511 ID anunț : 1761425469",22.10.2025,36,151872.671875,2025-10-22,46.0,0,-11882.671875
103,Anunț,170000,EUR,4,115,https://www.publi24.ro/anunturi/imobiliare/de-vanzare/case/case-vile/anunt/duplex-giroc-4-camere-3-bai-115mp-utili-170-000-euro/g296f2f98hf970fedde86169dh7e79fh.html,images_case/anunt_103_img_0.webp|images_case/anunt_103_img_1.webp|images_case/anunt_103_img_2.webp|images_case/anunt_103_img_3.webp,4,,"Propunem spre vânzare jumătate de duplex situat în localitatea Giroc, într-o zonă nouă de case, liniștită și bine dezvoltată, cu acces rapid la toate utilitățile. Proprietatea are tipologia P+1E și o suprafață utilă de 115 mp, fiind compartimentată astfel: Parter: - Hol de acces - Baie - Spațiu de depozitare - Bucătărie + living open space (cu posibilitatea de închidere a bucătăriei) - Acces către terasa generoasă de 20 mp Etaj: - Hol - Baie - spatiu pentru dressing - 3 dormitoare, dintre care unul matrimonial, prevăzut cu baie proprie și dressing - Balcon Toate băile dispun de geam pentru aerisire naturală. Finisajele sunt la alegere, dintr-o gamă variată, pentru a vă personaliza locuința după propriul gust. Confortul termic este asigurat de centrala proprie pe gaz și încălzire prin pardoseală. Curtea permite amenajarea unui carport pentru protejarea mașinii. Fotografiile din anunț reprezintă randări folosite cu scop informativ. Casa se află în stadiul de selectare a finisajelor, acestea putând fi personalizate de viitorul proprietar. Termenul de predare este de aproximativ două săptămâni. Preț: 170.000 (TVA 21% inclus) Telefon: 0723 100 819 ID anunț : 1764144066",21.02.2010,381,161090.375,2010-02-21,5768.0,0,8909.625
104,Anunț,220000,EUR,5,120,https://www.publi24.ro/anunturi/imobiliare/de-vanzare/case/case-vile/anunt/casa-tip-duplex-p-e-120-mp-utili-langa-eso-construtie-2025/55eid84234ge74262g79i36ei7731ff1.html,images_case/anunt_104_img_0.webp|images_case/anunt_104_img_1.webp|images_case/anunt_104_img_2.webp|images_case/anunt_104_img_3.webp,4,,"Se vinde o casă tip duplex cu arhitectură modernă, situată la limita dintre Timișoara și Giroc, în apropierea benzinăriei ESO, cu acces rapid la mijloace de transport, școli, grădinițe, supermarketuri și alte puncte de interes. Imobilul are suprafață utilă de 120 mp și teren de 270 mp, fiind construit pe regim de înălțime P+E (parter + etaj). Casa este compartimentată eficient și oferă confort, lumină naturală și finisaje de calitate. Confortul termic este asigurat de centrala proprie pe gaz, cu încălzire prin pardoseală. Compartimentare: Parter: hol de acces baie de serviciu bucătărie închisă dormitor birou living spațios cu ieșire pe terasă spațiu de depozitare Etaj: 3 dormitoare luminoase baie principală dressing (cu posibilitate de transformare în a doua baie) Pod: placă de beton și acces prin scară retractabilă Accesul auto se face printr-o poarta metalica, iar curtea permite amenajarea unui carport pentru protejarea masinii. Pentru detalii si vizionari, va rugam sa ne contactati. Pret 220.000 Euro Tel.0723100819 ID anunț : 1761495689",21.02.2010,381,159355.140625,2010-02-21,5768.0,0,60644.859375
105,Anunț,145000,EUR,4,90,https://www.publi24.ro/anunturi/imobiliare/de-vanzare/case/case-vile/anunt/casa-insiruita-chisoda-drum-asfaltat-4-camere-90mp-145-000-euro/d67i1hh8dgi3775e2947h25f42hg05g7.html,images_case/anunt_105_img_0.webp|images_case/anunt_105_img_1.webp|images_case/anunt_105_img_2.webp|images_case/anunt_105_img_3.webp,4,,"Se vinde o casa insiruita situata intr-un ansamblu rezidential cu acces privat, in localitatea Chisoda, aproape de restaurantul Cuina, la asfalt. Imobilul are o suprafata utila de 90 mp si dispune de teren in spate de 40 mp, precum si de doua locuri de parcare in fata casei. Este racordata la toate utilitatile: curent, gaz, apa si canalizare. Casa este compartimentata astfel: la parter se afla livingul cu bucataria open space (cu posibilitate de inchidere), o baie si terasa, iar la etaj sunt trei dormitoare, o baie si un pod cu scara retractabila (spatiu de depozitare). Imobilul beneficiaza de finisaje de calitate, precum gresie, faianta, parchet laminat, instalatii electrice si sanitare moderne, obiecte sanitare montate in bai, centrala proprie pe gaz si incalzire prin pardoseala. Pretul de vanzare este de 145.000 euro. Pentru mai multe informatii sunati la 0723-100-819. ID anunț : 1762255160",21.02.2010,381,185737.9375,2010-02-21,5768.0,0,-40737.9375
106,Anunț,55000,EUR,3,49,https://www.publi24.ro/anunturi/imobiliare/de-vanzare/case/case-vile/anunt/casa-de-vanzare-schimb/7b0164757f6c6157.html,images_case/anunt_106_img_0.jpg|images_case/anunt_106_img_1.jpg|images_case/anunt_106_img_2.jpg|images_case/anunt_106_img_3.jpg,4,,"Casa renovata recent . Centrala termica,gresie,faianta,parchet...    Curte betonata,acces auto.Casa are 3 camere.Vand sau schimb cu apartament 2 sau 3 camere in orasul Braila sau Brasov .Casa se afla in Cartier Lacu Dulce.   Braila. , numar camere: 3, numar bai: 1,  suprafata totala: 200, suprafata construita: 90, Accept schimburi. Se vinde prin credit bancar sau alte variante, toate actele la zi. ID anunț : 19027520",06.07.2017,1,178764.625,2017-06-07,3105.0,0,-123764.625
107,Anunț,829900,EUR,6,469,https://www.publi24.ro/anunturi/imobiliare/de-vanzare/case/case-vile/anunt/pensiune-superba-cu-piscina-comision-0-girocului/6595i0gh988878e9e8098i6i05h3773d.html,images_case/anunt_107_img_0.webp|images_case/anunt_107_img_1.webp|images_case/anunt_107_img_2.webp|images_case/anunt_107_img_3.webp,4,,"District Real Estate va propune spre vanzare o pensiune deosebita, situata într-o zona linistita din zona Girocului, in spate la Kaufland. Este ideala pentru  continuarea business-ului sau pentru diverse functiuni comerciale sau rezidentiale precum clinică medicală , azil privat, spații de birouri, sediu de firmă sau chiar  locuință . Proprietatea este pozitioanta intr-o zona rezidendiala din Timisoara,pe Strada Mures,avand atat intimitatea necesara dar si o accesibilitate avantajoasa catre centrul orasului,astfel oferind un potential invetitional mare. Avand o suprafata utila de 469mp,situat pe un teren de 950mp,aceasta pensiune ofera diferite oportunitati pentru viitoare ta afacere. Compartimentarea casei este inteligent realizata, oferind atat functionalitate cat si confort: • Suprafață utilă: 469 mp, parter + etaj • Curte amenajata,avand piscina,terasa,lounge,zona verde si locuri de parcare • 10 camere mari,care se pot recompartimenta usor • Dotări camere: aer condiționat, TV, Wi-Fi, balcon • Facilități comune: bucătărie complet utilată, lounge, grătar,piscină si locuri de parcare. Proprietatea dispune de toate utilitatile necesare: apa, canalizare, gaz, electricitate și asfalt. Confortul termic este asigurat printr-un sistem de încalzire eficient cu calorifere, alimentat de centrala proprie. Prețul de vanzare este de 829.900euro. Se vinde mobilata si utilata. Oferim consultanța personalizata si solutii financiare avantajoase pentru obținerea unui credit ipotecar, prin intermediul partenerilor nostri specializati. Pentru programarea unei vizionari sau informatii suplimentare, nu ezitati să ne contactati. ID anunț : 1765054464",27.10.2021,717,184621.90625,2021-10-27,1502.0,0,645278.09375
108,Anunț,195000,EUR,4,108,https://www.publi24.ro/anunturi/imobiliare/de-vanzare/case/case-vile/anunt/casa-noua-giroc-4-camere-108mp-utili-195-000-euro/8e56i3e871e873fg295d46g4422hd769.html,images_case/anunt_108_img_0.webp|images_case/anunt_108_img_1.webp|images_case/anunt_108_img_2.webp|images_case/anunt_108_img_3.webp,4,,"OOportunitate de a achiziționa o casă modernă și eficientă energetic în Giroc. Situată într-o zonă liniștită, proprietatea oferă 108 mp utili și 276 mp teren. Caracteristici: Compartimentare practică: - Parter: living cu acces la terasă acoperită, bucătărie închisă, debara, baie, camera tehnica. - Etaj: 3 dormitoare (unul cu dressing), 2 balcoane și baie. Unitate separata prin camera tehnica, fara pereti comuni. Eficiență energetică ridicată, datorită pompei de căldură și panourilor fotovoltaice Finisaje de înaltă calitate. Curte cu gazon rulou. Toate utilitățile: gaz, curent, apă și canalizare. 2 locuri de parcare. Pret 185.000 Euro Tel.0723100819 ID anunț : 1759425217",21.02.2010,381,139518.265625,2010-02-21,5768.0,0,55481.734375
109,Anunț,152000,EUR,4,300,https://www.publi24.ro/anunturi/imobiliare/de-vanzare/case/case-vile/anunt/casa-individuala-sagului-4-camere-teren-300mp-152-000-euro/97hh1g89334276112ihfheg8f6i4888d.html,images_case/anunt_109_img_0.webp|images_case/anunt_109_img_1.webp|images_case/anunt_109_img_2.webp|images_case/anunt_109_img_3.webp,4,,,,0,151638.875,,,0,361.125
110,Anunț,330000,EUR,4,120,https://www.publi24.ro/anunturi/imobiliare/de-vanzare/case/case-vile/anunt/casa-tip-duplex-cu-panorama-deosebita/41h60fd9i7537i95eh0g900f68239071.html,images_case/anunt_110_img_0.webp|images_case/anunt_110_img_1.webp|images_case/anunt_110_img_2.webp|images_case/anunt_110_img_3.webp,4,,"Casă spațioasă și modernă, semifinisată, într-o zonă nouă din Cluj Va prezentam spre vanzare duplex in incartierul Iris, zona Voronet cu o suprafață utilă generoasă de 120 mp, amplasată pe un teren de 300 mp complet împrejmuit și delimitat, ideală pentru o familie care caută confort și funcționalitate. Compartimentare practică și modernă: Parter: -camera de zi + loc de luat masa cu acces pe terasa; -bucatarie separata cu acces in curte; -1 hoc; -1 baie; Etaj: -3 dormitoare; -1 baie; -1 dressing. Demisol: -1 garaj pentru 1 masina; Incalzirea se realieaza cu centrala termica proprie prin pardoseala. Se preda la stadiul semifinisat cu: -Pereți gletuiți și șapă autonivelantă -Geamuri termopan de calitate superioară -Instalații electrice și sanitare trase pe poziții -usa la intrare PVC Construcție durabilă din cărămidă, izolată termic la exterior, pentru un plus de eficiență energetică și confort pe tot parcursul anului. Această locuință reprezintă o oportunitate excelentă pentru cei care își doresc un cămin generos, într-o zonă liniștită și modernă din Cluj, în plină dezvoltare. Contactează-ne pentru mai multe detalii sau pentru a programa o vizionare! ID anunț : 1749733766",28.03.2025,474,248222.03125,2025-03-28,254.0,0,81777.96875
111,Anunț,43000,EUR,2,419,https://www.publi24.ro/anunturi/imobiliare/de-vanzare/case/case-vile/anunt/reducere-de-pret-casa-de-vanzare-in-tautii-de-sus/ih55efh4edif7213e2g67639972ff61i.html,images_case/anunt_111_img_0.webp|images_case/anunt_111_img_1.webp|images_case/anunt_111_img_2.webp|images_case/anunt_111_img_3.webp,4,,"Proprietar , vand casa in Tautii de Sus pe strada Gordanului, toate actele la zi, cu toate utilitatile , teren 419mp ingradit , la 10 min de centrul vechi Baia Mare TOATE ACTELE SUNT LA ZI CASA NECESITA RENOVARE Toata casa are geamuri si usi interioare termopan PVC si aluminiu noi Casa dispune de doua sobe pe lemn gaz Compartimentare casa 63mp construiti: -2 camere mari -baie utilata -hol -magazie si fantana in curte ID anunț : 1756839317",01.03.2017,1,149008.875,2017-01-03,3260.0,0,-106008.875
112,Anunț,36800,EUR,5,2880,https://www.publi24.ro/anunturi/imobiliare/de-vanzare/case/case-vile/anunt/casa-si-anexe-cermei-central-2-curti-front-stradal-50-ml-2880-mp/hi3d367942i77ii8290d252e3de92g00.html,images_case/anunt_112_img_0.webp|images_case/anunt_112_img_1.webp|images_case/anunt_112_img_2.jpg|images_case/anunt_112_img_3.jpg,4,,"Persoană fizică unic proprietar, acte în regulă în localitatea Cermei, la 20 km de Ineu, 30 km de Chișineu Criș, 70 km de Arad sau Oradea - 2 loturi (un CF), 2 curți, două case plus o casă țărănească, anexe și acareturi - Front stradal cca 50 m, teren total 2880 m, înconjurat de pomi (pruni în principal) - casa 1 compusă din 2 camere, bucătărie, hol, loc de baie (sau cămară), construcție de pământ cu lemn, si caramidă, locuibilă, o teracotă, are curent, iar gazul și canalizarea sunt la poartă, și apa în curte, mobilată, neutilată - casa 2 compusă din 2 camere, hol, antreu, loc de baie (sau cămară), construcție boltari de ciment cu caramida, o teracotă cu sobă gătit, semimobilată, neutilată, are curent, iar gazul și canalizarea sunt la poartă, și apa în curte, locuibilă - o casă țărănească în fundul curții, compusă din hol, cămară și o cameră, construcție de pământ, curent tras - acareturi: o colnă cu afumătoare și intrare în pod, o colniță de lemne, 2 anexe - gard la stradă - curte acoperita cu vie Utilități: curent în toate 3 casele, apa în curte, canalizare și gaz la poartă Vecinătăți: centrul satului, cu toate magazinele, primăria, stație etc ID anunț : 1725951408",06.09.2023,1,166005.109375,2023-06-09,912.0,0,-129205.109375
113,Anunț,280000,EUR,4,1080,https://www.publi24.ro/anunturi/imobiliare/de-vanzare/case/case-vile/anunt/casa-gradiste-dreapta-1080mp-fs-24-ml-280-000-euro/i8i5ei55ii387200dge3g36g753ggie6.html,images_case/anunt_113_img_0.jpg|images_case/anunt_113_img_1.jpg|images_case/anunt_113_img_2.jpg|images_case/anunt_113_img_3.jpg,4,,"Casa de vanzare Gradiste Suprafata casa : 110 mp utili, 135 mp construiti Suprafața teren : 1080 mp Front Stradal : cca 24 ml Material constructie : caramida, ziduri de 35 cm Izolatie termica: 10 cm Acoperis: tabla Lindab, vechime 5 ani. Incalzire: Centrala Gaz Curent trifazic, instalatie electrica impartita pe faze, bransament 10KW Prize suficiente, internet si TV, in fiecare camera Incalzire in pardoseala, termostate in fiecare camera. Casa este compusa din: Camera de zi/antreu 12 mp Hol 8 metri liniari Camera suplimentara/biblioteca 12 mp Bucatarie mare, 12 mp Doua camere mari, 23 mp, Baie si camera tehnica Dulapuri in perete Garaj cu capacitate de 4 locuri, de 77 mp utili Latime 7 metri, inaltime 3.5 metri, structura metalica cu posibilitate de amenajare a unui pod, garajul este betonat, doua porti automate, curent trifazic, canal auto, acces din strada in curte si in gradina prin garaj Anexa cu etaj, cu utilitati, canalizare, apa, curent. Suprafata la parter 15 mp utili, strucura caramida, cu baie de serviciu Suprafata etaj 18 mp utili, structura lemn Gradina foarte mare, sol negru, folosit pentru agricultura fara chimicale minim 7 ani suficient spatiu pentru extinderea casei sau alte anexe si/sau sisteme de energie alternative. Vecinatati foarte bune, zona foarte linistita, vecini deosebiti, La 2 minute de magazine alimentare, Peco, Lidl, Profi, statie tramvai, magazine bricolaj, vulcanizare si spalatorie auto. Necesita zugravit Se preda utiliata si mobilata integral, sau nu, dupa necesitati. ID anunț : 1672826698",16.12.2020,1,153612.890625,2020-12-16,1817.0,0,126387.109375
114,Anunț,31000,EUR,3,4200,https://www.publi24.ro/anunturi/imobiliare/de-vanzare/case/case-vile/anunt/vand-casa/d8h20679i1227eied1005d671i0d4967.html,,0,,"OFERTA!Vând casă la rosu formata din living,3 camere,bucătărie și baie, deschidere 40 ml și suprafață 4200mp în Com.Vagiulesti,SAT Carciu-Gorj ID anunț : 1705735020",21.02.2023,1,21540.212890625,2023-02-21,1020.0,0,9459.787109375
115,Anunț,85000,EUR,4,76,https://www.publi24.ro/anunturi/imobiliare/de-vanzare/case/case-vile/anunt/casa-de-vanzare-in-campulung-muscel/e772250gi02i7e4f208i08d553d1e543.html,images_case/anunt_115_img_0.jpg|images_case/anunt_115_img_1.jpg|images_case/anunt_115_img_2.jpg,3,,"Vans casa  in Campulung Muscel, str. Muzeul Fundeni,nr.8,  P+Etaj, 4 camere, 2 bai, 2 holuri. Suprafata teren 338 m. Zona linistita. ID anunț : 1742286115",21.01.2024,1,43694.26953125,2024-01-21,686.0,0,41305.73046875
116,Anunț,2700,EUR,3,40,https://www.publi24.ro/anunturi/imobiliare/de-vanzare/case/casa-de-vacanta/anunt/casa-de-vanzare/5h2ie00889f77841die2d8e3762d85d2.html,images_case/anunt_116_img_0.webp|images_case/anunt_116_img_1.webp|images_case/anunt_116_img_2.webp|images_case/anunt_116_img_3.webp,4,,,,0,138616.5,,,0,-135916.5
117,Anunț,241300,EUR,4,127,https://www.publi24.ro/anunturi/imobiliare/de-vanzare/case/case-vile/anunt/buftea-parcul-dintre-flori-casa-contructie-2013-su-127mp-teren-522mp-c/18h50hh26id3769h19242e6e4i97076i.html,images_case/anunt_117_img_0.jpg|images_case/anunt_117_img_1.jpg|images_case/anunt_117_img_2.webp|images_case/anunt_117_img_3.jpg,4,,"Avem deosebita placere de a va propune spre vanzare o casa in zona Buftea- Parcul dintre Flori- Flamanzeni, constructie 2013, caramida, teren 522mp, deschidere 18mp, suprafata utila parter 127,07 mp, suprafata construita la sol 152mp, 4 camere, 2 bai, bucatarie open space, terasa acoperita 17,70mp, pod mansardabil, mobilata si utilata, strada asfaltata, canalizare, toate utilitatile, acte in regula. Daca va doriti linistea si siguranta unui camin, aceasta poate fi zona visata!!! Este o locatie ideala, linistita. Pentru mai multe detalii, va rugam sa ne contactati. Va invitam sa vizitati aceasta frumoasa proprietate ID anunț : 1698700734",03.10.2017,10,136348.21875,2017-03-10,3194.0,0,104951.78125
118,Anunț,69000,EUR,3,386,https://www.publi24.ro/anunturi/imobiliare/de-vanzare/case/case-vile/anunt/vand-casa-la-rosu-in-comuna-cazasu/8iddh6708463780011694dig52i6972f.html,images_case/anunt_118_img_0.jpg|images_case/anunt_118_img_1.jpg|images_case/anunt_118_img_2.jpg,3,,"Vand casa la rosu P+M,Cazasu vechi,strada Nufarului nr 84. Suprafata totala 386 mp,apa,curent,suprafata construita la sol 71 mp si suprafata construita desfasurata 142 mp,dotata astfel: parter: living,bucatarie,baie.La etaj: 2 dormitoare,baie,hol,dressing si balcon.Accept diverse schimburi sau plata in rate.Mai multe detalii la tel ID anunț : 1721667411",19.10.2022,3,55366.72265625,2022-10-19,1145.0,0,13633.27734375
119,Anunț,170000,EUR,4,100,https://www.publi24.ro/anunturi/imobiliare/de-vanzare/case/case-vile/anunt/casa-individuala-cu-incalzire-in-pardoseala-in-domnesti/dhi344g20i3g7281e31hd99i08669fh6.html,images_case/anunt_119_img_0.webp|images_case/anunt_119_img_1.webp|images_case/anunt_119_img_2.webp|images_case/anunt_119_img_3.webp,4,,"Case individuale pe parter construite in Domnesti. Suprafata utila: 100 mp. Suprafata teren: 400 mp. Utilitati: retea de apa si canalizare, gaz si curent. Particularitati: sistem de incalzire in pardoseala tamplarie tripan placa de beton peste parter utilitati complete Compartimentare: living bucatarie separata dormitor copii dormitor oaspeti baie comuna (deserveste cele doua dormitoare) dormitor matrimonial baie matrimoniala Casele se predau la cheie, gata de locuit. Din stadiul prezentat in anunt, viitorii proprietari isi aleg finisajele dorite. Pretul afisat este cu TVA inclus Comision client: 0% Detalii suplimentare la telefon: 0725321511 ID anunț : 1761424671",22.10.2025,36,141202.78125,2025-10-22,46.0,0,28797.21875
120,Anunț,220000,EUR,6,300,https://www.publi24.ro/anunturi/imobiliare/de-vanzare/case/case-vile/anunt/vila-exclusivista-cu-garaj-si-piscina-i-dumbravita-i-comison-0/e9di12d6181f704512f3i77994734905.html,images_case/anunt_120_img_0.webp|images_case/anunt_120_img_1.webp|images_case/anunt_120_img_2.webp|images_case/anunt_120_img_3.webp,4,,"District Real Estate vă prezintă spre vânzare o proprietate cu adevărat excepțională: Vilă exclusivistă cu garaj, piscină și anexă, în Dumbrăvița. Situată într-o zonă liniștită de case, complet urbanizată, proprietatea combină luxul american, confortul autentic de „acasă” și atmosfera unui resort privat. Date generale si suprafețe -Suprafață utilă vilă: aprox. 300 mp -Teren: aprox. 800 mp - Front stradal: 18 m -5 camere (living + 4 dormitoare) -4 băi -Piscină + terasă acoperită ~45 mp Anexă tip apartament: - 2 camere + bucătărie închisă în sticlă, zonă de grătar An construcție: 2020 Structură: cărămidă (vilă + anexă) Concept si finisaje Vila a fost construită pentru a fi locuită, fără compromisuri: materiale premium (piatră naturală, travertin, lemn), design interior atemporal clasic–modern, paletă caldă, texturi fine, iluminat arhitectural, atmosferă elegantă, fluidă și coerentă. Compartimentare – Vilă principală Parter: -hol generos cu depozitări integrate, -living spatios de aprox. 40 mp cu ferestre mari și acces la terasă/piscină, -bucătărie separată complet utilată cu insulă și cămară, -dormitor/birou, -baie cu finisaje premium, -cameră tehnică, spațiu depozitare închis, -garaj integrat. Etaj: -dormitor matrimonial cu dressing walk-in și baie proprie, -2 dormitoare luminoase cu băi proprii, -spații depozitare integrate, -deasupra garajului spațiu versatil (joacă, home cinema, sală sport, studio). Anexă – apartament de vară / oaspeți 2 camere, bucătărie din sticlă deschizibilă complet spre exterior, zonă de grătar, baie proprie. Ideală pentru relaxare, evenimente și oaspeți. Curte si exterior – atmosferă de resort Piscină premium, terasă acoperită de aprox. 45 mp, gazon matur, gard viu înalt pentru intimitate totală, curte gândită pentru joacă, relaxare, grătar și evenimente. Locație si utilități Dumbrăvița – zonă de case, acces facil, stradă asfaltată, utilități complete, vecinătate liniștită, acces rapid către Timișoara. De ce este o casă rară? Construită pentru uz propriu, fără compromis la materiale și execuție, design coerent interior–exterior, camere cu băi proprii, spații tehnice și depozitare eficiente, anexă, piscină și terasă mare, eleganță discretă și echilibrată. Pretul de vanzare este de 1.220.000 euro! Comision 0% pentru cumparator! Pentru vizionari si alte detalii va stam la dispozitie! ID anunț : 1765052965",27.10.2021,717,189841.9375,2021-10-27,1502.0,0,30158.0625
121,Anunț,189000,EUR,5,330,https://www.publi24.ro/anunturi/imobiliare/de-vanzare/case/case-vile/anunt/casa-individuala-330-mp-teren-comuna-bereceni/e6fhg463h04d707ie28gdf5671e5d56d.html,images_case/anunt_121_img_0.webp|images_case/anunt_121_img_1.webp|images_case/anunt_121_img_2.webp|images_case/anunt_121_img_3.webp,4,,"Îți propun spre vânzare o locuință modernă, amplasată într-una dintre cele mai bine poziționate și în continuă dezvoltare zone din Comuna Berceni. O casă care oferă tot ce ai nevoie   spațiu, confort, intimitate și acces rapid către oraș. -Această vilă cu regim de înălțime P+1 este gândită pentru familiile care își doresc un cămin durabil, bine compartimentat și amplasat într-un cartier liniștit, dar conectat la tot ce contează. -Proiectul are avantajul unei locații strategice, cu acces facil către București, datorită apropierii de Autostrada A0 și extinderii magistralei de metrou M2. Stațiile Tudor Arghezi și Berceni asigură legătura rapidă cu centrul orașului, iar zona beneficiază de drumuri asfaltate, utilități complete și spații comerciale în apropiere. Caracteristici principale: -Suprafață utilă: 125 mp -Suprafață desfășurată: 145 mp -Teren: 330 mp -Casa este dispusă pe două niveluri și oferă o compartimentare practică și bine proporționată: -5 camere (4 dormitoare și un living generos) -Bucătărie spațioasă, cu posibilitate de recompartimentare Construcție și dotări: -Construită cu atenție la detalii, vila se remarcă prin finisaje moderne și materiale de calitate. Structura este realizată din beton armat, cu izolație exterioară eficientă (polistiren de 10 cm), tâmplărie Salamander cu geam tripan pentru o bună izolare fonică și termică, iar încălzirea este asigurată prin pardoseală, completată de o centrală termică pe gaz. -Accesul se face dintr-o stradă publică lată de 9 metri, iar curtea este complet împrejmuită, cu garduri durabile și alei din beton amprentat. Sistemul este pregătit pentru montarea de camere video și alarmă. Utilități disponibile: -Energie electrică -Gaze naturale -Apă din puț forat -Fosă ecologică cu drenaj -Această proprietate este ideală pentru cei care își doresc o casă bine construită, într-o zonă curată, liniștită și cu acces rapid către oraș. Poziționarea, suprafața și calitatea construcției o transformă într-o alegere sigură și inteligentă pentru viitor. Preț: 189.000 EURO ID anunț : 1755174348",12.05.2023,27,140367.21875,2023-12-05,733.0,0,48632.78125
122,Anunț,140000,EUR,4,83,https://www.publi24.ro/anunturi/imobiliare/de-vanzare/case/case-vile/anunt/ansamblul-rezidential-gloris-village-0-comision/995gd008i9327i241d3e13df1e50fee3.html,images_case/anunt_122_img_0.jpg|images_case/anunt_122_img_1.jpg|images_case/anunt_122_img_2.jpg|images_case/anunt_122_img_3.jpg,4,,"Koncept Imobiliare va ofera spre vanzare in exclusivitate, cu comision 0%, ultimele unitati disponibile din ansamblul rezidential privat Gloris Village, situat intr-o zona pitoreasca, retrasa si linistita a localitatii Gilau. Aflat la doar 350 de metri de Barajul si Lacul Gilau, acest complex ofera un camin perfect pentru familii, unde siguranta si intimitatea sunt prioritati absolute. Duplexurile au suprafete utile de 118.83 mp  si 114.19 mp, cu terase cu o suprafata utila cumulata de 18.24 mp si teren aferent cuprins intre 430 mp si 250 mp. Regimul de inaltime este P+1 si compartimentarea este gandita pentru a maximiza confortul si functionalitatea; -parter: hol, living open space, bucatarie cu loc de luat masa, baie, 2 terase si casa scarii; -etaj:  hol, 3 dormitoare, baie si 2 terase. Duplexurile sunt predate la stadiul de semifinisat, pregatite pentru a fi personalizate dupa gusturile fiecarui proprietar. Interiorul include pereti gletuiti, sapa autonivelanta, geamuri cu 3 foi de sticla, toate instalatiile trase pe pozitii, centrala termica proprie in condensatie si incalzire prin pardoseala. Complexul dispune de un parc privat de 2.350 mp, destinat exclusiv locatarilor, dotat cu locuri de joaca, banci si vegetatie matura care ofera umbra naturala. Aceste facilitati contribuie la un stil de viata modern si confortabil, oferind un spatiu perfect pentru relaxare si socializare. Fiecare unitate beneficiaza de 1-2 locuri de parcare proprii. Intregul complex este imprejmuit si echipat cu bariere de acces, porti si un sistem performant de supraveghere video, asigurand un control strict al accesului si monitorizare continua. Se recomanda acest ansamblu pentru familiile care doresc siguranta, confort si un mediu prietenos. Pretul nu include tva. Pentru informatii suplimentare, programarea unei vizionari sau pentru a afla oferta noastra completa, nu ezitati sa ne contactati telefonic, prin e-mail sau la sediul agentiei noastre de pe str. Aviator Badescu nr. 19, Cluj-Napoca. ID anunț : 1720718246",13.11.2018,591,129737.4921875,2018-11-13,2581.0,0,10262.5078125
123,Anunț,80000,EUR,2,9600,https://www.publi24.ro/anunturi/imobiliare/de-vanzare/case/case-vile/anunt/teren-9600-mp-si-casa-batraneasca-demolabila-dealu/ig7g3h060f68721f187h9f9d4hd92ghh.html,images_case/anunt_123_img_0.webp|images_case/anunt_123_img_1.webp,2,,"Blitz va ofera la vanzare: Teren drept, cu suprafața totală de 9.600 mp, situat în satul Dealu, comuna Zvoriștea, județul Suceava, poziționat la strada principală, cu acces facil. ✔️ Terenul este parțial intravilan, ideal pentru dezvoltare rezidențială, agricolă sau mixtă. ✔️ Dispune de front stradal generos la drumul principal. ✔️ Pe teren se află o casă bătrânească și două anexe, toate în stare demolabilă. Zona este liniștită, cu vecinătăți stabile și potențial de dezvoltare. Accesul la utilități este posibil, existând deja rețele de electricitate și canalizare în apropiere. Preț avantajos. Acte în regulă. Pentru mai multe detalii sau vizionare, nu ezitați să ne contactați! Cod ofertă / ID BLITZ: P148525 ID anunț : 1753191773",07.05.2021,9948,36019.01953125,2021-07-05,1616.0,0,43980.98046875
124,Anunț,198000,EUR,5,180,https://www.publi24.ro/anunturi/imobiliare/de-vanzare/case/case-vile/anunt/casa-180-mp-utili-teren-1-000-mp-sfantu-ilie-zona-excelenta/hg0dgg93208079d9244069gg0i6d514f.html,images_case/anunt_124_img_0.webp|images_case/anunt_124_img_1.webp|images_case/anunt_124_img_2.webp|images_case/anunt_124_img_3.webp,4,,"Blitz va propune spre vânzare o proprietate situată într-o zonă foarte bună din localitatea Sfântu Ilie, ideală pentru cei care caută liniște, spațiu și acces rapid către oraș. Caracteristici principale: Suprafață utilă: 180 mp Teren generos: 1.000 mp, ideal pentru grădină, foișor sau alte amenajări exterioare Living spațios de 40 mp, perfect pentru relaxare și petrecerea timpului cu familia Garaj inclus, oferind siguranță și protecție pentru autoturism Beci util, potrivit pentru depozitare suplimentară Casă solidă, dar care necesită investiții și amenajări interioare/exterioare după gustul viitorului proprietar Utilități: Fântână proprie Fosă septică Apă curentă și canalizare la frontul proprietății, pregătite pentru racordare Avantaje suplimentare: Zonă foarte bună, în continuă dezvoltare, cu acces facil către Suceava Potențial ridicat de personalizare și transformare în locuința visurilor tale Această proprietate este ideală pentru o familie care dorește un spațiu generos, curte mare și un cadru natural plăcut, dar și pentru investitori care caută un proiect promițător într-o zonă apreciată. Cod ofertă / ID BLITZ: P146887 ID anunț : 1749629507",07.05.2021,9948,152306.265625,2021-07-05,1616.0,0,45693.734375
125,Anunț,241300,EUR,4,7,https://www.publi24.ro/anunturi/imobiliare/de-vanzare/case/case-vile/anunt/buftea-parcul-dintre-flori-casa-contructie-2013-su-127-07mp-teren-522-mp-c/i7i4f9i662f27g1f2fhgge968061906e.html,images_case/anunt_125_img_0.jpg|images_case/anunt_125_img_1.jpg|images_case/anunt_125_img_2.jpg|images_case/anunt_125_img_3.jpg,4,,"Avem deosebita placere de a va propune spre vanzare o casa in zona Buftea- Parcul dintre Flori- Flamanzeni, constructie 2013, caramida, teren 522mp, deschidere 18mp, suprafata utila parter 127,07 mp, suprafata construita la sol 152mp, 4 camere, 2 bai, bucatarie open space, terasa acoperita 17,70mp, pod mansardabil, mobilata si utilata, strada asfaltata, canalizare, toate utilitatile, acte in regula. Daca va doriti linistea si siguranta unui camin, aceasta poate fi zona visata!!! Este o locatie ideala, linistita. Pentru mai multe detalii, va rugam sa ne contactati. Va invitam sa vizitati aceasta frumoasa proprietate ID anunț : 1696369162",06.10.2019,7,139929.390625,2019-06-10,2372.0,0,101370.609375
126,Anunț,450000,EUR,20,400,https://www.publi24.ro/anunturi/imobiliare/de-vanzare/case/vila/anunt/vanzare-vila-costinesti/7f2559gd0fed7defe49h75518180d38d.html,images_case/anunt_126_img_0.jpg|images_case/anunt_126_img_1.jpg|images_case/anunt_126_img_2.jpg|images_case/anunt_126_img_3.jpg,4,,,,0,163198.15625,,,0,286801.84375
127,Anunț,175000,EUR,3,438,https://www.publi24.ro/anunturi/imobiliare/de-vanzare/case/case-vile/anunt/casa-de-vanzare-in-muresel-arad/9d3125h025597f36di03g26if8iig5e1.html,images_case/anunt_127_img_0.webp|images_case/anunt_127_img_1.webp|images_case/anunt_127_img_2.webp|images_case/anunt_127_img_3.webp,4,,"Casa este alcătuită din 3 camere, antreu, bucătărie, două băi și pivniță. În curte are garaj și cămară de lemne. Suprafața totală este 438 mp. Casa este din cărămidă, la exterior este izolată cu polistiren de 10 cm, geamuri termopan cu rolete albe, acoperiș nou, climă. Intrarea în casă se face pe cinci trepte, printr-o terasă largă cu trei coloane decorative. Pe lângă canalizare și apă de oraș în curte se află o fântână pentru udat în grădină. Altă detalii în fața locului. ID anunț : 1756054933",19.10.2018,1,160029.59375,2018-10-19,2606.0,0,14970.40625
128,Anunț,100000,EUR,2,81,https://www.publi24.ro/anunturi/imobiliare/de-vanzare/case/case-vile/anunt/casa-curte-si-garaj-in-zona-centru/668713057fgi78dfe0e4f44hiee4f0e6.html,images_case/anunt_128_img_0.jpg|images_case/anunt_128_img_1.jpg|images_case/anunt_128_img_2.jpg|images_case/anunt_128_img_3.jpg,4,,"!!!   Pretul afisat (100.000 euro - pret fix) este solicitat doar pentru casa. In eventualitatea optiunii achizitiei casa + garaj, pretul este de 110.000 euro -pret fix. !!! Vanzare casa in Galati, str Domneasca, 2 camere cu dependinte, sup 81 mp, curte, garaj Localitate: Galati Zona: Centru Tip proprietate: Casa Compartimentare: Semidecomandat Suprafata utila: 81.00 m2 Nr. camere: 2 Nr. bai: 1 Regim inaltime: Parter Particular vand casa in Galati, zona centrala (str Domneasca), cu o amplasare foarte favorabila, avand in vecinatate multe obiective importante: Gradina Publica, Prefectura, facultati, Teatre, Biblioteca, Catedrala, Politia Rutiera, statii de transport in comun, etc. Imobilul are o suprafata utila de 81 mp, doua camere, baie, bucatarie, dependinte, curte, garaj si a fost renovat de curand cu finisaje de foarte buna calitate: -instalatii inlocuite (electrica, apa, canalizare) -centrala termica, calorifere aluminiu -racord individula apa -ferestre Salamander cu 3 foi si 7 camere -usi interioare profil aluminiu -parchet laminat, gresie, faianta -aer conditionat -termoizolatie polistiren 10 cm Suprafata terenului este de 141 mp in indiviziune, casa are o suprafata construita de 122 mp si o deschidere la strada Domneasca de 14 ml. Curtea va permite relaxarea in conditii de liniste si intimitate, chiar daca va aflati in centrul orasului: balansoar, copertina retractabila, zona gratar. Impreuna cu imobilul se vinde si un garaj proprietate personala, situat in aceeasi curte. Accesul se face din strada Domneasca, printr-o curte comuna (distincta de curtea proprie), cu colocatari civilizati si care respecta regulile de conduita in comunitate. Imobilul a fost construit cu simt de raspundere in anul 1955 si are urmatoarele caracteristici: -fundatie din beton armat monolit tip centuri -structura de rezistenta independenta autoportanta din zidarie de caramida -pereti din zidarie caramida -acoperis tip sarpanta din lemn cu astereala din scandura -invelitoare acoperis din tabla zincata Destinatia spatiului poate fi pastrata ca spatiu de locuit sau poate fi schimbata in spatiu comercial sau sediu agent economic cu accces direct din Str. Domneasca. ID anunț : 1694970331",19.09.2021,1,241399.265625,2021-09-19,1540.0,0,-141399.265625
129,Anunț,350000,EUR,4,300,https://www.publi24.ro/anunturi/imobiliare/de-vanzare/case/casa-de-vacanta/anunt/cabana-de-vanzare-vatra-dornei/4hg18idf0e74771dei791723998id529.html,images_case/anunt_129_img_0.jpg|images_case/anunt_129_img_1.jpg|images_case/anunt_129_img_2.jpg|images_case/anunt_129_img_3.jpg,4,,"Cabana de vanzare semifinisata (noul proprietar  are ocazia sa faca dupa plac finisajul ) Cu o suprafata generoasa de circa 300 mp locuibili si 25 ari de teren (avand posiilitatea de a cumpara tot terenul pe care il detinem in jur de 2 hectare ...dar pretul se va modifica fata de cel afisat ) La parter are un living spatios,bucatarie,hol ,baie La etaj 4 dormitoare ,baie Locatia este de vis ,raiul pe pamant pret 350 000 euro negociabil ID anunț : 1724263971",06.06.2018,7,118038.8984375,2018-06-06,2741.0,0,231961.1015625
130,Anunț,58000,EUR,4,4244,https://www.publi24.ro/anunturi/imobiliare/de-vanzare/case/case-vile/anunt/casa-de-vanzare-in-oravita/54975285240977fid6i7731g7i3h5i81.html,images_case/anunt_130_img_0.jpg|images_case/anunt_130_img_1.jpg|images_case/anunt_130_img_2.jpg|images_case/anunt_130_img_3.jpg,4,,"Vând casă locuibilă în Oravița, la 5 min. de magazin, 3 min. de liceul Dragalina, 2 min. de primărie și 1 min. de grădiniță. Casa este dispusă în 4 camere, 2 holuri, baie, bucătărie și o terasă termopan. Încălzirea este cu lemne (teracote); baie boiler pe lemne. Geamurile și ușile exterioare sunt din termopan. Totalul terenului intravilan aferent este de 4244 mp, din care 2000 mp este situat mai sus spre variantă. Curtea și gradina sunt amenajate cu trandafiri, pomi fructiferi, viță de vie și fântână. Intrare separată pentru lemne; curent mono și trifazic. Pentru mai multe informații va astept pe whatzapp. SAU SCHIMB CU APARTAMENT +- diferența. TEL:  zero zero patru nouă unu cinci unu șapte unu șase șapte zero nouă nouă zero ID anunț : 1746625038",29.04.2025,1,153926.46875,2025-04-29,222.0,0,-95926.46875
131,Anunț,14000,EUR,4,650,https://www.publi24.ro/anunturi/imobiliare/de-vanzare/case/case-vile/anunt/casa-batraneasca-de-vanzare/h1467fi67igi722hd95fe3d16dhi91g1.html,images_case/anunt_131_img_0.jpg|images_case/anunt_131_img_1.jpg,2,,"Casă de vanzare in Comuna CAMPURI, sat GURA VĂII, în centru, intr- o zonă linistită și foarte frumoasă. Casa deține beci si anexe, teren arabil 650 mp si 1300 mp livadă pomi fructiferi. Pentru detalii sunați la  . ID anunț : 1696942893",26.10.2019,1,49179.08984375,2019-10-26,2234.0,0,-35179.08984375
132,Anunț,41000,EUR,5,1300,https://www.publi24.ro/anunturi/imobiliare/de-vanzare/case/case-vile/anunt/casa-de-vanzare-turcoaia-teren-1300-mp/i59ed6i3f5657g85d44hd4209if9ed8h.html,images_case/anunt_132_img_0.webp|images_case/anunt_132_img_1.webp|images_case/anunt_132_img_2.webp|images_case/anunt_132_img_3.webp,4,,,,0,155114.09375,,,0,-114114.09375
133,Anunț,73000,EUR,4,737,https://www.publi24.ro/anunturi/imobiliare/de-vanzare/case/casa-de-vacanta/anunt/casa-de-vanzare-moldova-noua/f8g3iehd71hf716ed998d87i079665gh.html,images_case/anunt_133_img_0.webp|images_case/anunt_133_img_1.webp|images_case/anunt_133_img_2.webp|images_case/anunt_133_img_3.webp,4,,"Casă de vânzare   737 m  utili, 3 camere, complet mobilată, recent zugrăvită, grădină și dependințe Se vinde casă spațioasă, îngrijită și gata de mutat, ideală pentru familie sau pentru cei care caută un spațiu complet funcțional, cu investiții minime necesare. Detalii proprietate: Suprafață utilă: 737 m 3 camere luminoase Baie Încălzire centrală pe lemne Complet mobilată   totul inclus în preț Recent zugrăvită   interior curat, modern, pregătit pentru locuire Bucătărie de vară utilată Grădină generoasă, ideală pentru relaxare sau cultivare Dependințe: Construcție separată cu cameră, bucătărie și baie   perfectă pentru oaspeți, chirie sau activități independente Curte & avantaje: Curte mare, cu potențial de amenajare Acces la utilități și drum bun Locație: zonă liniștită, aproape de magazine, școală și transport. ID anunț : 1765052270",18.11.2025,1,126609.78125,2025-11-18,19.0,1,-53609.78125
134,Anunț,60000,EUR,3,1450,https://www.publi24.ro/anunturi/imobiliare/de-vanzare/case/case-vile/anunt/casa-in-sanmarghita-jud-cluj/0gii8377h8di70g428i303g66863d97i.html,images_case/anunt_134_img_0.webp|images_case/anunt_134_img_1.webp|images_case/anunt_134_img_2.webp|images_case/anunt_134_img_3.webp,4,,"Vand casa in loc.Sanmarghita compusa din 3 camere,hol,2 bucatarii, anexe, curte si gradina ,1450 mp,izolata termic,usi intrare si geamuri termopan,mobilata. Informații ID anunț : 1751917171",14.09.2019,2,157751.9375,2019-09-14,2276.0,0,-97751.9375
135,Anunț,185000,EUR,6,250,https://www.publi24.ro/anunturi/imobiliare/de-vanzare/case/casa-de-vacanta/anunt/vila-de-vanzare-pe-valea-cernei/e008d67ii5g972h01411ei3gf064fdhd.html,images_case/anunt_135_img_0.webp|images_case/anunt_135_img_1.webp|images_case/anunt_135_img_2.webp|images_case/anunt_135_img_3.webp,4,,"Vila amplasata pe Valea Cernei, langa Baile Herculane, construita in 2005, cu 6 dormitoare, living spatios, gradina, gratar si foisor. ID anunț : 1746045445",03.05.2021,1,129384.7734375,2021-03-05,1738.0,0,55615.2265625
136,Anunț,87000,EUR,5,300,https://www.publi24.ro/anunturi/imobiliare/de-vanzare/case/case-vile/anunt/vand-casa-sau-schimb-cu-ap-3-4-cam-exclus-parter-ultimul-et-casa-la-tara-diferenta-din-partea-cump/9hg08015f43h71ed295581619g0dfghf.html,images_case/anunt_136_img_0.jpg|images_case/anunt_136_img_1.jpg|images_case/anunt_136_img_2.jpg|images_case/anunt_136_img_3.jpg,4,,"Vând sau schimb casă cu apartament 3-4 camere (exclus parter sau ultimul etaj) sau casă la țară plus diferență din partea cumpărătorului. Prezentare generala Suprafata construita (m ): 220 m Suprafata utila (m ): 180 Numarul de camere: 5 din care( 2 dormitoare cu baie și dressing, livingul mare, și încă două camere ) Suprafata teren (m ): 300 m Tip locuinta: locuinta noua Tip proprietate: singur in curte Stare: in constructie Compartimentare: decomandat Anul constructiei: 2014 Numarul de bai: 3 Numarul total de etaje: 1 Casa de vanzare la rosu compusa din: Demisol compus din garaj, , pivnita și o cameră. Parter compus din living, bucatarie mare, baie, camera, spatiu pentru centrală-cameră tehnica. Etaj compus din 2 dormitoare fiecare cu dresing si baie. Casa este intabulată. Casa are termopane, gaz, curent , canalizare.Casa a fost construita in 2014. PRETUL ESTE IN EURO; 87000 EURO PS. Terenul este in superafata de 300 MP concesionat de la primarie cu posibilitate de cumparare ID anunț : 1627145167",24.07.2021,1,157234.09375,2021-07-24,1597.0,0,-70234.09375
137,Anunț,55000,EUR,5,2636,https://www.publi24.ro/anunturi/imobiliare/de-vanzare/case/case-vile/anunt/casa-de-vinzare-cu-teren-de-2636-mp-ieftina-la-gherghita-pozitie-excelenta-pentru-vila/785f5f15e65978h6ei57i5hig0he7858.html,images_case/anunt_137_img_0.webp|images_case/anunt_137_img_1.webp|images_case/anunt_137_img_2.webp|images_case/anunt_137_img_3.webp,4,,Casa   cu  suprafata  utila  de  89 mp  decomandata cu 5 camere  un  nivel  cu bucatarie  baie  3 dormitoare  hol de  access   cu posibiliatate de reabilitare  apa electricitatate  gaze la poarta    situata  pe strada Principala nr 188  la 3 km de autostrada Bucuresti Ploiesti   iesirea de la km 44   pe drumul judetean 147care leaga comuna Gherghita de judetul Ialomita  la 600 de metri de primarie deschidere la drum  35 de metri  curte cu vita  de vie gradina cu pomi fructiferi garaj anexe magazie  pret foarte bun zona cu perspective bune de dezvoltare. excelenta investitie  LA 40 DE MINUTE DE BUCURESTI    sunati si programati   o vizionare   de preferat la sfirsit de saptamina   cumperi ieftin acum  la 20 de euro metru pătrat  de teren si luati  casa gratis  în 2030 vinzi scump la 40 de euro pe metru pătrat după mici îmbunătățiri  îți dublezi banii în 5 ani  de ce sa ții în banca economiile cu dobânzi de 4 la suta pe an cind inflatie este de peste 10 la suta anual  lasă banii sa îți aducă ție profit nu băncii   poti realiza dezmembrarea dupa cumpărare  și apoi revinde parcela mai mica și recuperați investiția repede si eventual păstrezi cealaltă parcela ideal pentru o familie din 2  generații sau pentru 2 familii de prieteni care pot împărți în 2 terenul și apoi amenaja după preferințe pentru a împărți costurile amenajării și întreținerea celor 2 propietati  sau poti construi in spate   in gradina casa sau vila   asa cum va doriti. sunați programati și  HAIDETI LA VIZIONARE   pacat nu sunati  asa ocazie  nu mai gasiti ID anunț : 1723877885,20.10.2017,2,168411.40625,2017-10-20,2970.0,0,-113411.40625
138,Anunț,135000,EUR,6,316,https://www.publi24.ro/anunturi/imobiliare/de-vanzare/case/case-vile/anunt/casa-vila-cu-teren-de-vanzare/2f173g23g0367772e95412ef4835eid8.html,images_case/anunt_138_img_0.webp|images_case/anunt_138_img_1.webp|images_case/anunt_138_img_2.webp|images_case/anunt_138_img_3.webp,4,,"Suprafața locuibilă este de 316 mp. Proprietatea mai dispune și de 1100mp teren . Imobilul dispune de parter ( 1dormitor,1 bucătărie, 1 baie ,1 living spatios,garaj și camera centralei ). Etajul 1 dispune de 3 dormitoare, 1 baie, 1 terasă  spațioasă , 2 balcoane  și hol . Etajul  2 dispune de 1 dormitor, 1 baie, 1 dresing și pod. Imobilul este finsat in proporție de 85%. Materialele folosite la construcția casei au fost de foarte bună calitate. Prețul de vânzare  este de 135.000 negociabil. ID anunț : 1751812422",06.07.2025,1,147120.125,2025-06-07,183.0,0,-12120.125
139,Anunț,65000,EUR,2,58,https://www.publi24.ro/anunturi/imobiliare/de-vanzare/case/case-vile/anunt/casa-2-camere-teren-magazie-pt-spatiu-comercial-birouri-intrea-din-strada-zona-centrala-in-rate/805i7h93ife172561474fgh1h02gfi4d.html,images_case/anunt_139_img_0.webp|images_case/anunt_139_img_1.webp|images_case/anunt_139_img_2.webp|images_case/anunt_139_img_3.webp,4,,"Vând casa cu 2 camere și bucătărie, situata în Vatra Dornei  peste drum de politie pe strada unirii nr 15 cu intrare din stradă  pretabila pt spațiu comercial, are și teren în spatele casei cu magazie  ,perfectă pt o afacerea  la banii ches este 65000 euro sai în rate pe 5 ani 100.000euro ocupabila imediat, are cf se oferă contract notarial.mai multe detalii la telefon zero șapte patru patru opt patru noua noua doi doi si 07si44si84si99si22ok sunați ID anunț : 1756295571",16.10.2013,3,169591.8125,2013-10-16,4435.0,0,-104591.8125
140,Anunț,100000,EUR,4,218,https://www.publi24.ro/anunturi/imobiliare/de-vanzare/case/case-vile/anunt/casa-de-vanzare-prahova/7019ee74525h771h1f5600i1i05hf7e6.html,images_case/anunt_140_img_0.jpg|images_case/anunt_140_img_1.jpg|images_case/anunt_140_img_2.jpg|images_case/anunt_140_img_3.jpg,4,,"Casa de vânzare în Slănic,Prahova.Suprafata 218 mp,construcție cărămidă, teren 2100 mp, 3 dormitoare, living, 2 terase acoperite, 2 bai, bucătărie, centrala pe peleți.Pentru cei interesați sunați la  . ID anunț : 1732378993",21.02.2013,3,144011.625,2013-02-21,4672.0,0,-44011.625
141,Anunț,17000,EUR,2,231,https://www.publi24.ro/anunturi/imobiliare/de-vanzare/case/case-vile/anunt/casa-la-cheie-curte-generoasa-cu-un-singur-vecin-alfa/gfe95e17f5117f8e20948ggh46eh833f.html,images_case/anunt_141_img_0.webp|images_case/anunt_141_img_1.webp|images_case/anunt_141_img_2.webp|images_case/anunt_141_img_3.webp,4,,,,0,212249.5625,,,0,-195249.5625
142,Anunț,40000,EUR,4,189,https://www.publi24.ro/anunturi/imobiliare/de-vanzare/case/casa-de-vacanta/anunt/casa-de-vacanta-zona-zugreni/67296573e5977g1h2i7154i869d1ig18.html,images_case/anunt_142_img_0.webp|images_case/anunt_142_img_1.jpg|images_case/anunt_142_img_2.jpg|images_case/anunt_142_img_3.jpg,4,,"Vand casa de vacanta in sat Sunatori la 18 km de Vatra Dornei in zona Zugreni. Casa este cu etaj la care se afla doua camere iar jos doua camere si doua bai. Langa casa se afla si o magazie, un foisor cu soba si o incapere cu gratar de piatra. Este amenajat si un spatiu exterior acoperit unde se poate servi masa. Casa este acoperita cu tabla Lindab. Apa curenta este asigurata de un izvor in munte. Este complet mobilata. Mai multe informatii la telefon. ID anunț : 1762172987",09.01.2025,1,158322.34375,2025-09-01,97.0,1,-118322.34375
143,Anunț,235000,EUR,5,130,https://www.publi24.ro/anunturi/imobiliare/de-vanzare/case/case-vile/anunt/proprietar-vand-jumatate-de-duplex-5-camere-partial-mobilat-si-utilat/0ge11hieh2d8781ed259346e13g0e40i.html,,0,,"Proprietar Pret: 235000 negociabil Suprafață utilă de 130 mp, distribuiti pe doua nivele cu o compartimentare ce include 5 camere, 3 băi, 2 terase acoperite, si acces la pod Caramida porotherm cu izolatie de 10 cm Suprafata teren de 300 mp Localizare: - proximitatea benzinariei Socar, 600 m pana la Profi si benzinarie - 10 minute pe jos pana la padure lac -15 minute pe jos pana la parcul central primarie bancomat farmacii Compartimentare: Plan Parter: - Hol intrare - Dormitor birou - Baie - Camera tehnică - Living - Bucatarie - Acces terasa acoperita din bucatarie si living - parterul dispune de aer conditionat 24000 BTU Plan Etaj: - Dormitor 1 matrimonial cu baie - Dormitor 2 - Dormitor 3 - Baie cu cadă - Acces in pod Dispune de toate utilitatile : -Branșament curent si gaz, apa si canalizare, internet fibra+TV Strada este asfaltata si locuinta dispune de incalzire in pardoseala. ID anunț : 1765050980",01.12.2014,1,21531.525390625,2014-01-12,4347.0,0,213468.474609375
144,Anunț,110000,EUR,4,300,https://www.publi24.ro/anunturi/imobiliare/de-vanzare/case/case-vile/anunt/casa-batraneasca-cu-teren-300mp-deschidere-15-3mp/854e557h3h84779e1ed2f19hi47147e9.html,images_case/anunt_144_img_0.webp|images_case/anunt_144_img_1.webp|images_case/anunt_144_img_2.webp|images_case/anunt_144_img_3.webp,4,,"Casa de vanzare batraneasca  Str. Ana Ipătescu, zona Km 4   300 mp, deschidere 15.3 m Oportunitate de investiție! Vă prezentăm o casa batraneasca cu suprafața de 300 mp, situat pe Str. Ana Ipătescu, în zona Km 4, într-un cartier liniștit și bine conectat. Proprietatea are o deschidere generoasă de 15.3 m, fiind potrivită pentru construcția unei case individuale sau a unui duplex. Utilități: apă și curent în curte, gaze la poartă. Terenul este ideal pentru construcție P+1 sau mai mult, în funcție de certificatul de urbanism (care nu a fost încă emis). Acces facil la mijloace de transport în comun   stații de autobuz în apropiere, iar zona oferă un echilibru excelent între confort urban și liniște. ID anunț : 1750912841",02.08.2010,3,135411.203125,2010-02-08,5781.0,0,-25411.203125
145,Anunț,250000,EUR,5,150,https://www.publi24.ro/anunturi/imobiliare/de-vanzare/case/vila/anunt/valea-ursului-langa-padure-vila-lux-ecologica-150mp-utili-teren-550/ee83g8i99e2374dide0f49hed72f3g7h.html,images_case/anunt_145_img_0.webp|images_case/anunt_145_img_1.webp|images_case/anunt_145_img_2.webp|images_case/anunt_145_img_3.webp,4,,,,0,154103.515625,,,0,95896.484375
146,Anunț,220000,EUR,1,15,https://www.publi24.ro/anunturi/imobiliare/de-vanzare/case/case-vile/anunt/zona-verde-aproape/29h2217f3e13706heg65943d7399e00i.html,images_case/anunt_146_img_0.webp|images_case/anunt_146_img_1.webp|images_case/anunt_146_img_2.webp|images_case/anunt_146_img_3.webp,4,,"LOCALIZARE: Acest imobil este situat in zona Schei, in imediata apropiere a Pietei Unirii Brasov. COMPARTIMENTARE: Cu regim de inaltime P+E+M, vila este dispusa astfel: PARTER: -	o camera, aceasta dispune de acces din strada; -	un grup sanitar. ETAJUL: -	living, acesta dispune de suprafata generoasa, cu zona de luat masa incorporata; -	bucataria, care este inchisa, dispunand de zona depozitare alimente; -	doua grupuri sanitare, cu aerisire naturala; -	camara; -       doua dormitoare. MANSARDA: -	un dormitor, acesta dispune de chicineta si acces la podul amenajat in zona de relaxare; -	4 dormitoare, acestea dispunand de acces la cele doua terase de la acest etaj; -	baie, care cu aerisire naturala; DOTARI: - centrala termica; - incalzire calorifere; - tamplarie PVC, cu geam termopan; - terasa exterioara, de cca 15 mp; - canalizare. Tranzactionarea proprietatii se va face cu mobilierul aferent prezentei ofertari. IMPREJURIMI: Imobilul este situat intr-o zona de vile, accesul pietonal, pana zona de centru a orasului, facandu-se in cca.  10 minute. ATRACTII ZONA: Magazine, restaurante, parcuri, școli, spitale. ACCESIBILITATE: Transport public în apropiere | la aproximativ 20 m. FORMA ACHIZITIONARE: Se accepta plata prin accesare credit. Comision de intermediere 2%+TVA. NOTA: Informatiile prezentate reflecta situatia reala a proprietatii, fara a constitui o oferta contractuala. Aceste date au fost obtinute verbal, de la titularul de drept al imobilului. Structura acestei prezentari nu poate fi reprodusa, fara acordul scris al The Seller and Partners. ID anunț : 1750930627",01.11.2022,474,191482.3125,2022-01-11,1426.0,0,28517.6875
147,Anunț,240000,EUR,2,73,https://www.publi24.ro/anunturi/imobiliare/de-vanzare/case/case-vile/anunt/casa-moderna-constructie-2019-eficienta-energetica-clasa-a-4-dormitoare/h21h9fdg445e7823d41h196d26e47f85.html,images_case/anunt_147_img_0.webp|images_case/anunt_147_img_1.webp|images_case/anunt_147_img_2.webp|images_case/anunt_147_img_3.webp,4,,"Va prezentam o locuinta moderna si eficienta energetic, ideala pentru o familie care apreciaza calitatea constructiei, compartimentarea functionala si confortul termic pe tot parcursul anului. Casa a fost construita in anul 2019 pe cadre de beton armat, cu zidarie din caramida de beton celular autoclavizat (BCA) si finisaje premium. Detalii tehnice si structurale: Izolatie exterioara cu polistiren expandat de 15 cm (pereti) si 20 cm (acoperis); Elevatie (fundatie) hidro si termoizolata cu polistiren extrudat; Tamplarie PVC cu geam termopan Low-E si sistem de microventilatie; Izolatie sub pardoseala parterului: polistiren 10 cm; Incalzire in pardoseala pe ambele niveluri, alimentata de centrala pe gaz; 2 aparate de aer conditionat Daikin (parter + etaj); 2 rezervoare de apa + pompa pentru presiune constanta; Racordata la toate utilitatile: curent, apa, gaze, canalizare; Certificat energetic: Clasa A – consum redus si confort ridicat. Compartimentare si suprafete: Subsol: 7,73 mp – spatiu ideal pentru depozitare; Parter – 77,12 mp: 1 dormitor Living generos cu zona de dining Bucatarie inchisa Camera tehnica Grup sanitar Etaj – 78,49 mp: 3 dormitoare spatioase,cu balcon propriu Grup sanitar complet echipat Casa este luminoasa, bine compartimentata si construita cu accent pe durabilitate si eficienta energetica, fiind o alegere excelenta pentru cei care isi doresc un camin modern, complet utilat si gata de locuit. Pret: 240.000 euro + comisionul agentiei Pentru informatii suplimentare si programari vizionari: Ene Marian – 0740 949 871 Consilier vanzari – MAG Invest ID anunț : 1761047655",28.04.2018,91,172729.265625,2018-04-28,2780.0,0,67270.734375
148,Anunț,189990,EUR,6,140,https://www.publi24.ro/anunturi/imobiliare/de-vanzare/case/case-vile/anunt/comision-0-casa-individuala-6-camere-curte-comuna-zona-kiriac-id-v5183/73i05gdd587d79i91576f47d2de775e6.html,images_case/anunt_148_img_0.webp|images_case/anunt_148_img_1.webp|images_case/anunt_148_img_2.webp|images_case/anunt_148_img_3.webp,4,,"ID intern: V5183 Casa individuala, 6 camere, curte comuna, 140 mp, zona Kiriac FOXFORT Imobiliare propune spre de vanzare casa tip individuala, la curte comuna cu un regim de inaltime P+M, situata in zona Kiriac, avand un numar de 6 camere, cu o suprafata utila de 140 mp si teren 200 mp. Casa a fost construita in anul 1965 si renovata in anul 2018. Imobilul este situat in apropiere de Piata Iuliu Maniu, statii transport in comun, puncte de interes majore: OMV, Kaufland, Mega Image, la 5 minute cu masina de Shopping City si 8 minute de Centru Timisoara, iar pe jos la 3 minute de mijloacele de transport in comun. Compartimentarea este dispusa dupa cum urmeaza: - Parter: hol, living, baie, bucatarie, 2 camere. - Mansarda: hol, 3 dormitoare, baie, balcon, hol. - Pod depozitare. Casa se va preda complet utilata si mobilata. Casa dispune de 1 loc de parcare in curte si un garaj. Finisajele interioare sunt moderne: - Usa intrare: pvc; - Usi interioare: celulare; - Tamplarie ferestre: pvc, geamuri tripan. - Podele: parchet, gresie. Pretul de vanzare este de 189.990€ - COMISION 0%. Se accepta ca si modalitate de plata cash si credit ipotecar. Indicator performanta energetica: Clasa B Pentru a vedea toate ofertele valabile actualizate periodic, cu preturi reale si ultimele anunturi imobiliare adaugate intrati acum pe site-ul oficial FOXFORT Imobiliare: foxfort.ro Precizati intotdeauna ca ati vazut oferta cu ID: V5183 Sediu agentie: Strada Mureș, Nr.39 A, Timisoara, Timiș Mai multe detalii la telefon: 0374.069.727 / www.foxfort.ro / [email protected] ID anunț : 1682687588",11.10.2019,1416,169658.625,2019-11-10,2219.0,0,20331.375
149,Anunț,59950,EUR,6,300,https://www.publi24.ro/anunturi/imobiliare/de-vanzare/case/case-vile/anunt/vand-casa-mare-oferta-de-blak-friday/8h10644i15747e59dgfh83894hfdfi03.html,images_case/anunt_149_img_0.jpg|images_case/anunt_149_img_1.jpg|images_case/anunt_149_img_2.jpg|images_case/anunt_149_img_3.jpg,4,,"Proprietar vand casa in Aradul nou la un demisol  deosebit care este facut frumos ca pentru mine   are 300 mp utili la pret de apartament acum la super oferta Se poate locui acolo si se poate deschide ceva acolo sau se poate inchiria  o parte  ca este destul de mare   eu acum locuiesc acolo are toaleta cu wc si chiuveta curent si trifazic de 380V are mai multe camere Este termoteca pe gaz calorifere ferestre din termopan este izolat pe dinafara este o zona linistita este un bloc de biroruri si locuinte este o curte foarte mare ,cel mai bine veniti si vedeti cum este ma puteti suna cand doriti. Telefon zero sapte doi zero,doi noua noua trei trei cinci Acum la super oferta de Blak Friday Acum la pretul de 60.000 euro !!! ID anunț : 1732744501",22.08.2013,7,147146.875,2013-08-22,4490.0,0,-87196.875
150,Anunț,18000,EUR,6,110,https://www.publi24.ro/anunturi/imobiliare/de-vanzare/case/case-vile/anunt/casa-la-tara/ff97dg6ihe2d7025242ff9ei87143725.html,images_case/anunt_150_img_0.webp|images_case/anunt_150_img_1.jpg|images_case/anunt_150_img_2.jpg|images_case/anunt_150_img_3.webp,4,,"casa situata in comuna Uda Clocociov,  compusa din corpuri de clădire după cum urmează; corp 1 80 mp- 3 camere, hol corp 2 30 mp - bucatarie, baie, camera tehnica suprafață curte 850mp utilități: energie electrica, apa curenta, fosa septica ID anunț : 1730033174",29.10.2022,3,126960.5234375,2022-10-29,1135.0,0,-108960.5234375
151,Anunț,425000,EUR,6,278,https://www.publi24.ro/anunturi/imobiliare/de-vanzare/case/case-vile/anunt/schimb-casa-d-e-m-2006-marriott-sirenelor-sc-300-t-300-aut-extindere-libera/e194h5g87g8f70032f571ghh956ih99i.html,images_case/anunt_151_img_0.jpg|images_case/anunt_151_img_1.jpg|images_case/anunt_151_img_2.jpg|images_case/anunt_151_img_3.jpg,4,,"URGENT! Ocazie, pret redus de la 420000 Euro! PROPRIETAR! Eventual schimb cu apt. Bucuresti+ diferenta semnificativa din partea Dvs: Casa D+E+M, 2006, zona Marriott -Sirenelor, Sc=300 T= 278 MP in acte, 300 mp din masuratori D+P+E, aprox. Sc=aprox 100 MP nivel (sub 100 D si P, peste 100 E) Autorizatie de extindere la D+P+2E plus inca un bloc cu 12 garsoniere, tot D+P+2E. Liber, asigurata, taxe si impozite la zi. Toate facilitatile, libera, Pretabil locuit  sediu firma  Afacere: cabinete medicale, showroom, minimarket, minihotel.... Zona cu potential urias Detalii, foto, schite- pe email, Whatsapp Rog: sunati NUMAI dupa-amiaza seara! ID anunț : 1631442711",28.10.2019,7,192257.40625,2019-10-28,2232.0,0,232742.59375
152,Anunț,550000,EUR,6,100,https://www.publi24.ro/anunturi/imobiliare/de-vanzare/case/case-vile/anunt/casade-vanzare-zona-foarte-buna/d6d39272df89788414gg0522g8d6f6h1.html,,0,,"Vindem sau inchiriem casa pe 4 nivele(3 +mansarda)situata intr-o zona foarte buna aproape de centrul orasului (10 minute de mers pe jos) de spital(5 minute de mers pe jos)de malluri etc 3 nivele sunt cu intrare separata iar al patrulea se poate modifica pentru a avea intrare din exterior. Este o casa care se preteaza ca si locuinta spatii comerciale cabinete medicale birouri firma etc Casa se poate vinde sau inchiria toata sau pe nivele fiecare nivel avand aprox 100mp are parcare in fata amenajata pentru 2 masini cu posibilitate de extindere la 4 autoturisme. pentru orice alte informatii(vanzare ,inchiriere) va stam la dispozitie pe nr de mai jos sau pe whattsup. ID anunț : 1757504163",13.02.2023,3,21531.4921875,2023-02-13,1028.0,0,528468.5078125
153,Anunț,159900,EUR,4,385,https://www.publi24.ro/anunturi/imobiliare/de-vanzare/case/case-vile/anunt/casa-p-1-pod-4-camere-teren-385-mp-berceni/4h889g5301757fg5e25d46836h4i2518.html,images_case/anunt_153_img_0.webp|images_case/anunt_153_img_1.webp|images_case/anunt_153_img_2.webp|images_case/anunt_153_img_3.webp,4,,"Descoperiți casa visurilor dumneavoastră! Această proprietate spațioasă și primitoare este acum disponibilă pentru vânzare și oferă tot ce aveți nevoie pentru un trai confortabil. Detalii cheie: Tip: P+1+pod Suprafață teren: 385 mp Număr camere: 4 Bucătărie: Închisă, ideală pentru gătit și petrecut timp în familie Băi: 2, pentru confortul tuturor Balcon și terasă: Perfecte pentru relaxare și socializare Centrala proprie: Eficiență energetică și confort termic Finisaje de calitate: la alegere daca rezervarea se face in timp util! Această casă este ideală pentru familii sau pentru cei care doresc un cămin confortabil, cu acces rapid la toate facilitățile. Nu ratați ocazia de a vă muta imediat într-un loc unde veți crea amintiri de neuitat! Contactați-ne acum pentru mai multe detalii și pentru a programa o vizionare- 0785350590. Merită să o vedeți! Persoana fizica Comision 0% ID anunț : 1765050600",28.03.2024,344,183473.75,2024-03-28,619.0,0,-23573.75
154,Anunț,99500,EUR,2,88,https://www.publi24.ro/anunturi/imobiliare/de-vanzare/case/case-vile/anunt/casa-si-teren-1815-m/3d211f13753h716g12edfidd71d944h0.html,images_case/anunt_154_img_0.jpg|images_case/anunt_154_img_1.jpg|images_case/anunt_154_img_2.jpg|images_case/anunt_154_img_3.jpg,4,,"Vind casa 90 m și teren 1815m,parter și mansarda ,2 camere baie,bucătărie și un hol jos s-o 2 camere și o baie sus.Alei pietonale,put cu apa în curte cit cuprinde,încă o căsuța mica în curte,împrejmuit de jur împrejur,garaj la poarta ID anunț : 1701419233",16.03.2017,2,133714.171875,2017-03-16,3188.0,0,-34214.171875
155,Anunț,998700,EUR,4,126,https://www.publi24.ro/anunturi/imobiliare/de-vanzare/case/case-vile/anunt/film-3d-resedinta-notabila-in-pretiosul-areal-drumul-poienii-centru-istoric-medieval-brasov/7gd5e68h71g878202267635209gihdh7.html,images_case/anunt_155_img_0.jpg|images_case/anunt_155_img_1.jpg|images_case/anunt_155_img_2.jpg|images_case/anunt_155_img_3.jpg,4,,"660 EUR/m 2 |
                                    
                                210 m 2",,0,193293.34375,,,0,805406.65625
156,Anunț,55000,EUR,5,80,https://www.publi24.ro/anunturi/imobiliare/de-vanzare/case/case-vile/anunt/vanzare-casa-curte-sat-padureni-com-jaristea-focsani/8ge113gi4i287d93d2d1e934d399534d.html,images_case/anunt_156_img_0.jpg|images_case/anunt_156_img_1.jpg|images_case/anunt_156_img_2.jpg|images_case/anunt_156_img_3.jpg,4,,,11.04.2021,1,151894.6875,2021-11-04,1494.0,0,-96894.6875
157,Anunț,215000,EUR,5,180,https://www.publi24.ro/anunturi/imobiliare/de-vanzare/case/case-vile/anunt/vila-zona-lunca-cetatuii/224g68d5fhd67fd9d1gegeei161075hg.html,images_case/anunt_157_img_0.webp|images_case/anunt_157_img_1.webp|images_case/anunt_157_img_2.webp|images_case/anunt_157_img_3.webp,4,,"Vila de vânzare..zona Lunca Cetatuii ,cartier Astoria, compusa din: Parter: 1 camera, bucatarie, living spatios, baie, hol și terasa, Etaj: camera matrimoniala cu dressing si baie proprie + 2 camere hol și baie. Casa are 180 mp utili + 2 terase Incălzire în pardoseala pe ambele etaje Teren 500 mp Dispune de o stradă privată betonata cu poarta automatizata. Usi și ferestre veka 3 sticle. Aer conditionat. Utilitati: curent, gaz,apa, fosa septica și fântână, este împrejmuita cu gard din bolțari partea din fata, si spate sipca metalica Casa este construita în regie proprie din cărămidă tencuita manual interior exterior și placata cu polistiren 10cm Eps 80 austroterm. Livingul Dispune de un șemineu cu focar. Casa se vinde mobilata parțial. ID anunț : 1747763157",01.07.2017,2,139716.78125,2017-01-07,3256.0,0,75283.21875
158,Anunț,14000,EUR,2,12,https://www.publi24.ro/anunturi/imobiliare/de-vanzare/case/case-vile/anunt/casa-si-teren-de-vanzare/526281g9e8d379552hif13geg575i30e.html,,0,,,15.05.2025,1,21531.087890625,2025-05-15,206.0,0,-7531.087890625
159,Anunț,105000,EUR,4,93,https://www.publi24.ro/anunturi/imobiliare/de-vanzare/case/case-vile/anunt/apartament-ultracentral-piata-catedralei/5638066721ge7246d199hf82hhii849i.html,images_case/anunt_159_img_0.jpg|images_case/anunt_159_img_1.jpg|images_case/anunt_159_img_2.webp|images_case/anunt_159_img_3.jpg,4,,"Se ofera spre vanzare apartament in Str. Ghe. Baritiu colt   cu str. Metianu alcatuit din 4 camere, bucatarie  stil american, baie, cámara, WC serviciu  cu o suprafata de 201 metri. Apartamentul mai are in dotari  o terasa si un balcón exterior in Str. BARITIU, 2 pivnite de 40 metri dispunand de trifazic si geam exterior si o suprafata din curtea comunitara  de 50 metri. Ideal atat pt. firme cat si particular. ID anunț : 1741607145",18.06.2021,1,126463.4921875,2021-06-18,1633.0,0,-21463.4921875
160,Anunț,199000,EUR,6,785,https://www.publi24.ro/anunturi/imobiliare/de-vanzare/case/case-vile/anunt/casa-de-vanzare-cu-garaj-si-anexa-teren-785-mp-gageni-comision-0/39f7d4f61905712f1f8ggi6448045874.html,images_case/anunt_160_img_0.webp|images_case/anunt_160_img_1.webp|images_case/anunt_160_img_2.webp|images_case/anunt_160_img_3.webp,4,,,,0,141786.625,,,0,57213.375
161,Anunț,239000,EUR,5,460,https://www.publi24.ro/anunturi/imobiliare/de-vanzare/case/case-vile/anunt/proprietar-vand-casa-cu-5-camere-in-sibiu/8d4fi3d80i5g7fdf28h7g578377i243f.html,images_case/anunt_161_img_0.webp|images_case/anunt_161_img_1.webp|images_case/anunt_161_img_2.webp|images_case/anunt_161_img_3.webp,4,,"CASĂ DE VÂNZARE   5 camere, mobilată, 460 mp teren   zona Turnișor, Sibiu Preț: 239.000 EURO   negociabil Acceptăm și credit ipotecar! Vă propunem spre vânzare o casă singur în curte, mobilată și utilată complet, cu 5 camere, pivniță, garaj, anexe și un teren generos de 460 mp (inclusiv amprenta casei), situată într-o zonă liniștită din Turnișor   cu acces rapid către centrul orașului. DETALII TEHNICE: Suprafață totală: 150 mp Regim înălțime: S+P+E Construită în 2007, din cărămidă, izolată exterior Casa este intabulată, fără sarcini, disponibilă imediat COMPARTIMENTARE: Subsol: Pivniță spațioasă Parter (renovat recent): Living open space cu bucătărie Cămară Baie cu geam de aerisire Hol + debara Cameră de zi Etaj: 3 dormitoare luminoase Baie cu geam de aerisire Hol + balcon cu acces din hol DOTĂRI ȘI AVANTAJE: Centrala termică proprie cu calorifere Parchet, geamuri termopan, pereți groși Grădină frumos amenajată cu pomi fructiferi, straturi, seră Grătar, garaj, magazie pentru depozitare Loc de parcare în curte Camere spațioase și înalte, foarte luminoase ID anunț : 1744061744",09.02.2019,3,187061.28125,2019-09-02,2288.0,0,51938.71875
162,Anunț,165000,EUR,5,1000,https://www.publi24.ro/anunturi/imobiliare/de-vanzare/case/case-vile/anunt/casa-p-1-comuna-balotesti-ilfov/107f91653g0779d2116e8i6f8d621h74.html,images_case/anunt_162_img_0.webp|images_case/anunt_162_img_1.webp|images_case/anunt_162_img_2.webp|images_case/anunt_162_img_3.webp,4,,"Casă cu potențial, poziționată excelent   aproape de București și în inima naturii. Casa este situata pe una dintre străzile principale ale comunei Balotești. Vă oferim spre vânzare o proprietate cu potențial de la marginea orașului, fără a renunța la accesul rapid către București și principalele puncte de interes din nordul capitalei. Caracteristici generale: Suprafață teren: 1000 mp (conform acte)   965 mp (măsurată) Casă P+1, construită în 1980 cu recepția casei in 1998 (etaj edificat în 2000) Compartimentare: Parter   cu două intrări separate. Prima zonă: hol, baie, bucătărie, 2 dormitoare A doua zonă: hol, bucătărie, dormitor, baie, cămară Etaj: Hol, baie, bucătărie cu living open-space, dormitor Utilități: Apă curentă, gaz, canalizare Fântână proprie Stare imobil: Casa este locuibilă, însă necesită renovare și modernizare. Localizare excelentă: 3 minute de Spitalul SRI Agrippa Ionescu și Edenland Park 10 minute de DN1 Value Center și Therme București 20 minute de Cartierul Băneasa, București Zona este liniștită, cu vecini civilizați și multiple facilități în apropiere   ideală pentru cei care vor să trăiască aproape de oraș, dar departe de agitația acestuia. Documentație completă, acte în regulă. Dacă sunteți în căutarea unei case într-o zonă cu acces rapid către nordul Bucureștiului și cu un teren generos, această proprietate este o oportunitate excelentă! Langa casa este un alt teren de vanzare cu o casa demolabila, daca se doreste o deschidere mai mare ID anunț : 1751183875",13.05.2015,1,150369.765625,2015-05-13,3861.0,0,14630.234375
163,Anunț,215000,EUR,5,122,https://www.publi24.ro/anunturi/imobiliare/de-vanzare/case/case-vile/anunt/vand-casa-moderna-122mp-zona-premium-complex-lidl-mosnita-noua/225653h68h6471df14930hf1002d1gii.html,images_case/anunt_163_img_0.webp|images_case/anunt_163_img_1.webp|images_case/anunt_163_img_2.webp|images_case/anunt_163_img_3.webp,4,,"Casă modernă 122 mp   toate utilitățile   panouri fotovoltaice   zonă excelentă, la 300 m de Lidl Vând casă modernă, 122 mp utili, partial utilată și eficientă energetic. Amplasată într-o zonă foarte bună, liniștită, la doar 300 m de Lidl. Parter: hol, spațiu tehnic, baie, birou, living + bucătărie open-space, debara, terasă acoperită Etaj: 3 camere + 2 băi Pod utilizabil pentru depozitare Dotări premium: Panouri fotovoltaice Încălzire automatizată   control prin WiFi Aer condiționat Curte amenajată cu aspersoare Toate utilitățile (gaz, curent, apă, canalizare) Casă completă, eficientă, perfectă pentru familie și pentru cei care apreciază confortul și tehnologia modernă. Contact pentru detalii și vizionare. Pret 215.000 negociabil ID anunț : 1765049396",27.08.2009,1,274366.53125,2009-08-27,5946.0,0,-59366.53125
164,Anunț,85000,EUR,5,144,https://www.publi24.ro/anunturi/imobiliare/de-vanzare/case/case-vile/anunt/discount-casa-renovata-in-tuzla-jud-constanta/1gh443gdh46578g3eggf80g5g138gd1h.html,,0,,"Pret redus la casa renovată de curand, izolata ,acoperiș nou metalic, gresie , faianța, parchet, pereții îmbrăcați in lambriu , încălzire pe calorifere conectate la centrală termică pe peleți . Aer condiționat și Satelit funcționabile . Casa este călduroasă iarna și răcoroasă vara și este in conformitate cu ultimile cerințe UE privind casele ECO. Se vinde cu mobila noua de la Mobexpert. Este intr-o zona liniștita și are acces la gara și la microbuz .Casa are 144mp teren și 92 mp. utili . Și conține 5 camere , baie+ baie serviciu , veranda , magazie .Zona linistita cu aer ionizat, la 10 minutt pe jos de plaja Tuzla. Preț 85000  .. ID anunț : 1736368870",08.01.2025,2,21531.5546875,2025-08-01,128.0,1,63468.4453125
165,Anunț,85799,EUR,2,65,https://www.publi24.ro/anunturi/imobiliare/de-vanzare/case/casa-de-vacanta/anunt/skala-potamia-thassos-studio-cabana-lemn-cu-terasa-cu-bai-proprii-curte-700m-pana-la-plaja/3e400f16eg197ie914dee210946692f3.html,images_case/anunt_165_img_0.jpg|images_case/anunt_165_img_1.jpg|images_case/anunt_165_img_2.jpg|images_case/anunt_165_img_3.jpg,4,,"garsonieră studio ,constructie din caramida,cu baie și bucătărie,terasa  și casa din lemn cu terasă, izolată exterior,, baie proprie ,ambele mobilate complet,A C,pomi fructiferi,maslini,curte superbă 500 mp care pot fi individualizati dintr-o curte mare de 2500 mp ,700 m până la plaja Golden Beach ID anunț : 1623701244",16.09.2017,3,152014.734375,2017-09-16,3004.0,0,-66215.734375
166,Anunț,192495,EUR,5,190,https://www.publi24.ro/anunturi/imobiliare/de-vanzare/case/casa-de-vacanta/anunt/skala-potamia-thassos-casa-piatra-studio-cabana-lemn-dependinte-2500mp-teren-700m-pana-la-mare/743e7i6g513g790id5h86g14h005ff14.html,images_case/anunt_166_img_0.jpg|images_case/anunt_166_img_1.jpg|images_case/anunt_166_img_2.jpg|images_case/anunt_166_img_3.jpg,4,,"Casa construita din piatră ,traditionala cu 2 camere,baie,bucătărie, A C,TV,balcon, terasă,mobilata complet+ Cabana de lemn cu baie proprie,mobilata complet,A C,TV,izolata exterior si 2- Studio garsoniere, construite din caramida,baie,bucatarie,terasa,A C,TV,Mobilatecomplet 2500mp curte superba,pomi fructiferi,maslini, kiwi, lotus 700 m până la plaja ID anunț : 1623701146",16.09.2017,3,168477.328125,2017-09-16,3004.0,0,24017.671875
167,Anunț,175000,EUR,5,350,https://www.publi24.ro/anunturi/imobiliare/de-vanzare/case/case-vile/anunt/casa-p-1-m-350-mp-teren-70-ari-livezile-la-9-km-de-bistr/5ef57gdii955759i24i37e9d19407884.html,images_case/anunt_167_img_0.webp|images_case/anunt_167_img_1.webp|images_case/anunt_167_img_2.webp|images_case/anunt_167_img_3.webp,4,,"Oferim spre vanzare casă P+1+M, 350 mp, 6 camere, 4 bai, 2 garaje, beci, etc,semifinisata, încălzire pardoseala, cu utilități, apa, curent trifazic, teren aferent imprejmuit 70 arii, pozitie deosebita, și retrasa, in localitatea Livezile. Pret inf. 175.000 euro ID anunț : 1762712839",13.02.2011,5,124720.3125,2011-02-13,5411.0,0,50279.6875
168,Anunț,129000,EUR,5,500,https://www.publi24.ro/anunturi/imobiliare/de-vanzare/case/case-vile/anunt/vand-schimb-casa-p-1-mangalia-str-emil-cioran-teren-500-mp-145-mp-supratata-utila/0940ggd0344071gfd2g333hh43954ef3.html,images_case/anunt_168_img_0.webp|images_case/anunt_168_img_1.webp|images_case/anunt_168_img_2.webp|images_case/anunt_168_img_3.webp,4,,,,0,145072.671875,,,0,-16072.671875
169,Anunț,150000,EUR,3,1068,https://www.publi24.ro/anunturi/imobiliare/de-vanzare/case/case-vile/anunt/casa-3-camere-si-teren-1068-mp-centru/014g769gg46976dd2gd2hh9dh848h7d6.html,images_case/anunt_169_img_0.webp|images_case/anunt_169_img_1.webp|images_case/anunt_169_img_2.webp|images_case/anunt_169_img_3.webp,4,,"Blitz va propune pentru vanzare un teren intravilan de 1068 mp, situat în centrul orașului, într-o zonă de excepție, ideală pentru rezidență sau investiții. Proprietatea dispune de o casă de 140 mp, bine amplasată pe teren, care poate fi renovată sau adaptată după nevoi. De asemenea, pe teren se regăsesc și anexe funcționale, ce pot servi diverselor activități gospodărești sau pot fi demolate pentru a maximiza potențialul spațiului. Zona este extrem de accesibilă, având în proximitate facilități precum magazine, școli, restaurante și alte puncte de interes. Datorită poziționării centrale, proprietatea beneficiază de o valoare crescută și de oportunități multiple, atât pentru locuire, cât și pentru dezvoltare imobiliară. Un teren generos și o locație premium, care oferă flexibilitate pentru diverse proiecte! Cod ofertă / ID BLITZ: P137646 ID anunț : 1734593201",07.05.2021,9948,171543.03125,2021-07-05,1616.0,0,-21543.03125
170,Anunț,61900,EUR,2,200,https://www.publi24.ro/anunturi/imobiliare/de-vanzare/case/case-vile/anunt/casa-vila-cu-2-camere-de-vanzare/e418769g5e3d765hed3e8g5225517668.html,images_case/anunt_170_img_0.webp|images_case/anunt_170_img_1.webp|images_case/anunt_170_img_2.webp|images_case/anunt_170_img_3.webp,4,,"Se vinde casă situată în localitatea Ocna Șugatag, într-o zonă liniștită și ușor accesibilă, aproape de Băile Vechi, ideală atât pentru locuință, cât și pentru o investiție în turism. Proprietatea are un teren cu suprafața de 1.200 mp, drept, potrivit pentru construcții. Casa este compusă din hol, două camere și o baie. În curte se află o anexă care necesită reabilitare. Dispune de utilități – curent electric, apă, fosă septică. Accesul se face direct din drum asfaltat, cu iluminat stradal. Casa necesită renovare, oferind posibilitatea de amenajare după preferințele cumpărătorului. Ocna Șugatag este o localitate turistică renumită din Maramureș, cunoscută pentru băile sărate, aerul curat și peisajele deosebite, aflată între Sighetu Marmației și Cavnic, într-o zonă cu potențial turistic ridicat. ID anunț : 1763429634",11.08.2022,99,156347.671875,2022-11-08,1125.0,0,-94447.671875
171,Anunț,195000,EUR,4,101,https://www.publi24.ro/anunturi/imobiliare/de-vanzare/case/case-vile/anunt/duplex-cu-4-camere-si-2-bai-complet-mobilat-si-utilat-in-giroc/8ge5h56981id70gg2i58ef8e1e72f4i9.html,images_case/anunt_171_img_0.webp|images_case/anunt_171_img_1.webp|images_case/anunt_171_img_2.webp|images_case/anunt_171_img_3.webp,4,,"APOSTU ESTATE va propune spre vanzare un duplex situat in Giroc. Locatia imobilului se potriveste perfect celor ce isi doresc sa se detaseze de agitatia orasului. In apropiere sunt magazine si supermarket-uri precum Lidl, Penny, Profi, Mega Image, scoala si gradinita la o distanta de 5 minute. Imobilul dispune de 101 mp utili, este amplasat pe un teren de 250 mp, se vinde complet mobilat si utilat, precum se observa in imagini si este compartimentat astfel: Parter: - hol acces. - living spatios. - bucatarie inchisa. - baie cu geam si dus. - terasa. Etaj: - hol acces - 3 dormitoare. - baie cu geam si cada. - acces in pod. Detalii tehnice: Regim de inaltime Parter + Etaj + Pod. - constructie realizata in anul 2025 din caramida Porotherm de 30 cm. - izolata cu polistiren de 10 cm EPS 85. - pereti despartitori complet din caramida tencuiti mecanizat finisati cu vopsea lavabila alba. - placa de beton peste parter. - acoperis de tigla. - geamuri termopan cu 3 sticle pentru izolare atat fonica cat si termica superioara foarte mari si luminoase dotate cu site si jaluzele. - mobilier de bucatarie de calitate superioara, realizat pe comanda. - usa acces de termopan cu geam de sticla securizata, usi interioare Porta Doors. - centrala proprie pe gaz sistem eficient de incalzire in pardoseala. - aparataje modulare Gewis. - aparat pentru aer conditionat. - terasa acoperita. Utilitati: curent, apa de la retea, canalizare, gaz, internet prin fibra optica, cablu Tv. Pentru mai multe detalii nu ezitati sa ne contactati! Acceptam orice fel de credit bancar. Oferim consultanta si solutii financiare prin colaboratorii nostri pentru a obtine cel mai avantajos credit Ipotecar sau Noua Casa. Va asteptam cu drag la o vizionare chiar astazi! CP2800250 ID anunț : 1762227199",14.05.2017,2783,178822.390625,2017-05-14,3129.0,0,16177.609375
172,Anunț,210000,EUR,4,120,https://www.publi24.ro/anunturi/imobiliare/de-vanzare/case/case-vile/anunt/proprietate-moderna-in-zona-parcului-poligon-cu-acces-facil-si-curte/2d16576654657576d1i3i9g36756f353.html,images_case/anunt_172_img_0.webp|images_case/anunt_172_img_1.webp|images_case/anunt_172_img_2.webp|images_case/anunt_172_img_3.webp,4,,"Koncept Imobiliare va ofera spre vanzare o casa tip duplex situata in Floresti, in zona Parcului Poligon, pozitionata intr-un ansamblu rezidential linistit, cu acces facil dintr-o strada asfaltata, prevazuta cu iluminat public. Proprietatea beneficiaza de orientare Est-Vest, ceea ce asigura lumina naturala pe tot parcursul zilei, iar amplasarea intr-o zona bine conectata la magazine si statii de autobuz contribuie la un stil de viata comod si functional. Casa dispune de 120 mp utili si un teren de 200 mp, fiind structurata pe doua niveluri. Parterul este compus din hol, living generos, bucatarie separata, camara, baie si terasa cu acces direct spre curte. La etaj se regasesc trei dormitoare luminoase, un hol, doua bai, dintre care una proprie pentru dormitorul matrimonial, precum si doua balcoane cu vizibilitate placuta spre imprejurimi. Imobilul este realizat din caramida, are termosistem si decorativa exterioara, iar tamplaria PVC cu geam termopan contribuie la un randament termic optim. Interiorul este semifinisat, cu pereti tencuiti si gletuiti, instalatii trase pe pozitii si sapa autonivelanta pregatita pentru montarea finisajelor dorite. Incalzirea este asigurata prin centrala proprie pe gaz cu calorifere. Curtea este amenajata cu pavaj, dispune de zona verde si un spatiu ideal pentru gradina sau zona de gratar, iar in fata proprietatii sunt disponibile doua locuri de parcare. Ansamblul de case este finalizat si cuprinde doar locuinte noi, ceea ce contribuie la o atmosfera placuta si bine organizata. Punctele forte ale proprietatii includ compartimentarea echilibrata, luminozitatea conferita de orientare, posibilitatea personalizarii interioarelor, accesul rapid la facilitati urbane si cadrul linistit al ansamblului. Aceste elemente transforma casa intr-o optiune potrivita pentru o familie care isi doreste confort, functionalitate si un mediu sigur pentru locuit. Proprietatea este libera si poate fi preluata imediat, reprezentand o oportunitate excelenta pentru cei care cauta un duplex modern in Floresti, zona Parcului Poligon, cu acces facil si curte proprie. Pentru informatii suplimentare, programarea unei vizionari sau pentru a afla oferta noastra completa va stam la dispozitie telefonic, prin e-mail sau la sediul agentiei noastre, pe str. Aviator Badescu, nr. 19, Cluj-Napoca. ID anunț : 1764057895",13.11.2018,591,176282.328125,2018-11-13,2581.0,0,33717.671875
173,Anunț,326000,EUR,3,175,https://www.publi24.ro/anunturi/imobiliare/de-vanzare/case/case-vile/anunt/sacalaz-casa-de-vanzare/367hih805f567i1de0903519105efd16.html,images_case/anunt_173_img_0.webp|images_case/anunt_173_img_1.webp|images_case/anunt_173_img_2.webp|images_case/anunt_173_img_3.webp,4,,"Săcălaz casă de vânzare De vânzare casă în Săcălaz, la circa 11 km de Timișoara. Casa are: Suprafață construită desfășurată: 175 mp Suprafață utilă: 145 mp Suprafață totală a terenului: 600 mp Poziția și curtea Casă pe colț, cu fronturi stradale de 30 si 20 de ml. Curtea este amenajată cu trotuar din material ce da impresia de piatră de munte în jurul casei, gazon, pomi și plante ornamentale. Loc acoperit pentru grătar cu vatră, fără ușă, perfect pentru mese și relaxare în aer liber. Acces pentru un autoturism prin poarta mare, iar în fața frontului stradal se mai pot parca cel puțin două autoturisme. Accesul în casă Intrare principală: prin față, direct în holul care delimitează zona de zi și zona de noapte. Intrare din spate: de pe terasa acoperită, cu acces direct în living bucătărie și de acolo spre holul decomandat. Interiorul cronologic și decomandat Zona de zi drept înainte la intrare: Living + bucătărie open space, spațiu generos și luminos, cu acces direct pe terasa acoperită și curte. Mobilat și utilat decent; centrala pe gaz și mașina de spălat sunt încorporate în mobilier și vizibile doar la cerere. Zona de noapte acces decomandat prin hol, pe stânga la intrare: Baia cu cabină de duș, sifon în pardoseală și paravan din sticlă. Camera de joacă a copilului, luminoasă și izolată de zona de zi. Primul dormitor, mobilat, cu televizor cu LED. A doua baie, cu vană, la capătul holului. Al doilea dormitor, la capătul holului, pe dreapta, izolat și cu intimitate maximă. Utilități Canalizare Apă curentă Gaz Încălzire prin pardoseală cu centrală pe gaz Curent trifazic Preț de vânzare 326.000 complet mobilată și utilată Tel. 0744863386. ID anunț : 1763839592",06.07.2006,80,139936.203125,2006-06-07,7123.0,0,186063.796875
174,Anunț,153500,EUR,4,145,https://www.publi24.ro/anunturi/imobiliare/de-vanzare/case/case-vile/anunt/casa-parter-145-mp-utili-zona-dedeman/06f9541914h37082118i70ig97701500.html,images_case/anunt_174_img_0.webp|images_case/anunt_174_img_1.webp|images_case/anunt_174_img_2.webp|images_case/anunt_174_img_3.webp,4,,"Oferim spre vanzare casă parter, 145 mp utili, nou construită, 3 dormitoare, 2 bai, hol, living, bucatarie, garaj, din cărămidă, izolata, utilități, curent trifazic, gaz, apa, canal, zona Dedeman. Preț inf. 153.500 euro, negociabil. ID anunț : 1762340390",13.02.2011,5,187546.15625,2011-02-13,5411.0,0,-34046.15625
175,Anunț,35000,EUR,3,31,https://www.publi24.ro/anunturi/imobiliare/de-vanzare/case/case-vile/anunt/vand-casa-locuibila/id3132626hd675f41964ig35gif2h2f6.html,images_case/anunt_175_img_0.jpg|images_case/anunt_175_img_1.jpg|images_case/anunt_175_img_2.jpg,3,,Vand casă locuibila in comuna Jupaneati.casa are si doua anexe  trei camere  un hol vie si pomi fructiferi suprafata construita la sol 63m patrati  suprafata totala 2350m patrati teren  relati la telefon    sau ID anunț : 1683296162,06.12.2016,3,62322.37890625,2016-06-12,3465.0,0,-27322.37890625
176,Anunț,130000,EUR,5,2197,https://www.publi24.ro/anunturi/imobiliare/de-vanzare/case/case-vile/anunt/casa-spatioasa-de-vanzare-in-hitias-judetul-timis-teren-2197-mp/i0196569dd6h7d522hffe173dg8g5d54.html,images_case/anunt_176_img_0.webp|images_case/anunt_176_img_1.webp|images_case/anunt_176_img_2.webp|images_case/anunt_176_img_3.webp,4,,"De vânzare casă solidă, construită în anul 2002, situată în localitatea Hitiaș, județul Timiș. Proprietatea oferă o suprafață la sol de 100 mp și un teren generos de 2197 mp, ideal pentru familie sau pentru cei care își doresc liniște și spațiu verde. Compartimentare: Parter: 2 camere, living, bucătărie, cămară, baie, cameră tehnică Mansardă: 3 camere și baie de serviciu Dotări: Centrală pe lemne Fosa septică Foraj propriu pentru apă, cu posibilitate de racordare la rețea Curent electric, cablu TV și internet Casa se vinde complet mobilată și utilată, fiind disponibilă imediat pentru locuit. Construcția este solidă, bine întreținută, și oferă potențial excelent pentru renovare sau modernizare ulterioară. Preț: 130.000 Contact: ID anunț : 1760806053",22.10.2014,1,151364.28125,2014-10-22,4064.0,0,-21364.28125
177,Anunț,45000,EUR,4,70,https://www.publi24.ro/anunturi/imobiliare/de-vanzare/case/case-vile/anunt/schimb-casa-la-5-km-de-satu-mare-cartier-nou-inainte-de-cionchesti-in-faza-de-construire-70mp/482i404h31127hf82e3227h2622fe7h0.html,,0,,"ofer la schimb casa de 70mp parter cu etaj tot 70mp si 250 mp teren construit doar parterul  living ,hol dormitor baie ,toaleta ,bucatarie si urmeaza la etaj 3 dormitoare ,hol ,baie .debara , este deja imprejmuit cu gard din boltari  si se  va finaliza si finisa la cerinta cumparatorului  de catre noi vanzatorul, sau la schimb cu apartament ,la parter sau etaj 1 sau 2 pret 45000 euro sau caut si garsoniera  detalii la telefon  astept ID anunț : 1761938898",09.11.2017,3,21531.330078125,2017-09-11,3009.0,0,23468.669921875
178,Anunț,55000,EUR,5,49,https://www.publi24.ro/anunturi/imobiliare/de-vanzare/case/case-vile/anunt/costructor-vand-case-in-satu-mare-martinesti-odoreu-cionchesti-viile-satu-mare-prteturi-mici/d0d94930197d74i9d2586di4g19417h8.html,,0,,,,0,21531.3125,,,0,33468.6875
179,Anunț,28500,EUR,3,3780,https://www.publi24.ro/anunturi/imobiliare/de-vanzare/case/case-vile/anunt/casa-si-teren-in-judetul-valcea-comuna-ladesti-sat-chiricesti/510d5e05827h7h7ie0654h6i448g20h1.html,images_case/anunt_179_img_0.jpg|images_case/anunt_179_img_1.jpg|images_case/anunt_179_img_2.jpg|images_case/anunt_179_img_3.webp,4,,"Vând proprietetate în suprafață de 3780 mp, compusă din: - casă din lemn cu hol, bucătărie, 3 camere mari și încă una mai ingustă, baie și beci; - o a doua casă (bucătărie) din lemn cu 2 camere, baie și cămară; - magazie din bârnă; - garaj; - pătul pe furci din fier; - boltă cu viță de vie; - pomi fructiferi, etc. Utilități: curent electric mono fazic și trifazic, apă curentă din rețea și fântână mare, lângă casă. Deschiderea la strada pricipală este de 35 m Proprietatea se află la stradă, la cca 700 m față la târgul săptamânal și la cca 1000 m față de centrul comunei. Sunt unic moștenitor. Acte pregătite pentru vânzare, proprietate întabulată. Se pretează foarte bine pentru dezvoltarea unei afaceri fiind foarte bine amplasată și pe un teren foarte generos cu multiple posibilități de extindere. ID anunț : 1704282440",03.01.2024,1,159315.28125,2024-03-01,646.0,0,-130815.28125
180,Anunț,70000,EUR,4,62,https://www.publi24.ro/anunturi/imobiliare/de-vanzare/case/case-vile/anunt/de-vanzare-casa-valea-lui-mihai-elado-haz-ermihalyfalvan/7gdh4e13f2707i9g1g1h2if14e563e90.html,images_case/anunt_180_img_0.webp|images_case/anunt_180_img_1.webp|images_case/anunt_180_img_2.webp|images_case/anunt_180_img_3.webp,4,,"HU - RO Eladó sarki ingatlan nagy telekkel Érmihályfalván   kiváló lakóháznak vagy üzlethelyiségnek Közvetlenül a tulajdonostól, 845 m -es tágas telken, sarki fekvésű ingatlan eladó Érmihályfalva egyik frekventált részén, közel a központhoz. Aszfaltos út, jó láthatóság, könnyű parkolás   ideális választás akár családi otthon, akár üzlethelyiség, iroda vagy vendéglátóhely számára. Főbb jellemzők: 2 külön bejáratú lakrész Tágas udvar   akár 3 autó számára Bevezetett közművek (víz, gáz, villany) Melléképületek (tárolásra, gazdálkodásra is alkalmas) Sarki fekvés, két utcafront Tehermentes tulajdon, gyors ügyintézés Kiváló elhelyezkedés: Buszmegálló az utca túloldalán Iskola, park, boltok pár perc sétára Központ 10 perc gyalog Az ingatlan szabadon alakítható az Ön elképzelései szerint   lehet belőle modern családi otthon vagy jól jövedelmező üzlet. Ár: 70 000 EUR   közvetlenül a tulajdonostól, közvetítői díj nélkül. De vânzare   proprietate pe colț cu teren mare în Valea lui Mihai   ideală pentru locuință sau spațiu comercial Direct de la proprietar   teren generos de 845 m , casă amplasată pe colț, într-o zonă frecventată din Valea lui Mihai, aproape de centru. Drum asfaltat, vizibilitate excelentă, parcare ușoară   alegerea perfectă atât pentru locuință familială, cât și pentru spațiu comercial, birou sau local. Caracteristici principale: 2 unități locative cu intrări separate Curte spațioasă   loc pentru 3 mașini Utilități introduse (apă, gaz, curent) Anexe (pentru depozitare sau creșterea animalelor) Poziționare pe colț, două fronturi stradale Proprietate liberă de sarcini, acte în regulă Locație excelentă: Stație de autobuz chiar peste drum Școală, parc și magazine la câteva minute de mers pe jos Centru   10 minute pe jos Proprietatea poate fi amenajată după nevoile și viziunea dumneavoastră   de la casă modernă până la afacere profitabilă. Preț: 70.000 EUR   direct de la proprietar, fără comision de intermediere. ID anunț : 1755196590",14.08.2025,1,199718.90625,2025-08-14,115.0,1,-129718.90625
181,Anunț,139000,EUR,3,8,https://www.publi24.ro/anunturi/imobiliare/de-vanzare/case/case-vile/anunt/proprietar-vand-casa-insiruita/fe23d9f033247eg62865d271h0if7052.html,images_case/anunt_181_img_0.webp|images_case/anunt_181_img_1.webp|images_case/anunt_181_img_2.webp|images_case/anunt_181_img_3.webp,4,,"Casa este situata pe limita teritoriala Timisoara-Giroc ( zona Braytim- Calea Urseni). Este a doua casa dintr-un sir de 5 . Suprafata utila este de 75,8 mp, cota de teren 194 969 din care 52 mp reprezinta teren inierbat cu terasa, doua locuri de parcare si acces. Ansamblul din care face parte este dotat cu sistem de supraveghere video pe calea de acces acesta fiind privat si securizat. Este compartimentata astfel: -la parter: living, baie, casa scari, bucatarie separata cu iesire pe terasa, terasa inchisa in termopan, curte. -la etaj casa se gasesc de 2 dormitoare , balcon, baie si casa scarii. Dispune de 2 locuri de parcare, incalzire in pardoseala cu posibilitatea reglarii temperaturii in fiecare camera, toate utilitatile, aer conditionat, etc. Face parte din complexul Premium Residence. Se poate vinde mobilata sau nemobilata. Casa a fost data in folosinta in 2024. Nu doresc sa colaborez cu agentii ID anunț : 1761895611",24.01.2011,1,138518.3125,2011-01-24,5431.0,0,481.6875
182,Anunț,191000,EUR,4,1790,https://www.publi24.ro/anunturi/imobiliare/de-vanzare/case/case-vile/anunt/casa-schimb-vanzare-baile-govora/f030fed85d2i73egd3f18e81d47hdf0h.html,images_case/anunt_182_img_0.jpg|images_case/anunt_182_img_1.jpg|images_case/anunt_182_img_2.jpg|images_case/anunt_182_img_3.jpg,4,,"Va ofer spre schimb cu Timisoara(inclusiv Cartier Sag, Giroc,) sau vanzare,casa cu etaj si teren aferent (1790 mp) amplasament in statiunea Baile Govora, jud Valcea, suprafata construita=209mp, suprafata utila=327mp (din care 95 mp terase). Componenta: 4 dormitoare, 2 living-uri, 4 bai, 1 Wc serviciu,1 bucatarie interiora, o bucatarie serviciu, o magazie, garaj,beci, incalzire gaze naturale cu centrala proprie, posibiltate mansardare. ID anunț : 1695718028",11.05.2022,3,163401.71875,2022-11-05,1128.0,0,27598.28125
183,Anunț,65000,EUR,2,18,https://www.publi24.ro/anunturi/imobiliare/de-vanzare/case/casa-de-vacanta/anunt/vand-teren-cu-anexa-budeasa-mica/91193i213h9f7454d35705dh20h95ii4.html,images_case/anunt_183_img_0.webp|images_case/anunt_183_img_1.webp|images_case/anunt_183_img_2.webp|images_case/anunt_183_img_3.webp,4,,"Vand teren 1030 m cu anexa si magazie in zona Budeasa Mica. Este situat langa rau si padure, zona deosebita, drum privat. Accept si schimburi cu casa in Pitesti, Budeasa, Bascov sau Stefanesti + - diferenta ID anunț : 1756147379",04.04.2023,1,153195.09375,2023-04-04,978.0,0,-88195.09375
184,Anunț,210000,EUR,6,187,https://www.publi24.ro/anunturi/imobiliare/de-vanzare/case/case-vile/anunt/vand-vila-snagov-p-1-cu-6-camere-2-bai-250-metri-utili-si-400-teren-la-210000-euro/6g8geh91f8i176681e25i1fgh9f66ed6.html,images_case/anunt_184_img_0.jpg|images_case/anunt_184_img_1.jpg|images_case/anunt_184_img_2.jpg|images_case/anunt_184_img_3.jpg,4,,vand vila snagov p+1 cu 6 camere 2 bai 250 metri utili si 400 teren la 210000 euro ID anunț : 1724961847,05.08.2012,53,105914.296875,2012-05-08,4961.0,0,104085.703125
185,Anunț,210000,EUR,6,400,https://www.publi24.ro/anunturi/imobiliare/de-vanzare/case/case-vile/anunt/vand-vila-metrou-pantelimon-400-metri-utili-teren-400-mp-metrou-pantelimon/7h21igh06ffh71f7ed729165ie9d92d3.html,images_case/anunt_185_img_0.jpg|images_case/anunt_185_img_1.jpg|images_case/anunt_185_img_2.jpg|images_case/anunt_185_img_3.jpg,4,,Vand Vila metrou pantelimon 400 metri utili teren 400 mp metrou pantelimon structura beton ID anunț : 1714414901,05.08.2012,53,111935.75,2012-05-08,4961.0,0,98064.25
186,Anunț,99000,EUR,3,88,https://www.publi24.ro/anunturi/imobiliare/de-vanzare/case/case-vile/anunt/vand-casa-3-camere-snagov-70-metri-teren-325-la-99000-euro/8f4gh43i42e377f41g5ed8id794h0520.html,images_case/anunt_186_img_0.webp|images_case/anunt_186_img_1.webp|images_case/anunt_186_img_2.webp|images_case/anunt_186_img_3.webp,4,,vand casa 3 camere snagov 70 metri teren 325 la 99000 euro centrala gaze caldura baie cada fonta apa canal ID anunț : 1755018004,05.08.2012,53,136904.875,2012-05-08,4961.0,0,-37904.875
187,Anunț,160000,EUR,4,145,https://www.publi24.ro/anunturi/imobiliare/de-vanzare/case/case-vile/anunt/casa-p-1-pod-145-mp-utilitati/6g37f4gih8e77ifh1701495d0ee509d1.html,images_case/anunt_187_img_0.webp|images_case/anunt_187_img_1.webp|images_case/anunt_187_img_2.webp|images_case/anunt_187_img_3.webp,4,,,,0,104161.3359375,,,0,55838.6640625
188,Anunț,459000,EUR,6,408,https://www.publi24.ro/anunturi/imobiliare/de-vanzare/case/case-vile/anunt/vila-uniri-rond-regina-maria-400-metri-cu-teren-200-metri/02g0g0gdfe18752eddif3724hf250h3e.html,images_case/anunt_188_img_0.webp|images_case/anunt_188_img_1.webp|images_case/anunt_188_img_2.webp|images_case/anunt_188_img_3.webp,4,,vila uniri rond regina maria 400 metri cu teren 200 metri ID anunț : 1715166568,05.08.2012,53,103629.265625,2012-05-08,4961.0,0,355370.734375
189,Anunț,19999,EUR,2,709,https://www.publi24.ro/anunturi/imobiliare/de-vanzare/case/case-vile/anunt/vand-casa-tip-container/2262gg97e0ii7e0626ff9heh03f6eieg.html,images_case/anunt_189_img_0.webp|images_case/anunt_189_img_1.webp|images_case/anunt_189_img_2.webp|images_case/anunt_189_img_3.webp,4,,"Casă tip container, poziționată excelent, direct la stradă principală   Strada Republicii nr. 43, vis-a-vis de Mega Image și Pepco, cu farmacie și toate magazinele necesare în imediata apropiere. Detalii proprietate: suprafață utilă: 8 m lungime x 3 m lățime compartimentată în 2 camere parțial mobilată baie cu duș și WC aer condiționat, frigider curent electric, apă, butelie bine izolată termic se află pe teren intravilan de 709 mp Este potrivită pentru locuit permanent, cuplu sau familie, dar ideală și pentru vacanțe ori weekenduri. Opțional: Există și posibilitatea achiziției unui teren agricol extravilan de 9.400 mp, ideal pentru inițierea unei mici afaceri agricole sau producție proprie. Terenul agricol se vinde separat. Pentru detalii, imagini și vizionare, mă puteți contacta telefonic la numărul de telefon   sau pe WhatsApp. Mulțumesc! ID anunț : 1765048536",14.09.2016,1,130589.953125,2016-09-14,3371.0,0,-110590.953125
190,Anunț,197000,EUR,4,200,https://www.publi24.ro/anunturi/imobiliare/de-vanzare/case/case-vile/anunt/casa-noua-in-livada-locul-perfect-pentru-familie/08713g41edff7ieh22hff6466gdf8i38.html,images_case/anunt_190_img_0.webp|images_case/anunt_190_img_1.webp|images_case/anunt_190_img_2.webp|images_case/anunt_190_img_3.webp,4,,"Vă propunem spre vânzare o casă modernă, spațioasă și luminoasă, situată într-o zonă liniștită din Livada, la doar 15 minute de centrul Aradului. Caracteristici principale: Regim de înălțime: Parter + Etaj Suprafață desfășurată: 200 mp Amprentă la sol: 111 mp Teren: 300 mp Parter: Living generos open-space cu bucătărie modernă Baie complet utilată Cameră ce poate fi folosită ca birou, dormitor de oaspeți sau spațiu multifuncțional Etaj: Dormitor matrimonial cu baie proprie și dressing 2 dormitoare spațioase Baie comună Cameră tehnică ✨ Casa este construită cu materiale de calitate, oferind confort și funcționalitate pentru o familie modernă. Localizare excelentă: acces rapid către Arad, într-o zonă liniștită, ideală pentru viața de familie. Pentru mai multe detalii și programarea unei vizionări sună acum : 0744 766 780 Maria Filip Consultant imobiliar Arealis ID anunț : 1758069142",14.04.2025,11,219025.21875,2025-04-14,237.0,0,-22025.21875
191,Anunț,100000,LEI,3,89,https://www.publi24.ro/anunturi/imobiliare/de-vanzare/case/case-vile/anunt/casa-de-vanzare/123615d6871i7727d0e5e0f2d221097g.html,images_case/anunt_191_img_0.jpg|images_case/anunt_191_img_1.jpg|images_case/anunt_191_img_2.jpg|images_case/anunt_191_img_3.jpg,4,,"Casa din cărămidă cu 3 camere și hol +anexe, teren 34 ari, cu 46 m deschidere stradal în comuna Oboga, sat Oboga de sus, județul Olt. Pentru mai multe detalii sunați la numărul de telefon   . Prețul se discută la telefon cu proprietarul. ID anunț : 1695489238",27.02.2021,2,208511.703125,2021-02-27,1744.0,0,-108511.703125
192,Anunț,40000,EUR,2,36,https://www.publi24.ro/anunturi/imobiliare/de-vanzare/case/case-vile/anunt/casa-la-tara/7h5h93hide647e292e4f752h43e45d88.html,images_case/anunt_192_img_0.jpg|images_case/anunt_192_img_1.jpg|images_case/anunt_192_img_2.jpg|images_case/anunt_192_img_3.jpg,4,,"Vand casa la tara. Dispune de bucatarie la parter si beci iar la etaj sunt 2 camere, hol, baie; plus dependinte: sura, grajd, teren. Casa se afla in satul Mihai Viteazu, com. Saschiz, jud. Mures. Sunati va rog ptr. detalii, nu mai trimiteți mesaje! ID anunț : 1537186674",20.10.2016,3,130728.9375,2016-10-20,3335.0,0,-90728.9375
193,Anunț,39000,EUR,3,840,https://www.publi24.ro/anunturi/imobiliare/de-vanzare/case/case-vile/anunt/teren-casa-secuia-vaslui/272e928062gd77f619e38f114h3ef89h.html,images_case/anunt_193_img_0.webp|images_case/anunt_193_img_1.webp|images_case/anunt_193_img_2.webp|images_case/anunt_193_img_3.webp,4,,"Se vinde un teren de 840mp situat in Secuia,com Muntenii de Jos la 10km de Vaslui cu o deschidere de 24.5 m la o strada asfaltata,pe teren se afla o casa locuibilă conectată la toate utilitățile :apă,canalizare,curent,gaz(este trasă teava și pt centrala ). Se acceptă schimb cu un apartament garsonieră cu diferenta din partea mea în funcție de valoarea imobilului.casa necesită renovare. ID anunț : 1762720932",04.09.2012,4,174399.25,2012-04-09,4990.0,0,-135399.25
194,Anunț,320000,EUR,4,597,https://www.publi24.ro/anunturi/imobiliare/de-vanzare/case/case-vile/anunt/casa-individuala-cristian/2de5h7gifi5276e720e7i714202i5ffi.html,images_case/anunt_194_img_0.webp|images_case/anunt_194_img_1.webp|images_case/anunt_194_img_2.webp|images_case/anunt_194_img_3.webp,4,,"STARTIMOB va propune spre achizitie o casa individuala moderna, construita in anul 2025, amplasata in Cristian pe strada Muresului, intr-o zona aerisita, cu privelisti spectaculoase spre munti. Proprietatea este dezvoltata pe un teren de 597 mp si dispune de o suprafata construita desfasurata de 173 mp, organizata eficient pe parter si etaj, oferind spatii echilibrate si bine luminate natural. La parter regasim un living generos cu acces direct spre terasa, bucatarie, grup sanitar, camera tehnica si un hol de intrare bine proportionat. Etajul este dedicat zonei de noapte si include trei dormitoare, doua bai moderne, un hol spatios si doua balcoane deschise. Inaltimea interioara de 2,7 metri contribuie la o senzatie de volum si confort superior, accentuata de ferestrele ample care aduc lumina naturala in toate incaperile. Imobilul este construit cu atentie la detalii si eficienta energetica: izolatie exterioara cu vata bazaltica de 10 cm, tamplarie PVC cu geam tripan pentru un confort termic si fonic optim, iar incalzirea se realizeaza printr-o centrala electrica moderna si sistem de incalzire in pardoseala, atat la parter, cat si la etaj. Finisajele sunt in tonuri neutre, pregatite pentru personalizare dupa preferintele viitorului proprietar. Curtea permite amenajarea unei gradini, a unui spatiu de relaxare in aer liber sau a unei zone de joaca pentru copii, iar accesul catre Brasov se face rapid, zona fiind bine conectata. Vederea panoramica spre munti aduce un plus semnificativ de valoare acestei proprietati, transformand-o intr-un camin ideal pentru cei care cauta echilibru intre natura si accesibilitate urbana. Proprietatea este libera la vanzare, detinem cheile proprietatii si se poate viziona oricand pe baza de programare telefonica . Se accepta si achizitie prin credit ipotecar, cu plata pretului in moneda Euro . Pret vanzare : 320.000 Euro . Detalii la nr. de telefon : 0767.500.400, persoana de contact -Marius Stoica . ID anunț : 1763604324",09.04.2014,62,139025.15625,2014-09-04,4112.0,0,180974.84375
195,Anunț,249000,EUR,5,771,https://www.publi24.ro/anunturi/imobiliare/de-vanzare/case/case-vile/anunt/casa-individuala-teren-generos-771-mp-zona-bogdanestilor/i8h6ede3ddii7g1hd5f5i858e863d53d.html,images_case/anunt_195_img_0.webp|images_case/anunt_195_img_1.webp|images_case/anunt_195_img_2.webp|images_case/anunt_195_img_3.webp,4,,"Apostu Estate va ofera spre vanzare o casa spatioasa cu 5 camere, construita pe un teren de 771 mp, dintre care 331 mp gradina si restul teren intravilan. Front stradal de 17 metri. Proprietatea este situata in zona Bogdanestilor. Zona linistita de case. Potential excelent pentru renovare si personalizare dupa preferintele viitorului proprietar. Casa dispune de centrala proprie, geamuri termopan si de lemn, parchet laminat si de lemn si usi interioare de lemn. Casa este construita in anul 1970. Dispune de 3 camere, 1 baie, 1 debara si un antreu. Inaltim de aproximativ 3 metri, ceea ce ofera spatii luminoase si aerisite. In 1980, s au mai adaugat constructiei, urmatoarele: bucatarie spatioasa de aprox 20 mp, 2 dormitoare si 2 holuri. Așadar, avem un total de 5 camere, 1 baie si 1 bucatarie. Constructiei realizata integral din caramida. Acoperis din tigla pe casa veche si tabla pe partea construita ulterior. Acces in pod din debara. In partea veche a casei exista camara pentru alimente cu acces in pod, constructie pe scandura si acoperis din tigla. O intrare principala si o alta secundara, prin spatele casei. Parcare acoperita si constructie deasupra sa, pentru un plus de depozitare. De asemenea, in spatele gradinii exista mai multe anexe pentru lemne si unelte. Gradina frumos amenajata si bine intretinuta. Curte betonata. Incalzirea se realizeaza prin intermediul centralei proprii pe gaz, prin calorifere. Instalatie pe cupru. Exista insa si 3 teracote functionale. Aceasta proprietate ofera un potential deosebit pentru amenajare, fiind potrivita atat ca locuinta pentru familie, cat si ca investitie. Terenul generos permite extinderi, constructii auxiliare sau amenajarea unei gradini de relaxare. Oferim consultanta bancara gratuita prin intermediul colaboratorilor nostri. ID anunț : 1757679356",14.05.2017,2783,200748.53125,2017-05-14,3129.0,0,48251.46875
196,Anunț,300000,EUR,4,100,https://www.publi24.ro/anunturi/imobiliare/de-vanzare/case/case-vile/anunt/casa-stil-mediteranean-4-camere-100-mp-2300-mp-teren-zona-tudor/9eiiede2i84i75d023e64244eg80gi6i.html,images_case/anunt_196_img_0.webp|images_case/anunt_196_img_1.webp|images_case/anunt_196_img_2.webp|images_case/anunt_196_img_3.webp,4,,"Blitz va prezinta o casă deosebită, situată într-o zonă liniștită din cartierul Tudor, cu acces facil către centre comerciale, școli și mijloace de transport în comun. Este o locuință ideală pentru o familie care își dorește liniștea unei zone verzi, dar și proximitatea facilităților urbane. Proprietatea beneficiază de un teren generos de 2300 mp, într-un cadru natural cu livadă matură, foișor pentru relaxare și două garaje (în total 48 mp), oferind multiple posibilități de amenajare și depozitare. Casa este construită pe un singur nivel și are o suprafață utilă de 100 mp, fiind compartimentată astfel: Living spațios și luminos 3 dormitoare Bucătărie 1 baie Cameră tehnică Pivniță Locuința este izolată cu polistiren, are geamuri termopan cu profil din lemn, ceea ce asigură eficiență energetică și un confort termic sporit în toate anotimpurile. Proprietatea oferă intimitate, mult spațiu verde, aer curat și este perfectă pentru o familie care caută un cămin complet, echilibrat între viața urbană și liniștea naturii. Vă așteptăm cu drag la vizionare! Cod ofertă / ID BLITZ: P143767 ID anunț : 1744612745",07.05.2021,9948,158168.796875,2021-07-05,1616.0,0,141831.203125
197,Anunț,130000,EUR,2,80,https://www.publi24.ro/anunturi/imobiliare/de-vanzare/case/case-vile/anunt/ssi5131-duplex-sacalaz-2-cam-80mpu/f744efg42i34782d17402h2hd3268944.html,images_case/anunt_197_img_0.jpg|images_case/anunt_197_img_1.jpg|images_case/anunt_197_img_2.jpg|images_case/anunt_197_img_3.jpg,4,,"Cod anunt SSI5131. Agentia Solutii Simple Imobiliare va supune atentiei o casa tip duplex plan pater in Sacalaz,  zona noua de case, cu un teren de 278 mp, amprenta la sol de 100mp, suprafata utila de 80mp, terasa de 19mp, acoperis tiglA, FS de 9m. loc de parcare in fata, fara acces auto la spatiul verde din spate,  avand urmatoarea configurare - coridor intrare cu acces catre pod (utilizabil ca spatiu depozitare sau loc de joaca copii) - 2 dormitoare - bucatarie open space cu living, ambele cu vedere si acces individual catre terasa si curtea interioara - baie cu vana - spatiu depozitare dresing - spatiu tehnic care poate fi amenajat ca un WCS vand utilitatile trase, dar si ca dresing, loc pt masina spalat - terasa acoperita 18mp Imobilul este nou construit, frumos amenajat si finisat, incalzirea acestuia se face prin pardoseala cu ajutorul centralei termice pe gaz, iar ca utilitati avem retea curent si gaz, foraj apa cu hidrofor si fosa septica ecologica din fibra. Pretul de vanzare este de 130mii. COMISION 2%!!!! Inf la tel 0740 159025 ID anunț : 1708246370",11.10.2011,26,137583.03125,2011-11-10,5141.0,0,-7583.03125
198,Anunț,98700,EUR,3,720,https://www.publi24.ro/anunturi/imobiliare/de-vanzare/case/case-vile/anunt/casa-si-teren-in-arad-cartier-gradiste/e5h06475i24g71e71d34h7ehd06g2173.html,images_case/anunt_198_img_0.webp|images_case/anunt_198_img_1.webp|images_case/anunt_198_img_2.webp|images_case/anunt_198_img_3.webp,4,,"Locație excelentă – Situată în cartierul Grădiște,  într-o zonă liniștită și aerisită, cu acces rapid către punctele de interes ale orașului Arad. Proprietatea: Suprafață totală teren: 720 mp Front stradal : 12 ml Casă cu teren generos, ideală pentru renovare sau construcție nouă. Construcție existentă: Casă cu 3 camere, bucătărie, hol, baie, cămară, necesită renovare completă sau demolare. Curte lungă, cu grădină și anexe Utilități disponibile: Apă, curent și canalizare – deja racordate Gazul este la stradă – racordarea în casă poate fi realizată cu ușurință Terenul are un format ideal, drept și adânc, fiind potrivit atât pentru o locuință individuală, cât și pentru un mic proiect rezidențial. ️ Stradă asfaltată, cu vecini liniștiți și acces facil către mijloace de transport, magazine, școli, grădinițe și alte facilități urbane. Pentru mai multe informații și programări vizionări, nu ezitați să mă contactați: Maria Filip 0744 766 780 - Consultant Imobiliar Arealis Arad. ID anunț : 1752687966",14.04.2025,11,165157.65625,2025-04-14,237.0,0,-66457.65625
199,Anunț,103000,EUR,3,92,https://www.publi24.ro/anunturi/imobiliare/de-vanzare/case/case-vile/anunt/proprietar-vand-casa-3-camere-130-metri-2025-caramida-dubla/013he13g645g7063di2eh52d40h30722.html,images_case/anunt_199_img_0.webp|images_case/anunt_199_img_1.webp|images_case/anunt_199_img_2.webp|images_case/anunt_199_img_3.webp,4,,"Direct proprietar cu acte in regula. Vind locuinta familiala la curte, construita cu simt de răspundere, in regim personal, compusa din 3 camere, baie si bucatarie, 130 metri pătrați locuibili, gradina față - spate. Renovată complet anul acesta 2025, dovedesc cu facturi și garanții !! Toți Pereții sunt din cărămidă dublă! TEMELIE NOUĂ! Acoperis complet schimbat, tâmplărie, vata de sticla, folie  și țiglă metalica de calitate, groasa de 0,5, (cu garanție 25 ani) -instalatie de curent și de apă NOI!! -Gresie și faianță noi -Calorifere noi -Termopane noi -Temelie nouă + șapa noua in fiecare cameră -Toate ușile noi -Parchet nou -Dus + chiuveta noi -Izolatie dubla de 10 cm noua -Decorativa calitate cu silicon în compoziție -Revizie gaz -Tras apă și curent de câteva luni -Gard nou, poarta noua Bucătăria este cu terasa ce da direct in gradina. In afara de pereții dubli de cărămidă, totul este NOU! Zona Tache pe strada liniștită. La 200 metri se afla grădinița, școala și magazine. Preț în  EURO Mai multe detalii la telefon: ID anunț : 1763797024",09.09.2023,1,162931.3125,2023-09-09,820.0,0,-59931.3125
200,Anunț,130000,EUR,4,400,https://www.publi24.ro/anunturi/imobiliare/de-vanzare/case/case-vile/anunt/de-vanzare-casa-la-curte/iheifd49440278961088fg0608e10582.html,images_case/anunt_200_img_0.jpg|images_case/anunt_200_img_1.jpg|images_case/anunt_200_img_2.jpg|images_case/anunt_200_img_3.jpg,4,,,,0,149970.65625,,,0,-19970.65625
201,Anunț,191000,EUR,3,93,https://www.publi24.ro/anunturi/imobiliare/de-vanzare/case/case-vile/anunt/vand-casa-frumusani-liziera-de-lac/6g86i4784389711127g8h071ed5ig503.html,images_case/anunt_201_img_0.webp|images_case/anunt_201_img_1.webp|images_case/anunt_201_img_2.webp|images_case/anunt_201_img_3.webp,4,,"PERSOANA FIZICĂ vând casa cu etaj în ansamblul LIZIERA DE LAC comuna Frumusani, acces rapid din A2 - 93 mp utili -trei camere -bucătărie mobilată și utilată totul nou -aer condiționat DAIKIN nou - marchiza noua din termopan, construita la întrarea principala in casa. -teren 225 mp inclus două parcări Casa a fost achiziționată în 2023 și nu a fost locuită . Complexul dispune de mai multe facilități: piscină , terenuri sport, comunity hub, grădiniță, etc. Pentru detalii suplimentare rog telefon . Prețul dezvoltatorului pentru casele din faza 2 este peste 200000  iar casele vor fi gata in 2028. ROG CONTACTAȚI-MĂ PE WAPP. ID anunț : 1747913131",16.10.2011,2,177114.703125,2011-10-16,5166.0,0,13885.296875
202,Anunț,169000,EUR,6,334,https://www.publi24.ro/anunturi/imobiliare/de-vanzare/case/case-vile/anunt/vila-p-1-su-334-mp-t-4057-mp-d-21-m-com-ganeasa-izvoru/47e140f4912i70g2dd36d1i380gd9362.html,images_case/anunt_202_img_0.webp|images_case/anunt_202_img_1.webp|images_case/anunt_202_img_2.webp|images_case/anunt_202_img_3.webp,4,,"IMOBILUL propus spre vanzare se compune din doua cladiri separate, C1 si C2, edificate in anul 1994, amplasate pe un teren in suprafata totala de 4057 mp, cu o deschidere la strada principala, care este asfaltata, de 21 m si este situat la o distanta de cca 12 km fata de mun. Slatina, in com. Ganeasa -Izvoru. Terenul este imprejmuit cu gard pe fundatii si stalpi din beton si plase metalice la strada principala si pe laturile laterale din uluca lemn si plase sarma. Ambele cladiri sunt construite pe fundatii de beton si zidarie de BCA, acoperite cu tigla, iar cladirea C1 este izolata cu polistiren de 10 cm. pe exterior. Cladirea C1 - Casa de locuit P+E, cu Sc = 167 mp. si suprafata utila de 239 mp, are tamplaria exterioara din PVC stejar auriu, si este compartimentata astfel: LA PARTER: living, 2 bucatarii, debara, camera centrala, 3 holuri, WC, casa scarii, magazie si beci. LA ETAJ: 4 dormitoare, 3 holuri, 1 baie, WC, 2 casa scarii, afumatoare si 4 balcoane. Cladirea C2 - Casa de locuit P+E, cu Sc = 120 mp.si suprafata utila de 95 mp, are tamplaria exterioara parte din PVC stejar auriu si parte din lemn si este compartimentata astfel: LA PARTER: garaj, casa scarii, sauna, baie, WC. LA ETAJ: salon de protocol, bucatarie, baie, hol, casa scarii si terasa. In ambele cladiri sunt montate 2 aparate de aer conditionat. Finisajele interioare nu sunt de data recenta, dar au fost de calitate superioara la momentul realizarii, multe dintre ele putand fi pastrate, inca. In curte, care este placata cu pavele pe o suprafata de cca 400 mp, este construita o piscina. Alimentarea cu apa se face din sursa proprie (fantana cu hidrofor), iar pentru apele reziduale este construita o fosa septica, dar in localitate exista si reteaua de alimentare cu apa. Imobilul este racordat la curent electric monofazic si trifazic. In cladiri sunt realizate instalatii de incalzire complete, cu calorifere, fiind necesara achizitia si montarea unei centrale termice, fie pe combustibil solid, fie pe curent electric. De asemenea, in zona bucatariei de vara exista o soba si un cuptor, ambele pe lemne. ID anunț : 1762325244",12.07.2018,24,130852.71875,2018-12-07,2557.0,0,38147.28125
203,Anunț,5000,EUR,5,400,https://www.publi24.ro/anunturi/imobiliare/de-vanzare/case/case-vile/anunt/casa-de-vanzare-comuna-salcia-teleorman/d1dh67700d6i712id6ddi582h9fhe14i.html,images_case/anunt_203_img_0.jpg|images_case/anunt_203_img_1.jpg|images_case/anunt_203_img_2.jpg|images_case/anunt_203_img_3.jpg,4,,"Casa de vanzare - Sat Tudor Vladimirescu, comuna Salcia, Teleorman ID anunț : 1757091792",31.10.2024,1,157315.765625,2024-10-31,402.0,0,-152315.765625
204,Anunț,45000,EUR,4,40,https://www.publi24.ro/anunturi/imobiliare/de-vanzare/case/vila/anunt/vila-de-vanzare-in-judetul-arges/e74i0h9417gi7393124f98e3d2752d00.html,images_case/anunt_204_img_0.jpg|images_case/anunt_204_img_1.jpg|images_case/anunt_204_img_2.jpg|images_case/anunt_204_img_3.jpg,4,,,,0,108117.265625,,,0,-63117.265625
205,Anunț,326000,EUR,3,175,https://www.publi24.ro/anunturi/imobiliare/de-vanzare/case/case-vile/anunt/sacalaz-casa-de-vanzare/0hff99312d6g749318fgf122f71248d7.html,images_case/anunt_205_img_0.webp|images_case/anunt_205_img_1.webp|images_case/anunt_205_img_2.webp|images_case/anunt_205_img_3.webp,4,,"Săcălaz casă de vânzare De vânzare casă în Săcălaz, la circa 11 km de Timișoara. Casa are: Suprafață construită desfășurată: 175 mp Suprafață utilă: 145 mp Suprafață totală a terenului: 600 mp Poziția și curtea Casă pe colț, cu fronturi stradale de 30 si 20 de ml. Curtea este amenajată cu trotuar din material ce da impresia de piatră de munte în jurul casei, gazon, pomi și plante ornamentale. Loc acoperit pentru grătar cu vatră, fără ușă, perfect pentru mese și relaxare în aer liber. Acces pentru un autoturism prin poarta mare, iar în fața frontului stradal se mai pot parca cel puțin două autoturisme. Accesul în casă Intrare principală: prin față, direct în holul care delimitează zona de zi și zona de noapte. Intrare din spate: de pe terasa acoperită, cu acces direct în living bucătărie și de acolo spre holul decomandat. Interiorul cronologic și decomandat Zona de zi drept înainte la intrare: Living + bucătărie open space, spațiu generos și luminos, cu acces direct pe terasa acoperită și curte. Mobilat și utilat decent; centrala pe gaz și mașina de spălat sunt încorporate în mobilier și vizibile doar la cerere. Zona de noapte acces decomandat prin hol, pe stânga la intrare: Baia cu cabină de duș, sifon în pardoseală și paravan din sticlă. Camera de joacă a copilului, luminoasă și izolată de zona de zi. Primul dormitor, mobilat, cu televizor cu LED. A doua baie, cu vană, la capătul holului. Al doilea dormitor, la capătul holului, pe dreapta, izolat și cu intimitate maximă. Utilități Canalizare Apă curentă Gaz Încălzire prin pardoseală cu centrală pe gaz Curent trifazic Preț de vânzare 326.000 complet mobilată și utilată Tel. 0744863386. ID anunț : 1763839023",06.07.2006,80,209936.390625,2006-06-07,7123.0,0,116063.609375
206,Anunț,225000,EUR,4,14,https://www.publi24.ro/anunturi/imobiliare/de-vanzare/case/case-vile/anunt/casa-otopeni-proprietar-23-august/hd3d984e07537gg62472fggg329fig03.html,images_case/anunt_206_img_0.jpg|images_case/anunt_206_img_1.jpg|images_case/anunt_206_img_2.jpg|images_case/anunt_206_img_3.jpg,4,,,20.04.2024,1,180285.59375,2024-04-20,596.0,0,44714.40625
207,Anunț,220000,EUR,3,436,https://www.publi24.ro/anunturi/imobiliare/de-vanzare/case/case-vile/anunt/casa-spatioasa-mobilata-utilata-perfect-pentru-familie-simian/083i73f5fedf7g1528f2gi0e772gh40f.html,images_case/anunt_207_img_0.jpg|images_case/anunt_207_img_1.jpg|images_case/anunt_207_img_2.jpg|images_case/anunt_207_img_3.jpg,4,,"Se vinde casa pe Calea Hinovei, la iesirea din Simian, intr-o zona linistita. Prorietatea este mobilata,utilata si amenajata , avand : UTILITĂȚI : Apa, Canalizare, Curent 380, GAZ,Asfalt,Iluminat Stradal, Fibra optică Internet-TV Suprafata Teren - 436 mp cu front stradal de 20 m An Constructie : 2020 Suprafata utila casa : 160 mp Suprafata amprenta:  159 mp ( casa 108 mp amprenta  + terasa 36 mp+ 15 mp Camera tehnica  ) Parter : 1 Dormitor cu dimensiunea de 4x4=16 mp 1 Bucatrie cu dimensiunea de 6x4=24 mp 1 Living cu dimensiunea de 8x4=32 mp 1 Baie cu dimensiunea de 4x2=8mp Etaj: 1 Dormitor cu dimensiunea de 4x5 =20 mp 1 Living cu dimensiunea de 4x8 =32 mp 1 Dormitor cu dimensiunea de 4x5=20 mp 1 Baie cu dimensiunea de 4x2=8 1 Terasa alaturata casei 12x3=36 mp 1 Camera tehnica + baie exterioară 5x3=15mp ID anunț : 1741021648",17.02.2025,1,137045.21875,2025-02-17,293.0,0,82954.78125
208,Anunț,179000,EUR,3,100,https://www.publi24.ro/anunturi/imobiliare/de-vanzare/case/case-vile/anunt/casa-pe-un-singur-nivel/9ef1g9224f977gfh229fg0hh844410g9.html,images_case/anunt_208_img_0.webp|images_case/anunt_208_img_1.webp|images_case/anunt_208_img_2.webp|images_case/anunt_208_img_3.webp,4,,"Vand casa renovata si izolata in 2023 . Casa dispune de 3 camere , 2 bucatarii ,camara, 2 bai ...dotat cu aer conditionat, usi si geamuri termopan .Pe jos are parchet,gresie ,faianta. Incalzire cu centrala termica si un semineu pe colt daca e nevoie. Casa construita are 100m2 cu terenul total de 1000 m2...se vinde cu mobila de bucatarie inclusa . Daca se doreste,poate sa ramana si mobilierul din camere. Se situeaza intr-o zona linistita la marginea orasului Tg.Mures , pe str.Remetea. In curte este construit un atelier izolat si mai multe anexe. Proiect  instalatie de gaz facut in 2019 . Instalatia electrica schimbata in 2019 Deschiderea portii este mare pt.acces auto de mare tonaj daca e nevoie. In oartea de gradina se mai poate construi o casa sau orice altceva. In curte mai avem si o fantana cu apa din abundenta . .Intre timp am modificat in partea din spate, si am adaugat o baie in plus care o puteți vedea și în ultimele fotografii si o bucatarie mica . Astfel va fi pretabil chiar si pentru 2 familii cu intrare separata din curte. Merita vazut. Zona este superba si aerul curat. In curte sunt mai multe anexe , un atelier izolat ,mai este spatiu suficient atat pt.loc de joaca cat si pentru bazin,filegorie sau orice altceva . Daca se doreste pot sa ofer mai multe fotografii pe wattsapp... ID anunț : 1752509368",03.07.2016,2,153491.546875,2016-03-07,3562.0,0,25508.453125
209,Anunț,270000,EUR,6,12,https://www.publi24.ro/anunturi/imobiliare/de-vanzare/case/case-vile/anunt/vila-pensiune-de-vanzare/9003e8f9i1ff7630eh158f001923fh9d.html,images_case/anunt_209_img_0.jpg|images_case/anunt_209_img_1.jpg|images_case/anunt_209_img_2.jpg|images_case/anunt_209_img_3.jpg,4,,"Vila de vanzare ( pereti din caramida porotherm , izolata cu polistiren si tencuiala decorativa siliconata )  cu o suprafata de circa 400m patrati avind parter   etaj   mansarda . La parter gasiti  2 dormitoare , o baie mare de 12 mp ( cu cada de baie-jacuzzi si bideu) si  un living -   bucatarie openspace . Accesul la etaj se face pe scara interioara si exterioara .La etaj gasim 4cam cu bai proprii, tv, frigider si aer  cond. Aceeasi configurare avem si la mansarda . Cea mai mica camera are 16 mp . Proprietaria mai dispune de o garsoniera cu cam  baie  bucatarie si balcon ( cu aer cond și șemineu ) . Terenul are 300m și amprenta casei 120m .Curte amenajată și terasa acoperită . Pensiunea se afla de 14ani in circuitul turistic cu clientela formată . Racordată la rețeaua de gaze , curent trifazic , apa   canalizare ,  panouri solare si sistem de supraveghere video. Distanta pina la plaja sau Lacul Techirghiol este de aproximativ 800   900 m ( 15 - 20 min de mers lejer ) Strazile au fost asfaltate de curand  ( nu cum se in poze ) . Imobilul se afla într-o zonă linistita, departe de zgomotul mașinilor si foarte aerisita, în fața casei existând două parcuri care nu vor fi desființate NICIODATĂ.  ( se poate face și un cămin de bătrâni  ; sau se poate împărți în 3 apartamente ) NUMAI VANZARE. ID anunț : 1669061084",26.01.2016,2,178978.21875,2016-01-26,3603.0,0,91021.78125
210,Anunț,270000,EUR,6,12,https://www.publi24.ro/anunturi/imobiliare/de-vanzare/case/case-vile/anunt/vila-pensiune-de-vanzare/648ide91eh8f76g5e8e32602905296de.html,images_case/anunt_210_img_0.jpg|images_case/anunt_210_img_1.jpg|images_case/anunt_210_img_2.jpg|images_case/anunt_210_img_3.webp,4,,"pensiune de vanzare , cu o suprafata de 400 m patrati , compusa astfel : la parter avem un living cu bucatarie ( openspace ) , o baie mare de 12 mp ( cu cada de baie cu jacuzzi și bideu ) si 2 dormitoare . La etajul I gasim 4 cam . cu bai fiecare , frigider , tv si aer conditionat , hol si loc de luat masa si un balcon . Aceeasi configuratie avem si la mansarda . Cea mai mica camera are 16 mp. Proprietatea mai are si o garsoniera de aproximativ 35   36 m patrati ( camera , bucatarie , baie si balcon ) cu aer conditionat si semineu . Casa are amprenta de 120 m patrati pe un teren de 300 m . Curtea este amenajata avind si o terasa . Proprietatea se afla in zona linistita , in partea de vest a orasului , in cartierul nou la aproximativ 800m de mare . Este racordata la utilitati ( apa   canalizare , curent trifazic , gaze cu centrala Ariston  )  are panouri solare ptr apa calda  si sistem de supraveghere video ..Se afla in circuitul turistic de 14 ani cu clientela formata .Distanta pina la plaja sau Lacul Techirghiol este de aproximativ 800   900 m ( 15 - 20 min de mers lejer ) Ptr alte informatii sunati ...poze la cerere . Strazile au fost asfaltate de curand ( nu cum se vede in poze ) . Imobilul se afla intr-o zona linistita departe de traficul cotidian si foarte aerisita avind in fata casei doua parcuri care nu vor fi desființate NICIODATĂ . ( se poate face și un cămin de bătrâni ;  sau se poate transforma în 3 apartamente) . NUMAI  VÂNZARE . ID anunț : 1667051143",26.01.2016,2,157273.765625,2016-01-26,3603.0,0,112726.234375
211,Anunț,104990,EUR,3,1577,https://www.publi24.ro/anunturi/imobiliare/de-vanzare/case/case-vile/anunt/casa-individuala-cu-3-camere-si-teren-de-1577-mp-bucovat-central/dfi687feefeg73461d89ei0635e0ie3e.html,images_case/anunt_211_img_0.webp|images_case/anunt_211_img_1.webp|images_case/anunt_211_img_2.webp|images_case/anunt_211_img_3.webp,4,,"Casa individuala cu 3 camere de vanzare in localitatea Bucovat - zona centrala. FOXFORT propune spre vanzare casa tip individuala, cu un regim de inaltime Parter, situata in Bucovat, avand un numar de 3 camere, cu o suprafata utila de 100 mp si teren 1577 mp. Anul constructiei este 1923, structura caramida cu vaiuga. Imobilul dispune de urmatoarele utilitati: curent electric, put, fosa septica si gaz. Casa dispune de soba teracota si 3 locuri de parcare. Compartimentarea este dispusa dupa cum urmeaza: - Parter: hol, living, baie, bucatarie, 2 dormitoare; - Pod depozitare; - Anexe exterioare. Finisajele interioare sunt clasice: - Usa intrare: lemn; - Usi interioare: lemn; - Tamplarie ferestre: lemn; - Podele: parchet. Pretul este de 104.990€ negociabil - COMISION 0%. Se accepta ca si modalitate de plata surse proprii sau credit bancar. ID intern: V8816 ID anunț : 1763468978",11.10.2019,1416,139427.75,2019-11-10,2219.0,0,-34437.75
212,Anunț,2500,EUR,6,4800,https://www.publi24.ro/anunturi/imobiliare/de-vanzare/case/case-vile/anunt/casa-de-vanzare/g03ff7i34095730i1199g3df3gi4ei48.html,images_case/anunt_212_img_0.webp|images_case/anunt_212_img_1.webp|images_case/anunt_212_img_2.webp|images_case/anunt_212_img_3.webp,4,,"Vând casă Vilă în Vadu Moldovei Suceava, 13 km de Fălticeni, la strada principala E85  ! ID anunț : 1746157907",25.11.2023,1,62592.73828125,2023-11-25,743.0,0,-60092.73828125
213,Anunț,126990,EUR,4,75,https://www.publi24.ro/anunturi/imobiliare/de-vanzare/case/case-vile/anunt/casa-tip-triplex-cu-4-camere-de-vanzare-in-sanandrei/6gg8879968017g28df2hggie1f547d51.html,images_case/anunt_213_img_0.webp|images_case/anunt_213_img_1.webp|images_case/anunt_213_img_2.webp|images_case/anunt_213_img_3.webp,4,,"ID intern: V1026 Casa / Vila cu 4 camere de vanzare in Sanandrei. FOXFORT Imobiliare propune spre vanzare casa tip triplex, cu un regim de inaltime Parter, situata in localitatea Sanandrei, avand un numar de 2 camere, cu o suprafata utila de 75 mp si  teren 200 mp. Casa a fost construita in anul 2020, structura acesteia fiind din beton si pereti din caramida. Imobilul este situat in apropiere de statii transport in comun. Compartimentarea este dispusa dupa cum urmeaza: - Parter: living, dormitor, baie, bucatarie, terasa; - Pod depozitare. Finisajele interioare sunt moderne: - Usa intrare: pvc; - Usi interioare: panel; - Tamplarie ferestre: pvc; - Podele: parchet, gresie. Casa dispune de 2 locuri de parcare. Se accepta ca si modalitate de plata creditul bancar. Pretul este de 126.990€ . Indicator performanta energetica: Clasa B Pentru a vedea toate ofertele valabile actualizate periodic, cu preturi reale si ultimele anunturi imobiliare adaugate intrati acum pe site-ul oficial FOXFORT Imobiliare: foxfort.ro Precizati intotdeauna ca ati vazut oferta cu ID: V1026 Sediu agentie: Strada Mures, Nr. 39A, Timisoara, Timis ID anunț : 1611139208",11.10.2019,1416,188531.03125,2019-11-10,2219.0,0,-61541.03125
214,Anunț,525000,EUR,6,216,https://www.publi24.ro/anunturi/imobiliare/de-vanzare/case/case-vile/anunt/vand-casa-cu-beci-demisol-in-giroc/f9eg1295def8784528e691ed36ff5d5h.html,images_case/anunt_214_img_0.jpg|images_case/anunt_214_img_1.jpg|images_case/anunt_214_img_2.jpg|images_case/anunt_214_img_3.jpg,4,,,,0,128205.6875,,,0,396794.3125
215,Anunț,129900,EUR,3,60,https://www.publi24.ro/anunturi/imobiliare/de-vanzare/case/case-vile/anunt/vand-jumatate-de-duplex-in-sanandrei/49i3h6f3i4hf7fdhe2642e36d41e4644.html,images_case/anunt_215_img_0.webp|images_case/anunt_215_img_1.webp|images_case/anunt_215_img_2.webp|images_case/anunt_215_img_3.webp,4,,"Nu colaborez cu agenții imobiliare. Vând duplex la cheie in Sanandrei, la 6 km de Timisoara, pe parter cu pod inalt (mansardabil 60 mp,se poate merge in picioare pe toata suprafata podului, fiind pregatit pentru amenajare, avand si loc pentru scara cat si loc pentru geamuri velux),compartimentat astfel: 2 dormitoare 1 living open space cu bucataria(cu posibilitate de inchidere) 1 bucatarie 2 bai 1 dresing 1 camera tehnica Terasa acoperita de 10 mp. Suprafata utila în casa este de 73 mp + 10 mp terasa acoperita (care se poate inchide) + 60 mp mansarda. Terenul pe care este construit duplexul are o suprafata totala de 673 mp - 336,5 mp pe jumate de duplex. In momentul de fata imobilul este semifinisat, clientul poate sa aleaga faianta gresia parchetul usile obiectele sanitare in baza unui buget stabilit si astfel isi poate amenaja imobilul cum doreste. Imobilul dispune de curent, gaz, apa, fosa septica, drum pietruit. Duplexul a fost construit cu materiale de calitate superioara,caramida Porotherm,avand incalzire in pardoseala,instalatie electrica Gewiss,prize si intrerupatoare Gewiss,geamuri tripan pe gri antracit,este izolat cu polistiren de 10 eps 80, peste parter a fost turnata placa de beton si dispune de 2 locuri de parcare. Este situat in zona noua de case a localitatii. Imobilul se preda la cheie cu toate utilitatile. Se accepta orice fel de credit,iar pretul afisat pentru imobil este la cheie. ID anunț : 1757352894",12.03.2009,3,156444.0625,2009-12-03,5848.0,0,-26544.0625
216,Anunț,199990,EUR,4,500,https://www.publi24.ro/anunturi/imobiliare/de-vanzare/case/case-vile/anunt/casa-4-camere-spatioase-cu-incalzire-in-pardosea-zona-linistita/1ei462di78627f38egi0978eff71gg43.html,images_case/anunt_216_img_0.webp|images_case/anunt_216_img_1.webp|images_case/anunt_216_img_2.webp|images_case/anunt_216_img_3.webp,4,,"Doresti sa te muti intr-o zona mai linistita si retrasa? TABOO Imobiliare iti propune aceasta casa individuala de vanzare cu 4 camere  si 500 mp de teren in Poplaca, la doar 10 km distanta de Sibiu. Aceasta casa de vanzare din Poplaca are regimul de inaltime Parter + 1 etaj + Pod si iti ofera numeroase spatii de depozitare, confort sporit, o liniste ""apasatoare"" si o priveliste impresionanta spre munti. Casa este compartimentata astfel: ~ Parter: hol spatios cu scara de acces la etaj, un living luminos de 30 mp, o baie, o bucatarie inchisa, foarte spatioasa si o camera tehnica terasa; ~ Etaj: hol, 3 dormitoare, 2 bai si un balcon; ~ Pod depozitare. Casa este in curs de constructie si se va preda in anul 2025; structura acesteia este din caramida si va fi prevazuta cu sistem de incalzire cu centrala proprie si incalzire in pardosea. Suprafata construita a casei este de 165 mp, suprafata utila 125 mp, iar terenul are o suprafata totala de 447 mp. Casa se vinde la stadiul de cheie in exterior , prevazuta cu gard, poarta de acces si teren indreptat si pregatit pentru gazon si cu alee de acces pavata. Casa are o curte libera 371 mp cu locuri de parcare, 1 garaj si suficient loc pentru zona de joaca a copiilor. La interior casa se va preda la stadiul de alb , semifinisat: ~ Usa intrare: pvc; ~ Tamplarie ferestre: pvc, termopan; ~ Izolatii exterior: exterior. La solicitarea dumneavoastra, exista si posibilitatea amenajarii locuintei cu echipa constructorului si predarea acesteia la stadiul de cheie. Pret: 199.990€ Cod ofertă / ID: P23155 Sună-ne acum la 0369.823.823 și află detalii despre această proprietate de vanzare din Poplaca, dar și despre alte proprietăți potrivite pentru tine. Apartamente de vanzare Sibiu Case de vanzare Sibiu Informatii speciale: 1. Descarcă aplicația de mobilul tau "" TABOO Imobiliare "" din Apple Store, Google Play sau Huawei AppGallery pentru a afla instantaneu noile proprietăți care intră pe piață. 2. Dacă ai o proprietate pe care vrei să o vinzi sau să o închiriezi , suntem aici pentru tine! Contactează-ne pentru o evaluare gratuită fără obligații și vei descoperi avantajele de a lucra cu o echipă dedicată și experimentată. 3. Dacă vrei sa incepi o cariera de agent imobiliar , suna la 0369.823.823 si programeaza o intalnire pentru a afla toate beneficiile si avantajele. Intra pe www.TABOO.ro și descoperă cele mai recente oferte, actualizate zilnic. ID anunț : 1742983713",03.05.2018,1329,125748.109375,2018-03-05,2834.0,0,74241.890625
217,Anunț,177990,EUR,5,127,https://www.publi24.ro/anunturi/imobiliare/de-vanzare/case/case-vile/anunt/duplex-de-top-5-camere-pozitie-excelenta-sanandrei/ge8i06944df474eg213de59861630eig.html,images_case/anunt_217_img_0.webp|images_case/anunt_217_img_1.webp|images_case/anunt_217_img_2.webp|images_case/anunt_217_img_3.webp,4,,"ID:P1790 WestHub Imobiliare va propune spre vanzare jumatate de duplex cu 5 camere, 127 mp utili,  355 mp teren. Proprietatea se afla intr-un cartier complet dezvoltat si locuit, oferind acces facil la magazine, statii de transport in comun si alte facilitati esentiale pentru un stil de viata confortabil. • Nivel - Parter + 1 + pod • Suprafata teren - 355 mp • Suprafata utila - 127 mp • Numar camere - 5 • Dormitoare - 4 • Numar bai - 2 • Numar bucatarii - 1 • Camera tehnica: 1 Alcatuirea casei: Parterul este alcatuit din bucatarie  + living cu iesire pe terasa, 1 baie + 1 dormitor + 1 camera tehnica. La etaj regasim 3 dormitiare + 1 baie Dotari ale imobilului: • Incalzire - Centrala proprie pe gaz, incalzire in pardoseala • Usa ext. Usa PVC • Usa int. MDF • Geamuri: Geamuri PVC Tripan PRET:  177.990 Euro Pentru mai multe detalii si programarea unei vizionari ne puteti contacta la  0773 834 357 WestHub Imobiliare Va asteptam cu drag la o vizionare. ID anunț : 1763993055",29.04.2024,591,231874.25,2024-04-29,587.0,0,-53884.25
218,Anunț,550000,EUR,5,220,https://www.publi24.ro/anunturi/imobiliare/de-vanzare/case/case-vile/anunt/vila-superba-in-dumbravita-5-camere-220-mp-utili-teren-649-mp/68fe341982hh7d62e91i77d72i8e31f8.html,images_case/anunt_218_img_0.webp|images_case/anunt_218_img_1.webp|images_case/anunt_218_img_2.webp|images_case/anunt_218_img_3.webp,4,,"Proprietate spațioasă și bine gândită, ideală pentru familii care caută confort și intimitate. Casa oferă 220 mp utili, amplasați pe un teren generos de 649 mp, într-o zonă liniștită și foarte căutată din Dumbrăvița. Compartimentare: •	Living mare și luminos •	4 dormitoare spațioase •	3 băi moderne •	Bucătărie inchisa complet utilată •	Terasă largă cu ieșire spre curte Exterior: •	Curte generoasă, amenajată •	Duș exterior, perfect pentru zilele calde •	Zonă de barbeque amenajată, ideală pentru seri cu prietenii •	Loc de parcare în curte Proprietatea imbina confortul, functionalitatea și spatiul , într-o locație excelentă, aproape de punctele de interes din zonă! ID anunț : 1763589912",14.05.2017,2783,157804.8125,2017-05-14,3129.0,0,392195.1875
219,Anunț,139990,EUR,4,120,https://www.publi24.ro/anunturi/imobiliare/de-vanzare/case/case-vile/anunt/comision-0-duplex-de-vanzare-4-camere-sanandrei-pozitie-excelenta/9i6190dd33777gf8e2h2i3g8efgf5f1e.html,images_case/anunt_219_img_0.webp|images_case/anunt_219_img_1.webp|images_case/anunt_219_img_2.webp|images_case/anunt_219_img_3.webp,4,,"Duplex cu 4 camere de vanzare in localitatea Sanandrei, zona centrala. FOXFORT propune spre vanzare casa tip duplex, cu un regim de inaltime Parter + Mansarda, situat in Sanandrei, avand un numar de 4 camere, cu o suprafata utila de 120 mp si teren 250 mp. Anul constructiei este 2024, structura este din beton cu zidarie din caramida. Imobilul dispune de urmatoarele utilitati: curent electric, apa, gaz, fosa septica, catv, fibra optica. Casa dispune de centrala proprie cu incalzire in pardoseala si 2 locuri de parcare, iar finisajele interioare se pot alege in limita unui buget stabilit de constructor. Compartimentarea este dispusa dupa cum urmeaza: - Parter: hol, living cu bucatarie, birou, spatiu depozitare si terasa; - Mansarda: hol, 3 dormitoare, baie si dressing; - Pod depozitare. Finisajele interioare sunt moderne: - Usa intrare: pvc; - Usi interioare: celulare; - Tamplarie ferestre: pvc; - Podele: parchet, gresie. Pretul este de 139.990€ - COMISION 0%. Se accepta ca si modalitate de plata surse proprii sau credit bancar. Indicator performanta energetica: Clasa A ID intern: V6461 ID anunț : 1715669234",11.10.2019,1416,172198.28125,2019-11-10,2219.0,0,-32208.28125
220,Anunț,159000,EUR,4,110,https://www.publi24.ro/anunturi/imobiliare/de-vanzare/case/case-vile/anunt/film-casa-personalizabila-pe-un-singur-nivel-pod-mansardabil-pozitie-cu-liniste-sanpetru/4d7e69dh754f792d26h83f0e87dfd764.html,images_case/anunt_220_img_0.webp|images_case/anunt_220_img_1.webp|images_case/anunt_220_img_2.webp|images_case/anunt_220_img_3.webp,4,,"Comision cumparator: 2% + TVAdin valoarea de tranzactionare. ASCENDENT IMOBILIARE este onorata sa va propuna spre vanzare o casa, pe parter, situata in localitatea Sanpetru, judetul Brasov, avand o suprafata utila de 110 mp si o compartimentare functionala, gandita pentru confort si eficienta. Va invitam sa experimentati o vizionare initiala, din locatia unde va aflati, chiar acum, prin accesarea a filmului de prezentare: Film prezentare: https:  www.youtube.com watch?v=Ebdc1viCnPU Imobilul este structurat in trei camere spatioase, un salon generos cu lumina naturala abundenta, bucatarie cu spatiu optim pentru zona de luat masa, precum si doua bai, fiecare pregatita pentru dotari moderne. Deasupra casei se afla un pod mansardabil cu o suprafata utila de 70 mp, care poate fi amenajat in functie de viziunea noilor proprietari fie ca spatiu de locuit suplimentar, birou, sala de hobby sau depozitare. La exterior, rezidenta dispune de o terasa de 30 mp, ideala pentru relaxare, socializare sau mese in aer liber. Terenul aferent are o suprafata totala de 476 mp, cu o curte libera de 337 mp, oferind posibilitati de amenajare a unei gradini, constructie de anexe sau locuri de parcare. Constructia este noua, realizata din materiale de calitate si cu respectarea normelor actuale, iar interiorul se afla in stadiul de gri, nemobilat, pregatit pentru finisaje personalizate conform preferintelor. Zona este linistita, cu trafic redus, dar in acelasi timp are acces facil catre Brasov si principalele puncte de interes din apropiere, asigurand un echilibru  intre confortul unei locuinte moderne si avantajele unei comunitati primitoare. Consilier specializat pe aleasa oferta: doamna Daniela Lungu Telefon  WhatsApp: 0749 885 481 Detalii, fotografii suplimentare si alte oferte similare exclusive: www.ascendentimobiliare.ro ID anunț : 1763389740",23.05.2018,500,192187.59375,2018-05-23,2755.0,0,-33187.59375
221,Anunț,182000,EUR,4,600,https://www.publi24.ro/anunturi/imobiliare/de-vanzare/case/case-vile/anunt/casa-de-vanzare-branesti-ilfov/d03e3f8192137g2h1g02d1529gd81d00.html,images_case/anunt_221_img_0.webp|images_case/anunt_221_img_1.webp|images_case/anunt_221_img_2.webp|images_case/anunt_221_img_3.webp,4,,"Casă de vânzare în Brănești, Ilfov   lângă pădure Vând casă construită în 2017, pe teren de 600 mp, situată într-o zonă liniștită din Brănești, aproape de pădure. Imobilul este construit din cărămidă, racordat la apă curentă și canalizare și dispune de panouri solare pentru costuri reduse de întreținere. Localizare excelentă: 15 minute până la IKEA acces rapid către București zonă verde, aer curat ID anunț : 1765048053",02.07.2018,1,148247.359375,2018-02-07,2860.0,0,33752.640625
222,Anunț,191990,EUR,4,101,https://www.publi24.ro/anunturi/imobiliare/de-vanzare/case/case-vile/anunt/duplex-cu-4-camere-de-vanzare-in-localitatea-giroc/ef53e11f13gh794e1f5ddghhi4d25121.html,images_case/anunt_222_img_0.webp|images_case/anunt_222_img_1.webp|images_case/anunt_222_img_2.webp|images_case/anunt_222_img_3.webp,4,,"Duplex cu 4 camere de vanzare in localitatea Giroc FOXFORT va propune spre vanzare duplex, cu un regim de inaltime Parter + 1 Etaj, situata in Giroc, avand un numar de 4 camere, cu o suprafata utila de 101 mp si teren 250 mp. Anul constructiei este 2025, structura de beton, material zidarie de caramida. Imobilul dispune de urmatoarele utilitati: curent electric, apa, gaz, fosa septica, acces internet, fibra optica si este pregatit pentru camere video, video-interfon, automatizare poarta si sistem de alarma. Compartimentarea este dispusa dupa cum urmeaza: - Parter: hol, living, baie, bucatarie, terasa; - Etaj: hol, 3 dormitoare, baie; - Pod depozitare. Finisajele interioare sunt de lux: - Usa intrare: pvc; - Usi interioare: celulare; - Tamplarie ferestre: pvc; - Podele: parchet, gresie. Casa se vinde mobilata si utilata: plita, cuptor, hota, masina de spalat rufe, masina de spalat vase, frigider cu congelator, cuptor cu microunde, expresor de cafea. Imobilul dispune de centrala proprie cu incalzire prin pardoseala si 2 locuri de parcare, unul in fata casei si unul in curte. Pretul este de 191.990€ + comisionul standard al agentiei. Se accepta ca si modalitate de plata surse proprii sau credit bancar. Indicator performanta energetica: Clasa A ID intern: V9138 ID anunț : 1764949784",11.10.2019,1416,160940.609375,2019-11-10,2219.0,0,31049.390625
223,Anunț,169000,EUR,3,76,https://www.publi24.ro/anunturi/imobiliare/de-vanzare/case/case-vile/anunt/proprietar-pers-fizica-vand-duplex-in-zona-calea-urseni-mobilat-si-utilat/d78h2338f2327919e68442h31hg2ffde.html,images_case/anunt_223_img_0.webp|images_case/anunt_223_img_1.webp|images_case/anunt_223_img_2.webp|images_case/anunt_223_img_3.webp,4,,"Proprietar persoana fizica   Vand duplex in zona Calea Urseni (strada Galbenelelor, Giroc) CF: 417274-C3-U2 Giroc Detalii generale: - An constructie: 2023 - Suprafata utila: 76 mp - Terasa acoperita: 15 mp (dotata cu masa si scaune) - Suprafata teren: 150 mp - 3 locuri de parcare in fata casei - Compartimentare: P+1+pod (placa de beton peste etaj) Compartimentare interioara: - Parter: living, bucatarie separata, baie, debara - Etaj 1: hol, 2 dormitoare (unul cu balcon), baie - Pod: izolat cu polistiren de 20 cm Dotari si facilitati: - Incalzire in pardoseala (centrala pe gaz, 6 termostate independente) - Aer conditionat - Rulouri si camere de supraveghere - Terasa acoperita cu masa si scaune - Curte amenajata, gratar - Se vinde complet mobilat si utilat Mobilier si electrocasnice incluse: - Living: canapea extensibila, balansoare, masa cu scaune, biblioteca, comoda - Bucatarie: mobilier la comanda, masina de spalat vase, plita inductie, cuptor, hota, frigider, masa cu scaune, TV - Baie parter: dus - Debara: masina de spalat rufe - Dormitor cu balcon: TV, birou, dulap - Dormitor matrimonial: pat 180x200, noptiere, dulap, comoda - Baie etaj: cada Utilitati: - Curent electric - Gaz - Apa de la retea - Canalizare - Fibra optica TV + internet Alte informatii: - Casa este locuita, dar se poate elibera imediat - Se accepta credit imobiliar - In apropiere: Zone 2, centura Timisoara, supermarketuri (Mega Image, Profi), farmacie, Continental - Statia de autobuz la 400 m Pret 169.000 euro ID anunț : 1759088710",17.03.2024,1,157156.5625,2024-03-17,630.0,0,11843.4375
224,Anunț,349000,EUR,5,234,https://www.publi24.ro/anunturi/imobiliare/de-vanzare/case/case-vile/anunt/casa-de-vanzare-oradea/672ifi2g25f97g861i6g47he5hf9he2g.html,images_case/anunt_224_img_0.webp|images_case/anunt_224_img_1.webp|images_case/anunt_224_img_2.webp|images_case/anunt_224_img_3.webp,4,,"Casă individuală! Două nivele - Preț vânzare   349000  , negociabil. Am plăcerea să vă prezint spre vânzare o proprietate modernă și bine compartimentată, situată într-o zonă liniștită din cartierul Episcopia, Oradea. Proprietatea beneficiază de o poziție excelentă, pe o stradă asfaltată și iluminată public, oferind confort și siguranță. Detalii casa: Regimul de înălțime P+M; Suprafață construită - 234 mp; Suprafața utilă - 180 mp; Terenul casei - 780 mp. Compartimentare: Casa este dispusa pe parter și mansarda înaltă, fiecare nivel gândit astfel încât sa răspundă nevoilor dumneavoastră: Parterul întâmpină oaspeții cu un hol de acces, un living primitor, urmata de zona de dining și bucătărie utilată, o baie mare, un dormitor cu baie proprie, cămară pentru depozitare, camera tehnică, spălătorie, plus casa scări. La mansardă regăsim 4 dormitoare spațioase, dressing, baie mare cu vană, spațiu pe depozitare, hol, plus două balcoane mari. Casa edificată între anii 2010-2011, primitoare, modernă cu ferestre mari, bine vitrate, completată perfect de o terasă spațioasă și zonă pentru grătar, locul ideal pentru petreceri și momente de relaxare alături de cei dragi. Curtea din jurul casei este amenajată cu gazon, pomi fructiferi și plante decorative, oferind un ambient plăcut și personalizat. De ce să alegi această proprietate? Se predă complet mobilată și utilată, gata de locuit, totul arată impecabil; Conectată la toate utilitățile necesare; Centrală proprie pe gaz; Confortul termic este asigurat prin pardoseală; Construită pentru uz personal; Se vinde o casă de calitate, elegantă și confortabilă; Locația ideală, conectată ușor și rapid la toate zonele, prin centura orașului; Zona bună de case vile a Episcopiei. Tel. ID anunț : 1763838229",22.11.2025,2,164753.78125,2025-11-22,15.0,1,184246.21875
225,Anunț,66000,EUR,6,2500,https://www.publi24.ro/anunturi/imobiliare/de-vanzare/case/case-vile/anunt/casa-cu-teren-in-zona-dambovita/01gei67390h07g6211g189ief9ee9ge4.html,images_case/anunt_225_img_0.webp|images_case/anunt_225_img_1.webp|images_case/anunt_225_img_2.webp|images_case/anunt_225_img_3.webp,4,,"Spre vânzare casă modernă într-o zonă liniștită Casa este împărțită în: - parter care conține baie, bucătărie, camera centralei, living și 2 dormitoare, - etaj cu 4 camere nefinalizate Dispune de centrală termica pe lemn, garaj plus anexa și beci, apa curenta. 2500 m2 livadă cu pomi fructiferi Casă se afla în comuna Buciumeni, sat Valea Leurzii, județul Dâmbovița Petru mai multe informații mă puteți contacta telefonic ID anunț : 1760812564",18.10.2025,1,130544.03125,2025-10-18,50.0,1,-64544.03125
226,Anunț,159990,EUR,4,95,https://www.publi24.ro/anunturi/imobiliare/de-vanzare/case/case-vile/anunt/comision-0-duplex-cu-4-camere-toate-utilitatile-mosnita-drumul-boilor/5dgd5849255878g0e27130edigg69e70.html,images_case/anunt_226_img_0.webp|images_case/anunt_226_img_1.webp|images_case/anunt_226_img_2.webp|images_case/anunt_226_img_3.webp,4,,"Duplex cu 4 camere de vanzare in localitatea Mosnita. FOXFORT propune spre vanzare casa tip duplex, cu un regim de inaltime Parter + 1 Etaj, situata in Mosnita, avand un numar de 4 camere, cu o suprafata utila de 95 mp si teren 290 mp. Anul constructiei este 2025, structura beton, material zidarie caramida. Imobilul dispune de urmatoarele utilitati: curent electric, apa, canalizare, gaz, catv, fibra optica. Casa dispune de centrala proprie cu incalzire prin pardoseala si 2 locuri de parcare. Imobilul se afla 3-4 minute de noul Lidl si statie de transport in comun. Compartimentarea este dispusa dupa cum urmeaza: - Parter: hol, living, baie, bucatarie, dormitor, terasa; - Etaj: hol, 2 dormitoare, baie, balcon; - Pod depozitare. Finisajele interioare sunt moderne: - Usa intrare: pvc; - Usi interioare: celulare; - Tamplarie ferestre: pvc; - Podele: parchet, gresie. Pretul este de 159.990€ - COMISION 0%. Se accepta ca si modalitate de plata surse proprii sau credit bancar. Indicator performanta energetica: Clasa B ID intern: V8550 ID anunț : 1753106803",11.10.2019,1416,218253.53125,2019-11-10,2219.0,0,-58263.53125
227,Anunț,298000,EUR,4,1400,https://www.publi24.ro/anunturi/imobiliare/de-vanzare/case/case-vile/anunt/casa-individuala-mehala/37f6hf865h08719ie551f25g80g312f6.html,images_case/anunt_227_img_0.jpg|images_case/anunt_227_img_1.webp|images_case/anunt_227_img_2.webp|images_case/anunt_227_img_3.webp,4,,,,0,189942.796875,,,0,108057.203125
228,Anunț,54900,EUR,2,1339,https://www.publi24.ro/anunturi/imobiliare/de-vanzare/case/case-vile/anunt/casa-cu-teren-pentru-constructie-de-vanzare/7404fd26i3067i39d093f41762g5940h.html,images_case/anunt_228_img_0.webp|images_case/anunt_228_img_1.webp|images_case/anunt_228_img_2.webp|images_case/anunt_228_img_3.webp,4,,"Casa cu teren pentru constructie de vanzare la Zimandu-Nou. Suprafata totala 1339 mp. Situat pe colt in zona centrala a satului,  aproape de scoala, gradinita, primarie, parc pentru copii, teren de fotbal. Mai multe detalii la telefon sau in fata locului. ID anunț : 1746520620",10.03.2017,1,248488.0625,2017-10-03,2987.0,0,-193588.0625
229,Anunț,279990,EUR,5,1000,https://www.publi24.ro/anunturi/imobiliare/de-vanzare/case/case-vile/anunt/comision-0-casa-individuala-5-camere-1000-mp-teren-parta/516g3g2f29i078e7dg064if4995efh27.html,images_case/anunt_229_img_0.webp|images_case/anunt_229_img_1.webp|images_case/anunt_229_img_2.webp|images_case/anunt_229_img_3.webp,4,,"Casa individuala cu 5 camere de vanzare in localitatea Parta, zona Est. FOXFORT propune de vanzare casa tip individuala, cu un regim de inaltime Parter + 1 Etaj, situata in Parta, zona Est, avand un numar de 5 camere, cu o suprafata utila de 260 mp si teren 1000 mp. Anul constructiei este 2018, structura beton, material zidarie caramida. Imobilul dispune de urmatoarele utilitati: curent electric, apa, canalizare, gaz, catv, telefon, acces internet, fibra optica. Compartimentarea este dispusa dupa cum urmeaza: - Parter: hol mare, living, baie, bucatarie, terasa de 34 mp, dormitor, camera tehnica; - Etaj: hol imens, 3 dormitoare, 2 bai. Finisajele interioare sunt moderne: - Usa intrare: pvc; - Usi interioare: panel; - Tamplarie ferestre: pvc; - Podele: parchet, gresie. Casa se vinde mobilata si utilata: plita, cuptor, hota, aragaz, masina de spalat rufe, masina de spalat vase, frigider cu congelator, cuptor cu microunde. Casa dispune de centrala proprie cu incalzire pardoseala la parter si calorifere la etaj. Pretul este de 279.990€ - COMISION 0% Se accepta ca si modalitate de plata surse proprii sau credit bancar. Indicator performanta energetica: Clasa A ID intern: V8702 ID anunț : 1757585226",11.10.2019,1416,187689.0,2019-11-10,2219.0,0,92301.0
230,Anunț,132990,EUR,3,125,https://www.publi24.ro/anunturi/imobiliare/de-vanzare/case/casa/anunt/casa-tip-a-125-mp-utili-cu-terasa-30-mp-si-teren-586-mp-daia-noua/f5e39hd6f32d7i58e36f30d57f0002h8.html,images_case/anunt_230_img_0.webp|images_case/anunt_230_img_1.webp|images_case/anunt_230_img_2.webp|images_case/anunt_230_img_3.webp,4,,"Casa individuala de tip A-frame, de vanzare, cu priveliste panoramica peste dealurile din Daia Noua, la doar 5 km de intrarea in orasul Sibiu. Construita pe un teren intravilan , inscris in eTerra, cu suprafata totala de 586 mp , aceasta insumneaza o suprafata utila de 125 mp , distribuita pe 2 nivele: la parter, 75 mp , compusi din bucatarie cu living, camera si baie, iar la etaj, 50 mp , sunt prezente doua dormitoare, accesul facandu-se pe o scara interioara. Acoperisul este construit din tigla metalica cu izolatie corespunzatoare. In materie de utilitati, avem urmatoarele: - Curent electric - pentru buna functionalitate a casei; - Curent trifazic - urmeaza a se adauga; - Sursa de apa - prezenta prin intermediul fantanii la care au fost adaugate 6 burlane; - Statie de epurare - inlocuitor perfect pentru canalizare; - Pompa de caldura - cu incalzire prin calorifere; - Aer conditionat - pentru propriul confortul. Predarea acesteia se face la stadiul de cheie, cu finisajele interioare facute si baia amenajata cu sanitare. Accesul la proprietate se face pe un drum de 250 m de la DJ106, inca neamenajat, de pamant. Pretabila pentru casa de vacanta, iar achizitia se poate face atat prin credit cat si prin surse proprii. Pret: 132.990€ Cod ofertă / ID: P23349 Sună-ne acum la 0369.823.823 și află detalii despre această proprietate de vanzare din Daia, dar și despre alte proprietăți potrivite pentru tine. Apartamente de vanzare Sibiu Case de vanzare Sibiu Informatii speciale: 1. Descarcă aplicația de mobilul tau "" TABOO Imobiliare "" din Apple Store, Google Play sau Huawei AppGallery pentru a afla instantaneu noile proprietăți care intră pe piață. 2. Dacă ai o proprietate pe care vrei să o vinzi sau să o închiriezi , suntem aici pentru tine! Contactează-ne pentru o evaluare gratuită fără obligații și vei descoperi avantajele de a lucra cu o echipă dedicată și experimentată. 3. Dacă vrei sa incepi o cariera de agent imobiliar , suna la 0369.823.823 si programeaza o intalnire pentru a afla toate beneficiile si avantajele. Intra pe www.TABOO.ro și descoperă cele mai recente oferte, actualizate zilnic. ID anunț : 1744705488",03.05.2018,1329,164819.65625,2018-03-05,2834.0,0,-31829.65625
231,Anunț,224990,EUR,4,125,https://www.publi24.ro/anunturi/imobiliare/de-vanzare/case/case-vile/anunt/casa-individuala-cu-4-camere-de-vanzare-in-giarmata-zona-nord-vest/18h6g292612i73e42f6h05719hf1eig8.html,images_case/anunt_231_img_0.webp|images_case/anunt_231_img_1.webp|images_case/anunt_231_img_2.webp|images_case/anunt_231_img_3.webp,4,,"Casa individuala cu 4 camere de vanzare in localitatea Giarmata. FOXFORT propune spre vanzare casa tip individuala, cu un regim de inaltime Parter + Mansarda, situata in Giarmata, zona Nord-Vest, in cartierul Primaverii (printre putinele cu retea de canalizare), avand un numar de 4 camere, cu o suprafata utila de 125 mp si teren 614 mp. Anul constructiei este 2009, structura beton, material zidarie din caramida tip Porotherm. Imobilul dispune de urmatoarele utilitati: curent electric, apa, canalizare, curent trifazic, catv, utilitati in zona (gaz la limita de proprietate). Compartimentarea este dispusa dupa cum urmeaza: - Parter: hol, living, baie, bucatarie, terasa; - Mansarda: hol, 3 dormitoare, baie, balcon; - Pod depozitare. Finisajele interioare sunt moderne: - Usa intrare: pvc; - Usi interioare: celulare, lemn, sticla; - Tamplarie ferestre: pvc; - Podele: parchet, gresie. Casa se vinde nemobilata si neutilata. Imobilul dispune de instalatie de incalzire pe cupru, cu centrala pe lemne si boiler electric, prin calorifere de otel. Imobilul are acces auto cu posibilitate de 2 locuri de parcare in curte. Pretul este de 224.990€ - COMISION 0%. Se accepta ca si modalitate de plata surse proprii sau credit bancar. ID intern: V8419 ID anunț : 1749049011",11.10.2019,1416,198602.03125,2019-11-10,2219.0,0,26387.96875
232,Anunț,120000,EUR,4,280,https://www.publi24.ro/anunturi/imobiliare/de-vanzare/case/case-vile/anunt/casa-cu-potential-de-investitie-280-mp-utili-teren-liber-2064-cincu/9127f77fh6g076g5e45d36fhh167e174.html,images_case/anunt_232_img_0.webp|images_case/anunt_232_img_1.webp|images_case/anunt_232_img_2.webp|images_case/anunt_232_img_3.webp,4,,,,0,142491.25,,,0,-22491.25
233,Anunț,184990,EUR,5,120,https://www.publi24.ro/anunturi/imobiliare/de-vanzare/case/case-vile/anunt/duplex-cu-5-camere-mosnita-noua-pozitie-excelenta-zona-mcity/127hih1eidhh7f8e156i2h851g87e251.html,images_case/anunt_233_img_0.webp|images_case/anunt_233_img_1.webp|images_case/anunt_233_img_2.webp|images_case/anunt_233_img_3.webp,4,,"Duplex cu 5 camere de vanzare in localitatea Mosnita Noua, zona MCity. FOXFORT propune spre vanzare casa tip duplex, cu un regim de inaltime Parter + 1 Etaj, situata in Mosnita Noua, avand un numar de 5 camere, cu o suprafata utila de 120 mp si teren 299 mp. Anul constructiei este 2023, structura beton, material zidarie caramida. Imobilul dispune de urmatoarele utilitati: curent electric, apa, gaz, fosa septica ecologica. Casa dispune de centrala proprie cu incalzire prin pardoseala si 4 locuri de parcare. Curte se va preda cu gazon si sistem de irigare. Acesta este situat la doar 4 minute de Mcity si de statie de transport in comun. Compartimentarea este dispusa dupa cum urmeaza: - Parter: hol, living, baie, dormitor, bucatarie inchisa, terasa acoperita; - Etaj: hol, 3 dormitoare, 2 bai, balcon. - Pod de depozitare. Finisajele interioare sunt moderne: - Usa intrare: pvc; - Usi interioare: celulare; - Tamplarie ferestre: pvc; - Podele: parchet, gresie. Pretul este de 184.990€ - COMISION 0%. Se accepta ca si modalitate de plata surse proprii sau credit bancar. Indicator performanta energetica: Clasa B ID intern: V6548 ID anunț : 1718269936",11.10.2019,1416,240904.546875,2019-11-10,2219.0,0,-55914.546875
234,Anunț,64000,EUR,2,57,https://www.publi24.ro/anunturi/imobiliare/de-vanzare/case/case-vile/anunt/casa-in-zona-semicentrala/d25d84d0id2g7461140d7ghg7513467e.html,images_case/anunt_234_img_0.jpg|images_case/anunt_234_img_1.jpg|images_case/anunt_234_img_2.jpg|images_case/anunt_234_img_3.jpg,4,,Casa este compusa din 2 camere bucatarie baie atelier garaj din caramida cu toate utilitățile. + pivnita și terasa Dispune de centrala  noua in condensare . Pret 64.000 Euro Pentru informații  la nr de telefon ID anunț : 1724968305,20.12.2016,3,178615.75,2016-12-20,3274.0,0,-114615.75
235,Anunț,160000,EUR,5,133,https://www.publi24.ro/anunturi/imobiliare/de-vanzare/case/case-vile/anunt/casa-de-vanzare-cu-teren-intravilan-in-beregsaul-mic-judetul-timis/e10fd2ddf0317gehd125681e8843gfi1.html,images_case/anunt_235_img_0.jpg|images_case/anunt_235_img_1.jpg|images_case/anunt_235_img_2.jpg|images_case/anunt_235_img_3.jpg,4,,"Vând proprietate rezidențială în satul Beregsău Mic, comuna Săcălaz, județul Timiș, în centrul satului, situat la 24 km de Timișoara. Proprietatea este compusă dintr-o casă, curte, anexă și teren intravilan (livadă și grădină). Pe terenul în suprafață de 4.133 mp, sunt casa, curtea și anexa (cu destinația inițială de cocină, iar în prezent utilizată ca magazie). Suprafața construită efectivă a locuinței este de 269,36 mp, iar suprafața utilă totală este de 221,10 mp și se compune din: terasă acoperită, 1 cameră antreu, 1 sufragerie, 1 bucătărie mare utilată, 2 magazii, 1 cămară, 4 camere mari, o baie spațioasă și o pivniță. Locuința dispune de fundații de cărămidă arsă, de structură din cărămidă arsă și acoperiș tip șarpantă din lemn cu învelitoare din țiglă. Livada și grădina pot fi dezmembrate. Accesul la imobil se face prin două fronturi stradale (strada principală DJ 214 și o stradă secundară). Încălzirea casei este pe lemne. Utilități: apă și curent. Prețul este 160.000 euro. ID anunț : 1701625337",03.12.2023,1,104602.6875,2023-03-12,1001.0,0,55397.3125
236,Anunț,104990,EUR,4,16,https://www.publi24.ro/anunturi/imobiliare/de-vanzare/case/case-vile/anunt/comision-0-duplex-cu-4-camere-si-terasa-de-16-mp-zona-dragsina/ig2526g8g9gg7ed42f88983e76g72fh0.html,images_case/anunt_236_img_0.webp|images_case/anunt_236_img_1.webp|images_case/anunt_236_img_2.webp|images_case/anunt_236_img_3.webp,4,,"Duplex cu 4 camere de vanzare in localitatea Dragsina. FOXFORT propune de vanzare casa tip duplex, cu un regim de inaltime Parter + Mansarda, situata in Dragsina, avand un numar de 4 camere, cu o suprafata utila de 120 mp si teren 450 mp. Anul constructiei este 2022, structura beton, material zidarie caramida. Imobilul dispune de urmatoarele utilitati: curent electric, put, fosa septica, cablu Tv, fibra optica. Compartimentarea este dispusa dupa cum urmeaza: - Parter: hol, living, baie, bucatarie, terasa,; - Mansarda: hol, 3 dormitoare, baie; - Pod depozitare. Finisajele interioare sunt moderne: - Usa intrare: pvc; - Tamplarie ferestre: pvc. Pretul este de 104.990€ - COMISION 0%. Se accepta ca si modalitate de plata surse proprii sau credit bancar. ID intern: V6299 ID anunț : 1718268794",11.10.2019,1416,224354.6875,2019-11-10,2219.0,0,-119364.6875
237,Anunț,70000,EUR,5,350,https://www.publi24.ro/anunturi/imobiliare/de-vanzare/case/case-vile/anunt/schimb-casa-spatioasa-in-butin-cu-proprietate-mai-aproape-de-timisoara/0i64e6f72215737f1d2845h78i37e9e3.html,images_case/anunt_237_img_0.webp|images_case/anunt_237_img_1.webp,2,,"Schimb casă situată în satul Butin, într-o zonă liniștită, la aproximativ 55 km de Timișoara. Proprietatea are o suprafață totală de cca. 350 mp utili, este compusă din peste 5 camere, dependințe și este ideală pentru o familie numeroasă sau pentru cineva care își dorește spațiu generos. Terenul aferent este spațios și include pomi fructiferi, grădină și posibilitate de extindere sau alte amenajări. ID anunț : 1746804591",08.05.2025,1,38498.53515625,2025-08-05,124.0,1,31501.46484375
238,Anunț,247500,EUR,4,98,https://www.publi24.ro/anunturi/imobiliare/de-vanzare/case/case-vile/anunt/a-mai-ramas-una-4benzi-mosnita-noua-proprietar/91d706947f187ee218h73i8678d580h9.html,images_case/anunt_238_img_0.webp|images_case/anunt_238_img_1.webp|images_case/anunt_238_img_2.webp|images_case/anunt_238_img_3.webp,4,,"247.500   TVA inclus , Pentru a viziona proiectele noastre finalizate sau în curs de execuție vizitați pagina noastră de facebook Sc.Proconstruct Investiții.Srl De vânzare casă individuală în curs de construire despărțită prin terasă în Mosnita Nouă,strada lelelor nr 26(la 400m de asfalt și cele 4 benzi,(vizavi de Valery)cu regim de înăltime P+1E+Pod si o suprafata utila de 119,98 mp ,proiectul se construiește pe un teren de 668 mp si dispune de două fronturi stradale unul de 22 ML iar celălalt de 24ML,casele fiind poziționate pe frontul cel mare ,fiecare parte are in posesie un teren de 334mp ,respectiv 12ML front stradal! Utilităţi :Apă de la reţea,Canalizare,Gaz,Curent,internet ! La parter dispune de: Hol intrare : 4,97mp Dormitor 1 : 9,88mp Baie : 5,75mp Casa scări: 7,21mp Bucatarie: 10,84mp Cămară:2,05mp Living: 23,31mp Camera Tehnică : 2,29 mp Terasa acoperită:20,84mp Etaj: Hol: 3,81mp Baie: 7,11mp Dormitor 1matrimonial cu baie: 12,12mp 2,82mp Dormitor 2: 12,12mp Dormitor 3: 15,60mp Detali tehnice: Clădirea este construită pe structura de beton armat iar zidăria interioară exterioara este executată cu blocuri de cărămida CEMACON EVOCERAMIC 24 LM portant,termoizolatia exterioara va fi executata cu polistiren expandat grafitat EPS100 15cm grosime. Tencuirea zidurilor se va face interior-exterior,tavanele vor fi și ele tencuite,atât zidurile cat și sapele sunt executate mecanizat. Casele dispun de 3 placi turnate(placa de la cota 0,placa peste parter si placa peste etaj)iar acoperisul este tip șarpantă in 6 ape,acoperit cu tigla! Instalatia electrică este trifazica si este pregătită pentru panouri fotovoltaice(trebuie doar montate panourile și invertoarele)toată instalația este executata din cablu masiv (nu litat) Instalatia sanitara+încălzirea in pardoseala sunt atât la parter cât şi la etaj,şi sunt marca TECE(Garantie 12 ani + polita de asigurare oferită de producător) Geamurile au profil REHAU, seria Synego, profil cu 7 camere de izolare termica si cu 3 garnituri de etansare,bagheta calda intre sticle, Termopanul are o grosimea de 80mm si este alcătuit din 3 sticle : Climaguard solar(for season) + floare + low-e (garantie 10 ani) Finisaje interioare: Prize întrerupătoare marca GEWISS Tavane tencuite Glet Gresie Faianta Parchet Mobilier băi Uși ATENȚIE ! Când se va ajunge la finisajele interioare (gresie,faianță,parchet,uși)clientul va dispune de un buget stabilit înainte de ambele părți implicate ! ACCEPTAM TOATE TIPURILE DE CREDIT BANCAR ȘI OFERIM CONSULTANTA FINANCIARĂ IN OBȚINEREA CREDITULUI! ID anunț : 1746795650",17.08.2017,2,179811.8125,2017-08-17,3034.0,0,67688.1875
239,Anunț,150000,EUR,6,200,https://www.publi24.ro/anunturi/imobiliare/de-vanzare/case/casa/anunt/casa-ultracentrala-200mp-teren-450-mp-radauti/9g5158d692f176i3182473129de8efgf.html,images_case/anunt_239_img_0.jpg|images_case/anunt_239_img_1.jpg|images_case/anunt_239_img_2.jpg|images_case/anunt_239_img_3.jpg,4,,,,0,141283.46875,,,0,8716.53125
240,Anunț,245000,EUR,5,147,https://www.publi24.ro/anunturi/imobiliare/de-vanzare/case/casa/anunt/casa-de-vanzare-5-camere-147-mpu-si-teren-de-434-mp-cristian-sibiu/0d85582g2e6d7f1f25218g1e41718d1e.html,images_case/anunt_240_img_0.webp|images_case/anunt_240_img_1.webp|images_case/anunt_240_img_2.webp|images_case/anunt_240_img_3.webp,4,,,,0,148531.0,,,0,96469.0
241,Anunț,150000,EUR,4,750,https://www.publi24.ro/anunturi/imobiliare/de-vanzare/case/case-vile/anunt/casa-individuala-de-vanzare-in-freidorf-zona-linistita-si-acces-facil/2dg59g4ei37f73gf22eee84g0h7f6e39.html,images_case/anunt_241_img_0.webp|images_case/anunt_241_img_1.webp|images_case/anunt_241_img_2.webp|images_case/anunt_241_img_3.webp,4,,,07.04.2008,199,144260.46875,2008-07-04,6365.0,0,5739.53125
242,Anunț,305000,EUR,5,150,https://www.publi24.ro/anunturi/imobiliare/de-vanzare/case/case-vile/anunt/com-0-casa-individuala-cu-5-camere-si-garaj-lugojului/37hef09760hh75d6e8fg191985gh02id.html,images_case/anunt_242_img_0.webp|images_case/anunt_242_img_1.webp|images_case/anunt_242_img_2.webp|images_case/anunt_242_img_3.webp,4,,"District Real Estate va prezinta spre vanzare o casa individuala, cu 5 camere, situata in Timisoara, in zona Telegrafului, intr-o zona foarte liniștită cu acces facil catre punctele de interes din oras. Casa se desfasoara pe o suprafata utila de 150mp și este amplasată pe un teren de 277mp. Compartimentarea se prezinta astfel: PARTER: - Hol de acces - Bucatarie inchisa - Living generos - Dormitor/Birou - Baie - Spatiu depozitare sub scara - Terasa generoasa de 14mp cu acces din living și hol MANSARDA: - 3 Dormitoare - Baie cu cada și dus - Terasa cu acces din colidor și dintr-un dormitor. - Acces in pod Mai multe detalii: - Dispune de toate utilitatiile: gaz, apa, canalizare, curent - Camere de supraveghere - Confortul termic este realizat cu ajutorul centralei proprii prin intermediul caloriferelor. - Acoperiș din țiglă ceramica - Instalații electrice și sanitare noi - Curte amenajată cu pavaj și spații verzi - Garaj exterior Imobilul este pretabil atat pentru locuinta familiala, cat si pentru investitie în inchiriere ( a funcționat grădiniță) Pretul este de 305.000 euro negociabil. Oferim consultanta si solutii financiare in vederea obtinerii unui credit imobiliar avantajos, cu ajutorul colaboratorilor nostri. Pentru vizionari si alte detalii va stam la dispozitie. ID anunț : 1760965838",27.10.2021,717,189037.21875,2021-10-27,1502.0,0,115962.78125
243,Anunț,235000,EUR,10,477,https://www.publi24.ro/anunturi/imobiliare/de-vanzare/case/case-vile/anunt/casa-bors-10-camere-477-mp-construiti/12f0i023h7h47472e4e7ei4103h7hde4.html,images_case/anunt_243_img_0.webp|images_case/anunt_243_img_1.webp|images_case/anunt_243_img_2.webp|images_case/anunt_243_img_3.webp,4,,,02.09.2022,60,217151.8125,2022-02-09,1397.0,0,17848.1875
244,Anunț,390000,EUR,4,169,https://www.publi24.ro/anunturi/imobiliare/de-vanzare/case/case-vile/anunt/casa-la-rosu-4-camere-169mp-piata-pacurari/50fi2820473i7f7ie2215d3006dge768.html,images_case/anunt_244_img_0.jpg|images_case/anunt_244_img_1.jpg|images_case/anunt_244_img_2.jpg|images_case/anunt_244_img_3.jpg,4,,"BLITZ va propune spre vanzare o casa cu 4 camere, situata in zona Pacurari, care dispune de o suprafata utila de 189mp si 420mp teren. ( 500 mp in masuratori).  Imobilul este construit din caramida GV, intre nivele avand placi din beton armat iar acoperisul este din tabla ondulata si este izolat cu spuma. Casa este compusa din subsol + parter + mansarda si este racordata la toate utilitatile: gaz, curent electric 220Vsi380v, canalizare. Acasta dispune de un garaj pentru 2 masini sau depozit contruit din BCA si inca o casa mai mica locuibila in suprafata de 40m2. Se afla la stadiul de gri, subsolul este finisat in totalitate fiind amenajata o sala de sport si camera centralei, mansarda fiind la gri. Pentru mai multe detalii, nu ezitati sa ne contactati! Cod ofertă / ID BLITZ: P10237 ID anunț : 1724858623",07.05.2021,9948,150542.4375,2021-07-05,1616.0,0,239457.5625
245,Anunț,32000,EUR,4,600,https://www.publi24.ro/anunturi/imobiliare/de-vanzare/case/case-vile/anunt/urgent-casa-de-vanzare-caramida-arsa-sau-schimb-cu-apartament/d8211de867417003dgf376ggf0gd8h8h.html,,0,,"De vânzare casă din cărămidă arsă sau schimb apartament 2 camere Casa se află la 30 min.de Reșița spre Lugoj Casă compusa din 4 camere , bucatarie, loc pentru baie Hol ,pivniță etc Anexe mai multe Curte mare Suprafața 600mp Casa necesita puțină atenție renovare Pentru mai multe detali sunați. ID anunț : 1718189956",11.08.2017,50,21532.486328125,2017-11-08,2951.0,0,10467.513671875
246,Anunț,399990,EUR,5,546,https://www.publi24.ro/anunturi/imobiliare/de-vanzare/case/case-vile/anunt/comision-0-casa-individuala-cu-5-camere-si-teren-de-546-mp-zona-ciarda-rosie/fe10963hd209799ge26157h2f44221d7.html,images_case/anunt_246_img_0.webp|images_case/anunt_246_img_1.webp|images_case/anunt_246_img_2.webp|images_case/anunt_246_img_3.webp,4,,"Casa individuala cu 5 camere de vanzare in localitatea Timisoara, zona Ciarda Rosie. FOXFORT propune spre vanzare casa tip individuala, cu un regim de inaltime Parter + 1 Etaj, situata in Timisoara, zona Ciarda Rosie, avand un numar de 5 camere, cu o suprafata utila de 179 mp si teren 546 mp. Anul constructiei este 2022, structura beton, material zidarie caramida. Imobilul dispune de urmatoarele utilitati: curent electric, apa, canalizare, gaz, put, curent trifazic, catv, fibra optica. Compartimentarea este dispusa dupa cum urmeaza: - Parter: hol, living, baie, dormitor, bucatarie, terasa; - Etaj: hol, 3 dormitoare, dresibg, baie, balcon; - Pod depozitare. Finisajele interioare sunt moderne: - Usa intrare: pvc; - Usi interioare: celulare; - Tamplarie ferestre: pvc; - Podele: parchet, gresie. Casa se vinde mobilata si utilata: plita, cuptor, hota, masina de spalat rufe, masina de spalat vase, frigider cu congelator, Tv. Imobilul dispune de centrala proprie cu incalzire prin pardoseala si 2 locuri de parcare. Pretul este de 399.990€ - COMISION 0%. Se accepta ca si modalitate de plata surse proprii sau credit bancar. Indicator performanta energetica: Clasa A ID intern: V8096 ID anunț : 1742827901",11.10.2019,1416,152710.390625,2019-11-10,2219.0,0,247279.609375
247,Anunț,150000,EUR,3,900,https://www.publi24.ro/anunturi/imobiliare/de-vanzare/case/case-vile/anunt/casa-de-vanzare/03e27964eg8g748f1i97d66hd5514f53.html,images_case/anunt_247_img_0.webp|images_case/anunt_247_img_1.webp|images_case/anunt_247_img_2.webp|images_case/anunt_247_img_3.webp,4,,"Casa individuala pe parter, situata intr o zona linistita din Sacele -Satulung, singur curte, constructie caramida , curte si gradina cu pomi fructiferi si fructe de padure, beci, magazie, bucatarie de vara. Detalii tehnice: Suprafata teren 900mp Suprafata utila : 109mp Regim: parter +Pod(posibilitate mansardare) Compartimentare: 3 camere, 1 baie, 1 bucatarie, 1 camara cu intrare in pod, 2 holuri Utilitati: apa, gaz, curent,canalizare Centrala termica proprie , soba teracota functionala. Proprietate libera la vanzare Pret: 150000Euro negociabil Comision 3% Telefon: ID anunț : 1761675443",24.10.2020,2,181987.8125,2020-10-24,1870.0,0,-31987.8125
248,Anunț,225000,EUR,5,180,https://www.publi24.ro/anunturi/imobiliare/de-vanzare/case/case-vile/anunt/casa-5-camere-3-bai-2-terase-garaj-magazie-de-vanzare-180-mp-utili/hf22f7360f5d7f54ef37f31865df9e1g.html,images_case/anunt_248_img_0.webp|images_case/anunt_248_img_1.webp|images_case/anunt_248_img_2.webp|images_case/anunt_248_img_3.webp,4,,"Doresti sa te muti intr-o zona mai linistita si retrasa? TABOO Imobiliare iti propune aceasta casa de vanzare cu 5 camere in zona Meltea, Fagaras. Casa de vanzare din Fagaras este o casa de tip individuala, cu un regim de inaltime Parter, 1 etaje + Pod. Casa este compartimentata astfel: ~ Parter: hol, living, dormitor, baie, bucatarie, 2 terase; ~ Etaj: hol, 3 dormitoare, 2 bai, balcon; ~ Pod depozitare. Casa a fost construita in anul 2018, cu o structura din caramida si sistem de incalzire cu centrala pe gaz, centrala pe lemne, calorifere. Suprafata construita a casei este de 246 mp, suprafata utila 180 mp, iar terenul are o suprafata totala de 833 mp. Casa este mobilata complet si utilata: plita, cuptor, hota, aragaz, masina de spalat rufe, frigider cu congelator, cuptor cu microunde, expresor de cafea. Casa are o curte libera 587 mp cu locuri de parcare, 1 garaj si suficient loc pentru zona de joaca a copiilor, 2 terasa de relaxare si spatiu pentru depozitare. Indicator performanta energetica: Clasa B. Finisajele interioare sunt moderne: ~ Usa intrare: pvc; ~ Usi interioare: lemn; ~ Tamplarie ferestre: pvc, termopan; ~ Podele: parchet, gresie, marmura; ~ Izolatii exterior: exterior. Casa dispune de sistem de supraveghere, panou solar apa calda 200L nepresurizat inox cu controller si boilar 1000L. Casa se poate vinde mobilata - utilata cat si nemobilata - neutilata la alt pret. Pret: 225.000€ Cod ofertă / ID: P24482 Sună-ne acum la 0369.823.823 și află detalii despre această proprietate de vanzare din Fagaras, dar și despre alte proprietăți potrivite pentru tine. Apartamente de vanzare Sibiu Case de vanzare Sibiu Informatii speciale: 1. Descarcă aplicația de mobilul tau "" TABOO Imobiliare "" din Apple Store, Google Play sau Huawei AppGallery pentru a afla instantaneu noile proprietăți care intră pe piață. 2. Dacă ai o proprietate pe care vrei să o vinzi sau să o închiriezi , suntem aici pentru tine! Contactează-ne pentru o evaluare gratuită fără obligații și vei descoperi avantajele de a lucra cu o echipă dedicată și experimentată. 3. Dacă vrei sa incepi o cariera de agent imobiliar , suna la 0369.823.823 si programeaza o intalnire pentru a afla toate beneficiile si avantajele. Intra pe www.TABOO.ro și descoperă cele mai recente oferte, actualizate zilnic. ID anunț : 1754573000",03.05.2018,1329,132051.25,2018-03-05,2834.0,0,92948.75
249,Anunț,135000,EUR,4,648,https://www.publi24.ro/anunturi/imobiliare/de-vanzare/case/case-vile/anunt/casa-spatioasa-4-dormitoare-teren-648-mp-strada-asfaltata/902fe077719d7979255297d7622hg554.html,images_case/anunt_249_img_0.webp|images_case/anunt_249_img_1.webp|images_case/anunt_249_img_2.webp|images_case/anunt_249_img_3.webp,4,,"O casă gândită pentru confortul unei familii moderne, cu spații generoase și materiale premium, renovată în 2023. Proprietar, propun spre vanzare casa pe strada George Cosbuc - asfaltată, aproape de școli, grădinițe și magazine   locul perfect pentru o familie care caută liniște și accesibilitate în același timp. Suprafață totală teren: 648 mp Suprafață utilă: 210 mp Compartimentare: Parter (125 mp): Living room cu acces spre etaj, 2 dormitoare, bucătărie mare și luminoasă, baie spațioasă, cămară, hol. Etaj (87 mp): 2 dormitoare, baie, balcon în formă de L cu acces direct în curte. Dormitorul matrimonial are baie proprie și balcon privat. Poduri: 2 spații generoase pentru depozitare. Calitate în fiecare detaliu: Construcție solidă: Porotherm + BCA Acoperiș nou, tablă Bilka cu izolație Ferestre premium: Salamander BluEvolution 92 , geam tripan 4 anotimpuri   ideale pentru eficiență energetică Izolație pod: vată bazaltică Rockwool 15 20 cm + folie Intello Plus certificata NZEB Avantaj major: Casa este la roșu la parter și finisată parțial la etaj, ceea ce înseamnă că viitorul proprietar își poate personaliza complet interiorul după propriul stil și necesități. Cu o suprafață generoasă, finisaje premium și o locație excelentă, această casă este ideală pentru cei care își doresc un cămin pe termen lung sau o investiție sigură. Prețul de 135.000 euro, negociabil. ID anunț : 1758389191",30.10.2019,1,122859.953125,2019-10-30,2230.0,0,12140.046875
250,Anunț,199990,EUR,6,250,https://www.publi24.ro/anunturi/imobiliare/de-vanzare/case/case-vile/anunt/o-casa-cu-istorie-si-suflet-250-mp-utili-si-1300-mp-de-gradina/g81ih3e32he27026e9659731id7f033f.html,images_case/anunt_250_img_0.webp|images_case/anunt_250_img_1.webp|images_case/anunt_250_img_2.webp|images_case/anunt_250_img_3.webp,4,,"O casa cu suflet, care asteapta sa scrii un nou capitol in istoria ei. FOXFORT iti prezinta o proprietate rara, cu farmecul unei alte epoci si confortul unei case spatioase – o locuinta individuala construita in 1901, cu 6 camere, 250 mp utili, situata in Mosnita Veche. O casa cu poveste, in inima naturii Aceasta casa pastreaza esenta arhitecturii de altadata, cu ziduri din caramida solida, ferestre mari si incaperi generoase. Totul este completat de o gradina superba de 1600 mp, unde te poti bucura de: - Vita de vie pentru propriul tau vin de casa; - Pomi fructiferi – mere, prune, ciresi si altele; - Capsuni si zmeura – gustul autentic al naturii direct din propria gradina. Spatii suplimentare pentru pasiunile tale: - Ateliere de lucru – perfecte pentru proiectele tale creative; - Spatii de depozitare – ideale pentru un stil de viata organizat. Compartimentare inteligenta Parter: - Hol spatios; - Living generos; - Bucatarie functionala; - 3 dormitoare luminoase; - Baie; - Balcon si terasa pentru relaxare; Pod – spatiu perfect pentru depozitare sau amenajare ulterioara. Dotari si facilitati - Centrala proprie + calorifere pentru confort termic; - Curent, gaz, apa, canalizare + put forat; - Internet prin fibra optica, CATV, telefon; - Sistem de irigatie – pentru o gradina mereu verde; - 4 locuri de parcare. Un refugiu perfect, la doar cativa pasi de oras. Aflata in Mosnita Veche, aceasta casa combina linistea si natura cu accesibilitatea catre Timisoara. Pret: 199.990€ - COMISION 0%. Se accepta plata prin surse proprii sau credit bancar. Pentru detalii si vizionari, suna acum. ID intern: V7977 Sediu FOXFORT Imobiliare: Strada Mures, Nr. 39A, Timisoara, Timis. 0374.069.727 ID anunț : 1741601568",11.10.2019,1416,166053.6875,2019-11-10,2219.0,0,33936.3125
251,Anunț,73000,EUR,4,1750,https://www.publi24.ro/anunturi/imobiliare/de-vanzare/case/case-vile/anunt/casa-individuala-voiteg/9i6h2h8g38457e01d0h0gfge4944g969.html,images_case/anunt_251_img_0.webp|images_case/anunt_251_img_1.webp|images_case/anunt_251_img_2.webp|images_case/anunt_251_img_3.webp,4,,"Oportunitate investiție! Va prezentam in exclusivitate Casa din cărămidă + teren  1750 mp Front stradal 20 m Pentru achiziționarea casei se acceptă credit bancar ipotecar,oferim consultanta pentru obținerea unui credit bancar ipotecar zona Centrala   in   comuna  Voiteg  judetul  Timis  la  35  km  de  Timisoara Compartimentat astfel Constructie  Parter Casa   solida   din   caramida  ,necesita   amenajare ! Terasă Hol intrare generos Bucătărie 3  camere   mari  luminoase 1 camera  tehnica 1 baie (neamenajat) Centrala termica proprie Curte, anexa  in curte , terasă,spatiu verde ,acces auto, Gradina   cu   pomi  fructiferi  ,  spatiu   pentru   gospodarie Prețul solicitat de proprietar este de 73000 euro negociabil Pentru detalii suplimentare și programare pentru vizionare ne puteți contacta telefonic ID anunț : 1693655436",13.08.2023,12,156976.59375,2023-08-13,847.0,0,-83976.59375
252,Anunț,309500,EUR,5,500,https://www.publi24.ro/anunturi/imobiliare/de-vanzare/case/case-vile/anunt/casa-prelungirea-ghencea-modern-amenajata-langa-scoala-pro-ingenio/df630904h8e8714gd7e4715dhh059d61.html,images_case/anunt_252_img_0.jpg|images_case/anunt_252_img_1.jpg|images_case/anunt_252_img_2.jpg|images_case/anunt_252_img_3.jpg,4,,,,0,175165.40625,,,0,134334.59375
253,Anunț,169990,EUR,4,335,https://www.publi24.ro/anunturi/imobiliare/de-vanzare/case/case-vile/anunt/duplex-cu-5-camere-de-vanzare-si-teren-de-335-mp-zona-sacalaz/49583103f5627207d40fgdd4df4ddd14.html,images_case/anunt_253_img_0.webp|images_case/anunt_253_img_1.webp|images_case/anunt_253_img_2.webp|images_case/anunt_253_img_3.webp,4,,"Duplex cu 4 camere de vanzare in localitatea Sacalaz. FOXFORT propune spre vanzare casa tip duplex, cu un regim de inaltime Parter + 1 Etaj, situata in Sacalaz, avand un numar de 4 camere, cu o suprafata utila de 107 mp si teren 335 mp. Anul constructiei este 2025, structura beton, material zidarie caramida. Imobilul dispune de urmatoarele utilitati: curent electric, apa, gaz, canalizare, catv, fibra optica. Casa dispune de centrala proprie cu incalzire prin pardoseala si 2 locuri de parcare. Compartimentarea este dispusa dupa cum urmeaza: - Parter: hol, living, baie, dormitor, bucatarie, terasa; - Etaj: hol, 2 dormitoare, baie; - Pod depozitare. Finisajele interioare sunt moderne: - Usa intrare: pvc; - Usi interioare: celulare; - Tamplarie ferestre: pvc; - Podele: parchet, gresie. Pretul este de 169.990€ - COMISION 0%. Se accepta ca si modalitate de plata surse proprii sau credit bancar. Indicator performanta energetica: Clasa A ID intern: V8799 ID anunț : 1761056007",11.10.2019,1416,219025.859375,2019-11-10,2219.0,0,-49035.859375
254,Anunț,139990,EUR,3,84,https://www.publi24.ro/anunturi/imobiliare/de-vanzare/case/case-vile/anunt/comision-0-duplex-cu-3-camere-si-2-bai-zona-giarmata-vii/i869f824906478fi2f5h86id1f0ffdfd.html,images_case/anunt_254_img_0.webp|images_case/anunt_254_img_1.webp|images_case/anunt_254_img_2.webp|images_case/anunt_254_img_3.webp,4,,"Duplex cu 3 camere de vanzare in localitatea Giarmata-Vii. FOXFORT propune spre vanzare casa tip duplex, cu un regim de inaltime Parter + Mansarda, situata in Giarmata-Vii, avand un numar de 3 camere, cu o suprafata utila de 84 mp si teren 282 mp. Anul constructiei este 2021, structura beton, material zidarie caramida. Imobilul dispune de urmatoarele utilitati: curent electric, canalizare, put. Compartimentarea este dispusa dupa cum urmeaza: - Parter: hol, living, baie, bucatarie, terasa; - Mansarda: hol, 2 dormitoare, baie. Finisajele interioare sunt moderne: - Usa intrare: metal; - Usi interioare: celulare; - Tamplarie ferestre: pvc; - Podele: parchet, gresie. Casa dispune de centrala proprie cu incalzire prin pardoseala, pompa de caldura si 2 locuri de parcare. Pretul este de 139.990€ - COMISION 0%. Se accepta ca si modalitate de plata surse proprii sau credit bancar. Indicator performanta energetica: Clasa A ID intern: V8511 ID anunț : 1751630822",11.10.2019,1416,155812.8125,2019-11-10,2219.0,0,-15822.8125
255,Anunț,129990,EUR,2,58,https://www.publi24.ro/anunturi/imobiliare/de-vanzare/case/casa/anunt/casa-individuala-2-camere-58-mpu-curte-si-gradina-332-mp-cisnadie/586i0hef7h317479e5098574167idegf.html,images_case/anunt_255_img_0.webp|images_case/anunt_255_img_1.webp|images_case/anunt_255_img_2.webp|images_case/anunt_255_img_3.webp,4,,,,0,150130.25,,,0,-20140.25
256,Anunț,134990,EUR,4,100,https://www.publi24.ro/anunturi/imobiliare/de-vanzare/case/case-vile/anunt/comision-0-duplex-4-camere-sacalaz-panouri-fotovoltaice/073978i697667g2e165368107f2g3h88.html,images_case/anunt_256_img_0.webp|images_case/anunt_256_img_1.webp|images_case/anunt_256_img_2.webp|images_case/anunt_256_img_3.webp,4,,"Duplex cu 4 camere de vanzare in localitatea Sacalaz, zona Exterior Est. FOXFORT propune spre vanzare casa tip duplex, cu un regim de inaltime Parter + Mansarda + Pod, situata in Sacalaz, zona Exterior Est, avand un numar de 4 camere, cu o suprafata utila de 100 mp si teren 304 mp. Anul constructiei este 2025, structura beton, material zidarie caramida. Imobilul dispune de urmatoarele utilitati: curent electric, gaz, put forat, fosa septica. Compartimentarea este dispusa dupa cum urmeaza: - Parter: hol, living cu bucatarie, baie, camera tehnica, terasa; - Mansarda: hol, 3 dormitoare, 2 bai; - Pod depozitare. Finisajele interioare sunt moderne: - Usa intrare: pvc; - Usi interioare: celulare; - Tamplarie ferestre: pvc; - Podele: parchet, gresie. Stadiul actual al constructiei se afla la ROSU, cu termen de predare la cheie in 11.2025 Duplexul va beneficia de instalatie panouri solare de 3KW. Dispune de centrala proprie cu incalzirea prin  pardoseala si 2 locuri de parcare. Pretul este de 134.990€ - COMISION 0% Se accepta ca si modalitate de plata surse proprii sau credit bancar. Indicator performanta energetica: Clasa A ID intern: V8319 ID anunț : 1747222424",11.10.2019,1416,256742.09375,2019-11-10,2219.0,0,-121752.09375
257,Anunț,230000,EUR,4,2000,https://www.publi24.ro/anunturi/imobiliare/de-vanzare/case/casa/anunt/casa-individuala-zona-centrala-radauti/0g5ee7dd49d17467184100979dh5i134.html,images_case/anunt_257_img_0.jpg|images_case/anunt_257_img_1.jpg|images_case/anunt_257_img_2.jpg|images_case/anunt_257_img_3.jpg,4,,"Blitz va ofera o casă cu etaj, situată la doar 5 minute de centrul orașului, care este o oportunitate unică pentru cei care caută un loc deosebit, gata să devină un camin personalizat. Cu un design spațios și o locație convenabilă, această proprietate poate deveni baza perfectă pentru un stil de viață urban. La intrarea în casă, veți fi întâmpinați de un living generos și luminos, oferind un spațiu perfect pentru relaxare și socializare. Designul său deschis încurajează interacțiunea familială și conferă casei un aer prietenos. Bucătăria modernă oferă un fundal perfect pentru a vă pune în practică talentul culinar. Spațiul este generos și permite personalizarea în funcție de preferințe. Parterul găzduiește două camere versatile - un dormitor spațios și o cameră de birou, permitând flexibilitate în utilizarea spațiului. Baia la parter, cu gresie si faianta va ofera libertatea de a alege finisajele potrivite și de a adăuga propria notă personală. Accesul facil la un spațiu tehnic eficient este esențial pentru întreținerea facilă a casei. La etaj, patru dormitoare oferă spațiu privat pentru membrii familiei. Fiecare cameră vă oferă șansa de a le amenaja după propriul gust. Un al doilea living la etaj este ideal pentru momentele de intimitate sau petreceri mai mici, adăugând un nivel suplimentar de flexibilitate spațiului. Baia de la etaj, cu gresie, faianță și cadă poate fi personalizată pentru a satisface nevoile și preferințele locuitorilor. Cele două terase mari, una la parter și una la etaj, oferă locuri perfecte pentru a vă bucura de aerul proaspăt și a contempla peisajul înconjurător. În curte, un foisor cu bucătărie adaugă un spațiu suplimentar pentru activități sociale și petreceri în aer liber. Două garaje spațioase asigură locuri de parcare sigure pentru vehicule, iar magazia oferă spațiu suplimentar pentru depozitare. Casa este echipată cu toate utilitățile necesare, încălzire prin pardoseală, asigurând confortul și funcționalitatea. Totuși, fiind în stadiu semifinisat, aveți libertatea de a adăuga elementele dorite. Această proprietate reprezintă o casă ideală pentru cei care doresc să își pună amprenta personală asupra spațiului de locuit și să creeze o casă pe măsura visurilor lor. Este o oportunitate rară de a avea o locuință la doar câteva minute de centrul orașului, cu posibilitatea de a adăuga propria notă de eleganță și confort. Va invitam la vizionare! Cod ofertă / ID BLITZ: P101005 ID anunț : 1724859214",07.05.2021,9948,158014.609375,2021-07-05,1616.0,0,71985.390625
258,Anunț,98000,EUR,4,134,https://www.publi24.ro/anunturi/imobiliare/de-vanzare/case/casa/anunt/casa-p-m-la-strada-principala-dragutesti/4114486e1h037e8hd3319g79g1gdi176.html,images_case/anunt_258_img_0.webp|images_case/anunt_258_img_1.webp|images_case/anunt_258_img_2.webp|images_case/anunt_258_img_3.webp,4,,,,0,128546.578125,,,0,-30546.578125
259,Anunț,137990,EUR,4,119,https://www.publi24.ro/anunturi/imobiliare/de-vanzare/case/case-vile/anunt/comision-0-duplex-4-camere-bucovat-calitate-premium/7g9884ed38gi7059228h40di4he902gd.html,images_case/anunt_259_img_0.webp|images_case/anunt_259_img_1.webp|images_case/anunt_259_img_2.webp|images_case/anunt_259_img_3.webp,4,,"Duplex cu 4 camere de vanzare in localitatea Bucovat (Remetea Mare). FOXFORT propune de vanzare casa tip duplex, cu un regim de inaltime Parter + 1 Etaj, situata in Bucovat (Remetea Mare), avand un numar de 4 camere, cu o suprafata utila de 119 mp si teren 250 mp. Anul constructiei este 2022, structura beton, material zidarie caramida. Imobilul dispune de urmatoarele utilitati: curent electric, apa, gaz, put, fosa septica, catv, fibra optica. Casa dispune de centrala proprie cu incalzire in pardoseala si 3 locuri de parcare. Beneficii imobil: - Semineu; - Sistem centralizat de aspirare; - Scari imbracate in lemn si iluminate pe senzor; - Zid despartitor dublu + izolatie de polistiren; - Parchet triplu stratificat; - Posibilitate amenajare mansarda. Compartimentarea este dispusa dupa cum urmeaza: - Parter: hol, living, baie, bucatarie inchisa, camera tehnica, terasa; - Etaj: hol, 3 dormitoare, 2 bai; - Pod depozitare - posibilitate amenajare mansarda. Finisajele interioare sunt moderne si calitative: - Usa intrare: pvc; - Usi interioare: celulare; - Tamplarie ferestre: pvc; - Podele: parchet, gresie. Pretul este de 137.990€ - COMISION 0%. Se accepta ca si modalitate de plata surse proprii sau credit bancar. ID intern: V6218 ID anunț : 1718268572",11.10.2019,1416,176218.46875,2019-11-10,2219.0,0,-38228.46875
260,Anunț,254990,EUR,5,123,https://www.publi24.ro/anunturi/imobiliare/de-vanzare/case/case-vile/anunt/comision-0-casa-individuala-5-camere-sacalaz-garaj-incorporat/iediie44ee0d7023d21efd71g5fe8196.html,images_case/anunt_260_img_0.webp|images_case/anunt_260_img_1.webp|images_case/anunt_260_img_2.webp|images_case/anunt_260_img_3.webp,4,,"Casa individuala cu 5 camere de vanzare in localitatea Sacalaz, zona Central. FOXFORT propune de vanzare casa tip individuala, cu un regim de inaltime Parter + 1 Etaj + Pod, situata in Sacalaz, zona Central, avand un numar de 5 camere, cu o suprafata utila de 123 mp si teren 500 mp. Anul constructiei este 2024, structura beton, material zidarie caramida. Imobilul dispune de urmatoarele utilitati: curent electric, apa, canalizare, bransare gaz contract semnat-procedura in curs extindere retea. Compartimentarea este dispusa dupa cum urmeaza: - Parter: hol, living, dormitor, baie, bucatarie, terasa, garaj. - Etaj: hol, 3 dormitoare, baie, balcon; - Pod depozitare. Finisajele interioare sunt moderne: - Usa intrare: pvc; - Usi interioare: panel; - Tamplarie ferestre: pvc; - Podele: parchet, gresie. Se vinde nemobilata si neutilata. Proprietatea se afla in zona centrala, predarea la cheie va dispune de toate utilitatiile. Casa dispune de centrala proprie cu incalzire prin pardoseala si 1 loc de parcare. Pretul este de 254.990€- COMISION 0% Se accepta ca si modalitate de plata surse proprii sau credit bancar. Indicator performanta energetica: Clasa B ID intern: V7187 ID anunț : 1725016976",11.10.2019,1416,167678.046875,2019-11-10,2219.0,0,87311.953125
261,Anunț,158990,EUR,4,115,https://www.publi24.ro/anunturi/imobiliare/de-vanzare/case/case-vile/anunt/duplex-cu-4-camere-si-teren-de-270-mp-2-locuri-de-parcare-ghiroda/5h8h5d63108d77d6e4h13f2h0g712gf5.html,images_case/anunt_261_img_0.webp|images_case/anunt_261_img_1.webp|images_case/anunt_261_img_2.webp|images_case/anunt_261_img_3.webp,4,,"Duplex cu 4 camere de vanzare in localitatea Ghiroda. FOXFORT propune spre vanzare casa tip duplex, cu un regim de inaltime Parter + Mansarda, situata in Ghiroda, avand un numar de 4 camere, cu o suprafata utila de 115 mp si teren 270. Anul constructiei este 2025, structura beton, material zidarie caramida. Imobilul dispune de urmatoarele utilitati: curent electric, apa, canalizare, gaz, catv, fibra optica. Casa dispune de centrala proprie si termostat in fiecare incapere cu incalzire prin pardoseala si 2 locuri de parcare. Finisajele se pot alege de catre client. Compartimentarea este dispusa dupa cum urmeaza: - Parter: hol, living, baie, bucatarie, terasa; - Mansarda: hol, 3 dormitoare, baie. Finisajele interioare sunt moderne: - Usa intrare: pvc; - Usi interioare: celulare; - Tamplarie ferestre: pvc; - Podele: parchet, gresie. Pretul este de 158.990€ Comision 0%. Se accepta ca si modalitate de plata surse proprii sau credit bancar. ID intern: V8414 ID anunț : 1749112284",11.10.2019,1416,257204.21875,2019-11-10,2219.0,0,-98214.21875
262,Anunț,365000,EUR,3,324,https://www.publi24.ro/anunturi/imobiliare/de-vanzare/case/case-vile/anunt/vand-casa-mehala/06dd8fhdi47g796hd10f8203ggd07h10.html,images_case/anunt_262_img_0.jpg|images_case/anunt_262_img_1.jpg|images_case/anunt_262_img_2.jpg|images_case/anunt_262_img_3.jpg,4,,vand casa mehala 2 dormitoare living bucatarie închisă doua bai cămară camera tehnica teren 420metri patrati ID anunț : 1733650842,22.09.2019,1,171969.953125,2019-09-22,2268.0,0,193030.046875
263,Anunț,214990,EUR,6,153,https://www.publi24.ro/anunturi/imobiliare/de-vanzare/case/case-vile/anunt/comision-0-casa-individuala-6-camere-de-vanzare-remetea-mare-centru/e6d108h5218e79ff16hee98f5934d09d.html,images_case/anunt_263_img_0.webp|images_case/anunt_263_img_1.webp|images_case/anunt_263_img_2.webp|images_case/anunt_263_img_3.webp,4,,,,0,161761.09375,,,0,53228.90625
264,Anunț,175000,EUR,3,500,https://www.publi24.ro/anunturi/imobiliare/de-vanzare/case/casa/anunt/casa-deosebita-de-vanzare-cu-3-camere-sura-mare-sibiu-500-mp-teren/07f023800if072i412g2gf4igdh79327.html,images_case/anunt_264_img_0.webp|images_case/anunt_264_img_1.webp|images_case/anunt_264_img_2.webp|images_case/anunt_264_img_3.webp,4,,"Cauti o locuinta ideala pentru tine si pentru familia ta in Sura Mare? Iti doresti o casa intr-o zona linistita, cu curte? TABOO Imobiliare iti propune aceasta casa de vanzare cu 3 camere in zona , Sura Mare. Terenul casei are o suprafata totala de 500 mp , iar suprafata utila a casei este de 100 mp . Structura cladirii este din caramida, are sistem de incalzire cu centrala pe lemne, incalzire pardoseala , calorifere si sistem de climatizare aer conditionat . Casa a fost construita in anul 2017 , renovata in 2022 si are suprafata construita de 147 mp. Casa este de tip individuala , cu un regim de inaltime Parter + mansarda. Este compartimentata astfel: ~ Parter: hol, living, baie, bucatarie, terasa ,doua dormitoare; ~ Pod pregatit pentru mansardare . Casa are o curte libera 353 mp cu locuri de parcare, loc pentru zona de joaca a copiilor, 1 terasa de relaxare si spatiu de depozitare. Casa se vinde mobilata complet si utilata. Zona unde este amplasata casa  este foarte bine cotata pe piata imobiliara din Sura Mare cu o priveliste deosebita asupra orasului. Finisajele interioare sunt moderne: ~ Usa intrare: pvc; ~ Usi interioare: celulare; ~ Tamplarie ferestre: pvc, termopan; ~ Podele: parchet, gresie; ~ Finisaj: finisat; ~ Pereti: vopsea lavabila, faianta. Pret: 175.000€ Cod ofertă / ID: P23102 Sună-ne acum la 0369.823.823 și află detalii despre această proprietate de vanzare din Sura Mare, dar și despre alte proprietăți potrivite pentru tine. Apartamente de vanzare Sibiu Case de vanzare Sibiu Informatii speciale: 1. Descarcă aplicația de mobilul tau "" TABOO Imobiliare "" din Apple Store, Google Play sau Huawei AppGallery pentru a afla instantaneu noile proprietăți care intră pe piață. 2. Dacă ai o proprietate pe care vrei să o vinzi sau să o închiriezi , suntem aici pentru tine! Contactează-ne pentru o evaluare gratuită fără obligații și vei descoperi avantajele de a lucra cu o echipă dedicată și experimentată. 3. Dacă vrei sa incepi o cariera de agent imobiliar , suna la 0369.823.823 si programeaza o intalnire pentru a afla toate beneficiile si avantajele. Intra pe www.TABOO.ro și descoperă cele mai recente oferte, actualizate zilnic. ID anunț : 1742483618",03.05.2018,1329,175151.90625,2018-03-05,2834.0,0,-151.90625
265,Anunț,595000,EUR,4,529,https://www.publi24.ro/anunturi/imobiliare/de-vanzare/case/case-vile/anunt/vila-contemporana-finisaje-interioare-lux-gradina-interioara/d918310f8h4f706feg4ege200i2461de.html,images_case/anunt_265_img_0.jpg|images_case/anunt_265_img_1.jpg|images_case/anunt_265_img_2.jpg|images_case/anunt_265_img_3.jpg,4,,"Această proprietate impresionantă combină designul modern cu dotări de lux, oferind tot confortul necesar unei locuințe premium. Exteriorul casei îmbină stilul contemporan cu funcționalitatea, având o fațadă geometrică dominată de ferestre mari cu tâmplărie din aluminiu îmbrăcată în lemn. Grădina spațioasă oferă un spațiu verde ideal pentru relaxare, în timp ce terasa acoperită din grădină este perfectă pentru mese în aer liber, cu zonă de grătar și spațiu dedicat pentru luat masa. Casa dispune de o grădină interioară care adaugă un element natural în centrul spațiului, creând o atmosferă relaxantă și luminoasă. Feroneria casei este realizată din aluminiu îmbrăcat în lemn, ceea ce asigură durabilitate și un aspect elegant. Interiorul este o adevărată oază de lux. În băi, s-au folosit finisaje de calitate superioară precum marmură, granit și mozaic, iar ușile interioare sunt realizate din lemn și MDF, adăugând un plus de rafinament. Mobilierul, de proveniență italiană, este de cea mai înaltă calitate, reflectând un stil contemporan elegant și funcțional. Încălzirea se face atât prin pardoseală, calorifere cât și prin ventiloconvectoare, iar sistemul de climatizare centralizat asigură confortul termic pe tot parcursul anului. Distribuția proprietății: Parter: Zona principală de locuit include un birou, trei dormitoare fiecare cu baie proprie și dressing, dintre care dormitorul matrimonial se remarcă prin jacuzzi-ul îngropat. Livingul spațios este dotat cu un șemineu modern și este conectat cu zona de dining și bucătăria flancată de un perete, dar cu un design deschis. Grădina interioară centralizează dormitoarele copiilor și livingul, oferind un cadru unic și natural în mijlocul locuinței. Etaj: La etaj se află un dormitor cu terasă proprie, o sală de sport, o cameră de joacă și o spălătorie care include și o mică bucătărie. De asemenea, există o altă terasă spațioasă care oferă multiple opțiuni de relaxare. Exterior: Grădina include o terasă acoperită, ideală pentru petreceri și grătare, având o zonă dedicată pentru luat masa în aer liber. Transparență și detalii suplimentare: Proprietarul dorește să fie complet transparent în legătură cu starea imobilului. Există unele probleme la nivelul fațadei, unde este necesară schimbarea tencuielii decorative, precum și mici infiltrații provenite de la grădina interioară. În acest sens, s-a realizat un raport de constatare întocmit de un inginer specializat în expertize. Scopul inspecției a fost de a viziona toate zonele imobilului accesibile la momentul evaluării, pentru a identifica aspecte ce țin de structură, instalații și calitatea componentelor imobilului. Această proprietate este ideală pentru cei care caută un stil de viață exclusivist, într-un mediu modern și confortabil. Fiecare detaliu a fost gândit cu grijă pentru a oferi lux și funcționalitate, în timp ce designul contemporan îmbinat cu elemente naturale creează o locuință cu adevărat deosebită. ID anunț : 1724112872",03.03.2023,68,195213.578125,2023-03-03,1010.0,0,399786.421875
266,Anunț,145000,EUR,4,0,https://www.publi24.ro/anunturi/imobiliare/de-vanzare/case/case-vile/anunt/casa-4-camere-finalizata-intabulata-cartier-izvor-tarlungeni/d25e2he751097ghid870h52igd496791.html,images_case/anunt_266_img_0.webp|images_case/anunt_266_img_1.webp|images_case/anunt_266_img_2.webp|images_case/anunt_266_img_3.webp,4,,,28.07.2025,35,209330.0625,2025-07-28,132.0,0,-64330.0625
267,Anunț,460000,EUR,6,232,https://www.publi24.ro/anunturi/imobiliare/de-vanzare/case/case-vile/anunt/cotroceni-davila-vila-d-p-2-232-mp-total-terasa-intima/4f4g75i4hi11774hd7344g0e5hg277e1.html,images_case/anunt_267_img_0.webp|images_case/anunt_267_img_1.webp|images_case/anunt_267_img_2.webp|images_case/anunt_267_img_3.webp,4,,"COTROCENI - DAVILA, VILA D+P+2, 232 MP TOTAL, TERASA INTIMA. Proprietate situata in Cotroceni, pe Aleea Medic Col. Dr. Stoenescu, fara trafic, din Str. Carol Davila, foarte aproape de Gradina Botanica. Vila solida si eleganta, cu spatii bine proportionate, potrivita atat pentru locuinta, pentru o famile cu 1-2 copii, cat si pentru birouri, cabinete, firma sau un concept mixt locuinta/birou. Imobil liber, igienizat, dispus pe demisol, parter, doua etaje si doua intrari, putand fi folosit integral sau pe apartamente. Camere mari, 4 bai, 6 dormitoare, bucatarie mare cu dining la demisol, cu acces la o terasa superba, termopan, AC, centrala proprie, balcon la etajul 1. ID anunț : 1756482235",06.11.2019,48,185474.59375,2019-06-11,2371.0,0,274525.40625
268,Anunț,195000,EUR,4,500,https://www.publi24.ro/anunturi/imobiliare/de-vanzare/case/case-vile/anunt/casa-noua-deosebita-4-camere-teren-500-mp-cartier-izvor/916fe71deh6d76i61gf0dg73i1g528f9.html,images_case/anunt_268_img_0.webp|images_case/anunt_268_img_1.webp|images_case/anunt_268_img_2.webp|images_case/anunt_268_img_3.webp,4,,"ATENTIE ! Casa este la stadiul de 99 % gata ,finisajele interioare RAMAN    la alegerea clientului , care intr-o luna, dupa primirea unui avans  de catre proprietar , clientii se pot muta in casa , PROPRIETARUL SE OCUPA DE MONTAJ DE TOT ! Se oferă spre vânzare o casă individuală situată în cartierul Izvor, județul Brașov, parte dintr-un proiect imobiliar modern de locuințe noi. Proprietatea beneficiază de o parcelă generoasă de 500 mp și o amprentă la sol de 154,8 mp, având o suprafață utilă de 108 mp. Locuința este compusă din 3 dormitoare spațioase, 2 băi, living open space cu bucătărie, hol și o terasă acoperită de 21,75 mp, ideală pentru relaxare. Construcția este realizată integral pe parter, folosindu-se materiale de calitate superioară: cărămidă T30, izolație exterioară EPS 80+, izolație tavane cu vată bazaltică de 15 cm și acoperiș din tablă Bilka de 0,65 mm. Ferestrele mari, cu termopane Salamander tripan (7 camere) ,asigură lumină naturală abundentă și eficiență energetică. Încălzirea este în pardoseală, oferind confort termic optim. Casa dispune și de un pod de 60 mp utili, cu înălțime de 2 m, perfect pentru depozitare. Curtea amenajată include alee pietonală și acces auto pavate, restul fiind acoperit cu gazon. Gardul este din lemn cu stâlpi de beton, iar deschiderea terenului este de 19 m. Proprietatea este racordată la gaz, curent și apă, canalizarea fiind asigurată prin fosă septică megaperformantă. Casa se află la asfalt, într-o zonă liniștită și accesibilă, gata să devină noul tău cămin. Va asteptam la vizionare! Cod ofertă / ID BLITZ: P157360 ID anunț : 1762509231",07.05.2021,9948,254942.703125,2021-07-05,1616.0,0,-59942.703125
269,Anunț,175000,EUR,3,500,https://www.publi24.ro/anunturi/imobiliare/de-vanzare/case/casa/anunt/casa-deosebita-de-vanzare-cu-3-camere-sura-mare-sibiu-500-mp-teren/07f023800if072i412g2gf4igdh79327.html,images_case/anunt_269_img_0.webp|images_case/anunt_269_img_1.webp|images_case/anunt_269_img_2.webp|images_case/anunt_269_img_3.webp,4,,,,0,175151.90625,,,0,-151.90625
270,Anunț,85000,EUR,3,76,https://www.publi24.ro/anunturi/imobiliare/de-vanzare/case/case-vile/anunt/casa-zona-maria/eeih27h8h7i571i0e9ghhf331ee51898.html,,0,,"Vand casa in zona Maria la 5 min de centru, casa este veche la curte comuna , cladirea necesita unele renovari ,nu are ziduri comune cu celelalte cladiri din curte , utilitati (apa, canalizare ,curent, gaz ) , are doua intrari separate , pret in euro ,alte relati O 747 noua67 doi37 intre orele 09-18 ID anunț : 1759921956",06.11.2009,11,21531.298828125,2009-06-11,6023.0,0,63468.701171875
271,Anunț,209990,EUR,5,132,https://www.publi24.ro/anunturi/imobiliare/de-vanzare/case/case-vile/anunt/duplex-exclusivist-mosnita-zona-serena-1-v2959/fe146ee99289719h2e9f686e144i2efi.html,images_case/anunt_271_img_0.webp|images_case/anunt_271_img_1.webp|images_case/anunt_271_img_2.webp|images_case/anunt_271_img_3.webp,4,,"Id intern: V2959 Duplex Exclusivist Mosnita - Zona Serena 1 FOXFORT Imobiliare propune spre de vanzare casa tip duplex, cu un regim de inaltime Parter + Etaj, situata in localitatea Mosnita Noua, avand un numar de 5 camere, cu o suprafata utila de 132 mp si teren 324 mp. Casa este in constructie, structura acesteia fiind din beton armat, pereti din caramida. Dormitoarele imobilului nu au perete comun cu dormitoarele din cealalta jumatate. Curtea va fi amenajata cu alei din pavaj. Imobilul este situat la 300 m de Cartier Serena 1 si la 300 m  de statii transport in comun si la 3 minute de Lidl si Penny. Compartimentarea este dispusa dupa cum urmeaza: - Parter: hol, living, baie, bucatarie, dormitor/birou, terasa, spatiu depozit; - Etaj: hol, 3 dormitoare, 2 bai, dressing, balcon; - Pod depozitare. Finisajele interioare sunt calitative si moderne: - Usa intrare: pvc; - Usi interioare: celulare; - Tamplarie ferestre: pvc; - Podele: parchet, gresie. Casa dispune de 2 locuri de parcare. Se accepta ca si modalitate de plata creditul ipotecar. Pretul este de 209.990€ + comisionul standard al agentiei. Indicator performanta energetica: Clasa A Pentru a vedea toate ofertele valabile actualizate periodic, cu preturi reale si ultimele anunturi imobiliare adaugate intrati acum pe site-ul oficial FOXFORT Imobiliare: foxfort.ro Precizati intotdeauna ca ati vazut oferta cu ID: V2959 Sediu agentie: Strada Mures, Nr. 39A, Timisoara, Timis. Mai multe detalii la telefon: 0374.069.727 ID anunț : 1644915462",11.10.2019,1416,194662.8125,2019-11-10,2219.0,0,15327.1875
272,Anunț,390000,EUR,7,1012,https://www.publi24.ro/anunturi/imobiliare/de-vanzare/case/case-vile/anunt/de-vanzare-casa-individuala-cu-teren-de-1012-mp-situata-in-gheorgheni/00f23g63710f73h9e0541d81i2hef9d1.html,images_case/anunt_272_img_0.webp|images_case/anunt_272_img_1.webp|images_case/anunt_272_img_2.webp|images_case/anunt_272_img_3.webp,4,,"Cauti o casa spatioasa in Cluj-Napoca pentru tine si familia ta? Vrei sa ai un stil de viata exclusivist intr-una din cele mai cautate zone din Cluj-Napoca? TABOO Imobiliare iti propune aceasta casa de vanzare cu 7 camere in zona Gheorgheni, Cluj-Napoca. Casa are un stil modern si este situata in una dintre cele mai cotate zone pe piata imobiliara din orasul Cluj-Napoca. Suprafata construita este de 658 mp, teren cu suprafata totala de 1012 mp si casa cu suprafata utila de 540 mp. Structura cladirii este realizata din caramida, are sistem de incalzire cu centrala proprie, calorifere si sistem de climatizare. Casa este complet mobilata si utilata, curent electric, apa, canalizare, gaz, catv, telefon, acces internet, fibra optica. Casa este compartimentata si este compusa din: ~ Demisol: spatiu depozitare, sala de jocuri, sauna, inca o incapere ~ Parter: camera separata cu jacuzzi, baie, hol, living, baie, bucatarie, terasa; ~ Etaj: hol, 3 dormitoare, 3 bai, balcon; In partea exerioara a casei se regaseste o curte libera de 760 mp cu 2 locuri de parcare, loc pentru zona de joaca a copiilor, terasa de relaxare si spatiu de depozitare. Imobilul este situat in apropiere de facultati, insitituii publice, insitutii bancare, scoli si statii pentru mijloace de transport public. Finisajele interioare sunt clasice: ~ Usa intrare: metal; ~ Usi interioare: lemn; ~ Tamplarie ferestre: pvc, termopan; ~ Podele: parchet, gresie; ~ Finisaj: finisat; ~ Pereti: vopsea lavabila. Pret: 1.390.000€ Cod ofertă / ID: P25277 Sună-ne acum la 0369.823.823 și află detalii despre această proprietate de vanzare din Cluj-Napoca, dar și despre alte proprietăți potrivite pentru tine. Apartamente de vanzare Sibiu Case de vanzare Sibiu Informatii speciale: 1. Descarcă aplicația de mobilul tau "" TABOO Imobiliare "" din Apple Store, Google Play sau Huawei AppGallery pentru a afla instantaneu noile proprietăți care intră pe piață. 2. Dacă ai o proprietate pe care vrei să o vinzi sau să o închiriezi , suntem aici pentru tine! Contactează-ne pentru o evaluare gratuită fără obligații și vei descoperi avantajele de a lucra cu o echipă dedicată și experimentată. 3. Dacă vrei sa incepi o cariera de agent imobiliar , suna la 0369.823.823 si programeaza o intalnire pentru a afla toate beneficiile si avantajele. Intra pe www.TABOO.ro și descoperă cele mai recente oferte, actualizate zilnic. ID anunț : 1761058960",03.05.2018,1329,201228.015625,2018-03-05,2834.0,0,188771.984375
273,Anunț,352000,EUR,5,3,https://www.publi24.ro/anunturi/imobiliare/de-vanzare/case/case-vile/anunt/casa-tip-duplex-dumbravita-v1146/5iigdeg23dg17e2526d81660igi58d1f.html,images_case/anunt_273_img_0.webp|images_case/anunt_273_img_1.webp|images_case/anunt_273_img_2.webp|images_case/anunt_273_img_3.webp,4,,"ID intern: V1146 FOXFORT Imobiliare va propune spre vanzare casa tip duplex la alb interior/exterior finalizat, cu un regim de inaltime P+1E, situata in zona Decathlon, localitatea Dumbravita, avand un numar de 5 camere, cu o suprafata utila de 157,3 mp si teren 340 mp. Structura acesteia este din beton, pereti din caramida Porotherm de 44 cm, tencuiala manuala interior/exterior, zugravit pe baza de var pentru a respira peretii si pentru a oferii conditii de trai intr-un mediu igienic si ""bio"". Se va personaliza in functie de preferintele cumparatorului la tot ce tine de finisaje. Imobilul este situat in apropiere de accesul din zona Aradului, intr-o zona linistita. Exteriorul este tencuit manual avand o grosime de 2-3 cm, urmat de un strat de tinci, iar decorativa este realizata din ciment alb si praf de marmura. La interior s-a folosit o tencuiala manuala pe baza de var, iar finisajul peretiilor este realizat din tinci (2 mâini) . Compartimentarea este dispusa dupa cum urmeaza: - Parter: hol, living, baie, bucatarie, dormitor, terasa; - Etaj: hol, 3 dormitoare din care unul cu baie proprie, baie. Finisajele interioare sunt moderne: - Usa intrare: pvc tripan Salamander; - Tamplarie ferestre: pvc tripan Salamander ; Se poate opta pentru varianta la CHEIE si se ofera buget pentru gresie, faianta, parchet, usi interioare, bai, scara interioara (va fi de metal si se poate imbraca in ceea ce-si doreste clientul). Casa va dispune de 2 locuri de parcare, semineu, gazon, gard, put forat pentru sistemul de irigare(inclus). Se accepta ca si modalitate de plata creditul ipotecar. Pretul este de 352000€ + comisionul standard al agentiei. Pentru a vedea toate ofertele valabile actualizate periodic, cu preturi reale si ultimele anunturi imobiliare adaugate intrati acum pe site-ul oficial FOXFORT Imobiliare: foxfort.ro Precizati intotdeauna ca ati vazut oferta cu ID: V1146 Sediu agentie: Strada Mures, Nr. 39A, Timisoara, Timis ID anunț : 1612900683",11.10.2019,1416,167623.40625,2019-11-10,2219.0,0,184376.59375
274,Anunț,35000,EUR,5,31,https://www.publi24.ro/anunturi/imobiliare/de-vanzare/case/case-vile/anunt/de-vanzare-casa/271541f1efg171h7edfiff6dhe480e13.html,images_case/anunt_274_img_0.webp|images_case/anunt_274_img_1.webp|images_case/anunt_274_img_2.webp|images_case/anunt_274_img_3.webp,4,,"Vand casa in zona Vulturu, Vrancea pret negociabil, detalii in privat pe mail. ID anunț : 1760208755",09.08.2025,1,153438.0625,2025-09-08,90.0,1,-118438.0625
275,Anunț,249990,EUR,4,118,https://www.publi24.ro/anunturi/imobiliare/de-vanzare/case/case-vile/anunt/casa-superba-complet-mobilata-la-15-minute-de-oras-id-v4992/5df31ef6g3f97df0df407121ef8hf7g8.html,images_case/anunt_275_img_0.webp|images_case/anunt_275_img_1.webp|images_case/anunt_275_img_2.webp|images_case/anunt_275_img_3.webp,4,,,,0,153192.75,,,0,96797.25
276,Anunț,399800,EUR,4,193,https://www.publi24.ro/anunturi/imobiliare/de-vanzare/case/case-vile/anunt/film-tur-3d-locuinta-rafinata-arhitectura-cu-personalitate-asezare-cautata-livezeni-mures/d067ig4higd17860dgg4g0e80gd0785d.html,images_case/anunt_276_img_0.jpg|images_case/anunt_276_img_1.jpg|images_case/anunt_276_img_2.jpg|images_case/anunt_276_img_3.jpg,4,,"Comision cumparator:0% ASCENDENT IMOBILIARE TARGU MURES va propune: Vila de Lux cu Arhitectura Moderna, Confort si Securitate de Top Descoperiti aceasta superba vila cu arhitectura moderna, finalizata in 2019, ce ofera o locuinta ideala pentru cei care apreciaza eleganta, confortul si siguranta. Situata pe un teren generos de 16,2 arii, aceasta proprietate se remarca prin finisajele premium si dotarile de top. Va invitam sa experimentati o vizionare initiala, din locatia unde va aflati, chiar acum, prin accesarea turului virtual  si a filmului de prezentare: Tur virtual tridimensional: https:  my.matterport.com show ?m=RopYL4g4Jrt Film prezentare: https:  www.youtube.com watch?v=M9xOiMw995Q Detalii Tehnice si Structurale: Suprafata utila: 193 mp | Desfasurata: 360 mp; Constructie solida, cu fundatie din beton, zidarie Porotherm si izolatie termica superioara; Acoperis durabil din tigla Bramac; Instalatie electrica premium, cu cablaj separat pe fiecare nivel; Geamuri termopan de calitate germana. Interior de Lux si Functionalitate: Parter: Hol primitor cu dulap incorporat; Bucatarie open space, complet echipata cu aparatura AEG: cuptor incorporat, plita cu inductie, cuptor cu microunde, hota tip insula, frigider LG Side by Side; Living spatios tip loft, cu semineu modern si incalzire in pardoseala de ultima generatie; Dormitor generos si un dressing complet utilat; Baie moderna, complet echipata, cu dus walk-in. Mansarda: 3 dormitoare mobilate cu gust; Baie moderna cu cada si oglinda smart; Acces la terasa de 50 mp cu gazon artificial din doua dormitoare si balcon de 7 mp din al treilea dormitor. Spatii Exterioare Amenajate: Terasa de 100 mp la nivelul solului; Curte pavata cu piatra naturala, iluminata ambiental; Garaj dublu automatizat, cu rigole de scurgere si spatiu de depozitare suplimentar; Pivnita cu usa culisanta; Doua terase suplimentare de 70 mp, amplasate deasupra garajului si depozitului; Fantana cu hidrofor; Foisor acoperit cu tigla Bramac, inconjurat de plante ornamentale, tuia si pomi fructiferi; Aleile din jurul casei pavate cu granit; Teren complet imprejmuit cu gard si terasat pe 4 nivele. Confort si Securitate de Varf: Confort termic asigurat de centrala Vaillant, incalzire in pardoseala si semineu modern; la mansarda sunt disponibile calorifere; Sistem de securitate avansat: alarma BSG, camere de supraveghere, senzori de miscare in fiecare incapere; Cablu TV si internet de mare viteza; Iluminare LED interior-exterior, cu lumini ambientale; Mobilier MDF personalizat, de inalta calitate. Aceasta vila reprezinta combinatia perfecta intre design modern, functionalitate si siguranta, fiind alegerea ideala pentru o familie care isi doreste un camin deosebit, in care luxul si confortul sunt la ele acasa. Nu ratati oportunitatea de a deveni proprietarul acestei bijuterii imobiliare! Se accepta ca si metoda de plata credit , cash si BTC. Invitam colegii la colaborare, onoram agentul  agentia partenera cu comisionul aferent! Detalii, fotografii suplimentare, precum si alte variante similare exclusive: www.ascendentimobiliare.ro ID anunț : 1763502226",23.05.2018,500,208931.59375,2018-05-23,2755.0,0,190868.40625
277,Anunț,474990,EUR,5,165,https://www.publi24.ro/anunturi/imobiliare/de-vanzare/case/case-vile/anunt/ocazie-casa-individuala-5-camere-165-mp-in-dumbravita/ff3ei32f47fh7hdge9g7if5ef7i99if5.html,images_case/anunt_277_img_0.webp|images_case/anunt_277_img_1.webp|images_case/anunt_277_img_2.webp|images_case/anunt_277_img_3.webp,4,,"Proprietate superba formata din doua corpuri de cladire, in centrul Dumbravitei, aproape de primarie, scoala, gradinita, parcuri, piata, terenuri de sport si mijloc de transport in comun, pe partea cu padurea. FOXFORT propune spre vanzare proprietate formata din 2 corpuri de cladire, cu un regim de inaltime Parter + 1 Etaj, situata in Dumbravita, zona Stadion. Corpul 1 : avand un numar de 5 camere, cu o suprafata utila de 165 mp, beci 17 mp, pod si terasa 22.5 mp. Corpul 2: open space cu o suprafata utila de 52 mp si teren 560 mp. Anul constructiei este 1999, structura beton, material zidarie caramida. Imobilul dispune de urmatoarele utilitati: curent electric, apa, canalizare, gaz, catv, fibra optica, sistem irigatie. Compartimentarea este dispusa dupa cum urmeaza: Corp 1: La parter regasim un hol larg, din care se face accesul la casa scarii, un birou de 16 mp, o bucatarie inchisa de 16 mp, o baie cu dus, o camera tehnica, spatiu de depozitare sub scari, un living plus loc de luat masa - 30 mp. Etajul are urmatoarea configuratie: hol larg, din care se face accesul in pod, un dormitor matrimonial cu baie proprie cu dus si dressing, in suprafata totala de 32 mp, plus doua dormitoare a cate 16 mp fiecare si o baie cu cada. Corpul 2 : Are o suprafata utila de 52 mp, centrala proprie pe gaz, iar incalzirea se face prin intermediul caloriferelor. Imobilul este izolat cu polistiren si are tamplarie pvc. Acesta este format dintr-un living cu bucatarie deschisa, in suprafata de 46 mp, o camara si o baie cu dus. Finisajele interioare sunt de lux: - Usa intrare: pvc; - Usi interioare: celulare; - Tamplarie ferestre: pvc; - Podele: gresie. Imobilul se vinde mobilata si utilata: plita, cuptor, hota, masina de spalat rufe, masina de spalat vase, frigider cu congelator. Casa dispune de centrala proprie cu incalzire prin pardoseala, 2 locuri de parcare, curtea este amenajata cu gazon (rulou), sistem de irigatii automatizat, are o gradina de legume, o terasa si spatii de depozitare. Pretul este de 474.990€ + comisionul standard al agentiei. Se accepta ca si modalitate de plata surse proprii sau credit bancar. ID intern: V7406 ID anunț : 1729600367",11.10.2019,1416,172775.078125,2019-11-10,2219.0,0,302214.921875
278,Anunț,211900,EUR,4,120,https://www.publi24.ro/anunturi/imobiliare/de-vanzare/case/casa/anunt/casa-individuala-120-mpu-4-camere-pivnita-teren-liber-230-mp-sibiu/g6969d84e83g7h422e42i5e719f47369.html,images_case/anunt_278_img_0.webp|images_case/anunt_278_img_1.webp|images_case/anunt_278_img_2.webp|images_case/anunt_278_img_3.webp,4,,,,0,163529.625,,,0,48370.375
279,Anunț,100000,EUR,5,600,https://www.publi24.ro/anunturi/imobiliare/de-vanzare/case/case-vile/anunt/vand-casa-caracal/258423i44g6f71hhe92eh2di08332g92.html,images_case/anunt_279_img_0.jpg|images_case/anunt_279_img_1.jpg|images_case/anunt_279_img_2.jpg|images_case/anunt_279_img_3.jpg,4,,"Vand casa in Caracal, strada Gheorghe Asachi, 5 minute de mers pe jos pana in centru 600mp teren, 5 camere,1 baie, 1 bucatarie, garaj cu beci,gard beton ID anunț : 1738422903",26.02.2011,2,138429.125,2011-02-26,5398.0,0,-38429.125
280,Anunț,70000,EUR,4,417,https://www.publi24.ro/anunturi/imobiliare/de-vanzare/case/case-vile/anunt/casa-cu-4-camere-si-417mp-teren-in-fata-garii-de-sud-din-tecuci/5i8if09172d47f60e4h723389h4249g2.html,images_case/anunt_280_img_0.webp|images_case/anunt_280_img_1.webp|images_case/anunt_280_img_2.webp|images_case/anunt_280_img_3.webp,4,,"Casa cu 4 camere si 417mp teren | O casă de fală stă bine celor care concurează cu lumea. Comorile însă sunt, fie în pamat, fie în sipet, fie dosite de ochii lumii. O casă care să fie o comoară pentru stăpânul ei trebuie să fie amplasată în zona centrală, să ofere siguranţă, linişte, veselie şi intimitate, şi să fie la un preţ acceptabil sau, suportabil. Noi avem o astfel de casă. Se află pe strada Mihail Kogălniceanu, nr. 55 A, este din cărămidă, este izolată, are 4 camere, beci, bucătărie, baie, magazii, şi curte de 417 mp, cu flori, vie şi pomi fructiferi. Nu are datorii, deţine întrega documentaţie şi se vinde cu 70.000 Euro, preț fix, fără comision la cumpărător. Pentru orice detalii, şi programare vizionare, vă stăm la dispoziţie la telefon 0720 618 142 Casa cu 4 camere si 417mp teren | CARACTERISTICI IMOBIL Tip imobil: casă cărămidă şi 417 mp teren Culturi agricole: - PROPRIETAR Amplasament: Zona Gara de Sud Adresă proprietate de vânzare: Tecuci, str. Mihail Kogălniceanu Carte funciară nr. 3231 Proprietar: unic Casa cu 4 camere si 417mp teren | CONSTRUCŢIE Tip construcţie: casă de cărămidă Materiale construcţie: cărămidă Confort: - Grad de finisare: stare bună Regim înălţime: P Mansardă: - Expunere: - An construcţie: 1970 Stil: rezidenţial Alte caracteristici: - Acoperiş: - Gard: fier forjat Curte: alei de ciment şi curte cu vie, flori şi pomi fructiferi Casa cu 4 camere si 417mp teren | PLANIMETRIE Nr. camere: 4 Hol: 1 Living: 1 Dormitoare: 3 Băi: 1 Bucătărie: 1 Debara: 1 Beci: 1 Balcon: - Dresing: - Terasă: 1 Magazie: 1 Foişor: - Loc parcare: da Garaj autoturism: Casa cu 4 camere si 417mp teren | SUPRAFAŢA ÎN MP Suprafaţă utilă: 117 mp Suprafaţă construită: 126 mp Suprafaţă totală: 417 mp Front stradal: 4 m Adâncime: - FINISAJE Faţada: - Var lavabil tapet: - Uşa exterioare: lemn Uşi interioare: lemn Ferestre - termopan: Parchet: da Gresie: da Faianţă: da Marmură: - INSTALAŢII Izolaţie termică: da Hidroizolaţie: - Încălzire sobe calorifere pardoseală: centrală cu calorifere pe gaz metan Instalaţie apă: da Canalizare: da Instalaţie electrică: da Curent trifazic: - Panouri solare: - Gaz metan: da DOCUMENTE Proprietari unic moştenitori: unic Ipoteci litigii: nu Intabulat: da Certificat energetic: da Se acceptă credit: da DOTĂRI Toate utilităţile: Mobilat: da Electrocasnice: da Centrală gaze naturale: da Centrală combustibil solid: - Sobe lemne gaz metan: - Aer condiţionat: - Internet: - Interfon: - Piscină: - Contorizare: apă, gaz şi curent electric SPAŢII VERZI: Vie: da Pomi: da Solar: Grădina cu flori: da Stradă Asfaltată: da Centru: Zonă Gara de Sud Vecini: liniştiţi Activitate: rezidenţial Vecinătăţi Piaţa: 15 minute Centre comerciale: 7 minute Şcoli: 5 minute Licee: 10 minute Spital: 20 minute Mijloace transport: - Văd comercial: - Alte repere: RECOMANDAT PENTRU: rezidenţial ID anunț : 1758393291",28.02.2022,39,158320.53125,2022-02-28,1378.0,0,-88320.53125
281,Anunț,240000,EUR,4,128,https://www.publi24.ro/anunturi/imobiliare/de-vanzare/case/casa/anunt/casa-4-camere-128mpu-cu-spatiu-comercial-36mpu-in-zona-terezian-sibiu/69322i58i358710fef151f26219di60d.html,images_case/anunt_281_img_0.webp|images_case/anunt_281_img_1.webp|images_case/anunt_281_img_2.webp|images_case/anunt_281_img_3.webp,4,,,,0,168610.15625,,,0,71389.84375
282,Anunț,45000,EUR,1,40,https://www.publi24.ro/anunturi/imobiliare/de-vanzare/case/case-vile/anunt/casa-batraneasca/68779di82h357eg9d7144634h1g387d9.html,images_case/anunt_282_img_0.jpg|images_case/anunt_282_img_1.jpg|images_case/anunt_282_img_2.jpg|images_case/anunt_282_img_3.jpg,4,,"vând casă bătrânească ,zona tig 2 ,doua camere ,bucătărie ,baie cu dus,suprafața construită și teren 104m pret45000 euro neg ID anunț : 1656252007",29.12.2021,1,205104.3125,2021-12-29,1439.0,0,-160104.3125
283,Anunț,105000,EUR,2,93,https://www.publi24.ro/anunturi/imobiliare/de-vanzare/case/case-vile/anunt/casa-de-vanzare/04fh09209i82749225ed8h41ff2hig95.html,images_case/anunt_283_img_0.jpg|images_case/anunt_283_img_1.jpg|images_case/anunt_283_img_2.jpg|images_case/anunt_283_img_3.jpg,4,,Zona foarte linistita ID anunț : 1565197274,07.08.2019,1,119828.984375,2019-07-08,2344.0,0,-14828.984375
284,Anunț,194990,EUR,5,410,https://www.publi24.ro/anunturi/imobiliare/de-vanzare/case/casa/anunt/comision-0-duplex-individual-5-camere-si-teren-de-410-mp-zona-mosnita/765gh15221317fg81f807072ih1ed35e.html,images_case/anunt_284_img_0.webp|images_case/anunt_284_img_1.webp|images_case/anunt_284_img_2.webp|images_case/anunt_284_img_3.webp,4,,,,0,149323.125,,,0,45666.875
285,Anunț,12000,EUR,5,18,https://www.publi24.ro/anunturi/imobiliare/de-vanzare/case/case-vile/anunt/casa-cu-utilitati-in-rate/8if032495363781ed506fge1g4274g73.html,,0,,"Rog citiți anunțul în întregime!Casă la țară situată la drum principal și strada secundara asfaltata intr.o localitate liniștită,fără infracționalitate.Casa este locuită și este dotată pentru un minim confort de trai:,panou solar presurizat apa calda +boiler pe lemne pentru apa calda in sezonul rece,sobe de teracota mobile la a doua iarna de folosință.Tamplarie PVC cu geam termopan la camere și băi,uși mdf la interior,ușa metalică la intrare in casa.Compartimentare:doua camere (16-18mp)renovate cu baie proprie fiecare,bucătărie+alte 3 camere(5m cu 3m;3m cu 3m;3m cu 2m.)folosite că spatii de depozitare.Exteriorul necesită renovare...nu am renovat nimic niciodata.Utilitati:apa curentă în sistem hidrofor din puț forat (+rețea de apă curentă cu cămin la stradă)canalizare tip hazna,tv și internet prin fibra optica,electricitate.Proprietar cu  cf și intabulare.Pret fix.Nu răspund la mesaje sau oferte făcute pe publi24.Sunati și discutăm!Accept plata in rate lunare cu avans minim 60% din preț. ID anunț : 1753099001",01.10.2017,2,21531.267578125,2017-01-10,3253.0,0,-9531.267578125
286,Anunț,121000,EUR,4,108,https://www.publi24.ro/anunturi/imobiliare/de-vanzare/case/case-vile/anunt/casa-de-vanzare-mizil-prahova/hh5g95h588hg7gd7e8hi198fhe16851f.html,images_case/anunt_286_img_0.webp|images_case/anunt_286_img_1.webp|images_case/anunt_286_img_2.webp|images_case/anunt_286_img_3.webp,4,,"Casa de vanzare locuibila, Zona A vizavi de biserica de lemn. Contact  0491628114482 ID anunț : 1755276280",15.08.2025,1,142262.46875,2025-08-15,114.0,1,-21262.46875
287,Anunț,399990,EUR,4,240,https://www.publi24.ro/anunturi/imobiliare/de-vanzare/case/case-vile/anunt/casa-cu-4-camere-de-vanzare-in-timisoara-id-v4009/63f0085523eh7dfg1f320i95i9616158.html,images_case/anunt_287_img_0.webp|images_case/anunt_287_img_1.webp|images_case/anunt_287_img_2.webp|images_case/anunt_287_img_3.webp,4,,"Casa cu 4 camere de vanzare in localitatea Timisoara, zona B-dul Cetatii. FOXFORT va propune spre vanzare casa de tip individuala, pe parter, situata in Timisoara, zona B-dul Cetatii, avand un numar de 4 camere, cu o suprafata utila de 240 mp si teren 535 mp. Anul constructiei este 1930, structura este din caramida. Imobilul dispune si de un spatiu comercial, compus dintr-o camera si un mic grup sanitar, care face parte din casa si este declarat ca si spatiu comercial, dispunde de curent trifazic, centarala termica si retea de apa separate. Imobilul dispune de urmatoarele utilitati: curent electric, canalizare, gaz, utilitati in zona. Casa se vinde semimobilata si semiutilata: aragaz, masina de spalat rufe, TV. Imobilul dispune de centrala proprie cu incalzire prin calorifere si 2 locuri de parcare. Compartimentarea este dispusa dupa cum urmeaza: - Parter: hol, living, 3 dormitoare, baie, bucatarie, terasa; Finisajele interioare sunt moderne: - Usa intrare: pvc; - Usi interioare: lemn; - Tamplarie ferestre: pvc; - Podele: parchet, gresie. Casa este amplasata intr-o zona facila pentru dezvoltarea unei afaceri si totodata se preteaza pentru asa ceva, avand in vedere ca dispunde 2 fronturi stradale (23 ml si 21 ml) si in zona sunt: clinici medicale, sali de fitness, centre comerciale si are acces la multe mijloace de transport in comun. Pretul este de 399.990€ - COMISION 0%. Se accepta ca si modalitate de surse proprii si credit bancar. ID intern: V4009 Indicator performanta energetica: Clasa B ID anunț : 1659679952",11.10.2019,1416,181101.6875,2019-11-10,2219.0,0,218888.3125
288,Anunț,220000,EUR,4,190,https://www.publi24.ro/anunturi/imobiliare/de-vanzare/case/case-vile/anunt/casa-tunari-4-camere-str-paris/81e670ee44827dgfediid9h4f780i9f2.html,images_case/anunt_288_img_0.webp|images_case/anunt_288_img_1.webp|images_case/anunt_288_img_2.webp|images_case/anunt_288_img_3.webp,4,,"Proprietar, vând casa p+1 tunari, strada paris. Recent renovata. 3 dormitoare, 2 bai, living open space, doua ac uri noi, parchet stratificat Teren 190mp, casa 100mp ID anunț : 1748708189",19.08.2023,1,150677.53125,2023-08-19,841.0,0,69322.46875
289,Anunț,65000,EUR,3,100,https://www.publi24.ro/anunturi/imobiliare/de-vanzare/case/case-vile/anunt/casa-de-vanzare-rediu-judetul-neamt/33391h1digfi7158163i0dde58g2dggg.html,images_case/anunt_289_img_0.webp|images_case/anunt_289_img_1.webp|images_case/anunt_289_img_2.webp|images_case/anunt_289_img_3.webp,4,,"Obiectiv Imobiliare vă oferă spre vânzare o casă situată în localitatea Rediu, județul Neamț, ideală atât pentru locuință, cât și pentru un spațiu comercial. Detalii imobil: Suprafață construită desfășurată: 100 mp (parter + mansardă) Suprafață construită la sol: 54 mp Anul construcției: 2001 Suprafața terenului: 193 mp Caracteristici: Structură parter: construit din boltari de beton, cu ancorare la colțuri și la mijloc cu stâlpi de beton și fier-beton. Etaj: structură din lemn (bârne). Surse de apă: Fântână cu suport interior de hidrofor. Conductă cu cămin lângă casă, cu ramificație – necesită doar racordul de 2 metri pentru apă curentă. Sisteme de încălzire: Centrala pe peleți (cea mai eficientă opțiune). Posibilitate de instalare centrală pe butelie de metan sau pe gaz (gazul va fi adus în viitor). Alte facilități: Beci dedesubt. Două terase. Instalație electrică și bransamente. Pentru mai multe informații sau pentru a programa o vizionare, nu ezitați să ne contactați: Locație: Piața Mihail Kogălniceanu nr. 2, Piatra Neamț Telefon: 0757 030 616 ID anunț : 1755783699",07.06.2016,388,150410.90625,2016-07-06,3441.0,0,-85410.90625
290,Anunț,123000,EUR,4,141,https://www.publi24.ro/anunturi/imobiliare/de-vanzare/case/case-vile/anunt/duplex-superb-141-mp-construiti-295-mp-teren-domnesti/5g2374i67h097f4129i9h3620e62h56g.html,images_case/anunt_290_img_0.webp|images_case/anunt_290_img_1.webp|images_case/anunt_290_img_2.webp|images_case/anunt_290_img_3.webp,4,,"Vila moderna tip duplex – 141 mp construiti, teren 250 mp + 45 mp drum de servitute (latime 8 m) Descopera confortul unei case bine construite, perfecta pentru un cuplu tanar care vrea sa scape de agitatia orasului si sa se bucure de liniste, aer curat si spatiu! ✅ Constructie solida: fundatie, stalpi, grinzi si planseu din beton armat, zidarie din caramida Porotherm, izolatie exterioara din polistiren de 10 cm, acoperis Lindab, ferestre termopan Salamander 7 camere. ✅ Zid despartitor dublu intre cele doua unitati, cu polistiren intre caramizi – pentru confort si intimitate maxima. Compartimentare ideala: •   Parter: living spatios si luminos, dormitor, bucatarie inchisa, baie si hol generos •   Etaj: 2 dormitoare si o baie •   Pod izolat cu spuma cu celula inchisa si vata minerala Vila se vinde la cheie, cu finisaje de foarte buna calitate: gresie, parchet, usi, bai complet echipate, bucatarie moderna. Curte individuala imprejmuita cu gard de beton, terasa de 18 mp si o pivnita practica sub terasa – ideala pentru depozitare sau muraturi. Vila se vinde la pretul de 123000€ la care NU se adauga TVA, usor discutabil Vila se poate vinde la stadiul actual , fara finisaje la pretul de 110000€ Un loc perfect pentru a incepe o noua viata – intre confort, calitate si natura! Oferta apartine agentiei EBA REAL ESTATE ! ID anunț : 1762802387",25.08.2025,45,190389.3125,2025-08-25,104.0,0,-67389.3125
291,Anunț,227000,EUR,5,130,https://www.publi24.ro/anunturi/imobiliare/de-vanzare/case/case-vile/anunt/direct-de-la-proprietar/1272igg795977762efgif40e9ide44i6.html,images_case/anunt_291_img_0.webp|images_case/anunt_291_img_1.webp|images_case/anunt_291_img_2.webp|images_case/anunt_291_img_3.webp,4,,,,0,179956.90625,,,0,47043.09375
292,Anunț,599000,EUR,2,519,https://www.publi24.ro/anunturi/imobiliare/de-vanzare/case/case-vile/anunt/casa-de-vanzare-in-zona-mehala-timisoara-ideala-pentru-locuinta-clinica/f187hh6530d470g9232899576855e2i2.html,images_case/anunt_292_img_0.jpg|images_case/anunt_292_img_1.jpg|images_case/anunt_292_img_2.jpg|images_case/anunt_292_img_3.jpg,4,,"Vă prezentăm o proprietate deosebită, situată în zona Mehala, Timișoara, ideală atât pentru locuit, cât și pentru activități comerciale sau birouri. Casa are o suprafață generoasă, compartimentare eficientă și o curte spațioasă, oferind multiple posibilități de utilizare. Caracteristici generale: Regim de înălțime: Demisol + Parter + Etaj + Mansardă Suprafață teren: 519 mp Suprafață utilă: 350 mp Încălzire: Centrală proprie cu calorifere Finisaje: Zugrăveală San Marco Compartimentare: Demisol: 2 camere 1 cameră de așteptare 1 baie 1 spațiu de depozitare Parter: 2 camere 1 living generos 1 bucătărie 1 baie Garaj de 41 mp Etaj: 4 camere 1 living 1 bucătărie 1 baie Mansardă: 1 cameră open-space de aproximativ 40 mp Anexă în curte: Pe teren se află și o a doua construcție la roșu, pe plan parter, care include: 2 dormitoare 1 baie 1 bucătărie Această proprietate este perfectă pentru o familie numeroasă, o clinică medicală, birouri sau alte activități comerciale. Zona Mehala oferă acces facil la transport, școli, magazine și alte puncte de interes. Pentru mai multe detalii și programarea unei vizionări, nu ezitați să ne contactați! ID anunț : 1739959998",07.04.2008,199,191689.828125,2008-07-04,6365.0,0,407310.171875
293,Anunț,340000,EUR,5,250,https://www.publi24.ro/anunturi/imobiliare/de-vanzare/case/case-vile/anunt/vila-de-lux-de-vanzare-in-sebes-zona-rezidentiala/4300g837246d75g11e51e022070he94f.html,images_case/anunt_293_img_0.webp|images_case/anunt_293_img_1.webp|images_case/anunt_293_img_2.webp|images_case/anunt_293_img_3.webp,4,,"De vanzare vila de lux construita in anul 2022, situata in Sebes, strada privata cu bariera. Suprafata totala a proprietatii este de 250 mp, curtea libera de 160 mp este pavata cu dale si spatii verzi cu aspersoare. Este structurata pe 2 etaje. La parter se afla un living open-space cu bucataria, o baie, o camera tehnica, un dormitor cu baie proprie si un birou. Accesul la etaj se face pe o scara placata cu lemn masiv din stejar si balustrada de sticla. La etaj gasim 2 dormitoare si o baie. Dotari: geamuri termopan, incalzire in pardoseala, video interfon, poarta acces auto electrica cu telecomanda, gresie, faianta import Italia, granit, centrala termica pe gaz. Utilitati: gaz, curent, apa, canal. Se vinde cu livingul si bucataria mobilata, utilata cu mobila de lux. Pret: 340.000€ Cod ofertă / ID: P22041 Sună-ne acum la 0369.823.823 și află detalii despre această proprietate de vanzare din Sebes, dar și despre alte proprietăți potrivite pentru tine. Apartamente de vanzare Sibiu Case de vanzare Sibiu Informatii speciale: 1. Descarcă aplicația de mobilul tau "" TABOO Imobiliare "" din Apple Store, Google Play sau Huawei AppGallery pentru a afla instantaneu noile proprietăți care intră pe piață. 2. Dacă ai o proprietate pe care vrei să o vinzi sau să o închiriezi , suntem aici pentru tine! Contactează-ne pentru o evaluare gratuită fără obligații și vei descoperi avantajele de a lucra cu o echipă dedicată și experimentată. 3. Dacă vrei sa incepi o cariera de agent imobiliar , suna la 0369.823.823 si programeaza o intalnire pentru a afla toate beneficiile si avantajele. Intra pe www.TABOO.ro și descoperă cele mai recente oferte, actualizate zilnic. ID anunț : 1729603562",03.05.2018,1329,150129.859375,2018-03-05,2834.0,0,189870.140625
294,Anunț,450000,EUR,6,417,https://www.publi24.ro/anunturi/imobiliare/de-vanzare/case/case-vile/anunt/evadare-intr-un-paradis-privat-proprietate-unica-in-valenii-de-munte/8650d93ed23i7efg2gi8egiggg492fi2.html,images_case/anunt_294_img_0.jpg|images_case/anunt_294_img_1.jpg|images_case/anunt_294_img_2.jpg|images_case/anunt_294_img_3.jpg,4,,"**Evadare Într-un Paradis Privat: Proprietate Unică în Vălenii de Munte** Descoperiți o oază de liniște și eleganță, o proprietate de vis situată în inima naturii, la Vălenii de Munte. Această proprietate unică oferă o combinație perfectă între confort modern și peisaje naturale idilice, întinzându-se pe o suprafață totală de 26.417 mp, din care 6.144 mp sunt în intravilan și 20.273 mp în extravilan cu acces strada asfaltata pe o deschidere de 52 ml si acces din strada secundara (neasfaltat de 145 ml. **Detalii proprietate:** 1. **Casa principală**: - Suprafață utilă: 171,5 mp - Garaj: 31,75 mp - Terase: 46,66 mp - Subsol: 32,55 mp 2. **A doua casă**: - Suprafață utilă: 57,4 mp - Terasă: 11,90 mp 3. **Casa pentru personalul de întreținere**: - Suprafață utilă: 74,80 mp - Terasă: 2 mp 4. **Piscină betonată**: - Suprafață: 50 mp **Facilități și caracteristici speciale**: - Proprietatea este complet racordată la utilități. - Multiple zone de agrement, perfecte pentru relaxare și divertisment. - Fântâni cu apă naturală, aducând un plus de farmec și autenticitate. - Livadă cu pomi fructiferi și gazon bine întreținut. - Vecinătate directă cu lunca râului Teleajen, oferind peisaje pitorești și un cadru natural deosebit. Această proprietate este ideală pentru cei care caută un refugiu departe de agitația orașului, unde să se bucure de intimitate și confort. Fie că doriți să o transformați într-o locuință permanentă, într-o casă de vacanță sau într-un loc de evenimente, această proprietate oferă nenumărate posibilități. Nu ratați ocazia de a deveni proprietarul acestui paradis privat! Pentru mai multe informații și programarea unei vizionări, vă rugăm să ne contactați. ID anunț : 1722506562",09.06.2008,21,192413.25,2008-09-06,6301.0,0,257586.75
295,Anunț,390000,EUR,6,687,https://www.publi24.ro/anunturi/imobiliare/de-vanzare/case/case-vile/anunt/cantacuzino-megaimage-casa-p-1-si-teren-687-mp/47f8dhd8863e7ih6163d8626192d8664.html,images_case/anunt_295_img_0.jpg|images_case/anunt_295_img_1.jpg|images_case/anunt_295_img_2.jpg|images_case/anunt_295_img_3.jpg,4,,"Casa parter + etaj intrari 2 intrari, 3 garaje, 2 beciuri, terasa etaj, 4 bai, suprafata utila 275 mp, teren total 687 mp cu deschidere dubla la strada Ghe Gr Cantacuzino (20 ml) cu Reconstructiei (33 ml). Casa este contruita in anul 1980, structura rezistenta beton, placa beton intre etaje. Informatii suplimentare, un set complet poze interior exterior, programare vizionare va rugam sa nu ezitati sa sunati la numarul de telefon de contact din anunt. ID anunț : 1686043315",09.06.2008,21,129457.421875,2008-09-06,6301.0,0,260542.578125
296,Anunț,119990,EUR,3,360,https://www.publi24.ro/anunturi/imobiliare/de-vanzare/case/case-vile/anunt/comision-0-duplex-cu-3-camere-si-teren-de-360-mp-zona-giarmata/i83677eh6dh77i9id598836hf1g184h1.html,images_case/anunt_296_img_0.webp|images_case/anunt_296_img_1.webp|images_case/anunt_296_img_2.webp|images_case/anunt_296_img_3.webp,4,,"Duplex cu 3 camere de vanzare in localitatea Giarmata. FOXFORT propune spre vanzare casa tip duplex, cu un regim de inaltime Parter, situata in Giarmata, zona Est, avand un numar de 3 camere, cu o suprafata utila de 81 mp si teren 360 mp. Anul constructiei este 2025, structura beton, material zidarie caramida. Imobilul dispune de urmatoarele utilitati: curent electric, apa, gaz, fosa septica. Casa dispune de centrala proprie cu incalzire prin pardoseala si 3 locuri de parcare. Compartimentarea este dispusa dupa cum urmeaza: - Parter: hol, living, 2 bai, bucatarie, 2 dormitoare, terasa; - Pod depozitare. Finisajele interioare sunt clasice: - Usa intrare: pvc; - Usi interioare: celulare; - Tamplarie ferestre: pvc; - Podele: parchet, gresie. Pretul este de - 119.990€ + TVA - COMISION 0%. - 145.200 cu TVA inclus - COMISION 0%. Se accepta ca si modalitate de plata surse proprii sau credit bancar. Indicator performanta energetica: Clasa A ID intern: V8402 ID anunț : 1748595788",11.10.2019,1416,150699.59375,2019-11-10,2219.0,0,-30709.59375
297,Anunț,140000,EUR,3,117,https://www.publi24.ro/anunturi/imobiliare/de-vanzare/case/case-vile/anunt/casa-117-mp-sat-gageni/5h8468fd9f867396d2dh406di9ged031.html,images_case/anunt_297_img_0.jpg|images_case/anunt_297_img_1.jpg|images_case/anunt_297_img_2.jpg|images_case/anunt_297_img_3.jpg,4,,"Casa vanzare sat Gageni Prahova suprafata 117 mp, garaj in suprafata de 28 mp, foisor + bucatarie vara 60 mp, toate aplasate pe un teren in suprafata toatala de 1028 mp din care  518 mp sunt in categoria ""curti constructii"". Constructia dateaza din anul 1980, izolata exterior cu polistiren 10 cm, tamplarie PVC cu geam termopan. Incalzirea se realizeaza cu centrala termica proprie. ID anunț : 1716460694",09.06.2008,21,156643.625,2008-09-06,6301.0,0,-16643.625
298,Anunț,110000,EUR,6,270,https://www.publi24.ro/anunturi/imobiliare/de-vanzare/case/case-vile/anunt/lipanesti-prahova-casa-p-m-finisaj-la-gri/7fii1de41f5i722g1g7e27g37110897g.html,images_case/anunt_298_img_0.jpg|images_case/anunt_298_img_1.jpg|images_case/anunt_298_img_2.jpg|images_case/anunt_298_img_3.jpg,4,,"Casa P+1 situata in Lipanesti Prahova, suprafata totala 270 mp, util cca 200 mp dispusa astfel : Parter - bucatarie, baie, camera tehnica, finisata, acces beci, acces garaj, acces terasa; Etaj 5 dormitoare, baie, acces balcon, avand stadiul de finisare la ""gri"", construita in anul 2012, aplasata pe un teren de 650 mp cu front stradal de 18 ml. Acces la utilitati : apa, electricitate, gaze, strada asfaltata. ID anunț : 1724841599",09.06.2008,21,170135.9375,2008-09-06,6301.0,0,-60135.9375
299,Anunț,199000,EUR,5,269,https://www.publi24.ro/anunturi/imobiliare/de-vanzare/case/case-vile/anunt/proprietate-ideala-pentru-familie-boldesti-scaeni/h94g2gf0744870922282h8f3fe21451i.html,images_case/anunt_299_img_0.webp|images_case/anunt_299_img_1.webp|images_case/anunt_299_img_2.webp|images_case/anunt_299_img_3.webp,4,,"OFERTĂ DE VÂNZARE   AGENTIA IMOBILIARĂ LOCATO Proprietate ideală pentru familie   Boldesti-Scăeni, județul Prahova, la doar 9 km de Ploiești! Teren: 1.269 mp Construcție P+1, edificată în anul 1999, cu o suprafață totală desfășurată de 294 mp Parter   158 mp Etaj   136 mp Compartimentare & dotări: Living generos și dormitoare spațioase Băi pe fiecare etaj Garaj integrat Centrala termică proprie   confort pe tot parcursul anului Terasa acoperită perfectă pentru relaxare Bucătărie de vară și foișor Anexe utile (magazie) Curte amenajată, ce oferă intimitate în partea din spate Copaci fructiferi, vegetație matură și spațiu verde generos Proprietatea este amplasată într-o zonă liniștită, accesibilă, potrivită pentru o familie care își dorește confort, intimitate și proximitate față de oraș. Preț de vânzare: 199.999 Euro Comision agenție: 2% ID anunț : 1759910858",09.06.2008,21,162631.40625,2008-09-06,6301.0,0,36368.59375
300,Anunț,324990,EUR,5,160,https://www.publi24.ro/anunturi/imobiliare/de-vanzare/case/case-vile/anunt/casa-individuala-160-mp-cu-atelier-auto-110-mp-in-utvin/ih8h95d30i5876f41gghh615h8d14f2e.html,images_case/anunt_300_img_0.webp|images_case/anunt_300_img_1.webp|images_case/anunt_300_img_2.webp|images_case/anunt_300_img_3.webp,4,,"Casa individuala cu 5 camere de vanzare in localitatea Utvin. FOXFORT propune spre vanzare casa tip individuala, cu un regim de inaltime Parter + 1 Etaj, situata in Utvin, avand un numar de 5 camere, cu o suprafata utila de 160 mp si teren 712 mp. Anul constructiei este 2014, structura beton, material zidarie caramida. Imobilul dispune de urmatoarele utilitati: curent electric, apa, canalizare, gaz, catv, fibra optica. Casa dispune de centrala proprie cu incalzire prin calorifere si 2 locuri de parcare. Compartimentarea este dispusa dupa cum urmeaza: - Parter: hol, living, baie, bucatarie, camera; - Etaj: hol, 3 dormitoare, baie; - Pod depozitare - 70mp. Finisajele interioare sunt moderne: - Usa intrare: pvc; - Usi interioare: celulare; - Tamplarie ferestre: pvc; - Podele: parchet, gresie. Casa se vinde mobilata si utilata: plita, cuptor, hota, masina de spalat rufe, masina de spalat vase, frigider cu congelator. Imobilul dispune de garaj dublu in curte 36 mp, depozit 70 mp, zona de gratar. In curtea imobilului se afla un atelier auto complet de 110 mp. Imobilul are sistem de supraveghere video. Pretul este de 324.990€ + comisionul standard al agentiei. Se accepta ca si modalitate de plata surse proprii sau credit bancar. ID intern: V7497 ID anunț : 1731323135",11.10.2019,1416,131304.34375,2019-11-10,2219.0,0,193685.65625
301,Anunț,49000,EUR,5,226,https://www.publi24.ro/anunturi/imobiliare/de-vanzare/case/case-vile/anunt/vand-casa-sau-la-schimb-cu-apartament/9fe32e40e21h73431dfei78i910i0647.html,,0,,"Vând casă sau la schimb cu apartament.        226mp , Soseaua Alexandriei numărul 100 Telefon ID anunț : 1759826557",12.11.2023,1,21531.732421875,2023-12-11,727.0,0,27468.267578125
302,Anunț,108000,EUR,5,163,https://www.publi24.ro/anunturi/imobiliare/de-vanzare/case/case-vile/anunt/casa-163-mp-barcanesti-primarie-dn1/9ff3d3if253476ge25ie590360d0d108.html,images_case/anunt_302_img_0.webp|images_case/anunt_302_img_1.webp|images_case/anunt_302_img_2.webp|images_case/anunt_302_img_3.webp,4,,"De vânzare   Casă la gri în localitatea Barcănești, județul Prahova, cu amplasare excelentă! Situată vizavi de Primăria Barcănești și Școala Gimnazială  Gheorghe Lazăr , la doar câteva minute de mers pe jos față de Liceul Tehnologic Agricol și la numai 10 minute (aproximativ 8 km) de centrul municipiului Ploiești! Vă prezentăm o proprietate cu potențial deosebit, localizată strategic în Barcănești, vizavi de Primărie, cu acces facil la DN1 și o poziționare avantajoasă la 48 ml față de axul drumului național   un beneficiu important pentru reducerea zgomotului și a traficului intens. Imobilul este o construcție solidă, la gri, cu o suprafață utilă de 163 mp, compartimentată eficient astfel: 3 dormitoare, un living generos, baie, bucătărie și un spațiu destinat zonei de luat masa. Casa este edificată pe un teren de 800 mp, cu o deschidere de 8 ml. Beneficiază de izolație termică exterioară, tâmplărie PVC marca Rehau și geamuri termopan. Interiorul este tencuit, iar instalațiile electrice, sanitare și de gaz sunt deja realizate. Proprietatea este racordată la toate utilitățile esențiale: apă, electricitate și gaze naturale. Viitorii proprietari au astfel oportunitatea de a personaliza finisajele după propriul stil și preferințe. Ideală atât pentru locuință permanentă, cât și pentru investiție! Pentru mai multe detalii și programări la vizionare, nu ezitați să ne contactați. ID anunț : 1749645459",09.06.2008,21,139205.890625,2008-09-06,6301.0,0,-31205.890625
303,Anunț,494900,EUR,2,320,https://www.publi24.ro/anunturi/imobiliare/de-vanzare/case/case-vile/anunt/casa-de-vanzare-individuala-8-camere-teren-terasa-zona-centrala-sibiu/8438218i90357fd72h51e7e6dh5ff15f.html,images_case/anunt_303_img_0.webp|images_case/anunt_303_img_1.webp|images_case/anunt_303_img_2.webp|images_case/anunt_303_img_3.webp,4,,"Iti doresti o casa individuala generoasa intr-o zona buna a orasului? Aceasta casa de vanzare este situata in zona centrala a orasului Sibiu, o zona linistita si cu acces facil catre toate punctele centrale si de interes public ale orasului. Terenul are o suprafata totala de 320 mp din care 160 mp teren liber iar casa este compartimentata astfel: - La subsol se afla 2 camere de depozitare a cate 10 mp fiecare, si o crama de 17 mp; - Parterul este compus dintr-o camera spatioasa cu suprafata de 53 mp, fiind pretabila pentru spatiu de birou, camera de zi sau living, o camera de birou de 17 mp, o baie, un hol mare de 20 mp, debara, toaleta de serviciu si terasa; - Etajul 1 va ofera accesul catre cele 2 dormitoare decomandate in suprafata de 17 mp fiecare, un living generos de 33 mp, bucatarie, 2 bai, si o terasa spatioasa in suprafata de 58 mp; - Etajul al 2-lea confera accesul catre dormitorul matrimonial in suprafata de 26 mp, dressing, baie de 7 mp, terasa. Predarea se va face la stadiul de semifinisat in exterior, cu parterul finalizat, la etajul 1 partea de dormitoare si bai sunt functionale, iar la etajul 2 finisajele interioare nu au fost finalizate lasand la alegerea viitorului beneficiar modul in care se va amenaja. Casa dispune de urmatoarele imbunatatiri precum parchet, gresie, faianta, ferestre din PVC-termopan, usi celulare, centrala termica proprie si calorifere. Casa mai dispunde si de o curte privata cu acces auto, carport unde se poate parca masina, iar curtea dispune de o suprafata libera de 160 mp. Casa poate fi recompartimentata in functie de gusturile fiecaruia, in functie de necesitati. Imobilul este situat pe o strada iluminata, avand 2 fronturi la strazi diferite, iar in apropiere se afla mijloace de transport in comun, parcuri, restaurante, scoli, spatii verzi, spatii comerciale. Pret: 494.900€ Cod ofertă / ID: P15105 Sună-ne acum la 0369.823.823 și află detalii despre această proprietate de vanzare din Sibiu, dar și despre alte proprietăți potrivite pentru tine. Apartamente de vanzare Sibiu Case de vanzare Sibiu Informatii speciale: 1. Descarcă aplicația de mobilul tau "" TABOO Imobiliare "" din Apple Store, Google Play sau Huawei AppGallery pentru a afla instantaneu noile proprietăți care intră pe piață. 2. Dacă ai o proprietate pe care vrei să o vinzi sau să o închiriezi , suntem aici pentru tine! Contactează-ne pentru o evaluare gratuită fără obligații și vei descoperi avantajele de a lucra cu o echipă dedicată și experimentată. 3. Dacă vrei sa incepi o cariera de agent imobiliar , suna la 0369.823.823 si programeaza o intalnire pentru a afla toate beneficiile si avantajele. Intra pe www.TABOO.ro și descoperă cele mai recente oferte, actualizate zilnic. ID anunț : 1654694753",03.05.2018,1329,158422.84375,2018-03-05,2834.0,0,336477.15625
304,Anunț,65000,EUR,6,58,https://www.publi24.ro/anunturi/imobiliare/de-vanzare/case/case-vile/anunt/de-vanzare-casa-cu-6-camere-2-bai-2-balcoane-in-stil-rustic/414df0f040837596e077dgi3gfeii10f.html,images_case/anunt_304_img_0.jpg|images_case/anunt_304_img_1.jpg|images_case/anunt_304_img_2.jpg|images_case/anunt_304_img_3.jpg,4,,,,0,152775.125,,,0,-87775.125
305,Anunț,419990,EUR,9,270,https://www.publi24.ro/anunturi/imobiliare/de-vanzare/case/case-vile/anunt/casa-cu-9-camere-panouri-fotovoltaice-timisoara-bogdanestilor/47fed93834f07f822i1577e51d71306d.html,images_case/anunt_305_img_0.webp|images_case/anunt_305_img_1.webp|images_case/anunt_305_img_2.webp|images_case/anunt_305_img_3.webp,4,,"ID intern: V3539 Vila de vanzare in Timisoara, zona Bogdanestilor. FOXFORT Imobiliare va propune spre vanzare casa tip individuala, cu un regim de inaltime distribuit D+P+M, situata in zona Bogdanestilor la 7 minute pe jos Carrefour Cetatii, in localitatea Timisoara, avand un numar de 9 camere, cu o suprafata utila de 270 mp si teren 500 mp. Casa a fost construita in anul 2010, structura acesteia fiind din beton si pereti din caramida. Imobilul este situat in apropiere de statia transport in comun si la 7 minute pe jos Carrefour Cetatii. Compartimentarea este dispusa dupa cum urmeaza: - Demisol: 3 dormitoare, baie, bucatarie, dressing, camera tehnica; - Parter: hol, living, baie, bucatarie, 2 dormitoare, terasa; - Mansarda: hol, 3 dormitoare, 2 bai, 2 balcone; - Pod depozitare. Casa este mobilata si utilata: aragaz, hota, masina de spalat rufe, masina de spalat vase, frigider cu congelator, semineu. Finisajele interioare sunt moderne: - Usa intrare: pvc; - Usi interioare: panel; - Tamplarie ferestre: pvc; - Podele: parchet, gresie. Casa dispune de 3 locuri de parcare si panouri fotovoltaice. Se accepta ca si modalitate de plata cash sau credit bancar. Pretul este de 419.990€ - COMISION 0%. Indicator performanta energetica: Clasa A Pentru a vedea toate ofertele valabile actualizate periodic, cu preturi reale si ultimele anunturi imobiliare adaugate intrati acum pe site-ul oficial FOXFORT Imobiliare: foxfort.ro Precizati intotdeauna ca ati vazut oferta cu ID: V3539 Sediu agentie: Strada Mures, Nr. 39A, Timisoara, Timis. Mai multe detalii la telefon: 0374.069.727 ID anunț : 1721154422",11.10.2019,1416,185195.1875,2019-11-10,2219.0,0,234794.8125
306,Anunț,69000,EUR,4,10955,https://www.publi24.ro/anunturi/imobiliare/de-vanzare/case/case-vile/anunt/casa-anexe-complet-mobilata-la-tara/2114375h0i29711fd4087d1h196g982d.html,images_case/anunt_306_img_0.webp|images_case/anunt_306_img_1.webp|images_case/anunt_306_img_2.webp|images_case/anunt_306_img_3.webp,4,,"Casa locuibilă la țară complet mobilată + teren 10955 mp în jurul casei +anexe . Casa ( proprietatea ) se află în sat . Cainelul de sus , com. Băiță , Jud. Hunedoara . Casa formată din 4 camere , 2 băi , cămară , și 2 terase . Apă de La Fântană , curent electric , tv și internet prin cablu Digi . ID anunț : 1762027507",08.02.2017,2,116535.265625,2017-08-02,3049.0,0,-47535.265625
307,Anunț,295000,EUR,5,240,https://www.publi24.ro/anunturi/imobiliare/de-vanzare/case/case-vile/anunt/casa-individuala-240-mp-cu-teren-1-200-mp-de-vanzare-in-talmaciu-sibiu/04d33gf5d152778ie18fd76g7e9252h1.html,images_case/anunt_307_img_0.webp|images_case/anunt_307_img_1.webp|images_case/anunt_307_img_2.webp|images_case/anunt_307_img_3.webp,4,,"Vila spațioasă cu teren generos de 1.200 mp, situată într-un cartier rezidențial modern din Tălmaciu, jud. Sibiu Îți prezentăm o vilă individuală, cu regim de înălțime S+P+E și posibilitatea de extindere cu încă un etaj, datorită plăcii de beton turnate peste nivelul superior. Proprietatea este amplasată într-un cartier rezidențial nou, cu străzi asfaltate, iluminat public și infrastructură completă de apă și canalizare – un cadru ideal pentru o viață liniștită și confortabilă. Suprafața utilă totală este de aproximativ 240 mp , la care se adaugă o terasă spațioasă și două balcoane generoase . Terenul aferent are o suprafață impresionantă de 1.200 mp , este complet împrejmuit și atent amenajat, oferind atât intimitate cât și spațiu suficient pentru relaxare sau activități în aer liber. Compartimentare: Subsol : două încăperi – una pentru centrală, cealaltă pentru depozitare. Parter : hol de acces, living cu zonă de relaxare și ieșire pe terasă, bucătărie, baie, debara și un dormitor spațios. Etaj : 3 dormitoare, baie, dressing, hol cu zonă de relaxare, living secundar cu ieșire pe balcon și deschidere tip supantă către zona de zi de la parter. În plus, în curte se află o bucătărie de vară , ideală pentru mese în aer liber sau organizarea de evenimente în familie. Casa a fost construită de către proprietar pentru uz propriu, nu pentru vânzare, motiv pentru care calitatea materialelor, a finisajelor și a instalațiilor este superioară. Încălzirea se face prin centrală pe lemne, iar casa este complet izolată termic (polistiren de 10 cm), dotată cu geamuri termopan și instalații electrice, termice și sanitare de înaltă calitate. Imobilul se predă la cheie. Utilități : apă, canalizare, curent electric. Rețeaua de gaz este disponibilă la aproximativ 200 m. Această vilă reprezintă o investiție de suflet și este alegerea perfectă pentru o familie care caută un cămin spațios, modern, sigur și aproape de natură, la doar 15 minute de Sibiu. Pret: 295.000€ Cod ofertă / ID: P23509 Sună-ne acum la 0369.823.823 și află detalii despre această proprietate de vanzare din Talmaciu, dar și despre alte proprietăți potrivite pentru tine. Apartamente de vanzare Sibiu Case de vanzare Sibiu Informatii speciale: 1. Descarcă aplicația de mobilul tau "" TABOO Imobiliare "" din Apple Store, Google Play sau Huawei AppGallery pentru a afla instantaneu noile proprietăți care intră pe piață. 2. Dacă ai o proprietate pe care vrei să o vinzi sau să o închiriezi , suntem aici pentru tine! Contactează-ne pentru o evaluare gratuită fără obligații și vei descoperi avantajele de a lucra cu o echipă dedicată și experimentată. 3. Dacă vrei sa incepi o cariera de agent imobiliar , suna la 0369.823.823 si programeaza o intalnire pentru a afla toate beneficiile si avantajele. Intra pe www.TABOO.ro și descoperă cele mai recente oferte, actualizate zilnic. ID anunț : 1746532722",03.05.2018,1329,168148.828125,2018-03-05,2834.0,0,126851.171875
308,Anunț,150000,EUR,6,133,https://www.publi24.ro/anunturi/imobiliare/de-vanzare/case/case-vile/anunt/ofer-casa-la-schimb-cu-apartament-in-bucuresti/4h92f0gh372d7fe42f3i4fff4ef73h04.html,images_case/anunt_308_img_0.webp|images_case/anunt_308_img_1.webp|images_case/anunt_308_img_2.webp|images_case/anunt_308_img_3.webp,4,,"Ofer casa la schimb in Comuna Snagov sat Tancabesti km29 cu  apartament cu 3 camere in bucuresti soseaua Mihai Bravu.Piata Obor, Piata iancului,Piata Muncii,dristor sau  Stefan cel Mare stradal sau semi stradal.Detalii la tel. ID anunț : 1753352097",16.04.2018,3,72801.5390625,2018-04-16,2792.0,0,77198.4609375
309,Anunț,150000,EUR,4,133,https://www.publi24.ro/anunturi/imobiliare/de-vanzare/case/vila/anunt/ilfov-casa-la-schimb-in-bucuresti/78086770786f6b54.html,images_case/anunt_309_img_0.jpg|images_case/anunt_309_img_1.jpg|images_case/anunt_309_img_2.jpg|images_case/anunt_309_img_3.jpg,4,,,,0,146260.421875,,,0,3739.578125
310,Anunț,150000,EUR,3,133,https://www.publi24.ro/anunturi/imobiliare/de-vanzare/case/case-vile/anunt/casa-la-schimb-cu-apartament-3-camere/7808667f786a6057.html,images_case/anunt_310_img_0.jpg|images_case/anunt_310_img_1.jpg|images_case/anunt_310_img_2.jpg|images_case/anunt_310_img_3.jpg,4,,"Ofer casa la schimb in Comuna Snagov sat Tancabesti km 29. 2 apartamente cu 2 camre in bucuresti soseaua Mihai Bravu.Piata Obor, Piata iancului,Piata Muncii,dristor sau  Stefan cel Mare stradal sau semi stradal.Detalii la tel. ID anunț : 20280330",16.04.2018,3,112804.4921875,2018-04-16,2792.0,0,37195.5078125
311,Anunț,67000,EUR,2,60,https://www.publi24.ro/anunturi/imobiliare/de-vanzare/case/case-vile/anunt/casa-in-timisoara/gd0g27ehhg4e7d8h2fi42g184eg6ee7f.html,images_case/anunt_311_img_0.jpg|images_case/anunt_311_img_1.jpg,2,,"Proprietar, vand casa în Timișoara, zona Lunei, la curte comuna. Prețul este negociabil. Aproape de Lidl. Izolata la exterior. Toate utilitățile. Centrala pe gaz. Se vinde direct de la proprietar. ID anunț : 1639558543",19.12.2013,4,48819.4296875,2013-12-19,4371.0,0,18180.5703125
312,Anunț,69000,EUR,4,10995,https://www.publi24.ro/anunturi/imobiliare/de-vanzare/case/case-vile/anunt/casa-teren-de-vanzare/4e547196g1ih73g6e357d363f50edg2e.html,images_case/anunt_312_img_0.webp|images_case/anunt_312_img_1.webp|images_case/anunt_312_img_2.webp|images_case/anunt_312_img_3.webp,4,,Casa + anexe + teren 10995 mp de vânzare în com. Băiță  Jud. Hunedoara . ID anunț : 1752522604,08.02.2017,2,102621.75,2017-08-02,3049.0,0,-33621.75
313,Anunț,299980,EUR,5,267,https://www.publi24.ro/anunturi/imobiliare/de-vanzare/case/case-vile/anunt/duplex-deosebit-in-feleacu/i0i3e14di45i7ef8e79fh59h690h2272.html,images_case/anunt_313_img_0.webp|images_case/anunt_313_img_1.webp|images_case/anunt_313_img_2.webp|images_case/anunt_313_img_3.webp,4,,"Koncept Imobiliare va ofera spre vanzare o casa tip duplex situata in Feleacu, foarte aproape de partia de schi, pe ultima parcela dintr-o zona de case noi premium. Proprietatea beneficiaza de o orientare est sud vest, astfel incat livingul si terasa se bucura de lumina naturala pe tot parcursul zilei si de o vedere panoramica neobstructionata spre orasul Cluj-Napoca si spre partia de schi. Fiecare unitate locativa dispune de un teren generos de aproximativ 405 de metri patrati, iar casa are o suprafata utila de aproximativ 180 metri patrati, care cuprinde si un pod de aproximativ 60 de metri patrati, usor amenajabil. La parter regasim un living spatios cu bucatarie open space si iesire directa pe terasa si in curte, o baie, camera tehnica, casa scarii si hol. Etajul este gandit pentru zona de noapte, cu dormitor matrimonial cu baie proprie si balcon cu panorama spre oras, doua dormitoare luminoase, o baie, terasa, casa scarii si hol. Podul tip open space, cu ferestre de tip velux, poate fi compartimentat in doua dormitoare cu baie si dressing sau poate deveni un spatiu generos pentru birou, loc de joaca ori biblioteca. Casa se preda la interior la stadiul de semifinisat, cu sapa egalizatoare, pereti cu doua maini de glet, toate instalatiile trase pe pozitii si usa de intrare antiefractie. Sistemul de incalzire este asigurat de o centrala termica proprie marca Viessmann, cu incalzire in pardoseala. Tamplaria este Rehau Synego, instalatiile de apa si de canalizare sunt antifonate iar exteriorul este finalizat complet, in stil neoromanesc contemporan, cu termosistem, tencuiala decorativa, glafuri si trotuare perimetrale, acoperis din tigla si detalii executate atent, cu materiale de foarte buna calitate. Curtea este imprejmuita, accesul se face prin poarta automatizata cu telecomanda, exista doua locuri de parcare pavate pentru fiecare unitate, iar zona din spate este amenajata cu gazon si spatiu liber pentru viitoarea terasa, loc de joaca sau zona de relaxare. Proprietatea dispune de gaz, energie electrica, apa de la retea, fibra optica pentru internet, micro statie de epurare pentru cele doua unitati locative, sistem de alarma, supraveghere video si retea pregatita pentru montarea de panouri fotovoltaice. Accesul se face pe doua drumuri, cu asfalt pana in imediata apropiere, ultimul tronson de aproximativ 150 de metri fiind neasfaltat, iar la drumul asfaltat exista statie pentru transportul in comun. Aceasta casa tip duplex din Feleacu este o alegere potrivita pentru familii cu copii, pentru cei care lucreaza de acasa sau pentru iubitorii de natura si sport, care isi doresc liniste, aer curat, intimitate si o panorama spectaculoasa spre Cluj-Napoca, pastrand totodata accesul facil catre oras. Proprietatea este finalizata, are carte funciara, se poate preda imediat, iar in pretul afisat este inclusa si taxa pe valoare adaugata, vanzatorul fiind persoana juridica. Pentru informatii suplimentare, programarea unei vizionari sau pentru a afla oferta noastra completa va stam la dispozitie telefonic, prin e-mail sau la sediul agentiei noastre, pe str. Aviator Badescu, nr. 19, Cluj-Napoca. ID anunț : 1692951644",13.11.2018,591,156601.21875,2018-11-13,2581.0,0,143378.78125
314,Anunț,270000,EUR,4,150,https://www.publi24.ro/anunturi/imobiliare/de-vanzare/case/case-vile/anunt/garaj-toate-utilitatile-posibilitate-personalizare/93188if632457f50efg923gh9e667fe3.html,images_case/anunt_314_img_0.webp|images_case/anunt_314_img_1.webp|images_case/anunt_314_img_2.webp|images_case/anunt_314_img_3.webp,4,,"Duplex despartit prin garaj in Dumbravita in suparafat utila de 150 mp amplasat pe un teren de 392 mp. La parter avem living, bucatarie, baie, terasa si garaj, iar la etaj 3 dormitoare si 2 bai. Se poate preda la cheie la pretul de 285.000 Eur Neg Pret la alb 270.000 Eur Neg  Tel 0725680996 ID anunț : 1758532238",05.12.2019,134,162229.625,2019-05-12,2401.0,0,107770.375
315,Anunț,320000,EUR,4,160,https://www.publi24.ro/anunturi/imobiliare/de-vanzare/case/case-vile/anunt/duplex-modern-cu-garaj/6d326363g9h57033d18155i410838d89.html,images_case/anunt_315_img_0.jpg|images_case/anunt_315_img_1.jpg|images_case/anunt_315_img_2.jpg|images_case/anunt_315_img_3.jpg,4,,"Casa duplex cu pereti dubli si izolati, 160 mp utili + 50 mp terase, situată pe o stradă privată. Dacă visezi la un spațiu generos pentru tine și cei dragi, această locuință este alegerea perfectă! Compartimentare inteligentă: Parter: Living spațios cu bucătărie open-space, cameră tehnică, baie, dormitor/birou, hol, garaj incalzit și terasă. Etaj: Dormitor matrimonial cu dressing, baie și terasă mare acoperită, plus încă un dormitor cu dressing, baie proprie, hol și două terase. Detalii tehnice: Construcție solidă din porotherm 25-30 cm, izolatie de 15 cm, fundație din fier-beton 22 mm. Gard din beton, fundație 1 m, fier-beton 16 mm. Acoperiș pregătit pentru montarea panourilor fotovoltaice. Garaj de 18,11 mp + toate utilitățile individuale. Casa este locuibilă, necesită doar finisaje exterioare și mici retușuri interioare. Se vinde la stadiul actual. Preț: 320.000 € pentru o unitate. Ambele părți sunt disponibile! Nu rata această ocazie! Contactează-ne pentru detalii și vizionare! Cod ofertă / ID BLITZ: P142275 ID anunț : 1742374279",07.05.2021,9948,177954.125,2021-07-05,1616.0,0,142045.875
316,Anunț,205000,EUR,4,100,https://www.publi24.ro/anunturi/imobiliare/de-vanzare/case/case-vile/anunt/duplex-premium-4-camere-terasa-parcare-braytim/4i038f48eg7779542ih73d539h03f74i.html,images_case/anunt_316_img_0.jpg|images_case/anunt_316_img_1.jpg|images_case/anunt_316_img_2.jpg|images_case/anunt_316_img_3.jpg,4,,"Blitz prezintă un duplex luxos cu 4 camere, situat într-o locație privilegiată. Acest duplex elegant oferă 3 dormitoare spațioase, 1 living generos, 2 băi moderne, și o bucătărie. Bucurați-vă de confortul unei terase încălzite și a unei suprafețe utile de aproximativ 100 mp, amplasate pe un teren generos de 200 mp. Cu un design impresionant, duplexul dispune de sistem de încălzire în pardoseală și centrală proprie pentru confort. Beneficiați de finisaje premium care conferă o atmosferă de lux.Va invit la o vizionare. Cod ofertă / ID BLITZ: P99728 ID anunț : 1724755082",07.05.2021,9948,230525.84375,2021-07-05,1616.0,0,-25525.84375
317,Anunț,164990,EUR,4,100,https://www.publi24.ro/anunturi/imobiliare/de-vanzare/case/case-vile/anunt/comision-0-duplex-modern-cu-4-camere-zona-mosnita-noua/eedg86609i2079i82edie2187330g781.html,images_case/anunt_317_img_0.webp|images_case/anunt_317_img_1.webp|images_case/anunt_317_img_2.webp|images_case/anunt_317_img_3.webp,4,,"Duplex modern cu 4 camere – Structura metalica, design contemporan – Mosnita Noua FOXFORT propune spre vanzare un duplex cu structura metalica, construit pe fundatie de beton, situat intr-o zona linistita din Mosnita Noua, intr-un cartier in dezvoltare. Regim de inaltime: Parter + Etaj Suprafata utila: 100 mp Teren: 260 mp An constructie: 2022 Structura si utilitati Casa este construita pe structura metalica, oferind: Durabilitate crescuta Timp redus de executie Izolatie termica si fonica eficienta Utilitati disponibile: curent electric, apa, canalizare, gaz Compartimentare: Parter: Hol de acces Living luminos cu iesire pe terasa Bucatarie open space Baie Terasa Etaj: Hol 3 dormitoare Baie Balcon Pod pentru depozitare Finisaje si dotari: Usa intrare: PVC Usi interioare: celulare Tamplare ferestre: PVC cu geam termopan Podele: parchet si gresie Incalzire in pardoseala Centrala proprie 3 locuri de parcare Pret: 164.990 EUR - COMISION 0%. Modalitati de plata: surse proprii sau credit bancar ID intern: V8581 Indicator performanta energetica: Clasa in curs de actualizare Pentru mai multe detalii si programari la vizionare, echipa FOXFORT iti sta la dispozitie. ID anunț : 1753873511",11.10.2019,1416,169770.140625,2019-11-10,2219.0,0,-4780.140625
318,Anunț,85000,EUR,6,1500,https://www.publi24.ro/anunturi/imobiliare/de-vanzare/case/vila/anunt/o-proprietate-speciala-versatila-in-regim-demisol-parter-etaj-si-1500mp-teren/4104038ff1887f95e982d6d2277628f3.html,images_case/anunt_318_img_0.jpg|images_case/anunt_318_img_1.jpg|images_case/anunt_318_img_2.jpg|images_case/anunt_318_img_3.jpg,4,,,,0,106033.515625,,,0,-21033.515625
319,Anunț,162000,EUR,3,330,https://www.publi24.ro/anunturi/imobiliare/de-vanzare/case/case-vile/anunt/casa-de-vanzare-valu-lui-traian/16i80f27hi8i797f208g9206d65fd6f6.html,images_case/anunt_319_img_0.webp|images_case/anunt_319_img_1.webp|images_case/anunt_319_img_2.webp|images_case/anunt_319_img_3.webp,4,,"Casa la sol construcție 2019 pe o suprafață de teren de 330mp plus o alee de acces lata de 8m totalizând 150mp. Independenta energetic și termic!!! Suprafața interioară generoasa de 85mp la care se adaugă o terasa de 80mp care are un beci de 6mp tip buncăr. Casa este pe structura de lemn, cu acoperiș dual tabla și șindrilă bituminoase, izolație interioara spuma, polistiren 10cm exterior, folie aluminiu aero spațială. Tâmplărie tripan și ușa acces Barrier, rulouri exterioare la geamuri. Compartimentarea interioara este foarte bine gândită și este împărțită astfel : - living 33mp (aer condiționat Grundig A+++) - bucătărie semi open space 7.44mp (plita pe inducție Tema,cuptor Teka, mașina spălat vase Bosch) - dormitor 16.47mp - dormitor 13.72mp - baie 6mp (mașina de spălat și uscător) - hol 4.37mp - terasa 80mp. Siguranța este pe primul loc   casa este dotată cu sistem de supraveghere video și alarma. In curte se mai regăsesc o construcție de 6mp cu aer condiționat, o magazie de 8mp, solar de 16mp. Curtea în fața este pavata cu cauciuc de 3cm grosime autodrenant. Aleea de acces auto în lățime de 8mp poate adăposti până la 6 auto. Porțile de acces sunt acționate electric. Apa calda gratis, panouri solare cu baterii Anker de 7.6kw, aer condiționat, șemineu care încălzește toată casa, sistem de încălzire în pardoseală, grătar zidărie cărămidă..Gazele se afla pe proprietate. Casa se vinde mobilata utilata. Sunt proprietar, nu plătesc comision la agenții! Se accepta credit bancar ! Telefon ID anunț : 1759056510",25.11.2020,2,190159.234375,2020-11-25,1838.0,0,-28159.234375
320,Anunț,82000,EUR,5,1400,https://www.publi24.ro/anunturi/imobiliare/de-vanzare/case/case-vile/anunt/casa-de-vanzare-in-comuna-cut-judetul-alba/49f03iei3d9f7f1719e82132hdehd94f.html,images_case/anunt_320_img_0.webp|images_case/anunt_320_img_1.webp|images_case/anunt_320_img_2.webp|images_case/anunt_320_img_3.webp,4,,"Agentia imobiliara TABOO va ofera spre vanzare casa din caramida situata in Comuna Cut, Judetul Alba, la 5 km de autostrada Nadlac-Sibiu. Este compartimentata astfel: 5 camere, 2 bucatarii, un hol, o camera tehnica, sura, si pivnita cu bolta din caramida. Terenul este in suprafata de 1400 mp, cu deschidere la 2 strazi asfaltate de 12,5 ml la fiecare din acestea. Utilitati: apa, canalizare, curent. Casa necesita renovare. Se afla in apropiere de centrul comunei Cut, biserica, magazin, scoala. Pret: 82.000€ Cod ofertă / ID: P14791 Sună-ne acum la 0369.823.823 și află detalii despre această proprietate de vanzare din Cut, dar și despre alte proprietăți potrivite pentru tine. Apartamente de vanzare Sibiu Case de vanzare Sibiu Informatii speciale: 1. Descarcă aplicația de mobilul tau "" TABOO Imobiliare "" din Apple Store, Google Play sau Huawei AppGallery pentru a afla instantaneu noile proprietăți care intră pe piață. 2. Dacă ai o proprietate pe care vrei să o vinzi sau să o închiriezi , suntem aici pentru tine! Contactează-ne pentru o evaluare gratuită fără obligații și vei descoperi avantajele de a lucra cu o echipă dedicată și experimentată. 3. Dacă vrei sa incepi o cariera de agent imobiliar , suna la 0369.823.823 si programeaza o intalnire pentru a afla toate beneficiile si avantajele. Intra pe www.TABOO.ro și descoperă cele mai recente oferte, actualizate zilnic. ID anunț : 1650352499",03.05.2018,1329,161254.890625,2018-03-05,2834.0,0,-79254.890625
321,Anunț,127990,EUR,3,80,https://www.publi24.ro/anunturi/imobiliare/de-vanzare/case/case-vile/anunt/duplex-3-camere-perete-dublu-sanandrei-id-v5694/43e8id669h9274872h3d4hige7hidgd4.html,images_case/anunt_321_img_0.webp|images_case/anunt_321_img_1.webp|images_case/anunt_321_img_2.webp|images_case/anunt_321_img_3.webp,4,,"ID intern: V5694 Duplex cu 3 camere de vanzare in localitatea Sanandrei. FOXFORT propune spre vanzare casa tip duplex, cu un regim de inaltime Parter + 1 Etaj, situata in Sanandrei, zona asfaltata avand un numar de 3 camere, cu o suprafata utila de 80 mp si teren 170 mp. Anul constructiei este 2024, structura este din beton cu zidaria din caramida. Imobilul dispune de urmatoarele utilitati: curent electric, apa, gaz, asfalt, fosa septica, catv, fibra optica. Compartimentarea este dispusa dupa cum urmeaza: - Parter: hol, living, baie, bucatarie, camera tehnica, terasa; - Etaj: hol, 2 dormitoare, baie; - Pod depozitare. Finisajele interioare sunt moderne: - Usa intrare: pvc; - Usi interioare: celulare; - Tamplarie ferestre: pvc; - Podele: parchet, gresie. Casa dispune de centrala proprie cu incalzire in pardoseala. Finisajele interioare se pot alege in limita unui buget oferit de constructor. Pretul este de 127.990€ - COMISION 0%. Se accepta ca si modalitate de plata surse proprii sau credit bancar. Indicator performanta energetica: Clasa A Sediu agentie: Strada Mures, Nr. 39A, Timisoara, Timis Mai multe detalii la telefon: 0374.069.727 ID anunț : 1718277747",11.10.2019,1416,154597.8125,2019-11-10,2219.0,0,-26607.8125
322,Anunț,315000,EUR,4,235,https://www.publi24.ro/anunturi/imobiliare/de-vanzare/case/case-vile/anunt/casa-individuala-4-camere-3-bai-teren-235-mp-garaj-trei-stejari-sibiu/23g5d5f822ff76151g6426723d105egh.html,images_case/anunt_322_img_0.webp|images_case/anunt_322_img_1.webp|images_case/anunt_322_img_2.webp|images_case/anunt_322_img_3.webp,4,,"Casa individuala de vanzare in zona Trei Stejari, Sibiu, amplasata pe un teren cu suprafata de 235 mp. Avantaje majore ale acestei case: • Garaj ; • Renovata in anul 2022, izolata termic, centrala noua; • Trei bai; • Pivnita, plus alte spatii pentru depozitare; Casa are regim de inaltime D+P si are suprafata utila de 120 mp , fiind compusa din trei dormitoare, dintre care unul este folosit ca dressing in momentul de fata, living si bucatarie. Finisajele interioare sunt clasice: • Usa intrare: pvc; • Usi interioare: celulare; • Tamplarie ferestre: pvc, termopan; • Pereti: vopsea lavabila, faianta; • Podele: parchet, gresie. Utilitati si dotari: • Bucatarie: mobilata, utilata; • Mobilat: complet; • Utilitati: curent electric, apa, canalizare, gaz, catv, acces internet, fibra optica; • Izolatii: exterior, bloc izolat termic; • Contorizare: apometre, contor gaz, contor curent electric; Se accepta ca si modalitate de plata surse proprii sau credit bancar. Pret: 315.000€ Cod ofertă / ID: P25233 Sună-ne acum la 0369.823.823 și află detalii despre această proprietate de vanzare din Sibiu, dar și despre alte proprietăți potrivite pentru tine. Apartamente de vanzare Sibiu Case de vanzare Sibiu Informatii speciale: 1. Descarcă aplicația de mobilul tau "" TABOO Imobiliare "" din Apple Store, Google Play sau Huawei AppGallery pentru a afla instantaneu noile proprietăți care intră pe piață. 2. Dacă ai o proprietate pe care vrei să o vinzi sau să o închiriezi , suntem aici pentru tine! Contactează-ne pentru o evaluare gratuită fără obligații și vei descoperi avantajele de a lucra cu o echipă dedicată și experimentată. 3. Dacă vrei sa incepi o cariera de agent imobiliar , suna la 0369.823.823 si programeaza o intalnire pentru a afla toate beneficiile si avantajele. Intra pe www.TABOO.ro și descoperă cele mai recente oferte, actualizate zilnic. ID anunț : 1760601860",03.05.2018,1329,197719.296875,2018-03-05,2834.0,0,117280.703125
323,Anunț,15000,EUR,4,2500,https://www.publi24.ro/anunturi/imobiliare/de-vanzare/case/case-vile/anunt/casa-de-vanzare/79hf3diiegf3712717640642e38i87e9.html,,0,,"Casa spatioasa de vanzare-Comuna Barca ,strada Principala. Localizare premium: pozitionata chiar pe strada Principala,zona cu trafic si vizibilitate foarte buna. Potrivita pentru investitii: in localitate urmeaza sa debuteze proiecte finantate din fonduri europene ceea ce creste semnificativ potentialul proprietatii. Suprafata teren-2500mp Constructie solida Utilitati disponibile:curent,apa curenta ,canalizare. Curte mare potrivita pentru extindere sau amenajare. IDEALA pentru: -Pensiune  agroturism -Sediu firma sau centru de servicii -Dezvoltare proiecte cu finantare europeana -Locuinta personala cu potential comercial Nu rata ocazia de a investi intr-o zona in plina dezvoltare. Pentru detalii apelati telefonul din anunt. ID anunț : 1744182310",06.07.2018,13,21536.591796875,2018-06-07,2740.0,0,-6536.591796875
324,Anunț,146990,EUR,4,96,https://www.publi24.ro/anunturi/imobiliare/de-vanzare/case/casa/anunt/comision-0-duplex-mosnita-4-camere-asfalt-toate-utilitatile/8feg74ief49f7d13187f75gg73d6002g.html,images_case/anunt_324_img_0.webp|images_case/anunt_324_img_1.webp|images_case/anunt_324_img_2.webp|images_case/anunt_324_img_3.webp,4,,,,0,243879.6875,,,0,-96889.6875
325,Anunț,148990,EUR,4,104,https://www.publi24.ro/anunturi/imobiliare/de-vanzare/case/case-vile/anunt/duplex-mosnita-4-camere-pozitionat-excelent-v2961/0hd0f687ge1072262ff4gd809eeh8217.html,images_case/anunt_325_img_0.webp|images_case/anunt_325_img_1.webp|images_case/anunt_325_img_2.webp|images_case/anunt_325_img_3.webp,4,,"ID intern: V2961 Duplex de vanzare Mosnita Noua FOXFORT Imobiliare propune spre vanzare casa tip duplex, cu un regim de inaltime P+1, situata in Mosnita Noua, avand un numar de 4 camere, cu o suprafata utila de 104 mp si teren 256 mp.. Casa a fost construita in anul 2022, structura acesteia fiind din beton armat cu pereti de caramida, curtea va fi amenajata cu alei de beton amprentat. Imobilul este amplasat intr-un cartier foarte linistit la 3 minute de Mcity, Profi si la 5 minute de Lidl. Compartimentarea este dispusa dupa cum urmeaza: - Parter: hol, living, baie, bucatarie, terasa, camera tehnica; - Etaj: hol, 3 dormitoare, baie, dressing integrat în perete. Finisajele interioare sunt moderne si calitative: - Usa intrare: pvc; - Usi interioare: celulare; - Tamplarie ferestre: pvc; - Podele: gresie, parchet. Casa dispune de 1 loc de parcare. Se accepta ca si modalitate de plata creditul ipotecar. Pretul este de 148.990€ + comisionul standard al agentiei. Pentru a vedea toate ofertele valabile actualizate periodic, cu preturi reale si ultimele anunturi imobiliare adaugate intrati acum pe site-ul oficial FOXFORT Imobiliare: foxfort.ro Precizati intotdeauna ca ati vazut oferta cu ID: V2961 Sediu agentie: Strada Mures, Nr. 39A, Timisoara, Timis. Mai multe detalii la telefon: 0374.069.727 ID anunț : 1644917619",11.10.2019,1416,175759.484375,2019-11-10,2219.0,0,-26769.484375
326,Anunț,74000,EUR,2,2340,https://www.publi24.ro/anunturi/imobiliare/de-vanzare/case/casa/anunt/casa-de-vanzare-2-camere-2340-mp-teren-in-comuna-parau-judetul-brasov/22i9eh88329274751e87545f5e1gg146.html,images_case/anunt_326_img_0.webp|images_case/anunt_326_img_1.webp|images_case/anunt_326_img_2.webp|images_case/anunt_326_img_3.webp,4,,,,0,169156.0,,,0,-95156.0
327,Anunț,149000,EUR,6,2000,https://www.publi24.ro/anunturi/imobiliare/de-vanzare/case/case-vile/anunt/vand-case-in-hida/4e491e03e28579601d82227f71d29d1e.html,images_case/anunt_327_img_0.webp|images_case/anunt_327_img_1.webp|images_case/anunt_327_img_2.webp,3,,"Case de vânzare cu teren in suprafata de 2000 mp, in com. Hida, sat. Hida, str. Abatorului, nr. 2, jud Sălaj, la 35 km de Zalău și 50 km Cluj. Prima casa are la parter : 6 cam-ere (spațiu carmangerie) la etaj : 5 camere și spațiu pt o baie mare și pod . A doua casa are la subsol: 2 camere și 2 garaje , iar la parter 2 camere, bucatarie, spațiu restaurant, debara, baie . Constructiile sunt edificate in anul 1998 cu suprafața desfășurată de 654 mp. Incinta e pretabila pt: centru varstnici, pensiune, restaurant, carmangerie și locuință. ID anunț : 1745261994",17.02.2021,4,57297.1328125,2021-02-17,1754.0,0,91702.8671875
328,Anunț,155000,EUR,5,130,https://www.publi24.ro/anunturi/imobiliare/de-vanzare/case/case-vile/anunt/casa-individuala-becicherecu-mic-p-m-5-camere-2-bai/6985f89gi8i37ihe1f32ef34eih73d84.html,images_case/anunt_328_img_0.webp|images_case/anunt_328_img_1.webp|images_case/anunt_328_img_2.webp|images_case/anunt_328_img_3.webp,4,,"-Casa individuala Becicherecu Mic ,cu Regim de Inaltime Parter+Mansarda ,Termen de Finalizare Ianuarie 2026 - suprafata construita / utila de 160/130 mp - teren de 320  mp, cu front stradal de 14 ml - detalii constructive : ziduri exterioare si interioare din caramida porotherm 30 cm,tencuita interior\exterior , termoizolata exterior,polistiren de 10 cm Eps 80 , pod izolat,acoperis tigla - compartimentare: - Parter : hol acces,living , bucatarie,,un dormitor,o baie =Mansarda:3 dormitoare,o baie - Detalii AMENAJARE interioara :Finisaje si materiale de o calitate superioara -parchet laminat, gresie, faianta, ferestre cu tamplarie PVC si geam Tripan, usa PVC la intrare, usi interioare noi, vopsea lavabila, corpuri sanitare, incalzire prin pardoseala - CENTRALA termica PROPRIE Pe Gaz -Detalii suplimentare : Teren imprejmuit, poarta acces auto si poarta acces pietonal, acoperis tigla - dispune de urmatoarele utilitati (apa, canalizare , curent), drumul de acces fiind asfaltat Detalii pret : Pretul solicitat de proprietar este de 155.000 Euro Negociabil, Pret Casa La Cheie Se accepta si varianta de achizitionare prin intermediul unui credit bancar. Time for Investment a luat nastere din dorinta de a te ajuta sa-ti gasesti locuinta mult dorita si pentru ati fi alaturi pe tot parcursul de achizitie. Suntem o echipa tanara, dinamica dar si eficienta. Experienta ne permite sa facem lucrurile putin altfel oferind servicii complete, si ne ajuta sa ne regasim in cele sase criterii care ne definesc munca 1.Promptitudine Stim cat de important este timpul, suntem la dispozitia ta in cel mai scurt timp. 2.Atentia la detalii -Suntem atenti la criteriile clientului si le comparam cu piata actuala 3.Eficienta -Vizionam doar proprietatiile pliabile clientului 4.Baza de date Completa -Informam constant clientul in legatura cu ofertele din baza de date proprie si actualizata 5.Profesionalism - Oferim consultanta juridica, financiar bancara si va punem la dispozitie toate elementele tehnice 6.Suntem alaturi pana la final -Va impunem la primarie cat si la utilitati (gaz,curent) If youre planing to Invest, Call us… And we’ll do the rest !!! ID anunț : 1763230470",05.01.2021,65,150385.84375,2021-05-01,1681.0,0,4614.15625
329,Anunț,139990,EUR,3,100,https://www.publi24.ro/anunturi/imobiliare/de-vanzare/case/case-vile/anunt/casa-individuala-3-camere-sacalaz-zona-de-vest/f8dh7ed115237869162f257hi2f8i1h4.html,images_case/anunt_329_img_0.webp|images_case/anunt_329_img_1.webp|images_case/anunt_329_img_2.webp|images_case/anunt_329_img_3.webp,4,,"Casa individuala cu 3 camere de vanzare in localitatea Sacalaz, zona Vest. FOXFORT propune spre vanzare casa tip individuala, cu un regim de inaltime Parter + Pod, situata in Sacalaz, zona Vest, avand un numar de 3 camere, cu o suprafata utila de 100 mp si teren 504 mp. Anul constructiei este 2004, structura beton, material zidarie caramida. Imobilul dispune de urmatoarele utilitati: curent electric, apa, gaz, fosa septica. Compartimentarea este dispusa dupa cum urmeaza: - Parter: hol, 2 dormitoare, living, 2 bai, bucatarie, terasa; - Pod depozitare. Finisajele interioare sunt moderne: - Usa intrare: metal; - Usi interioare: panel; - Tamplarie ferestre: pvc; - Podele: parchet, gresie. Casa se vinde nemobilata si neutilata, dispune de centrala proprie cu incalzire prin calorifere si 2 locuri de parcare. Pretul este de 139.990€ + comisionul standard al agentiei. Se accepta ca si modalitate de plata surse proprii sau credit bancar. Indicator performanta energetica: Clasa B ID intern: V6562 ID anunț : 1717674080",11.10.2019,1416,194188.0625,2019-11-10,2219.0,0,-54198.0625
330,Anunț,59999,EUR,5,60,https://www.publi24.ro/anunturi/imobiliare/de-vanzare/case/case-vile/anunt/casa-individuala-60-mpu-974-m-teren-sat-armeni-sibiu/1gf75244e2e77030e6848ii1f6566306.html,images_case/anunt_330_img_0.webp|images_case/anunt_330_img_1.webp|images_case/anunt_330_img_2.webp|images_case/anunt_330_img_3.webp,4,,"Doresti sa achizionezi o locuinta? Vrei o casa cu 5 camere in Armeni la 40 minute de Judetul Sibiu. Aceasta casa de vanzare cu 5 camere este alegerea potrivita pentru tine si familia ta, cu suprafata construita de 167 mp si suprafata utila a casei de 60 mp. Structura cladirii este din caramida, are sistem de incalzire cu soba teracota pe gaz. Casa are un stil clasic si se vinde complet mobilata si utilata. Imobilul are o curte libera de 800 mp cu acces auto in curte, spatiu pentru zona de joaca a copiilor, Casa este formata din doua corpuri de cladire si este compartimentata : ~ Corp A: - Demisol: Pivnita; - Parter: hol, living, 2 camere; ~ Corp B: - Bucatarie, camera Casa beneficieaza si de o filigorie si o bucatarie de vara + un spatiu de depozitare in suprafata de 90mpu. Finisajele interioare sunt clasice: ~ Usa intrare: lemn; ~ Usi interioare: lemn; ~ Tamplarie ferestre: lemn; ~ Podele: dusumea; ~ Finisaj: necesita renovare; ~ Pereti: vopsea lavabila. In curte se afla si o fantana, apa si canalizarea sunt in fata porti. Pret: 59.999€ Cod ofertă / ID: P25158 Sună-ne acum la 0369.823.823 și află detalii despre această proprietate de vanzare din Armeni, dar și despre alte proprietăți potrivite pentru tine. Apartamente de vanzare Sibiu Case de vanzare Sibiu Informatii speciale: 1. Descarcă aplicația de mobilul tau "" TABOO Imobiliare "" din Apple Store, Google Play sau Huawei AppGallery pentru a afla instantaneu noile proprietăți care intră pe piață. 2. Dacă ai o proprietate pe care vrei să o vinzi sau să o închiriezi , suntem aici pentru tine! Contactează-ne pentru o evaluare gratuită fără obligații și vei descoperi avantajele de a lucra cu o echipă dedicată și experimentată. 3. Dacă vrei sa incepi o cariera de agent imobiliar , suna la 0369.823.823 si programeaza o intalnire pentru a afla toate beneficiile si avantajele. Intra pe www.TABOO.ro și descoperă cele mai recente oferte, actualizate zilnic. ID anunț : 1759927420",03.05.2018,1329,165341.90625,2018-03-05,2834.0,0,-105342.90625
331,Anunț,130000,EUR,3,736,https://www.publi24.ro/anunturi/imobiliare/de-vanzare/case/case-vile/anunt/teren-cu-casa-in-constructie/gi168d0127de7g37ei1ii6hf57i83e5e.html,images_case/anunt_331_img_0.jpg|images_case/anunt_331_img_1.jpg|images_case/anunt_331_img_2.jpg|images_case/anunt_331_img_3.webp,4,,"Vând 736 mp teren cu casa în construcție+anexă,proiect cu autorizație valabilă până în august 2026.Proiectul casei este P+M,100mp amprenta la sol.Parterul este distribuit in1dormitor  birou, bucătărie,baie,living iar mansarda 2 dormitoare,baie,dresing,living.Anexa este compusă din garaj,bucătărie,baie, cameră de alimente.Imprejmuirea,este cu gard din plăci din beton.Utilitati instalate: apă,contor,canalizare,curent( contor).Terenul se află în Moșnița Veche,str.Dorin Teodorescu.In momentul de față, construcția este la nivel de fundație+ placă.Informatii suplimentare pe watsapp   sau  . ID anunț : 1753385588",28.11.2021,1,155481.34375,2021-11-28,1470.0,0,-25481.34375
332,Anunț,300000,EUR,5,220,https://www.publi24.ro/anunturi/imobiliare/de-vanzare/case/casa-de-vacanta/anunt/casa-de-vanzare/381i5gfg5f9374f4d7hh440eef46435h.html,images_case/anunt_332_img_0.webp|images_case/anunt_332_img_1.webp|images_case/anunt_332_img_2.webp|images_case/anunt_332_img_3.webp,4,,"CASĂ DIN CĂRĂMIDĂ  5 CAMERE HOL BAIE BUCĂTĂRIE DEBARA ,BUC DE VARĂ HOL CRAMĂ SOLAR MAGAZIE DIN CĂRĂMIDĂ.PARCHET CENTRALA TERMICĂ PE GAZ. 35 ML DES GHIDERE 1850 MP GAZE APA CANAL CENTRALĂ. DOUA FĂNTĂNI CU APĂ BECI. ID anunț : 1744118930",12.09.2021,2,153704.359375,2021-12-09,1459.0,0,146295.640625
333,Anunț,145000,EUR,2,215,https://www.publi24.ro/anunturi/imobiliare/de-vanzare/case/case-vile/anunt/proprietar-vand-casa-in-gradiste/13g4098d3h047d3g10e17de93861g8ge.html,images_case/anunt_333_img_0.webp|images_case/anunt_333_img_1.webp|images_case/anunt_333_img_2.webp|images_case/anunt_333_img_3.webp,4,,"Proprietar, vand casa in gradiste, 215mp suprafață totala, 80mp utila, 2 camere, living, bucătărie, baie, garaj, cu posibilitate mansardare, încălzire în pardoseală, toate utilitățile. Preț 145000  negociabil! Nu doresc colaborare cu firme imobiliare!!! ID anunț : 1761772651",31.05.2020,1,138487.21875,2020-05-31,2016.0,0,6512.78125
334,Anunț,53500,EUR,4,146,https://www.publi24.ro/anunturi/imobiliare/de-vanzare/case/case-vile/anunt/casa-din-caramida-in-satul-visag/1675888f19e176g7e931f54ie8347551.html,images_case/anunt_334_img_0.jpg|images_case/anunt_334_img_1.jpg|images_case/anunt_334_img_2.jpg|images_case/anunt_334_img_3.jpg,4,,vind casa din cărămida in sat Visag  20 km de Lugoj compusă din 3 camere 1 Bucătărie mare 1 baie și un hol. construcție din cărămida cu fundatie solida. baea are boiler 80 litri nou. cabina dus. fosa septica. porți din fier cu policarbonat puse recent. tîmplarie termopan pusă recent cu rulouri. +o casa in curte cu Bucătărie și o magazie. apa de la rețea plus o fintina cu pompa in curte internet fibră optică cablu tv. grădina cu pomi fructiferi in jur de 90 pomi pe rod. vita de vie. plus terasa și grătar in curte suprafața construită 146 m2 total 2100m2. certificat energetic acte la zi. se vinde semi mobilată  mai multe detalii la telefon ID anunț : 1655320481,30.07.2008,4,162635.8125,2008-07-30,6339.0,0,-109135.8125
335,Anunț,90000,EUR,3,109,https://www.publi24.ro/anunturi/imobiliare/de-vanzare/case/case-vile/anunt/casa-de-vanzare-bucsesti-bacau/h3fei6eii72d77fhedi63id83h70hd4h.html,images_case/anunt_335_img_0.webp|images_case/anunt_335_img_1.webp|images_case/anunt_335_img_2.webp|images_case/anunt_335_img_3.webp,4,,,,0,148922.625,,,0,-58922.625
336,Anunț,235000,EUR,5,350,https://www.publi24.ro/anunturi/imobiliare/de-vanzare/case/case-vile/anunt/casa-5-camere-2-bai-mobilata-utilata-5-min-metrou-comuna-berceni/9755ee02910773d11g5f17f0h8g919fg.html,images_case/anunt_336_img_0.webp|images_case/anunt_336_img_1.webp|images_case/anunt_336_img_2.webp|images_case/anunt_336_img_3.webp,4,,"Proprietate rezidențială deosebită, situată fix la intrarea în Comuna Berceni, la doar 5 minute de stația de metrou Tudor Arghezi. Locuința este ideală pentru o familie care își dorește confort, acces rapid către București și liniștea unei zone rezidențiale în plină dezvoltare. Proprietatea dispune de un teren generos de 350 mp și o suprafață utilă de 126 mp, fiind excelent compartimentată: 5 camere, dintre care 3 dormitoare spațioase 2 băi moderne o cameră suplimentară ce poate fi utilizată ca birou sau dressing, în funcție de nevoile fiecăruia Casa se predă complet igenizată, mobilată și utilată, fiind pregătită pentru a fi locuită imediat. Dotările și finisajele de calitate includ: încălzire în pardoseală ferestre cu geam tripan sistem de supraveghere video și alarmă poartă cu motor automatizat gazon cu sistem de aspersoare placă de beton la etaj, oferind rezistență sporită construcției sistem de dedurizare a apei Proprietatea este foarte bine amenajată, astfel încât să ofere confort și relaxare pentru momentele petrecute alături de cei dragi. Pentru mai multe detalii și programarea unei vizionări, mă puteți contacta: Giamanu Augustin 07 arata numarul .240.889 ID anunț : 1756577818",22.08.2025,27,189213.34375,2025-08-22,107.0,0,45786.65625
337,Anunț,122500,EUR,4,415,https://www.publi24.ro/anunturi/imobiliare/de-vanzare/case/case-vile/anunt/pret-special-vila-4-camere-teren-415-mp-berceni-vidra/12371fdg0g0e7f94d230h99g90136e0i.html,images_case/anunt_337_img_0.webp|images_case/anunt_337_img_1.webp|images_case/anunt_337_img_2.webp|images_case/anunt_337_img_3.webp,4,,"Profită acum de o ofertă promoțională pentru o casă nouă, pe parter, cu 4 camere, amplasată pe un teren de 415 mp, în cel mai nou complex rezidențial din zona Berceni/Vidra. De ce să alegi această casă? • Design Practic și Elegant: Te vei bucura de un dormitor matrimonial cu baie proprie și dressing, perfect pentru intimitate. Bucătăria open space e ideală pentru cine în familie, iar terasa de 19 mp devine locul tău preferat pentru cafeaua de dimineață sau seri relaxante. • Calitate Superioară la Fiecare Pas: Nu facem compromisuri când vine vorba de confort! Casa dispune de finisaje premium, încălzire prin pardoseală pentru un ambient plăcut, tâmplărie Salamander tripan pentru izolație maximă și exterioare din travertin care adaugă o notă de rafinament. • Conectivitate Fără Griji: Toate utilitățile esențiale sunt deja racordate: curent, gaze și apă curentă. • Complex Centrat pe Familie: Locuiește într-un mediu sigur și prietenos! Complexul oferă supraveghere video, o stație STV și un loc de joacă modern pentru copii. • Acces Rapid la Oraș: Ești la doar câteva minute de DJ 401 - Calea București, prin cartierul Dealul Verde, Vidra, asigurând un acces facil și rapid către Capitală, fără stresul traficului intens. Grăbește-te! Această ofertă promoțională este limitată! Pentru mai multe detalii sau pentru a programa o vizionare. ID anunț : 1763544636",28.03.2024,344,165999.90625,2024-03-28,619.0,0,-43499.90625
338,Anunț,115000,EUR,3,7,https://www.publi24.ro/anunturi/imobiliare/de-vanzare/case/case-vile/anunt/duplex-parter-toate-utilitatile-finisaje-premium-curte-generoasa/dd99fiei4d3f72g2e42ii48ihf324667.html,images_case/anunt_338_img_0.webp|images_case/anunt_338_img_1.webp|images_case/anunt_338_img_2.webp|images_case/anunt_338_img_3.webp,4,,"Duplex modern de vânzare în Sanandrei, pe un singur nivel, cu utilități complete, finisaje premium și curte generoasă. Detalii proprietate: Suprafață utilă: 69,7 mp Teren: 250 mp Compartimentare: Living + bucătărie open space 2 dormitoare Baie mare cu cadă (complet utilată) Dotări și finisaje: Construcție din cărămidă 25 cm Izolație 10 cm EPS 80 Tâmplărie PVC cu geam tripan Încălzire prin pardoseală cu termostat în fiecare cameră Finisaje moderne, premium Disponibil imediat Utilități: Apă, gaz, curent electric, fosă septică Avantaje locație: Zonă liniștită, ideală pentru familii Acces facil către Timișoara Pentru detalii si vizite va rog sa ma contactati! ID anunț : 1764687253",18.10.2017,85,161038.484375,2017-10-18,2972.0,0,-46038.484375
339,Anunț,182000,EUR,3,444,https://www.publi24.ro/anunturi/imobiliare/de-vanzare/case/case-vile/anunt/casa-in-iosia-cu-teren-de-444-mp/9hf61681gh0f7493174226e6i15dg067.html,images_case/anunt_339_img_0.webp|images_case/anunt_339_img_1.jpg|images_case/anunt_339_img_2.jpg|images_case/anunt_339_img_3.jpg,4,,"Casa in cartierul Iosia Situata pe colt, cu un front stradal generos de 24 m si 18 m la doua strazi. Terenul aferent masoara 444 mp Casa este compusa din: 3 camere, o bucatarie, o baie + anexe utile pentru diverse nevoi gospodaresti Incalzirea este asigurata de o centrala pe gaz Avantaje: Proximitate fata de facilitati: transport in comun, magazine, scoala si gradinita Acces rapid: catre centrul orasului si catre centura Oradea Zona linistita si sigura, perfecta pentru familii sau investitii imobiliare * Aceasta proprietate ofera un potential remarcabil pentru cei care doresc sa isi creeze un camin de vis intr-o locatie premium sau sa realizeze o investitie solida pe piata imobiliara din Oradea. ID anunț : 1733236817",09.06.2008,84,200012.25,2008-09-06,6301.0,0,-18012.25
340,Anunț,649990,EUR,5,250,https://www.publi24.ro/anunturi/imobiliare/de-vanzare/case/casa/anunt/casa-tip-californian-cu-crama-piscina-sauna-garaj-teren-liber-250-mp/d45230i7h46e72i5ehi776365df05092.html,images_case/anunt_340_img_0.webp|images_case/anunt_340_img_1.webp|images_case/anunt_340_img_2.webp|images_case/anunt_340_img_3.webp,4,,"Vrei sa te muti intr-o casa individuala, eleganta si moderna in zona Calea Dumbravii din Sibiu? Aceasta casa tip californian cu crama, piscina, sauna, garaj si teren liber de 250 mp este exact ceea ce cauti! Imobilul este construit cu materiale de calitate superioara, iar finisajele interioare sunt de lux. Piscina de 20 mp are o adancime de 1,40 m si este incalzita de un panou termic de 20 mp, care poate fi folosit si pentru a furniza apa calda menajera. In plus, casa are panouri fotovoltaice de 7 kw, cu o baterie care poate furniza pana la 10 kw de energie electrica. Imobilul are o deschidere la drum de 12,5 metri si un garaj in care iti poti parca masina in siguranta. In curtea libera de 250 mp poti petrece timpul liber cu familia si prietenii, sau te poti relaxa in sauna dupa o zi lunga de munca. Casa are 5 camere, o suprafata utila de 323 mp si o suprafata construita de 431 mp. Structura cladirii este din caramida si are sistem de incalzire cu termoficare, centrala proprie, calorifere, semineu si sistem de climatizare aer conditionat. In interior, vei gasi o casa complet mobilata si utilata, cu usi interioare din lemn, tamplarie ferestre din PVC cu geam termopan, podele din parchet si gresie si pereti finisati cu vopsea lavabila, faianta sau lambriu. Casa este compartimentata astfel: demisol cu spatiu pentru depozitare si crama, parter cu hol, living, baie, bucatarie, etaj cu hol, 3 dormitoare, baie si balcoane de 8 mp si terasa de 35 mp, la mansarda avem 1 birou care poate fi folosit ca si camera pentru copil. Mai dispune si de pod pentru depozitare. Imobilul este situat in zona Calea Dumbravii, Sibiu, in apropiere de statiile de transport in comun si de alte facilitati. Aceasta este o oportunitate unica de a cumpara o casa deosebita intr-o locatie excelenta! Pret: 649.990€ Cod ofertă / ID: P17634 Sună-ne acum la 0369.823.823 și află detalii despre această proprietate de vanzare din Sibiu, dar și despre alte proprietăți potrivite pentru tine. Apartamente de vanzare Sibiu Case de vanzare Sibiu Informatii speciale: 1. Descarcă aplicația de mobilul tau "" TABOO Imobiliare "" din Apple Store, Google Play sau Huawei AppGallery pentru a afla instantaneu noile proprietăți care intră pe piață. 2. Dacă ai o proprietate pe care vrei să o vinzi sau să o închiriezi , suntem aici pentru tine! Contactează-ne pentru o evaluare gratuită fără obligații și vei descoperi avantajele de a lucra cu o echipă dedicată și experimentată. 3. Dacă vrei sa incepi o cariera de agent imobiliar , suna la 0369.823.823 si programeaza o intalnire pentru a afla toate beneficiile si avantajele. Intra pe www.TABOO.ro și descoperă cele mai recente oferte, actualizate zilnic. ID anunț : 1680859107",03.05.2018,1329,153479.609375,2018-03-05,2834.0,0,496510.390625
341,Anunț,235000,EUR,5,350,https://www.publi24.ro/anunturi/imobiliare/de-vanzare/case/case-vile/anunt/casa-5-camere-2-bai-mobilata-utilata-5-min-metrou-comuna-berceni/9755ee02910773d11g5f17f0h8g919fg.html,images_case/anunt_341_img_0.webp|images_case/anunt_341_img_1.webp|images_case/anunt_341_img_2.webp|images_case/anunt_341_img_3.webp,4,,,,0,189213.34375,,,0,45786.65625
342,Anunț,204990,EUR,4,115,https://www.publi24.ro/anunturi/imobiliare/de-vanzare/case/case-vile/anunt/duplex-individual-cu-garaj-si-4-camere-3-bai-mosnita-noua-toate-utilitatile/f7348d931f92770feg20f835h8g8ffdf.html,images_case/anunt_342_img_0.webp|images_case/anunt_342_img_1.webp|images_case/anunt_342_img_2.webp,3,,"Duplex cu 4 camere de vanzare in localitatea Mosnita Noua. FOXFORT propune spre vanzare casa tip duplex, cu un regim de inaltime Parter + 1 Etaj, situata in Mosnita Noua, avand un numar de 4 camere, cu o suprafata utila de 115 mp si teren 450 mp. Anul constructiei este 2025, structura beton, material zidarie caramida. Imobilul dispune de urmatoarele utilitati: curent electric, apa, canalizare, gaz, catv, fibra optica. Casa dispune de centrala proprie cu incalzire prin pardoseala si 3 locuri de parcare. Compartimentarea este dispusa dupa cum urmeaza: - Parter: hol, living, baie, bucatarie, garaj, camera tehnica si terasa; - Etaj: hol, 3 dormitoare, 2 bai; - Pod depozitare. Finisajele interioare sunt moderne: - Usa intrare: pvc; - Usi interioare: celulare; - Tamplarie ferestre: pvc; - Podele: parchet, gresie. Pretul este de 204.990€ - COMISION 0%. Se accepta ca si modalitate de plata surse proprii sau credit bancar. Indicator performanta energetica: Clasa B ID intern: V8842 ID anunț : 1763469263",11.10.2019,1416,50911.60546875,2019-11-10,2219.0,0,154078.39453125
343,Anunț,115000,EUR,5,97,https://www.publi24.ro/anunturi/imobiliare/de-vanzare/case/case-vile/anunt/casa-in-zona-centrala-5-camere-2-bucatarii-3-bai-curte-comuna-cisnadie/377gg14694f87e0010363e766969fd2d.html,images_case/anunt_343_img_0.webp|images_case/anunt_343_img_1.webp|images_case/anunt_343_img_2.webp|images_case/anunt_343_img_3.webp,4,,"Comision 0% Casa de vanzare situata pe o strada principala in Cisnadie, cu o suprafata utila de 97 mp si regim de inaltime parter si 1 etaj. Proprietatea este compusa din 2 apartamente cu intrari individuale iar in total sunt 5 camere, 2 bucatarii, 3 bai, camara, pivnita,loc de parcare si o zona verde de 25 mp pentru gradina de zarzavat sau zona de gratar. Primul apartament este compus din 3 camere, 1 bucatarie, 1 baie si scara interioara. Al doilea apartament este compus din 2 camere fiecare cu baie proprie, o bucatarie hol si scara interioara. Casa este izolata pe exterior, are acoperisul cu tigla schimbata, incalzirea se realizeaza prin centrala proprie si calorifere, geamurile sunt tip termopan, baile sunt decente si renovate in stil modern, bucatariile sunt mobilate si utilate iar curtea comuna este mare si vecinii pot parca usor masini. Proprietatea este ideala pentru 2 familii care doresc sa stea aproape dar totusi separat. Este ideala si pentru o familie care sa locuiasca intr-un apartament iar al doilea il inchirieaza pentru un venit suplimentar dar este ideala si pentru inchiriere in regim hotelier. Zona este buna deoarece strada este o strada principala iar pentru a ajunge in centrul orasul sau in zona de mall este nevoie de 15 minute de mers pe jos. Scolile, farmaciile, cafenelele, bancile piata agroalimentara si alte facilitati ale orasului sunt si ele aproape. Pret: 115.000€ Cod ofertă / ID: P25169 Sună-ne acum la 0369.823.823 și află detalii despre această proprietate de vanzare din Cisnadie, dar și despre alte proprietăți potrivite pentru tine. Apartamente de vanzare Sibiu Case de vanzare Sibiu Informatii speciale: 1. Descarcă aplicația de mobilul tau "" TABOO Imobiliare "" din Apple Store, Google Play sau Huawei AppGallery pentru a afla instantaneu noile proprietăți care intră pe piață. 2. Dacă ai o proprietate pe care vrei să o vinzi sau să o închiriezi , suntem aici pentru tine! Contactează-ne pentru o evaluare gratuită fără obligații și vei descoperi avantajele de a lucra cu o echipă dedicată și experimentată. 3. Dacă vrei sa incepi o cariera de agent imobiliar , suna la 0369.823.823 si programeaza o intalnire pentru a afla toate beneficiile si avantajele. Intra pe www.TABOO.ro și descoperă cele mai recente oferte, actualizate zilnic. ID anunț : 1760012987",03.05.2018,1329,187500.28125,2018-03-05,2834.0,0,-72500.28125
344,Anunț,234000,EUR,7,150,https://www.publi24.ro/anunturi/imobiliare/de-vanzare/case/case-vile/anunt/casa-cu-2-corpuri-in-curte-individuala-zona-bartolomeu-6-camere/hie373g0fff0782ge0e8fg09396e8di5.html,images_case/anunt_344_img_0.jpg|images_case/anunt_344_img_1.jpg|images_case/anunt_344_img_2.jpg|images_case/anunt_344_img_3.jpg,4,,"Blitz va prezinta o oportunitate unică de achiziție a unei proprietăți situate în zona centrală a Brașovului, ideală pentru cei care își doresc intimitate și confort, fiind singur în curte, cu acces direct din stradă. Această proprietate este compusă din două corpuri de clădire, fiecare oferind caracteristici distincte. Corpul 1: această casă este formată din două camere spațioase, o baie generoasă și o bucătărie complet utilată. La demisol se află o pivniță care se întinde pe toată suprafața casei, perfectă pentru depozitare. Casa se vinde mobilată și utilată, iar confortul este asigurat de cele două sobe de teracotă și un aparat de aer condiționat cu inverter. Acoperișul este din țiglă, iar ferestrele sunt de tip termopan, completând un interior dotat cu parchet, gresie și faianță. Corpul 2: recent renovată, această casă dispune de două camere, o baie și o bucătărie deschisă la parter, iar la etaj găsim alte două camere, o baie cu aerisire naturală și un hol generos. Izolația cu spumă poliuretanică, ferestrele termopan și structura mixtă (cărămidă la parter, BCA la etaj) oferă durabilitate și confort termic. Exteriorul este izolat, iar la interior necesită amenajări personalizate. Utilitățile sunt parțial realizate: apă și canalizare trase în interior, iar gazul este prezent în curte, necesită doar branșarea. Curtea oferă spațiu suficient pentru a parca mașina și pentru amenajarea unui foișor. Proprietatea reprezintă o investiție excelentă, potrivită atât pentru locuit, cât și pentru activități comerciale. Pretul este negociabil. Vă invităm la vizionare pentru a descoperi potențialul acestei case! Cod ofertă / ID BLITZ: P137414 ID anunț : 1733996302",07.05.2021,9948,190927.484375,2021-07-05,1616.0,0,43072.515625
345,Anunț,22000,EUR,4,1100,https://www.publi24.ro/anunturi/imobiliare/de-vanzare/case/case-vile/anunt/vand-casa-in-comuna-bala/hegd968422g07e6f1f60g77fd8346665.html,images_case/anunt_345_img_0.webp|images_case/anunt_345_img_1.webp|images_case/anunt_345_img_2.webp|images_case/anunt_345_img_3.webp,4,,"Se vinde casa batraneasca LOCUITA, in Comuna Bala Sat Crainici MH. Casa dispune de 4 dormitoare, baie si Bucatarie +anexe. Se vinde cu mobila existenta!!! Baia este noua cu Biler pe lemne din Inoc si panou solar pentru apa calda. Bucataria are mobila noua si se vinde utilata cu masina de spalat, Frigider si Aragaz. Proprietatea mai diapune si de apa curenta din sursa proprie. In curte mai exista ai doua fantani. Vie, Pomi fructiferi si gradina. Suprafata totala de teren 1100 mp cu deschidere 30ml la drum. Gard din placi de Beton. Nou( montat in primavara) Pentru alte detalii in privat! ID anunț : 1750996511",07.02.2022,2,134610.09375,2022-07-02,1254.0,0,-112610.09375
346,Anunț,60000,EUR,3,35,https://www.publi24.ro/anunturi/imobiliare/de-vanzare/case/case-vile/anunt/casa-de-vanzare/5g719g908e2e700gdd0i580f295d1gg7.html,images_case/anunt_346_img_0.jpg|images_case/anunt_346_img_1.jpg|images_case/anunt_346_img_2.jpg|images_case/anunt_346_img_3.jpg,4,,"Vând casă, în localitatea Laslău Mare,comuna Suplac,formată din două corpuri de clădire , ideală pentru două familii  ,astfel:primul corp acoperiș cu țiglă nouă,  este compus din două camere,bucătărie,baie,cămară , două holuri. Camerele și bucătăria sunt parchetate și izolate cu polistiren extrudat. Al doilea corp de clădire este format din sufragerie cu suprafața de 35mp,  loc pentru baie   cămară și o bucătărie de vară. Încălzirea locuinței se face cu CT pe gaz în condensare -calorifere sau cu sobe de teracotă noi. Alimentarea cu apă potabilă se face din fântână cu hidrofor, canalizarea se realizează prin fosă ecologică, iar apa și canalizarea de la rețea sunt în fața porții. Suprafața totală a clădirilor este de 149 mp. Casa dispune de o pivniță de 40mp, copertina auto pentru două autoturisme,magazie de unelte,anexe gospodărești, cotețe pentru păsări,camere de supraveghere etc. Suprafața terenului cu casa este de 25 de arii.Grădina este generoasă și dispune de pomi  fructiferi tineri:meri,peri,vișini,piersici,nuci și o livadă de pruni tineri toți pe rod,căpșuni,coacăze,zmeură,agrișe, rubarba. Casă se află la șoseaua principală,vis-a-vis de Școala Gimnazială,la o distanță de 35 km de Tg.Mureș și 23km de Târnăveni  ,într-o zonă liniștită și pitorească. Prețul este negociabil. NU RĂSPUND LA MESAJE!!! ID anunț : 1704260688",24.04.2018,2,208995.875,2018-04-24,2784.0,0,-148995.875
347,Anunț,29999,EUR,2,70,https://www.publi24.ro/anunturi/imobiliare/de-vanzare/case/case-vile/anunt/vand-casa-de-locuit-sat-braznic-com-ilia-jud-hunedoara/2ff55405ie2e761d1591ied339e56525.html,images_case/anunt_347_img_0.jpg|images_case/anunt_347_img_1.jpg|images_case/anunt_347_img_2.jpg|images_case/anunt_347_img_3.jpg,4,,"Vand casa de locuit in sat Braznic, com. Ilia, jud. Hunedoara, renovata in anul 2010. Un corp este format din trei camere de locuit si o pivnita. Al doilea corp este format dintr-o bucatarie si o baie si mai multe dependinte (sura, sopru). Suprafata locuibila este de 70 mp. Utilitati : acces auto (asfalt la poarta), apa curenta, fantana in curte, energie electrica. Curtea este partial betonata. Casa se vinde partial mobilata. ID anunț : 1701681677",19.02.2020,3,142154.125,2020-02-19,2118.0,0,-112155.125
348,Anunț,11500,EUR,4,700,https://www.publi24.ro/anunturi/imobiliare/de-vanzare/case/case-vile/anunt/vand-casa-in-battonya-ungaria/777f5070d8i77443ee475h3875fgd9i0.html,images_case/anunt_348_img_0.jpg|images_case/anunt_348_img_1.jpg|images_case/anunt_348_img_2.jpg,3,,"Vand casa in Battonya,ungaria.Casa necesita renovare dar se poate locuii.Are toate utilitatile(curent,apa,gaz,canalizare)Casa are si un teren de in jur de 700mp.Pret 11500euro ID anunț : 1735549758",08.01.2011,9,53664.43359375,2011-08-01,5242.0,0,-42164.43359375
349,Anunț,519990,EUR,10,500,https://www.publi24.ro/anunturi/imobiliare/de-vanzare/case/case-vile/anunt/vila-cu-10-camere-de-vanzare-in-chisoda-id-v3322/h3eg980266727f2920g09967g9d3i2ih.html,images_case/anunt_349_img_0.webp|images_case/anunt_349_img_1.webp|images_case/anunt_349_img_2.webp|images_case/anunt_349_img_3.webp,4,,"ID intern: V3322 Vila de vanzare in Chisoda, foarte aproape de Timisoara. FOXFORT Imobiliare va propune spre vanzare casa tip individuala, cu un regim de inaltime distribuit pe parter + 2 etaje, situata in localitatea Chisoda, aproape de Lidl-ul de langa Unitatea Militara. Casa are un numar de 10 camere, cu o suprafata utila de 500 mp si teren 2000 mp. Aceasta a fost construita in anul 1994, structura acesteia fiind din beton si pereti din BCA. Imobilul este situat in apropiere de statia transport in comun, Stadion Chisoda si Lidl-ul de langa Unitatea Militara. Compartimentarea este dispusa dupa cum urmeaza: - Parter: salon mare, hol, 2 bai, 2 dormitoare, bucatarie, terasa; - Etaj 1: hol, 3 dormitoare, 2 bai, dressing, 2 balcone; - Etaj 2: hol 3 dormitoare, 2 bai; - Pod: util. Casa este mobilata si utilata: aragaz, hota, masina de spalat rufe, uscator de rufe, 2 frigidere cu congelator. Finisajele interioare sunt moderne: - Usa intrare: pvc; - Usi interioare: lemn; - Tamplarie ferestre: pvc; - Podele: parchet, gresie. Casa dispune de 4 locuri de parcare + 4 garaje. Se accepta ca si modalitate de plata cash sau credit bancar. In curte mai sunt 2 case mici, una mai veche iar cealalta mai noua care se pot folosi sau darama si se castiga si mai mult spatiu. Curtea este amenajata, este gazon plantat si exista inclusiv o zona de gradina care se poate cultiva. In curte sunt si anexe pentru depozitare. Finisajele interioare sunt de calitate, iar parchetul, scara, balustrada si usile interioare sunt din lemn masiv. Pretul este de 519.990€ + comisionul standard al agentiei. Indicator performanta energetica: Clasa A Pentru a vedea toate ofertele valabile actualizate periodic, cu preturi reale si ultimele anunturi imobiliare adaugate intrati acum pe site-ul oficial FOXFORT Imobiliare: foxfort.ro Precizati intotdeauna ca ati vazut oferta cu ID: V3322 Sediu agentie: Strada Mures, Nr. 39A, Timisoara, Timis. Mai multe detalii la telefon: 0374.069.727 ID anunț : 1649707059",11.10.2019,1416,184445.4375,2019-11-10,2219.0,0,335544.5625
350,Anunț,299990,EUR,9,261,https://www.publi24.ro/anunturi/imobiliare/de-vanzare/case/case-vile/anunt/casa-individuala-cu-9-camere-dumbravita-id-v3263/8152993f07h77106d37757ed06d6244h.html,images_case/anunt_350_img_0.webp|images_case/anunt_350_img_1.webp|images_case/anunt_350_img_2.webp|images_case/anunt_350_img_3.webp,4,,"ID intern: V3263 Casa cu 9 camere de vanzare in localitatea Dumbravita, zona kaufland Dumbravita FOXFORT Imobiliare propune de vanzare casa tip individuala, cu un regim de inaltime Parter + Mansarda, situata in Dumbravita, zona Nord, avand un numar de 9 camere, cu o suprafata utila de 261 mp si teren 658 mp. Anul constructiei este 2004, structura beton, material zidarie caramida. Imobilul dispune de urmatoarele utilitati: curent electric, apa, canalizare, gaz, curent trifazic, catv, fibra optica Compartimentarea este dispusa dupa cum urmeaza: - Parter: hol, living, 2 bai, bucatarie, 3 dormitoare, terasa; - Mansarda: hol, 5 dormitoare, 2 bai, chicineta; - Demisol. Finisajele interioare sunt moderne: - Usa intrare: pvc; - Usi interioare: celulare; - Tamplarie ferestre: pvc; - Podele: parchet, gresie. Casa se vinde mobilata si utilata: plita, cuptor, hota, aragaz, masina de spalat rufe, frigider cu congelator. Casa dispune de 4 locuri de parcare. Pretul este de 299.990€ + comisionul standard al agentiei. Se accepta ca si modalitate de plata cash si credit ipotecar. Sediu agentie: Strada Mures, Nr. 39A, Timisoara, Timis. ID anunț : 1648886311",11.10.2019,1416,159353.234375,2019-11-10,2219.0,0,140636.765625
351,Anunț,117000,EUR,3,104,https://www.publi24.ro/anunturi/imobiliare/de-vanzare/case/case-vile/anunt/casa-individuala-timisoara-zona-crisan-teren-354-oportunitate-unica/567he979698i7f7114i56d3ef0i5ed8f.html,images_case/anunt_351_img_0.webp|images_case/anunt_351_img_1.webp|images_case/anunt_351_img_2.webp|images_case/anunt_351_img_3.webp,4,,"Va propunem spre vanzare o casa individuala in Timisoara, Zona Crisan. Casa are suprafata utila 70,85 metri patrati si suprafata curte individuala - 354 metri patrati. Casa este compusa din: - trei camere - o bucatarie -o baie -hol ( aveti schita detaliata cu pozitionarea lor si dimensiuni in fotografii). Casa se vinde partial mobilata. Casa e de caramida, are fundatie de beton, nu se poate mansarda. Utilitati : -apa si canalizare Aquatim - curent PPC - deseuri menajere Retim - put apa forat in curte. Gazul nu este racordat, dar este in fata portii. Casa a fost recent renovata. Incalzirea se face cu lemne. Are un loc de parcare in curte in fata casei si inca doua locuri de parcare pe strada. Zona e foarte linistita, pana in centru sunt 20 minute cu bicicleta pe pista pe malul Begai, cu masina intre 10 si 15 minute in functie de trafic. Pret 117000 euro+comision agentie PRETUL NU E NEGOCIABIL Pentru a programa o vizionare nu ezitati sa ma contactati. ID anunț : 1762791783",09.03.2025,191,131191.296875,2025-09-03,95.0,0,-14191.296875
352,Anunț,90000,EUR,5,820,https://www.publi24.ro/anunturi/imobiliare/de-vanzare/case/case-vile/anunt/casa-de-vanzare-5-camere/h6dhh33h95i87d34d817ide680g7g7d9.html,images_case/anunt_352_img_0.jpg|images_case/anunt_352_img_1.jpg|images_case/anunt_352_img_2.jpg|images_case/anunt_352_img_3.jpg,4,,"Se vinde casă ,5 camere ,10 m deschidere cu 82 lungime ,total 820 mp , Alexandria, str 1907 nr 1 , gaze ,centrala termica proprie,  apa curentă, canalizare. mobilată și utilată, preț 90 mii euro (90.000 euro) ID anunț : 1681548050",28.06.2014,2,143750.6875,2014-06-28,4180.0,0,-53750.6875
353,Anunț,90000,EUR,5,820,https://www.publi24.ro/anunturi/imobiliare/de-vanzare/case/case-vile/anunt/casa-de-locuit-820-mp/208f3i45ei937937e0fgihd3d6d24fie.html,images_case/anunt_353_img_0.jpg|images_case/anunt_353_img_1.jpg|images_case/anunt_353_img_2.jpg|images_case/anunt_353_img_3.jpg,4,,"Casă de vânzare în Alexandria, str 1907, nr 1 ,5 camere  ,baie, bucătărie, apă curentă, canalizare,  gaz, centrala, mobilată și utilată parțial ,10 m deschidere cu 82 m lungime, total 820 mp, preț 90 mii euro (90.000 euro) mai multe poze la cerere ID anunț : 1673643242",28.06.2014,2,173657.3125,2014-06-28,4180.0,0,-83657.3125
354,Anunț,143000,EUR,3,127,https://www.publi24.ro/anunturi/imobiliare/de-vanzare/case/case-vile/anunt/casa-de-vanzare-cu-3-camere-pe-un-nivel-143-000-euro-negociabil/470e64e6280e74dde88097f99403ghhg.html,images_case/anunt_354_img_0.webp|images_case/anunt_354_img_1.webp|images_case/anunt_354_img_2.webp|images_case/anunt_354_img_3.webp,4,,"Agentia Imobiliara Dalmata va ofera spre vanzare casa cu 3 camere , pe un nivel pe Strada Muncitorilor . Are 3,6 ARI de teren iar constructia casei este din caramida , cu fundatie de piatra si are 100 metri patrati utili . Este compusa astfel : hol , bucatarie , baie , camara si 3 camere decomandate . Are geamuri termopane , usa metalica , gresie-faianta , parchet . Ramane partial mobilata si utilata dar se poate si elibera la cererea clientului . In spate are o anexa cu o incapere si o baie . La subsol are un beci , care este uscat si destul de spatios . Este izolata la exterior si are tot in spate zona de gratar cu barbecue . In fata la intrare are o structura metalica care este acoperita cu tabla si unde intra in jur de 2-3 masini , fiind ideal pentru a proteja masina in caz de grindina sau alte intemperii . Tot in fata are si o gradina cu flori . Pentru mai multe detalii sau vizionare sunati la numarul afisat . ID anunț : 1762511107",23.06.2025,21,174637.125,2025-06-23,167.0,0,-31637.125
355,Anunț,23900,EUR,4,2500,https://www.publi24.ro/anunturi/imobiliare/de-vanzare/case/case-vile/anunt/vand-casa-la-tara-com-colceag-prahova/11211606ih777081e8gf741i5f43fei1.html,images_case/anunt_355_img_0.webp|images_case/anunt_355_img_1.webp|images_case/anunt_355_img_2.webp|images_case/anunt_355_img_3.webp,4,,"Casa de vânzare sat Parepa-Rusani, comuna Colceag,  Prahova. 2 corpuri de cladire și anexe, 2500mp teren. Preț negociabil! Detalii la telefon ID anunț : 1762445427",06.11.2025,2,142129.515625,2025-06-11,179.0,1,-118229.515625
356,Anunț,45000,EUR,3,40,https://www.publi24.ro/anunturi/imobiliare/de-vanzare/case/case-vile/anunt/vand-casa/87349g6276eg7h6gd2202876d2g844h4.html,images_case/anunt_356_img_0.jpg|images_case/anunt_356_img_1.jpg|images_case/anunt_356_img_2.jpg|images_case/anunt_356_img_3.jpg,4,,"Vând casă și teren 4500m în Comuna Uda, Sat Govora, Argeș Utilități :apă curenta, drum asfaltat, curent 380 Se accepta varianta de schimb cu apartament Telefon ID anunț : 1566479813",22.08.2019,1,146622.8125,2019-08-22,2299.0,0,-101622.8125
357,Anunț,95000,EUR,4,5000,https://www.publi24.ro/anunturi/imobiliare/de-vanzare/case/case-vile/anunt/casa-de-vanzare-cu-teren-de-5000-mp/13f649h5e48h7e72d3gi605hhe221378.html,images_case/anunt_357_img_0.webp|images_case/anunt_357_img_1.webp|images_case/anunt_357_img_2.webp,3,,"Casă de vânzare, teren 5000 mp, suprafata construita 350 mp, 4 camere, baie, bucatarie, bucatarie de vara, garaj. Casa este din boltari si se afla in comuna Draganesti( vis-a-vis de Politie), Jud. Galati. Pentru detalii sunati la nr de tel. Accept si schimb cu apartament in Tecuci plus diferenta. ID anunț : 1757061903",21.01.2013,1,49340.9765625,2013-01-21,4703.0,0,45659.0234375
358,Anunț,23900,EUR,4,2500,https://www.publi24.ro/anunturi/imobiliare/de-vanzare/case/case-vile/anunt/vand-casa-la-tara-com-colceag-prahova/851774136gi87f4e10ih020054d14871.html,images_case/anunt_358_img_0.webp|images_case/anunt_358_img_1.webp|images_case/anunt_358_img_2.webp|images_case/anunt_358_img_3.webp,4,,,,0,166143.0,,,0,-142243.0
359,Anunț,126990,EUR,4,150,https://www.publi24.ro/anunturi/imobiliare/de-vanzare/case/case-vile/anunt/casa-tip-triplex-cu-4-camere-de-vanzare-in-sanandrei/67e365149eif7h21di1d35ieei25hi3i.html,images_case/anunt_359_img_0.webp|images_case/anunt_359_img_1.webp|images_case/anunt_359_img_2.webp|images_case/anunt_359_img_3.webp,4,,"ID intern: V1026 Casa / Vila cu 4 camere de vanzare in Sanandrei. FOXFORT Imobiliare propune spre vanzare casa tip triplex, cu un regim de inaltime P + M, situata in localitatea Sanandrei, avand un numar de 4 camere, cu o suprafata utila de 150 mp si  teren 200 mp. Casa a fost construita in anul 2020, structura acesteia fiind din beton si pereti din caramida. Imobilul este situat in apropiere de statii transport in comun. Compartimentarea este dispusa dupa cum urmeaza: - Parter: living, dormitor, baie, bucatarie, terasa; - Etaj: hol, 2 dormitoare, baie, balcon; - Pod depozitare. Finisajele interioare sunt moderne: - Usa intrare: pvc; - Usi interioare: panel; - Tamplarie ferestre: pvc; - Podele: parchet, gresie. Casa dispune de 6 locuri de parcare. Se accepta ca si modalitate de plata creditul bancar. Pretul este de 126.990€ - COMISION 0%. Indicator performanta energetica: Clasa B Pentru a vedea toate ofertele valabile actualizate periodic, cu preturi reale si ultimele anunturi imobiliare adaugate intrati acum pe site-ul oficial FOXFORT Imobiliare: foxfort.ro Precizati intotdeauna ca ati vazut oferta cu ID: V1026 Sediu agentie: Strada Mures, Nr. 39A, Timisoara, Timis ID anunț : 1721154996",11.10.2019,1416,174519.953125,2019-11-10,2219.0,0,-47529.953125
360,Anunț,755000,EUR,6,5880,https://www.publi24.ro/anunturi/imobiliare/de-vanzare/case/case-vile/anunt/vila-cu-lac-si-piscina-giarmata-vii-cu-5880-mp-de-teren-id-v5269/194dd786525d7e8gef412i3hi6868592.html,images_case/anunt_360_img_0.webp|images_case/anunt_360_img_1.webp|images_case/anunt_360_img_2.webp|images_case/anunt_360_img_3.webp,4,,"ID intern: V5269 COMISION 0% Vila tip duplex cu 6 camere de vanzare in localitatea Giarmata-Vii, zona Exterior Sud. FOXFORT propune de vanzare o oaza de liniste si relaxare, casa tip duplex, cu un regim de inaltime Subsol + Parter + 1 Etaj + Mansarda, situata in Giarmata-Vii, zona Exterior Sud, avand un numar de 6 camere, cu o suprafata utila de 510 mp si teren 5880 mp. Anul constructiei este 2004 si renovat in 2017, structura beton, material zidarie caramida. Imobilul dispune de urmatoarele utilitati: curent electric, apa, canalizare, gaz, catv, fibra optica. Compartimentarea este dispusa dupa cum urmeaza: -Demisol: camera tehnica, crama, spatiu depozitare; - Parter: camera, hol, living, baie, bucatarie, terasa; - Etaj: hol, 3 dormitoare, 2 bai, 2 balcoane; - Mansarda: camera, o baie. Finisajele interioare sunt de lux: - Usa intrare: lemn; - Usi interioare: lemn; - Tamplarie ferestre: lemn; - Obloane lemn; - Podele: parchet, gresie. Vila se vinde semi mobilata si utilata: plita, cuptor, hota, aragaz, masina de spalat rufe, frigider cu congelator. Casa dispune de centrala proprie cu incalzire prin calorifere, 4 locuri de parcare si un sistem de panouri fotovoltaice de 8kw. Pretul este de 755000€ - COMISION 0%. Negocibil Se accepta ca si modalitate de plata cash si credit bancar. Sediu agentie: Strada Mures, Nr. 39A, Timisoara, Timis Mai multe detalii la telefon: 0374.069.727 ID anunț : 1685520773",11.10.2019,1416,205552.640625,2019-11-10,2219.0,0,549447.359375
361,Anunț,129990,EUR,5,104,https://www.publi24.ro/anunturi/imobiliare/de-vanzare/case/case-vile/anunt/casa-cu-5-camere-de-vanzare-str-crisan/6h3eefi1003277fh1700114i743e6h54.html,images_case/anunt_361_img_0.webp|images_case/anunt_361_img_1.webp|images_case/anunt_361_img_2.webp|images_case/anunt_361_img_3.webp,4,,"Casă spațioasă cu 5 camere, curte și anexe – zonă Sud, Sighetu Marmației Descoperă o locuință primitoare, amplasată într-o zonă liniștită a orașului, ideală pentru o familie care își dorește confort, spațiu și intimitate. Casa are o suprafață construită de 104 mp și o suprafață utilă de 90 mp, fiind amplasată pe un teren generos de 583 mp. Proprietatea este complet utilată și pregătită pentru mutare imediată. Locuința este compartimentată practic și oferă: 5 camere spațioase 4 dormitoare luminoase 2 bucătării funcționale 2 băi curte, debara, anexa,magazie și pivniță Dotări și facilități: Aragaz, frigider, mașină de spălat rufe Încălzire pe lemne Apă, canalizare, curent, CATV Pereți finisați, uși și ferestre din lemn Acoperiș solid și curte complet împrejmuită Acces ușor la mijloace de transport și drum asfaltat Proprietatea se vinde complet mobilată, fiind ideală atât ca locuință permanentă, cât și ca reședință de vacanță. Sighetu Marmației, strada Crișan Preț de vânzare: 149.900 € ID anunț : 1762479476",11.08.2022,99,153885.328125,2022-11-08,1125.0,0,-23895.328125
362,Anunț,202500,EUR,4,131,https://www.publi24.ro/anunturi/imobiliare/de-vanzare/case/case-vile/anunt/comision-0-vila-individuala-4-camere-finisata-complet-toate-utilitatile/5gf3620dfidd71d9e274f2de3d570gef.html,images_case/anunt_362_img_0.webp|images_case/anunt_362_img_1.webp|images_case/anunt_362_img_2.webp|images_case/anunt_362_img_3.webp,4,,"Imobilul situat  in zona Otopeni-Ferme, P+1, 131mp utili,  are 4 camere (3 dormitoare ), 3 grupuri sanitare cu geam la baie, 2 balcoane, 1 terasa, dormitor matrimonial cu baie proprie, constructie din caramida si stalpi din beton, casa se preda finisata la cheie exact ca in poze! Teren  350mp din care amprenta casei este de 67mp, din care teren liber in suprafata de 208mp,  spatiu pentru parcare - 2 auto, curte amenajata cu zona de gazon. Finisaje și dotări: • Finisaje moderne de lux, alese cu grijă până la cel mai mic detaliu, • Parchet triplu stratificat, gresie și faianță premium, • Tâmplărie PVC 7 camere cu geam tripan pentru izolație superioară, • Încălzire în pardoseală / centrală proprie (opțional personalizat), •Instalatie electrica din cupru, •Izolatie exterioara de 100mm. • Băi complet echipate cu obiecte sanitare de calitate superioară. Catalin Draguinea - Imozone. Te astept cu drag la o vizionare. COMISION 0%. ID anunț : 1764980571",31.10.2022,91,183274.484375,2022-10-31,1133.0,0,19225.515625
363,Anunț,110000,EUR,2,98,https://www.publi24.ro/anunturi/imobiliare/de-vanzare/case/case-vile/anunt/casa-de-vanzare-cu-2-camere-langa-liceul-economic-110-000-euro-neg/9f9hegh319g5777h1198e2hi1dh48id9.html,images_case/anunt_363_img_0.webp|images_case/anunt_363_img_1.webp|images_case/anunt_363_img_2.webp|images_case/anunt_363_img_3.webp,4,,"Agentia Imobiliara Dalmata va ofera spre vanzare casa cu 2 camere , din caramida vizavi de Liceul Economic . Casa este compusa astfel : are hol , bucatarie , baie si 2 camere separate . Incalzirea se face cu convector pe gaz dar are si sobe de teracota . Are geamuri termopan , gresie-faianta , parchet . Terenul are 4 ARI , iar constructia casei 120 metri patrati utili . Are beci si intrare cu masina . Trebuie renovata in totalitate . Pentru mai multe detalii sau vizionare sunati la numarul afisat . ID anunț : 1761649265",23.06.2025,21,133413.734375,2025-06-23,167.0,0,-23413.734375
364,Anunț,237000,EUR,5,240,https://www.publi24.ro/anunturi/imobiliare/de-vanzare/case/case-vile/anunt/vila-spectaculoasa-240-mp-construiti-330-mp-teren-duplex-chiajna/51ghee3i895d76d4d8e959674ge6i465.html,images_case/anunt_364_img_0.webp|images_case/anunt_364_img_1.webp|images_case/anunt_364_img_2.webp|images_case/anunt_364_img_3.webp,4,,"Vila moderna tip duplex – 240 mp construiti, teren 330 mp, P+1+M+P, accesul la vila se face pe un drum privat lat de 8 m cu porti electrice la ambele capete ale strazii. Descopera confortul unei case bine construite, perfecta pentru un cuplu tanar care vrea sa scape de agitatia orasului si sa se bucure de liniste, aer curat si spatiu! ✅ Constructie solida: fundatie, stalpi, grinzi si planseu din beton armat, zidarie din caramida Porotherm, izolatie exterioara din polistiren de 10 cm, acoperis Lindab, ferestre termopan Salamander 7 camere. ✅ Zid despartitor dublu de 70 cm intre cele doua unitati, cu polistiren intre caramizi – pentru confort si intimitate maxima. Compartimentare ideala: •   Parter: living spatios si luminos de 45 mp,  bucatarie inchisa, baie si hol generos •   Etaj: 3 dormitoare si 2 bai •.  Mansarda: 1 dormitor matrimonial cu dressing și baie •   Pod izolat cu spuma cu celula inchisa si vata minerala – perfect pentru depozitare Vila se vinde la cheie, cu finisaje de foarte buna calitate: gresie, parchet, usi, bai complet echipate, bucatarie moderna. Curte individuala imprejmuita cu gard de beton, terasa de 17 mp acoperita Un loc perfect pentru a-ti incepe noua viata – intre confort, calitate si natura! 2 locuri de parcare in fata vilei și 1 in curte Vila se vinde la prețul de 237000 euro, la care NU se adauga TVA , un pic discutabil Oferta apartine agentiei EBA REAL ESTATE ! ID anunț : 1763046283",25.08.2025,45,198234.359375,2025-08-25,104.0,0,38765.640625
365,Anunț,23900,EUR,4,2500,https://www.publi24.ro/anunturi/imobiliare/de-vanzare/case/case-vile/anunt/vand-casa-la-tara-com-colceag-prahova/11211606ih777081e8gf741i5f43fei1.html,images_case/anunt_365_img_0.webp|images_case/anunt_365_img_1.webp|images_case/anunt_365_img_2.webp|images_case/anunt_365_img_3.webp,4,,"Casa de vânzare sat Parepa-Rusani, comuna Colceag,  Prahova. 2 corpuri de cladire și anexe, 2500mp teren. Preț negociabil! Detalii la telefon ID anunț : 1762445427",06.11.2025,2,142129.515625,2025-06-11,179.0,1,-118229.515625
366,Anunț,45000,EUR,3,40,https://www.publi24.ro/anunturi/imobiliare/de-vanzare/case/case-vile/anunt/vand-casa/87349g6276eg7h6gd2202876d2g844h4.html,images_case/anunt_366_img_0.jpg|images_case/anunt_366_img_1.jpg|images_case/anunt_366_img_2.jpg|images_case/anunt_366_img_3.jpg,4,,"Vând casă și teren 4500m în Comuna Uda, Sat Govora, Argeș Utilități :apă curenta, drum asfaltat, curent 380 Se accepta varianta de schimb cu apartament Telefon ID anunț : 1566479813",22.08.2019,1,146622.8125,2019-08-22,2299.0,0,-101622.8125
367,Anunț,95000,EUR,4,5000,https://www.publi24.ro/anunturi/imobiliare/de-vanzare/case/case-vile/anunt/casa-de-vanzare-cu-teren-de-5000-mp/13f649h5e48h7e72d3gi605hhe221378.html,images_case/anunt_367_img_0.webp|images_case/anunt_367_img_1.webp|images_case/anunt_367_img_2.webp,3,,"Casă de vânzare, teren 5000 mp, suprafata construita 350 mp, 4 camere, baie, bucatarie, bucatarie de vara, garaj. Casa este din boltari si se afla in comuna Draganesti( vis-a-vis de Politie), Jud. Galati. Pentru detalii sunati la nr de tel. Accept si schimb cu apartament in Tecuci plus diferenta. ID anunț : 1757061903",21.01.2013,1,49340.9765625,2013-01-21,4703.0,0,45659.0234375
368,Anunț,23900,EUR,4,2500,https://www.publi24.ro/anunturi/imobiliare/de-vanzare/case/case-vile/anunt/vand-casa-la-tara-com-colceag-prahova/851774136gi87f4e10ih020054d14871.html,images_case/anunt_368_img_0.webp|images_case/anunt_368_img_1.webp|images_case/anunt_368_img_2.webp|images_case/anunt_368_img_3.webp,4,,"Casa de vânzare sat Parepa-Rusani, comuna Colceag,  Prahova. 2 corpuri de cladire și anexe, 2500mp teren. Preț negociabil! Detalii la telefon ID anunț : 1762445208",06.11.2025,2,166143.0,2025-06-11,179.0,1,-142243.0
369,Anunț,126990,EUR,4,150,https://www.publi24.ro/anunturi/imobiliare/de-vanzare/case/case-vile/anunt/casa-tip-triplex-cu-4-camere-de-vanzare-in-sanandrei/67e365149eif7h21di1d35ieei25hi3i.html,images_case/anunt_369_img_0.webp|images_case/anunt_369_img_1.webp|images_case/anunt_369_img_2.webp|images_case/anunt_369_img_3.webp,4,,,,0,174519.953125,,,0,-47529.953125
370,Anunț,755000,EUR,6,5880,https://www.publi24.ro/anunturi/imobiliare/de-vanzare/case/case-vile/anunt/vila-cu-lac-si-piscina-giarmata-vii-cu-5880-mp-de-teren-id-v5269/194dd786525d7e8gef412i3hi6868592.html,images_case/anunt_370_img_0.webp|images_case/anunt_370_img_1.webp|images_case/anunt_370_img_2.webp|images_case/anunt_370_img_3.webp,4,,"ID intern: V5269 COMISION 0% Vila tip duplex cu 6 camere de vanzare in localitatea Giarmata-Vii, zona Exterior Sud. FOXFORT propune de vanzare o oaza de liniste si relaxare, casa tip duplex, cu un regim de inaltime Subsol + Parter + 1 Etaj + Mansarda, situata in Giarmata-Vii, zona Exterior Sud, avand un numar de 6 camere, cu o suprafata utila de 510 mp si teren 5880 mp. Anul constructiei este 2004 si renovat in 2017, structura beton, material zidarie caramida. Imobilul dispune de urmatoarele utilitati: curent electric, apa, canalizare, gaz, catv, fibra optica. Compartimentarea este dispusa dupa cum urmeaza: -Demisol: camera tehnica, crama, spatiu depozitare; - Parter: camera, hol, living, baie, bucatarie, terasa; - Etaj: hol, 3 dormitoare, 2 bai, 2 balcoane; - Mansarda: camera, o baie. Finisajele interioare sunt de lux: - Usa intrare: lemn; - Usi interioare: lemn; - Tamplarie ferestre: lemn; - Obloane lemn; - Podele: parchet, gresie. Vila se vinde semi mobilata si utilata: plita, cuptor, hota, aragaz, masina de spalat rufe, frigider cu congelator. Casa dispune de centrala proprie cu incalzire prin calorifere, 4 locuri de parcare si un sistem de panouri fotovoltaice de 8kw. Pretul este de 755000€ - COMISION 0%. Negocibil Se accepta ca si modalitate de plata cash si credit bancar. Sediu agentie: Strada Mures, Nr. 39A, Timisoara, Timis Mai multe detalii la telefon: 0374.069.727 ID anunț : 1685520773",11.10.2019,1416,205552.640625,2019-11-10,2219.0,0,549447.359375
371,Anunț,48000,EUR,4,2500,https://www.publi24.ro/anunturi/imobiliare/de-vanzare/case/case-vile/anunt/casa-traditionala-4-cam-anexe-2500-mp-teren-d-15-ml-milcov-ulmi/765h618582537658e5dd8540ghd09ef4.html,images_case/anunt_371_img_0.webp|images_case/anunt_371_img_1.webp|images_case/anunt_371_img_2.webp|images_case/anunt_371_img_3.webp,4,,"Proprietatea promovata de agentia imobiliara este situata in localitatea Milcov - Sat Ulmi, la cel mult 10 km distanta fata de Slatina - centru si este formata din CASA DE LOCUIT cu 4 camere, doua bucatarii si o baie, care au in total 133 mp. amprenta la sol si o anexa cu pivnita, cu o suprafata construita la sol de 44 mp. Constructiile sunt amplasate pe un teren in suprafata de 2500 mp., cu deschidere de cca 15 m la strada principala, iar spre spate se largeste, avand 35 mp. si au fost edificate in anul 1965, din caramida, cu fundatii din beton si acoperite cu tigla. Incalzirea se face cu sobe de teracota cu combustibil solid, iar alimentarea cu apa se face din sursa proprie - fantana cu pompa, langa care este realizata instalatie de apa calda instant, cu hidrofor. Localitatea beneficiaza de retea de alimentare cu apa, care trece pe langa proprietate, racordarea la aceasta putandu-se face cu usurinta. Impreuna cu casa si terenul de 2500 mp., se poate vinde si un teren intravilan - loc de casa, in suprafata de 1800 mp, cu numar cadastral distinct, situat intr-o zona apropiata, aflata in plin proces constructiv de locuinte noi tip vile. Pretul acestui teren face obiectul unei discutii separate fata de pretul afisat al casei. ID anunț : 1754026964",12.07.2018,24,150954.65625,2018-12-07,2557.0,0,-102954.65625
372,Anunț,35000,EUR,4,682,https://www.publi24.ro/anunturi/imobiliare/de-vanzare/case/case-vile/anunt/cladire-cu-destinatie-afaceri-sau-casa-de-locuit/7ffgh0h4494e731hd66779877788hh49.html,images_case/anunt_372_img_0.webp|images_case/anunt_372_img_1.webp,2,,"Proprietar ofer spre vânzare clădire recent renovata situata în Scortoasa,  Policiori, zona centrala, la intersecția cu Vulcanii Noroioși,  la 3 km distanta de aceștia. Proprietatea este ideala dezvoltării unei afaceri în domeniul turismului  sau casa de locuit. Clădirea este compusa din 4 camere, hol și anexa. Suprafața teren 682 mp. ID anunț : 1762964345",06.10.2020,1,52163.91796875,2020-06-10,2006.0,0,-17163.91796875
373,Anunț,169990,EUR,5,300,https://www.publi24.ro/anunturi/imobiliare/de-vanzare/case/case-vile/anunt/duplex-5-camere-si-teren-de-300-mp-zona-ghiroda/22884932h7967115d1efe71d13355791.html,images_case/anunt_373_img_0.webp|images_case/anunt_373_img_1.webp|images_case/anunt_373_img_2.webp|images_case/anunt_373_img_3.webp,4,,"Duplex cu 5 camere de vanzare in localitatea Ghiroda FOXFORT propune spre vanzare casa tip duplex, cu un regim de inaltime Parter + Mansarda, situata in Ghiroda, avand un numar de 5 camere, cu o suprafata utila de 117 mp si teren 300 mp. Anul constructiei este 2024, structura beton, material zidarie caramida. Imobilul dispune de urmatoarele utilitati: curent electric, apa, canalizare, gaz, catv, fibra optica. Compartimentarea este dispusa dupa cum urmeaza: - Parter: hol, living, baie, bucatarie, dormitor, terasa; - Mansarda: hol, 3 dormitoare, baie; - Pod depozitare. Finisajele interioare sunt moderne: - Usa intrare: pvc; - Usi interioare: celulare; - Tamplarie ferestre: pvc; - Podele: parchet, gresie. Casa dispune de centrala proprie cu incalzire prin pardoseala si 2 locuri de parcare. Pretul este de 169.990€ + comisionul standard al agentiei. Se accepta ca si modalitate de plata surse proprii sau credit bancar. ID intern: V7367 ID anunț : 1730380316",11.10.2019,1416,166686.25,2019-11-10,2219.0,0,3303.75
374,Anunț,333000,EUR,6,492,https://www.publi24.ro/anunturi/imobiliare/de-vanzare/case/case-vile/anunt/casa-de-vanzare-lugoj-2etj-mansarda-la-parter-2-magazine-deja-inchiriate/734d49gd6g567eg8egefg6ih8568g4i5.html,images_case/anunt_374_img_0.webp|images_case/anunt_374_img_1.webp|images_case/anunt_374_img_2.webp|images_case/anunt_374_img_3.webp,4,,"Ofer spre vanzare casa cu 2 etaje si mansarda, + 2 spatii comerciale la parter care  in prezent sunt inchiriate, in Lugoj Suprafata totala: 492 m2 Mai multe detalii, telef: Parter-2 spatii comerciale( SAD) Etaj I-150mp,-bucatarie , living 32mp,2 dormitoare 2 băi Etaj II -150mp -bucatarie, living 32mp, 2 dormitoare , 2 băi Mansarda-2 apart Pod Terasă Beci Magazie Camera tehnica- centrala nouă Alarma in toata casa si camere de supraveghere Casa are 492mp 150mp   nivel ID anunț : 1753259211",24.05.2015,12,156410.859375,2015-05-24,3850.0,0,176589.140625
375,Anunț,75000,EUR,4,144,https://www.publi24.ro/anunturi/imobiliare/de-vanzare/case/vila/anunt/vanzare/i26dd6f240227f29e40h98658f634d79.html,,0,,,,0,21531.501953125,,,0,53468.498046875
376,Anunț,300000,EUR,4,1137,https://www.publi24.ro/anunturi/imobiliare/de-vanzare/case/case-vile/anunt/casa-de-vanzare-corunca-vatman/55f6e9f6ideg754ed0e23i1ffg16f7d2.html,images_case/anunt_376_img_0.webp|images_case/anunt_376_img_1.webp|images_case/anunt_376_img_2.webp|images_case/anunt_376_img_3.webp,4,,"Vă propunem spre vânzare o casă spațioasă, situată într-o zonă liniștită din Corunca   Vatman, ideală pentru o familie care își dorește confort, spațiu și intimitate. Suprafață teren: 1137 mp Suprafață utilă casă: 219 mp Compartimentare: Subsol: 4 încăperi + cameră tehnică Parter: living generos, bucătărie+camara, baie, casă scării Etaj: 3 camere spațioase + baie + 2 balcoane Proprietatea oferă un teren generos, cu multiple posibilități de amenajare, fie pentru grădină, zonă de relaxare sau loc de joacă pentru copii. Locație excelentă, liniște, aer curat Spațiu bine compartimentat și luminos Ideală pentru o familie Pentru mai multe detalii și programarea unei vizionări, ne puteți contacta telefonic. ID anunț : 1756359120",28.08.2025,1,178990.71875,2025-08-28,101.0,1,121009.28125
377,Anunț,35000,EUR,4,31,https://www.publi24.ro/anunturi/imobiliare/de-vanzare/case/case-vile/anunt/vand-casa-35000-rate-2-ani/837770idi5dg77fdeg983188f10fgf64.html,images_case/anunt_377_img_0.jpg|images_case/anunt_377_img_1.jpg|images_case/anunt_377_img_2.jpg|images_case/anunt_377_img_3.jpg,4,,"Casa Ghindaoani Neamt 2 camere + hol + bucatarie+ beci + sandrama+ pod si  inca una in aceeasi curte cu 2 camere si hol + pod ,  plus  grajd + camera depozit + beci gradina  +  pod fan + bucatarie vara + gard + fanarie + vita vie + pomi fructiferi + teren  (1,5 ha aprox) + fantana + instalatie apa cu pompa si hidrofor + curent electric plus plata in Rate pe 2 ani 35000   tel  . ID anunț : 1739973929",13.02.2025,1,144297.78125,2025-02-13,297.0,0,-109297.78125
378,Anunț,107000,EUR,6,300,https://www.publi24.ro/anunturi/imobiliare/de-vanzare/case/case-vile/anunt/casa-de-vanzare-cu-6-camere-in-drumul-spre-paltinis/52710d93dd5974h613fi71hi723e80ig.html,images_case/anunt_378_img_0.webp|images_case/anunt_378_img_1.webp|images_case/anunt_378_img_2.webp|images_case/anunt_378_img_3.webp,4,,"Cauti o casa de vacanta aprope de Paltinis dar si de Sibiu in acelasi timp? Iti doresti sa incepi o cariera in domeniul hotelier intr-o zona turistica de mare cautare? Casa pretabila pensiune de vanzare formata din 5 dormitoare, 1 living, o bucatarie, 4 bai, o teresa si balcon. Casa de vacanta la cheie, mobilata si utilata, situata intr-o zona agroturistica, la 12 km distanta de Sibiu, constructie 2009, cu o suprafata utila de 300 mp. Zona in care se afla, respectiv comuna Rasinari este situata in sud-estul judetului Sibiu fiind una dintre cele mai vechi comune din Marginimea Sibiului. La doar cativa km de statiunea montana Paltinis, ofera un cadru natural deosebit pentru a petrece un nemaipomenit concediu la munte alaturi de familie si cei dragi. Zona este apreciata din punct de vedere turistic pentru frumusetea pitoreasca, dar si pentru traditiile si obiceiurile locale, cum ar fi culesul rasinii de brad, indeletnicire ce a dat si numele localitatii. In comuna Rasinari s-au nascut si cateva persoane care au devenit mai tarziu personalitati literare sau savanti: Emil Cioran, Octavian Goga, Ilarie Mitrea (fondator al Muzeului Antipa - Bucuresti) si altii. Pensiunea despre care va povestim este structurata pe doua nivele, respectiv: - Parterul format din: un living spatios cu loc de luat masa si zona de relaxare, o baie si bucataria. - Etajul este format dintr-un hol care asigura accesul spre cele 5 dormitoare, 3 bai si balcoane. Pe parcela de 485 mp s-a mai construit un corp format din bucatarie, living si baie la parter, iar la etaj un dormitor, baie si dressing. Terenul liber de 250 mp este distribuit in special in spatele pensiunii, unde este amenajata o teresa acoperita. Ca si imbunatatiri aduse odata cu constructia din anul 2009, pensiunea dispune de usa la intrare si geamuri din termopan cu tamplarie PVC, usi din lemn la interior, parchet laminat, gresie, faianta, centrala termica pe lemne si calorifere din otel, toate utilitatile racordate (apa, curent, canalizare), curent trifazic, fiecare etaj are instalatie electrica separata, acoperis din tabla si izolat cu polistiren de 20 cm si curte pavata. Pret: 107.000€ Cod ofertă / ID: P22924 Sună-ne acum la 0369.823.823 și află detalii despre această proprietate de vanzare din Rasinari, dar și despre alte proprietăți potrivite pentru tine. Apartamente de vanzare Sibiu Case de vanzare Sibiu Informatii speciale: 1. Descarcă aplicația de mobilul tau "" TABOO Imobiliare "" din Apple Store, Google Play sau Huawei AppGallery pentru a afla instantaneu noile proprietăți care intră pe piață. 2. Dacă ai o proprietate pe care vrei să o vinzi sau să o închiriezi , suntem aici pentru tine! Contactează-ne pentru o evaluare gratuită fără obligații și vei descoperi avantajele de a lucra cu o echipă dedicată și experimentată. 3. Dacă vrei sa incepi o cariera de agent imobiliar , suna la 0369.823.823 si programeaza o intalnire pentru a afla toate beneficiile si avantajele. Intra pe www.TABOO.ro și descoperă cele mai recente oferte, actualizate zilnic. ID anunț : 1741094535",03.05.2018,1329,143666.5,2018-03-05,2834.0,0,-36666.5
379,Anunț,170000,EUR,4,256,https://www.publi24.ro/anunturi/imobiliare/de-vanzare/case/case-vile/anunt/vand-casa-in-fundulea-25-min-de-bucuresti-256-mp-teren-682-mp-la-gri/hif7deg25id97694df51e6d3722e8f22.html,images_case/anunt_379_img_0.webp|images_case/anunt_379_img_1.webp|images_case/anunt_379_img_2.webp|images_case/anunt_379_img_3.webp,4,,"Vă oferim spre vânzare o locuință spațioasă și bine compartimentată, ideală pentru o familie care își dorește liniște, confort și acces rapid către București ( 25 minute). Amplasată într-o zonă rezidențială liniștită din orașul Fundulea, proprietatea dispune de un teren generos de 682 mp, o suprafață desfășurată de 256 mp și o construcție solidă realizată în anul 2009, structurată pe Subsol + Parter + Mansardă. Casa se află la stadiul de gri, oferind avantajul personalizării finisajelor după gusturile și stilul viitorului proprietar. Detalii generale: Preț: 170.000   (ușor negociabil) Teren: 682 mp Suprafață desfășurată: 256 mp Suprafață utilă: 193 mp Regim de înălțime: S + P + M (Subsol + Parter + Mansardă) An construcție: 2009 Stadiu: casă la gri   finisaje parțiale Compartimentare și detalii interioare: Parter (finisaje medii) Vestibul: 5 mp Hol: 10 mp Cameră de zi   Living: 40 mp Bucătărie: 10 mp Baie: 3,7 mp Dormitor: 12 mp Cameră tehnică: 7 mp Terasă: 10 mp Mansardă (semifinisată   50%) Casă scării: 6 mp Hol deschis: 18 mp Dormitor principal: 22 mp (cu balcon) Dressing: 4 mp Dormitor secundar: 12 mp Spațiu de zi: 20 mp Baie: 4 mp Subsol: 9 mp   spațiu tehnic și de depozitare Construcție și finisaje: Structură solidă din cărămidă, cu termoizolație exterioară Fațadă finisată cu glet   pregătită pentru tencuială decorativă Acoperiș în stare foarte bună, tâmplărie PVC, uși și ferestre montate Grad de finisare: parter 80%, mansardă 50% Această locuință oferă oportunitatea perfectă de a fi personalizată după gusturile proprii, cu investiție minimă în finisaje și o bază solidă de construcție. Utilități și facilități: Curent electric și apă curentă   branșamente funcționale Canalizare și gaze naturale   la poarta proprietății Încălzire existentă: centrală pe lemne Curte generoasă   ideală pentru grădină, foișor sau spațiu de relaxare Acces auto pentru 4 locuri de parcare în curte Documentație completă   cadastru și intabulare Localizare și acces: Acces facil către Autostrada A2 și DN3 La doar 24 km de stația de metrou Anghel Saligny 3 minute până la supermarketul La Doi Pași 200 de metri de stația de maxi-taxi (ruta Fundulea   București) Zonă liniștită, retrasă, ideală pentru familie, recreere și intimitate Contact Cristian Marcu   Premier Imobiliare, Agenția Fundulea ID anunț : 1761414738",10.09.2025,14,140966.21875,2025-10-09,59.0,0,29033.78125
380,Anunț,75000,EUR,5,708,https://www.publi24.ro/anunturi/imobiliare/de-vanzare/case/case-vile/anunt/vand-casa-in-centrul-orasului-marasesti-vrancea-centrala-pe-gaze/7b01617f7c616351.html,images_case/anunt_380_img_0.jpg|images_case/anunt_380_img_1.jpg|images_case/anunt_380_img_2.jpg|images_case/anunt_380_img_3.jpg,4,,,,0,164647.59375,,,0,-89647.59375
381,Anunț,85000,EUR,5,1000,https://www.publi24.ro/anunturi/imobiliare/de-vanzare/case/case-vile/anunt/vand-casa-p-mansarda-cu-potential-turistic-in-comuna-murighiol/e526f30i43i47eg5207e02f9i9732h75.html,images_case/anunt_381_img_0.webp|images_case/anunt_381_img_1.webp|images_case/anunt_381_img_2.webp|images_case/anunt_381_img_3.webp,4,,"Casa este nou construita cu o suprafata totala de 1000 mp dintre care 150 mp construiti. Toate utilitatile trase plus fosa septica bio cu o capacitate de 5000 L. Casa este dotata cu sistem de tevi pentru incalzire, finisaje exterioare, geamuri si usi de termopan. Casa are potential de pensiune agroturistica avand acces usor la Delta Dunarii. Structura casei este parter + mansarda - 5 camere, 3 bai plus anexe. Pentru mai multe detalii si pt vizionarea casei, va rugam sa contactati numarul de mai jos. ID anunț : 1759490919",30.09.2025,1,148592.9375,2025-09-30,68.0,1,-63592.9375
382,Anunț,60000,EUR,4,1100,https://www.publi24.ro/anunturi/imobiliare/de-vanzare/case/case-vile/anunt/vand-casa-4-camere-in-sat-maluri-vulturu-vrancea-balta-leica/849462h3400779h4df4f52d9ged22edd.html,images_case/anunt_382_img_0.jpg|images_case/anunt_382_img_1.jpg|images_case/anunt_382_img_2.jpg|images_case/anunt_382_img_3.jpg,4,,"Pentru '' tineri pensionari '' care vor o viata linistita la tara pe malul unei ape care se numeste ''Leica'' ce traverseaza satul, care se varsa in Putna, apoi in Siret, unde vin pescari de pretudindeni, propunem spre vanzare o casa din caramida, 4 camere, 2 holuri, baie, bucatarie, magazie, dependinte tot din caramida, temelia de 2m din fier beton si pietre de rau, curent electric, apa de la retea, put forat si pompa de mana, canalizare, fosa septica, WC exterior cu alta fosa septica, asfalt, teren 1100 mp din care 230 mp constructii, cu gard zidit si porti de fier. S-a schimbat tamplaria, termopane interior si exterior la comanda, s-au cumparat obiecte sanitare si electrice, parchet, gresie, faianta si alte materiale de calitate. S-au cumparat si 5 masini de lemne, sobe si multe alte produse de casa. S-a facut si un gard lateral. S-a pus acoperisul si bazia,  inca nu am poze clare fiindca nu locuiesc acolo. S-au terminat renovarile interioare.  In apropiere de centre comerciale si statii de microbuze. Proiect de gaze aprobat la comuna. S-au plantat 45 pomi fructiferi, 50 vita de vie, mure, zmeura. Eu mai am o casa la oras si nu mai pot tine pe ambele. Negociabil la fata locului. ID anunț : 1563272920",29.06.2014,3,150639.59375,2014-06-29,4179.0,0,-90639.59375
383,Anunț,81990,EUR,5,120,https://www.publi24.ro/anunturi/imobiliare/de-vanzare/case/case-vile/anunt/cabana-la-munte/4i93fe22744g73f52h4hh3e80e44i282.html,images_case/anunt_383_img_0.webp|images_case/anunt_383_img_1.webp|images_case/anunt_383_img_2.webp|images_case/anunt_383_img_3.webp,4,,"ID intern: V1947 Cabana de vanzare in zona Rau de Mori, judetul Hunedoara FOXFORT Imobiliare propune spre de vanzare casa tip cabana, cu un regim de inaltime P+M situata in zona Rau de Mori, avand un numar de 5 camere, cu o suprafata utila de 120 mp si teren 235 mp. Cabana a fost construita in anul 1994, mansardata in 2001 si renovata in 2011. Imobilul este situat in apropiere de Piata, Scoala, Biserica. Compartimentarea este dispusa dupa cum urmeaza: - Parter: hol, living, baie, bucatarie, terasa; - Etaj: hol, 3 dormitoare, baie, balcon; - Pod depozitare. Finisajele interioare sunt clasice : - Usa intrare: Lemn; - Usi interioare: Lemn; - Tamplarie ferestre: Lemn, aluminiu; - Podele: Parchet, gresie. Casa dispune de 5 locuri de parcare. Este un loc foarte pitoresc cu multiple obiective turistice în apropiere: Barajul si lacul de acumulare Gura Apei Biserica Densus Biserica Santamaria Orlea Castelul Corvinestilor – Hunedoara Castelul Nopcsa Sacel Cetatea Colt Cetatea Deva Manastirea Prislop Masivul Retezat Ulpia Traiana Sarmizegetusa Lacul Bucura Conacul Kendeffy Casa Memoriala Crisan Trasee turistice Traseu de 45 km: Poiana Pelegii - locul de plecare spre salba de lacuri glaciare Bucura, Zanoaga, Lia si Ana. Traseu de 26 km: Statiunea Rausor - locul de plecare spre – Cabana Pietrele, Buta, Baleia, Culmea Lolaia, Varful Retezat. Traseu de 3 km - drumul spre schit: Izvorul lui Viorel, Cascada, Laguna Albastra (loc de baie), Biserica si Schitul de maici. Traseu de 2,5 km – drumul spre Galerie: Valea de Pietre, Valea Jurii, Stanca Belvedere si Foisorul de Vanatoare. Cabana se poate cumpara si pentru locuit sau ca si investitie. Pretul este de 81.990€ + comisionul standard al agentiei. Se accepta ca si modalitate de plata creditul ipotecar. Pentru a vedea toate ofertele valabile actualizate periodic, cu preturi reale si ultimele anunturi imobiliare adaugate intrati acum pe site-ul oficial FOXFORT Imobiliare: foxfort.ro. Precizati intotdeauna ca ati vazut oferta cu ID: V1947. Sediu agentie: Strada Mures Nr.39A Timisoara, Timis. Mai multe detalii la telefon: 0374.069.727 / www.foxfort.ro / [email protected] . ID anunț : 1622030914",11.10.2019,1416,186840.5,2019-11-10,2219.0,0,-104850.5
384,Anunț,230000,EUR,4,130,https://www.publi24.ro/anunturi/imobiliare/de-vanzare/case/case-vile/anunt/comision-0-casa-individuala-zona-giarmata-4-camere/h03hf6f264ef7d27203ggef1f5f0e62d.html,images_case/anunt_384_img_0.webp|images_case/anunt_384_img_1.webp|images_case/anunt_384_img_2.webp|images_case/anunt_384_img_3.webp,4,,"COMISION 0% pentru cumpărător! Vă propun spre vânzare o casă individuală superbă, cu 4 camere, finisaje premium și o compartimentare excelentă, situată în Giarmata, într-o zonă liniștită de case, ideală pentru o familie care își dorește confort, spațiu și siguranță. Proprietatea impresionează prin calitatea construcției, atenția la detalii și spațiile bine gândite, fiind o locuință în care te poți muta imediat, fără investiții suplimentare. LOCALIZARE Casa se află intr-un cartier verde, retras, dar conectat la infrastructura majoră a comunei Giarmata. Giarmata este o comună situată în județul Timiș, la doar câțiva kilometri de Timișoara. DETALII PROPRIETATE Locuința dispune de 130 mp utili, este structurată pe Parter + Etaj, fiind amplasată pe un teren generos de 550 mp. Construcția este realizată din cărămidă Porotherm, izolată cu polistiren de 20 cm, cu placă de beton la pod, ceea ce oferă durabilitate, rezistență și confort termic excelent. Terasa acoperită de 30 mp reprezintă un plus major pentru relaxare în aer liber, iar balconul de la etaj adaugă un plus de eleganță. COMPARTIMENTARE Parterul este conceput pentru funcționalitate maximă: bucătărie separată, cameră tehnică, baie, spațiu de depozitare sub scări, living spațios de 33 mp cu acces pe terasă — locul perfect pentru relaxare în familie. Etajul găzduiește zona de odihnă: 3 dormitoare confortabile, baie, dressing dedicat și un balcon generos, ideal pentru momente de relaxare. DOTĂRI ȘI FINISAJE Casa oferă finisaje moderne și materiale de calitate superioară: încălzire în pardoseală, centrală proprie pe gaz, pod pentru depozitare, 3 aparate de aer condiționat, ferestre premium, izolație exterioară de 20 cm. Este dotată cu sistem complet de supraveghere video (3 camere), senzori, iluminat exterior și sistem de alarmă, pentru un nivel ridicat de siguranță. PREȚ: 230.000 € O casă individuală modernă, construită în 2022, bine compartimentată, eficientă energetic și pregătită pentru a deveni căminul perfect al unei familii care caută confort, siguranță și spațiu. COMISION 0% pentru cumpărător! ID anunț : 1763993702",03.03.2024,154,189343.46875,2024-03-03,644.0,0,40656.53125
385,Anunț,299000,EUR,6,295,https://www.publi24.ro/anunturi/imobiliare/de-vanzare/case/case-vile/anunt/casa-vila-cu-6-camere-de-vanzare-in-zona-est/877h80677fff76491e89i79661f180f3.html,images_case/anunt_385_img_0.webp|images_case/anunt_385_img_1.webp|images_case/anunt_385_img_2.webp|images_case/anunt_385_img_3.webp,4,,"Casă modernă pe strada Solovan, Sighetu Marmației Pe una dintre cele mai liniștite și frumoase străzi din Sighetu Marmației, pe strada Solovan, se află o casă contemporană care îmbină perfect utilitatea, confortul și eficiența energetică. Cu o suprafață totală de 295 m², această locuință spațioasă este concepută pentru a oferi o experiență completă de trai modern. Casa este dotată cu panouri solare (15kw) și pompă de căldură, formând un sistem ecologic de ultimă generație care alimentează încălzirea în pardoseală și consumul de energie electrică. Datorită acestor soluții verzi, locuința oferă costuri reduse de întreținere și un confort termic constant în orice anotimp. Interiorul este complet mobilat și utilat, gândit pentru funcționalitate și relaxare: – living spațios și luminos cu acces la terasă; – bucătărie modernă, complet echipată; – dormitoare generoase; – băi elegante; – multiple spații de depozitare. Curtea oferă intimitate și un cadru natural plăcut, specific zonei Solovan – un loc ideal pentru cei care apreciază liniștea, aerul curat și confortul modern. Această casă este alegerea perfectă pentru o familie care își dorește o locuință verde, eficientă energetic, elegantă și complet pregătită pentru mutare. ID anunț : 1762479535",11.08.2022,99,162444.46875,2022-11-08,1125.0,0,136555.53125
386,Anunț,450000,EUR,6,294,https://www.publi24.ro/anunturi/imobiliare/de-vanzare/case/case-vile/anunt/casa-in-cartierul-nufarul-amplasata-pe-un-teren-generos-cu-suprafata-de-600-mp/9512504gf6687990174d098779f78056.html,images_case/anunt_386_img_0.jpg|images_case/anunt_386_img_1.jpg|images_case/anunt_386_img_2.jpg|images_case/anunt_386_img_3.jpg,4,,"Blitz va ofera spre vanzare un imobil P+M in Oradea, Cartier Nufarul, perfect pentru multiple utilizari, cu o suprafata totala construita de 332 mp si teren de 602 mp, acest imobil tip P+M reprezinta o oportunitate de investitie, fiind amplasat intr-o zona cu accesibilitate ridicata si expunere excelenta. Caracteristici si structura An constructie: 2008. Materiale de constructie: caramida, cu structura din beton armat si acoperis din tigla. Utilitati: curent, apa canal, gaz, strada beneficiaza de iluminat public si asfalt. Compartimentare inteligenta si versatila Zona rezidentiala (P+M) Conceputa pentru a oferi confort si functionalitate, zona rezidentiala include: Hol de acces spatios Bucatarie cu camara de alimente + Living open space: o zona aerisita, ideala pentru petrecerea timpului alaturi de familie sau prieteni cu iesire pe terasa, baie de serviciu, un spatiu de depozitare si casa scarii La etaj, 4 dormitoare, potrivite pentru odihna si relaxare, doua bai din care una la dormitorul matrimonial si dresing si acces la podul casei. Podul casei este o zona de relaxare si gaming, aceasta zona este pregatita pentru diverse activitati Dotari si Finisaje Imobilul este amenajat cu finisaje si dotari, gandite pentru un plus de confort si siguranta: Acces securizat: usa de intrare metalica antiefractie de inalta calitate si usi interioare PVC Confort termic: centrala proprie pe gaz ce asigura incalzirea prin calorifere, sustinuta de un sistem de climatizare Finisaje interioare: placi de gresie si faianta, parchet laminat, vopsea lavabila. Ferestre PVC cu geam termopan: pentru izolatie termica si fonica eficienta, prevazute cu rulouri exterioare pentru un plus de intimitate si confort Exterior amenajat pentru relaxare si functionalitate Curtea proprietatii este conceputa pentru a oferi un spatiu versatil: Terasa acoperita: ideala pentru relaxare, spatiu perfect pentru intalniri si activitati sociale si piscina Aceasta proprietate versatila este ideala pentru locuinta familiala – oferind un ambient confortabil si sigur PRET DE VANZARE: 450.000 EUR Imobilul se vinde complet mobilat si utilat conform prezentarii, gata sa fie folosit imediat. Cod ofertă / ID BLITZ: P136194 ID anunț : 1732007260",07.05.2021,9948,156115.984375,2021-07-05,1616.0,0,293884.015625
387,Anunț,499000,EUR,4,500,https://www.publi24.ro/anunturi/imobiliare/de-vanzare/case/case-vile/anunt/com-0-i-vila-pasiva-corbeanca-i-liziera-padurea-felix-premium-ocazie/hh7h7597e23e72h7df2421620789igef.html,images_case/anunt_387_img_0.webp|images_case/anunt_387_img_1.webp|images_case/anunt_387_img_2.webp|images_case/anunt_387_img_3.webp,4,,"Va ofer spre vanzare 4 vile premium, lux, cu arhitectura minimalista, construite la cele mai inalte standarde de calitate, intr-un complex luxury cu vile pasive din Corbeanca,  in cea mai selecta zona, langa noua Primarie si cu acces direct in Padurea Felix, langa Padurile Regale. Locatie excelenta langa noua Primarie, Scoala, Sala de sport si Piscina! Detalii financiare: contract vanzare cumparare - pret achizitie persoana juridica: 499.000 eur cu taxare inversa - pret achizitie persoana fizica : 499.000 eur + TVA 21% Solutii finantare: credit prin bancile partenere sau credit direct de la dezvoltator. Acest proiect inovator de vile de lux amplasate într-o locaţie de vis, la liziera Pădurii Felix. Complexul este format din 6 vile. Acestea beneficiaza de cele mai inate standarde de eficienta energetica dispoinibile la momentul actual, fiind cu adevarat pasive si ""full electric"". IDEAL pentru familiile care doresc un stil de viata verde si linistit, in armonie cu natura,  departe de poluare si de trafic, dar in acealsi timp o viata moderna cu toate faciltatile necesare (transport, magazine, scoli, clinici medicale, etc). Fiecare vila dispune de: - teren de 500 mp - fatade ventilate - sistem propriu de pompă de căldură aer/apă si panouri foto-voltaice - staţie de încărcare masini electrice, curent trifazat de mare capacitate carports - încălzire în pardoseală - sistemul de ventialtie VMC (Ventilatia Mecanica Controlata) - tamplarie aluminiu cu sistem anticondens - gradina proprie, spatiu verde, si ciresi japonezi deja plantati Facilitati complex: - piscina si loc de joaca pentru copii - spațiul verde și cireșii japonezi plantați, îți vor garanta oaza de pace și liniște căutată Facilitati locatie: zona cea mai cautata din Corbeanca, langa Primaria cea noua - facilitati sportive: sala de sport si piscina - acces rapid DN1, A0 si centura Bucuresti Va invit sa programati o vizionare! Alina Dinoiu Pentru mai multe detalii si oferte, va invit aicic:    dinoiuimobiliare.ro ID anunț : 1763093235",12.08.2024,100,152236.140625,2024-12-08,364.0,0,346763.859375
388,Anunț,290000,EUR,4,180,https://www.publi24.ro/anunturi/imobiliare/de-vanzare/case/case-vile/anunt/casa-180-mp-teren-800mp-zona-central/5hg6g3f6fd5874d2d75h9804708821ed.html,images_case/anunt_388_img_0.jpg|images_case/anunt_388_img_1.jpg|images_case/anunt_388_img_2.jpg|images_case/anunt_388_img_3.jpg,4,,"Blitz propune spre vânzare o proprietate cu o suprafață utilă de 180mp, amplasată în zona 0 a municipiului Bistrița ( central). Acesta dispune de 700mp de teren cu pomi fructiferi și o anexă a casei. Proprietatea necesita renovare, are centrale termice, contoare de gaz și curent separate pentru fiecare nivel. Această proprietate oferă oportunități multiple de închiriere sau pentru activități economice, educative, cabinete, etc. Pentru mai multe detalii nu ezitati sa ne contactati! Cod ofertă / ID BLITZ: P92933 ID anunț : 1724930040",07.05.2021,9948,162292.875,2021-07-05,1616.0,0,127707.125
389,Anunț,81990,EUR,5,120,https://www.publi24.ro/anunturi/imobiliare/de-vanzare/case/case-vile/anunt/cabana-la-munte/4i93fe22744g73f52h4hh3e80e44i282.html,images_case/anunt_389_img_0.webp|images_case/anunt_389_img_1.webp|images_case/anunt_389_img_2.webp|images_case/anunt_389_img_3.webp,4,,"ID intern: V1947 Cabana de vanzare in zona Rau de Mori, judetul Hunedoara FOXFORT Imobiliare propune spre de vanzare casa tip cabana, cu un regim de inaltime P+M situata in zona Rau de Mori, avand un numar de 5 camere, cu o suprafata utila de 120 mp si teren 235 mp. Cabana a fost construita in anul 1994, mansardata in 2001 si renovata in 2011. Imobilul este situat in apropiere de Piata, Scoala, Biserica. Compartimentarea este dispusa dupa cum urmeaza: - Parter: hol, living, baie, bucatarie, terasa; - Etaj: hol, 3 dormitoare, baie, balcon; - Pod depozitare. Finisajele interioare sunt clasice : - Usa intrare: Lemn; - Usi interioare: Lemn; - Tamplarie ferestre: Lemn, aluminiu; - Podele: Parchet, gresie. Casa dispune de 5 locuri de parcare. Este un loc foarte pitoresc cu multiple obiective turistice în apropiere: Barajul si lacul de acumulare Gura Apei Biserica Densus Biserica Santamaria Orlea Castelul Corvinestilor – Hunedoara Castelul Nopcsa Sacel Cetatea Colt Cetatea Deva Manastirea Prislop Masivul Retezat Ulpia Traiana Sarmizegetusa Lacul Bucura Conacul Kendeffy Casa Memoriala Crisan Trasee turistice Traseu de 45 km: Poiana Pelegii - locul de plecare spre salba de lacuri glaciare Bucura, Zanoaga, Lia si Ana. Traseu de 26 km: Statiunea Rausor - locul de plecare spre – Cabana Pietrele, Buta, Baleia, Culmea Lolaia, Varful Retezat. Traseu de 3 km - drumul spre schit: Izvorul lui Viorel, Cascada, Laguna Albastra (loc de baie), Biserica si Schitul de maici. Traseu de 2,5 km – drumul spre Galerie: Valea de Pietre, Valea Jurii, Stanca Belvedere si Foisorul de Vanatoare. Cabana se poate cumpara si pentru locuit sau ca si investitie. Pretul este de 81.990€ + comisionul standard al agentiei. Se accepta ca si modalitate de plata creditul ipotecar. Pentru a vedea toate ofertele valabile actualizate periodic, cu preturi reale si ultimele anunturi imobiliare adaugate intrati acum pe site-ul oficial FOXFORT Imobiliare: foxfort.ro. Precizati intotdeauna ca ati vazut oferta cu ID: V1947. Sediu agentie: Strada Mures Nr.39A Timisoara, Timis. Mai multe detalii la telefon: 0374.069.727 / www.foxfort.ro / [email protected] . ID anunț : 1622030914",11.10.2019,1416,186840.5,2019-11-10,2219.0,0,-104850.5
390,Anunț,230000,EUR,4,130,https://www.publi24.ro/anunturi/imobiliare/de-vanzare/case/case-vile/anunt/comision-0-casa-individuala-zona-giarmata-4-camere/h03hf6f264ef7d27203ggef1f5f0e62d.html,images_case/anunt_390_img_0.webp|images_case/anunt_390_img_1.webp|images_case/anunt_390_img_2.webp|images_case/anunt_390_img_3.webp,4,,"COMISION 0% pentru cumpărător! Vă propun spre vânzare o casă individuală superbă, cu 4 camere, finisaje premium și o compartimentare excelentă, situată în Giarmata, într-o zonă liniștită de case, ideală pentru o familie care își dorește confort, spațiu și siguranță. Proprietatea impresionează prin calitatea construcției, atenția la detalii și spațiile bine gândite, fiind o locuință în care te poți muta imediat, fără investiții suplimentare. LOCALIZARE Casa se află intr-un cartier verde, retras, dar conectat la infrastructura majoră a comunei Giarmata. Giarmata este o comună situată în județul Timiș, la doar câțiva kilometri de Timișoara. DETALII PROPRIETATE Locuința dispune de 130 mp utili, este structurată pe Parter + Etaj, fiind amplasată pe un teren generos de 550 mp. Construcția este realizată din cărămidă Porotherm, izolată cu polistiren de 20 cm, cu placă de beton la pod, ceea ce oferă durabilitate, rezistență și confort termic excelent. Terasa acoperită de 30 mp reprezintă un plus major pentru relaxare în aer liber, iar balconul de la etaj adaugă un plus de eleganță. COMPARTIMENTARE Parterul este conceput pentru funcționalitate maximă: bucătărie separată, cameră tehnică, baie, spațiu de depozitare sub scări, living spațios de 33 mp cu acces pe terasă — locul perfect pentru relaxare în familie. Etajul găzduiește zona de odihnă: 3 dormitoare confortabile, baie, dressing dedicat și un balcon generos, ideal pentru momente de relaxare. DOTĂRI ȘI FINISAJE Casa oferă finisaje moderne și materiale de calitate superioară: încălzire în pardoseală, centrală proprie pe gaz, pod pentru depozitare, 3 aparate de aer condiționat, ferestre premium, izolație exterioară de 20 cm. Este dotată cu sistem complet de supraveghere video (3 camere), senzori, iluminat exterior și sistem de alarmă, pentru un nivel ridicat de siguranță. PREȚ: 230.000 € O casă individuală modernă, construită în 2022, bine compartimentată, eficientă energetic și pregătită pentru a deveni căminul perfect al unei familii care caută confort, siguranță și spațiu. COMISION 0% pentru cumpărător! ID anunț : 1763993702",03.03.2024,154,189343.46875,2024-03-03,644.0,0,40656.53125
391,Anunț,45000,EUR,2,316,https://www.publi24.ro/anunturi/imobiliare/de-vanzare/case/case-vile/anunt/vand-casa-batraneasca-nelocuibila-teren-intravilan-4-316-mp-comuna-ezeris/g156hef58i9g7ee8e66hd86640ie5gdi.html,images_case/anunt_391_img_0.webp|images_case/anunt_391_img_1.webp|images_case/anunt_391_img_2.webp|images_case/anunt_391_img_3.webp,4,,"Proprietatea are curent electric branșat, apă și canalizare la poartă, plus fântână în fața casei. Ideală pentru construcție nouă sau investiție. teren intravilan 4.316 mp ID anunț : 1765044189",09.03.2017,1,169718.546875,2017-09-03,3017.0,0,-124718.546875
392,Anunț,280000,EUR,4,125,https://www.publi24.ro/anunturi/imobiliare/de-vanzare/case/case-vile/anunt/duplex-intreg-cu-panouri-solare-cu-2-intrari/0476d4g580d3735727ge23g18482i800.html,images_case/anunt_392_img_0.webp|images_case/anunt_392_img_1.webp|images_case/anunt_392_img_2.webp|images_case/anunt_392_img_3.webp,4,,"Daca sunteți 2 familii si doriți sa împărtășiți aceeași casa, aveți posibilitatea sa achiziționați aceste doua case dintr-un Duplex in Domnești Intrarea. Craitei nr. 17 ! Construcție in regie proprie 2023 ! Regim înălțime P+E+POD ( Placa de beton inclusiv intre etaj si pod ) Casele au 2 intrări 3 dormitoare ( + dressing ) 2 bai Suprafață Utila per casa = 125 mp Terase Generoase Teren total per casa - 192 mp Teren Liber per casa  - 100 mp Deschidere totală  20 ml Panouri Solare , respectiv Certificat Energetic A ( dobândă m mica automat la credit ) Acoperiș Lindab Termopane 3 camere Gealan Put adancime - 27 m Fosa ecologică cu drenaj, cu 3 camere. Pompa de caldura - Hyunday Doua locuri de parcare (  in curte /  la poarta ) ID anunț : 1762019443",04.06.2025,207,213637.34375,2025-04-06,245.0,0,66362.65625
393,Anunț,320000,EUR,5,284,https://www.publi24.ro/anunturi/imobiliare/de-vanzare/case/case-vile/anunt/vand-duplex-lipovei-britis-scholl-aradului/27348fg922227i4hd2338e8ie0e9i4e6.html,images_case/anunt_393_img_0.jpg|images_case/anunt_393_img_1.jpg|images_case/anunt_393_img_2.jpg|images_case/anunt_393_img_3.jpg,4,,"proprietar vand duplex zona Lipovei Aradului( Armoniei )5 camere in imediata apropiere de Brits scoll , posibil mobilat,3 locuri de parcare , poziționare foarte bună,magazine școli grădiniță în apropiere, relații suplimentare la telefon ID anunț : 1741276560",09.05.2019,3,153861.21875,2019-09-05,2285.0,0,166138.78125
394,Anunț,159990,EUR,4,118,https://www.publi24.ro/anunturi/imobiliare/de-vanzare/case/case-vile/anunt/comision-0-duplex-4-camere-in-sacalaz-la-intrare/g5f148fh118h759911h1d8d1d26hdi02.html,images_case/anunt_394_img_0.webp|images_case/anunt_394_img_1.webp|images_case/anunt_394_img_2.webp|images_case/anunt_394_img_3.webp,4,,"Duplex cu 4 camere de vanzare in localitatea Sacalaz. FOXFORT propune spre vanzare casa tip duplex, cu un regim de inaltime Parter + 1 Etaj, situata in Sacalaz, avand un numar de 4 camere, cu o suprafata utila de 118 mp si teren 250 mp. Anul constructiei este 2024, structura este din beton cu zidarie din caramida. Imobilul dispune de urmatoarele utilitati: curent electric, apa, canalizare, gaz, catv, fibra optica. Compartimentarea este dispusa dupa cum urmeaza: - Parter: hol, living, baie, bucatarie, terasa; - Etaj: hol, 3 dormitoare, 2 bai, dressing, balcon. Finisajele interioare sunt de lux: - Usa intrare: pvc; - Usi interioare: celulare; - Tamplarie ferestre: pvc; - Podele: parchet, gresie. Casa dispune de centrala proprie cu incalzire in pardoseala si 2 locuri de parcare. Clientul are posibilitatea sa isi aleaga finisajele interioare in limita unui buget oferit de constructor. Pretul este de 159.990€ + TVA, Comision 0%. Se accepta ca si modalitate de plata surse proprii sau credit bancar. Indicator performanta energetica: Clasa A ID intern: V5814 ID anunț : 1702299542",11.10.2019,1416,150284.984375,2019-11-10,2219.0,0,9705.015625
395,Anunț,244990,EUR,4,115,https://www.publi24.ro/anunturi/imobiliare/de-vanzare/case/case-vile/anunt/comision-0-casa-triplex-zona-dumbravita-4-camere/7575ed0i16h87778de40h870g9i582ed.html,images_case/anunt_395_img_0.webp|images_case/anunt_395_img_1.webp|images_case/anunt_395_img_2.webp|images_case/anunt_395_img_3.webp,4,,"COMISION 0% pentru cumpărător! Vă prezint o casă modernă, complet utilată și amenajată, situată într-un ansamblu rezidențial liniștit din Dumbrăvița – zona Lac–Pădure, una dintre cele mai frumoase și verzi zone din proximitatea Timișoarei. LOCALIZARE Proprietatea se află într-o zonă rezidențială exclusiv de case, retrasă de la aglomerație, dar cu acces rapid către principalele artere care leagă Dumbrăvița de Timișoara. Cartierul este apreciat pentru liniște, aer curat și vecinătatea cu lacul și pădurea – un cadru perfect pentru relaxare și viață de familie. DETALII PROPRIETATE Proprietatea are o suprafață utilă de 115 mp și un teren total de 335 mp, cu o terasă acoperită de 40 mp ideală pentru relaxare în aer liber. Casa are regim de înălțime P+E, o compartimentare practică cu 4 camere (3 dormitoare și un living spațios) și 2 băi complet utilate, ambele cu geam natural. Construită în 2015, locuința beneficiază de o structură solidă și bine întreținută, având front stradal de 11 m și 2 locuri de parcare în curtea amenajată, cu acces facil. Compartimentarea este practică și bine gândită: la parter, casa dispune de un hol de acces generos, bucătărie închisă complet mobilată și utilată (inclusiv cu mașină de spălat vase), un living luminos cu acces direct pe terasa acoperită, baie cu cabină de duș și geam natural, precum și o terasă spațioasă de 40 mp, ideală pentru relaxare sau servirea mesei în aer liber. La etaj, se află un hol de distribuție, două dormitoare spațioase, un dormitor secundar ce poate fi utilizat ca birou, o baie cu cadă și geam natural, precum și acces la podul utilizabil pentru depozitare. DOTĂRI ȘI FINISAJE Casa, construită în 2015 din cărămidă și izolată termic la exterior cu polistiren de 15 cm, are acoperiș din țiglă și finisaje moderne de calitate superioară. Este dotată cu ferestre Salamander PVC cu geam termopan și glafuri din marmură, uși interioare celulare & panel, iar la intrare o ușă din lemn masiv. Pardoselile sunt din parchet laminat și gresie, pereții sunt finisați cu vopsea lavabilă și faianță, iar confortul termic este asigurat de centrala proprie pe gaz cu încălzire prin calorifere, completată de două aparate de aer condiționat (la parter și etaj). În plus, locuința beneficiază de sistem de alarmă complet funcțional, oferind siguranță și confort sporit. EXTERIOR ȘI CURTE Curtea este complet amenajată și oferă un spațiu intim, perfect pentru relaxare și activități în aer liber. Proprietatea dispune de magazie pentru depozitare, seră generoasă, sistem de irigație automat, spațiu verde îngrijit și zonă de relaxare, iar pentru confortul zilnic, sunt disponibile două locuri de parcare în curte, cu acces facil. AVANTAJE SUPLIMENTARE – Casă amplasată în capăt de ansamblu, cu trafic redus – Spații bine gândite, ideale pentru o familie – Proprietate complet mobilată și utilată – Zonă liniștită, aproape de natură – Posibilitate extindere sau personalizare exterioară Pret: 244.990 Euro COMISION 0% pentru cumpărător! ID anunț : 1763115157",03.03.2024,154,181203.4375,2024-03-03,644.0,0,63786.5625
396,Anunț,80000,EUR,2,3067,https://www.publi24.ro/anunturi/imobiliare/de-vanzare/case/case-vile/anunt/casa-batraneasca-si-teren/d557fi186d837id9e023d1h8e90644f0.html,images_case/anunt_396_img_0.webp|images_case/anunt_396_img_1.webp|images_case/anunt_396_img_2.webp|images_case/anunt_396_img_3.webp,4,,"Vand cas  batraneasca (nu este renovata )cu teren de 3067 m2 , in satul Chiperesti comuna Tutora jud Iasi, la 9 km de Iasi. Biserica, magazine , statie autobuz, microbuz scolar , parc aproape de cas . Utilitati , electricitate , apa si internet trase , gazul si canalizarea la poarta . Deschidere la strada  27 m Mai multe informatii la nr de telefon  . Pret 27euro m2 ID anunț : 1759650839",06.09.2025,4,140445.765625,2025-06-09,181.0,0,-60445.765625
397,Anunț,162000,EUR,5,9,https://www.publi24.ro/anunturi/imobiliare/de-vanzare/case/case-vile/anunt/comision-0-duplex-zona-sag-5-camere/95eih2ef23hd74i4d4222fig9457h8g6.html,images_case/anunt_397_img_0.webp|images_case/anunt_397_img_1.webp|images_case/anunt_397_img_2.webp|images_case/anunt_397_img_3.webp,4,,"COMISION 0% pentru cumpărător! Vă propun spre vânzare un duplex modern, spațios și bine compartimentat, situat în Șag, zona Mănăstirii — o zonă rezidențială liniștită și în continuă dezvoltare, la doar 10 km de Shopping City Timișoara. LOCALIZARE Proprietatea este amplasată într-un cartier nou de case, caracterizat prin liniște, aer curat și acces facil către oraș. Zona Mănăstirii din Șag este una dintre cele mai căutate pentru cei care își doresc o locuință modernă, departe de agitația urbană, dar totodată aproape de principalele puncte de interes. DETALII PROPRIETATE • Suprafață utilă: 119,9 mp • Suprafață teren: 500 mp • Regim de înălțime: P+E • Camere: 5 (3 dormitoare + living) • Băi: 2 • Birou separat (ideal pentru lucru de acasă) • An construcție: 2025 • Tip clădire: duplex cu pereți dubli, izolați cu polistiren de 10 cm • Încălzire în pardoseală pe ambele niveluri COMPARTIMENTARE Parter: living generos cu bucătărie open-space, baie modernă, birou și spațiu de depozitare. Etaj: 3 dormitoare luminoase, baie complet utilată și hol cu acces facil către toate camerele. DOTĂRI ȘI FINISAJE Locuința se predă complet finisată, cu finisaje moderne, materiale de calitate și o atenție deosebită la detalii. Beneficiază de încălzire în pardoseală, izolație exterioară de 10 cm, geamuri termopan de înaltă eficiență energetică, curte generoasă amenajabilă și spațiu ideal pentru terasă, grădină sau loc de joacă. CURTEA Cu o suprafață totală de 500 mp, curtea oferă multiple posibilități de amenajare — fie pentru relaxare și grătar, fie pentru un mic colț verde cu flori și copaci ornamentali. AVANTAJE SUPLIMENTARE – Construcție nouă, finalizată în 2025 – Pereți dubli între unități, pentru izolare fonică și termică superioară – Zonă liniștită, de case noi – Acces rapid spre oraș (doar 10 minute de Timișoara) – Ideală pentru o familie care caută confort, spațiu și intimitate Un duplex nou, luminos și funcțional, care oferă echilibrul perfect între viața liniștită de suburbie și proximitatea față de oraș — alegerea ideală pentru o familie modernă! COMISION 0% pentru cumpărător! ID anunț : 1763058147",03.03.2024,154,133904.46875,2024-03-03,644.0,0,28095.53125
398,Anunț,85000,EUR,4,800,https://www.publi24.ro/anunturi/imobiliare/de-vanzare/case/case-vile/anunt/case-de-vanzare-parcul-natural-comana-giurgiu/2i88h2ghde3g77gh11idei7hf163fhg9.html,images_case/anunt_398_img_0.webp|images_case/anunt_398_img_1.webp|images_case/anunt_398_img_2.webp,3,,"Casa situată în parcul natural Comana la 300m de pădure,  2 dormitoare, living, bucătărie, hol 10 m pe 1,5m, baie, dresing, 100 m pătrați construiți, tâmplăria termopan exterior, curent electric în casa, ,canalizare la strada, apa la baie si bucătărie, 800 mp toată curtea, împrejmuit cu gard, stradal, acoperiș bilka, plus mansardă 85m pătrați, balcon 15m pătrați. Casa a fost construita pentru uzul personal și este făcută din materiale de bună calitate, deschiderea la strada 24m. Proiectul pt gaze este aprobat, și am bagat gaze în casă. ID anunț : 1673530940",26.04.2022,1,62085.3203125,2022-04-26,1321.0,0,22914.6796875
399,Anunț,590000,EUR,5,130,https://www.publi24.ro/anunturi/imobiliare/de-vanzare/case/casa/anunt/casa-5-camere-cu-teren-si-piscina-cisnadie/e54i4ff0ge0g76i21d493de9f7122393.html,images_case/anunt_399_img_0.webp|images_case/anunt_399_img_1.webp|images_case/anunt_399_img_2.webp|images_case/anunt_399_img_3.webp,4,,,,0,124730.59375,,,0,465269.40625
400,Anunț,379990,EUR,8,1942,https://www.publi24.ro/anunturi/imobiliare/de-vanzare/case/case-vile/anunt/casa-cu-teren-de-1942-mp-in-timisoara-comision-0-id-v4770/4f4e94271fi57hfh2993ifg22d0ghh04.html,images_case/anunt_400_img_0.webp|images_case/anunt_400_img_1.webp|images_case/anunt_400_img_2.webp|images_case/anunt_400_img_3.webp,4,,"ID intern: V4770 Casa cu 8 camere de vanzare in localitatea Timisoara, zona Girocului FOXFORT Imobiliare propune de vanzare casa tip individuala, formata din 2 corpuri de cladire. Prima constructie are un regim de inaltime pe parter fiind construita in anul 1970 si renovata complet in anul 2022. Aceasta are o suprafata utila de aproximativ 100 mp si este alcatuita din 2 dormitoare, 1 living, 1 bucatarie si o baie. Finisajele interioare sunt moderne: - Usa intrare: metal; - Usi interioare: lemn; - Tamplarie ferestre: pvc; - Podele: parchet, gresie. Casa se vinde semimobilata si semiutilata. Ideala pentru investitie. Cea de-a doua cladire este o casa la stadiul de rosu cu un regim de inaltime Parter + Etaj, construita in anul 2022, cu o suprafata utila de aproximativ 170 mp utili, 1 balcon de 20 mp si o terasa de 100 mp. Compartimentarea este dispusa dupa cum urmeaza: - Parter: hol, living, baie, bucatarie, terasa, birou/dormitor, carport pentru 2 masini - Etaj: hol, 3 dormitoare, 2 bai, dresing, balcon; - Pod depozitare. Casa este situata in Timisoara, zona Girocului iar terenul aferent casei este de 1942 mp cu un front stradal de 16 ml. Structura casei vechi este de caramida iar a celei noi este de beton. Ca si material de zidarie, ambele sunt din caramida. Imobilul dispune de urmatoarele utilitati: curent electric, apa, canalizare, gaz, catv. Suprafata terenului ofera posibilitatea constructiei unor case insiruite pentru a putea fi valorificat. Casa dispune de centrala proprie cu incalzire prin calorifere si 5 locuri de parcare. Pretul este de 379.990€ - COMISON 0% Se accepta ca si modalitate de plata cash si credit bancar. Sediu agentie: Strada Mures, Nr. 39A, Timisoara, Timis. ID anunț : 1676383217",11.10.2019,1416,172507.84375,2019-11-10,2219.0,0,207482.15625
401,Anunț,16800,EUR,5,1464,https://www.publi24.ro/anunturi/imobiliare/de-vanzare/case/case-vile/anunt/gospodarie-in-jud-valcea-com-pesceana-sat-ursoaia-2-case-si-anexe/968d4ei56gi774102ie024hi6f729787.html,images_case/anunt_401_img_0.webp|images_case/anunt_401_img_1.webp|images_case/anunt_401_img_2.webp|images_case/anunt_401_img_3.webp,4,,"Vând gospodărie cu tot ce e necesar compusă din: - o casă nouă cu 2 camere, baie, sală în partea din față, beci (sub toată sala cam 8m x 2m) și perdea (magazie,șopru) în spate. Se văd și pozele din interiorul casei; - o casă mai veche cu 3 camere, sală mare, perdea (magazie,șopru) în spate, garaj și baie (necesită reparații capitale sau se poate demola); - un pătul pe furci de fier; - fântână cu apă potabilă; - curtea e împrejmuită cu gard cu pioni metalici de tubing; - rețea comunală de apă la poartă; - cablu TV si Internet de la DIGI la poartă: - curent electric în ambele case. Sunt unic proprietar prin moștenire de la părinți. Proprietatea e întabulată, toate actele pentru vânzare sunt pregătite. E o zonă de deal cu aer foarte curat, păduri și multă verdeață și liniște, într-o zonă retrasă de la șoseaua principală. Pe șosea circulă foarte rar câte o mașină a celor ce locuiesc în sat deoarece șoseaua se înfundă la capătul satului. Cine cumpără poate să se extindă în scurt timp, poate să cumpere foarte multe terenuri și case din sat. E o zonă ideală pentru casă de vacanță sau pentru cineva care dorește să dezvolte o zonă turistică, dar și pentru persoane care-și doresc aer curat, liniște și să cultive legume sau să sădească pomi. De altfel pe proprietate există deja o livadă cu vreo 50 de pomi tineri și o boltă cu viță de vie. Vecini sunt de nota zece. Numai curtea casei are 1464 mp, iar deschiderea la șoseaua principală este de15 m. Posibilitate de racordare la reteaua Internet si televiziune prin cablu (aflată pe stâlpul de la poartă). Peste drum de casă e un râu care izvorăște din capătul satului de la vreo 300 metri și curgea de-a lungul șoselei și se varsă în râul Peșceana, acesta vărsându-se în Olt la Drăgășani. Locația se afla la 25 Km de orașul Drăgășani și la 45 km de municipiul Rm. Vâlcea. Dețin și alte trenuri agricole, livezi și păduri dar nu sunt încă intabulate iar cel ce cumpăra gospodăria le poate cumpăra ulterior. Accept schimb doar cu apartament în Rm. Vâlcea sau București. Pentru orice alte informații mă puteți suna la numărul de telefon afișat, pe WhatsApp sau să-mi scrieți mesaj aici. Gospodăria se află la 25 km de municipiul Drăgășani și la 45 km de municipiul Râmnicu Vâlcea și la 20 km de orașul Băbeni. Prețul este negociabil. ID anunț : 1704013066",03.06.2013,1,128506.109375,2013-03-06,4659.0,0,-111706.109375
